completeness_percent,publisher,title,weighted_error_percent,weighted_quality_score,weighted_quality_rating,weighted_completeness_percent,error_percent,quality_score,id,quality_rating
26.19,ALLIANCE > HQIP,National Audit of Care at the End of Life - Quality Survey,31.75,45.23,Not Rated,22.22,30.23,47.98,aeb2f1ea-c914-4b30-94c8-9fd3eb51b288,Not Rated
92.86,HUBS > DISCOVER NOW,North West London Coordinate My Care (NWL CMC),12.7,92.06,Gold,96.83,16.28,88.29,af660e81-bb96-4e85-99a8-b85147c6ba79,Gold
71.43,ALLIANCE > TISSUE DIRECTORY,RAPPER,20.63,71.43,Bronze,63.49,20.93,75.25,b0886a0c-7ddc-4c2b-a499-afd7262fbe56,Bronze
95.24,ALLIANCE > GENOMICS ENGLAND,GENOMICS ENGLAND 100K RARE DISEASE & COMMON,22.22,88.89,Gold,100.0,25.58,84.83,b0a8085e-8cf0-45ee-b4a6-12a4a545ca70,Silver
16.67,ALLIANCE > DUNDEE,Patient SIMD Postcode,36.51,38.89,Not Rated,14.29,37.21,39.73,b2124786-9658-40cc-b5a3-6624885ce490,Not Rated
92.86,HUBS > DISCOVER NOW,North West London Patient Index (NWL PI),15.87,90.48,Gold,96.83,18.6,87.13,b232b32f-07d4-4fce-85a0-3834efd8757a,Gold
92.86,HUBS > DISCOVER NOW,North West London Admitted Patient Care Data (NWL APC),9.52,93.66,Gold,96.83,16.28,88.29,b339ea90-c3dd-44d8-a968-88eba9e3edb3,Gold
71.43,ALLIANCE > TISSUE DIRECTORY,York Tissue Bank,19.05,72.22,Bronze,63.49,18.6,76.42,b36202ad-7652-460c-8389-baa1a1c1ac46,Silver
69.05,ALLIANCE > TISSUE DIRECTORY,HCV Research UK,22.22,69.05,Bronze,60.32,23.26,72.89,b3a10154-a409-491a-92fb-e7fac47ccd91,Bronze
95.24,NIHR Health Informatics Collaborative Critical Care Theme,HIC ICU 8.3.2,42.86,78.57,Silver,100.0,41.86,76.69,b40777a2-468b-4b45-8b7d-2f62f912e950,Silver
16.67,ALLIANCE > BARTS,CDE Surginet Documentation,39.68,37.3,Not Rated,14.29,39.53,38.57,b41bb360-f2ed-49f0-a45b-b2fb05321975,Not Rated
47.62,ALLIANCE > CPRD,Systemic Anti-Cancer Treatment (SACT) data for CPRD Aurum,38.1,61.11,Not Rated,60.32,44.19,51.72,b4f6a5c2-e652-4972-9d06-510e9a469dfe,Not Rated
61.9,NHS Digital,Mental Health Minimum Dataset v4.1 (Non-Sensitive) Episodes,46.03,64.28,Not Rated,74.6,46.51,57.7,b53f716d-a5c3-4ad8-a2aa-cae09c12ac18,Not Rated
69.05,ALLIANCE > TISSUE DIRECTORY,MRC Brain Banks Network,20.63,69.84,Bronze,60.32,20.93,74.06,b717d41e-9202-40ed-be1a-882ec0c47761,Bronze
69.05,ALLIANCE > TISSUE DIRECTORY,Tissue Solutions Ltd,26.98,67.46,Bronze,61.9,27.91,70.57,b730442a-72f3-4b0d-8ad3-4bdba046df7a,Bronze
71.43,ALLIANCE > TISSUE DIRECTORY,TRICON8,22.22,70.64,Bronze,63.49,23.26,74.09,b796b821-97cf-4aa1-bbc7-53e3c1fbc33f,Bronze
16.67,ALLIANCE > DUNDEE,Tayside Radiology,36.51,38.89,Not Rated,14.29,37.21,39.73,b8107ec3-ba35-45ee-8231-cb610fe2ce48,Not Rated
16.67,ALLIANCE > DUNDEE,NHS Tayside and Fife Haematology (Lab Data Restructured),36.51,38.89,Not Rated,14.29,37.21,39.73,b9a2fe09-60b3-48a4-b252-9ed04a7dcc66,Not Rated
64.29,NHS Digital,Mental Health Minimum Dataset v4 (Non-Sensitive) Events,46.03,65.88,Not Rated,77.78,46.51,58.89,ba071b0b-5ef4-457b-b194-3a69c2c71a06,Not Rated
92.86,HUBS > DISCOVER NOW,North West London Primary Care Events Data (NWL PCE),12.7,92.06,Gold,96.83,16.28,88.29,bc2d2a17-0f36-4cb0-85d3-b54e64460d75,Gold
50.0,ALLIANCE > CPRD,Patient postcode linked deprivation measures for CPRD GOLD,33.33,65.08,Not Rated,63.49,41.86,54.07,bc6ae5bc-7175-49e2-b093-337dde427736,Not Rated
69.05,ALLIANCE > TISSUE DIRECTORY,Wales Cancer Bank,20.63,69.84,Bronze,60.32,20.93,74.06,bcfdc597-1bf0-41c2-8b68-779f9a115f83,Bronze
64.29,NHS Digital,Mental Health & Learning Disabilities Dataset v 1 (Sensitive) Events,46.03,65.88,Not Rated,77.78,46.51,58.89,bdc17b2c-8b0f-4959-ab9b-e2de32d8a5f9,Not Rated
54.76,ALLIANCE > CPRD,Mother-Baby Link for CPRD GOLD,38.1,65.87,Not Rated,69.84,44.19,55.28,bdcbbb2b-df99-4ae7-b36e-f266cfe10ed3,Not Rated
26.19,ALLIANCE > HQIP,National Joint Registry - Revision Shoulder Replacement dataset,31.75,45.23,Not Rated,22.22,30.23,47.98,bddcc89d-028f-48a5-b568-7dccd574563b,Not Rated
69.05,ALLIANCE > SCOTLAND,Unscheduled Care Datamart,17.46,80.16,Silver,77.78,23.26,72.89,be170751-3ab2-4cb6-a59f-d5d5867e0bfd,Bronze
16.67,Oxford University Hospitals NHS Foundation Trust,TheatreEvents,41.27,36.51,Not Rated,14.29,41.86,37.41,bf83ada4-b72e-4789-b177-12a53aa763ea,Not Rated
59.52,HUBS > NHS DIGITRIALS,Civil Registration - Deaths,42.86,64.28,Not Rated,71.43,44.19,57.67,bfbf7741-65d1-47e3-92e2-bcf50e8c0c20,Not Rated
71.43,ALLIANCE > TISSUE DIRECTORY,UCL Infection DNA Bank,25.4,69.05,Bronze,63.49,25.58,72.93,c10d6c3a-e405-4ee9-828f-02443c210879,Bronze
28.57,HUBS > BREATHE,Vitamin D supplementation meta-analyses,33.33,45.24,Not Rated,23.81,30.23,49.17,c16605d7-6e6e-4461-bfab-107660e31427,Not Rated
69.05,ALLIANCE > TISSUE DIRECTORY,STAMPEDE,19.05,70.64,Bronze,60.32,18.6,75.22,c182a3b6-8eea-43ef-be18-6cd444f150dc,Bronze
92.86,HUBS > DISCOVER NOW,North West London Primary Care Prescriptions Data (NWL PCP),14.29,91.27,Gold,96.83,16.28,88.29,c1f947c3-4956-4e0b-93ef-23ce9abda000,Gold
16.67,ALLIANCE > DUNDEE,Fife Radiology,36.51,38.89,Not Rated,14.29,37.21,39.73,c22d8356-d51b-4d34-aadf-ed356d15fe46,Not Rated
66.67,HUBS > BREATHE,Assessing the eDPSEEA model in seasonal pollen induced asthma in Islamabad,20.63,68.25,Bronze,57.14,18.6,74.03,c2548017-7913-40e1-bf98-aaa2e907b0ea,Bronze
16.67,ALLIANCE > DUNDEE,Tayside Bowel Screening Dataset,36.51,38.89,Not Rated,14.29,37.21,39.73,c275f19e-2373-43dc-8e83-3318aaf8bfa4,Not Rated
73.81,ALLIANCE > TISSUE DIRECTORY,Arden Tissue Bank,19.05,73.02,Bronze,65.08,18.6,77.61,c29c3fbe-700e-4f85-8943-5557c30c1dfa,Silver
28.57,ALLIANCE > LEICESTER,Genvasc Primary Care Data,33.33,45.24,Not Rated,23.81,32.56,48.0,c324246a-22d9-45d8-9a7a-a513078be2d1,Not Rated
26.19,ALLIANCE > HQIP,Sentinel Stroke National Audit Programme Acute Organisational survey dataset,34.92,43.65,Not Rated,22.22,32.56,46.81,c3d84dfa-fe3a-4b86-a0f5-efbe45aa93ad,Not Rated
78.57,HUBS > BREATHE,UK BiLEVE Consortium Dataset,15.87,76.98,Silver,69.84,13.95,82.31,c43363e5-a2cd-4990-a425-733dfe559a4f,Silver
69.05,ALLIANCE > CPRD,HES Accident and Emergency data for CPRD GOLD,28.57,74.61,Bronze,77.78,32.56,68.25,c55b92d8-889d-435c-b0cb-2d9f7b432839,Bronze
69.05,ALLIANCE > CPRD,Death Registration data for CPRD Aurum,30.16,73.81,Bronze,77.78,34.88,67.09,c577669a-a84f-493e-8164-3fe02f618561,Bronze
26.19,ALLIANCE > HQIP,National Audit of Psychosis - Audit on Early Intervention in Psychosis services - contextual data,33.33,44.45,Not Rated,22.22,32.56,46.81,c5994fae-9c4a-47eb-ba42-85bd76e92879,Not Rated
50.0,ALLIANCE > CPRD,Practice postcode linked deprivation measures for CPRD GOLD,33.33,65.08,Not Rated,63.49,41.86,54.07,c6117afd-bc4d-404b-8d58-9d87db936b4c,Not Rated
69.05,ALLIANCE > TISSUE DIRECTORY,Barts CTU,23.81,68.25,Bronze,60.32,23.26,72.89,c6d6bbd3-74ed-46af-841d-ac5e05f4da41,Bronze
95.24,OTHER > COG-UK,COG-UK Viral Genome Sequences,12.7,93.65,Gold,100.0,16.28,89.48,c6dc78fa-1543-4fbf-87d8-a3f48e7de813,Gold
64.29,NHS Digital,Mental Health & Learning Disabilities Dataset v 1 (Non-Sensitive) Episodes,46.03,65.88,Not Rated,77.78,46.51,58.89,c713773c-e961-400e-b44a-947002deb073,Not Rated
73.81,ALLIANCE > TISSUE DIRECTORY,RATHL Trial,22.22,70.64,Bronze,63.49,23.26,75.28,c83d2206-3778-400b-9b26-27c7588af930,Bronze
16.67,ALLIANCE > DUNDEE,NHS Tayside and Fife Virology,36.51,38.89,Not Rated,14.29,37.21,39.73,c8ed8784-91ce-4823-8e80-fa3a4b732e11,Not Rated
64.29,NHS Digital,Mental Health Minimum Dataset v4.1 (Non-Sensitive) Records,46.03,65.88,Not Rated,77.78,46.51,58.89,c97b8058-a6a4-4c8d-92e1-6e9f4cddd301,Not Rated
26.19,ALLIANCE > HQIP,National Audit of Care at the End of Life - case note review,31.75,45.23,Not Rated,22.22,30.23,47.98,cabb1db1-ee3e-42ce-a40b-468282e2011d,Not Rated
26.19,ALLIANCE > HQIP,National Early Inflammatory Arthritis Audit - organisational survey dataset,34.92,43.65,Not Rated,22.22,32.56,46.81,cbda5643-96b7-4914-b990-a872e693ff29,Not Rated
64.29,NHS Digital,Mental Health Minimum Dataset v4.1 (Sensitive) Records,46.03,65.88,Not Rated,77.78,46.51,58.89,cc383a3f-1c47-4b7d-99cf-be8ee0afe401,Not Rated
71.43,ALLIANCE > CPRD,HES Admitted Patient Care data for CPRD Aurum,30.16,74.61,Bronze,79.37,34.88,68.28,cc3e20da-aca5-471d-a4bb-38e13f350f10,Bronze
57.14,ALLIANCE > SCOTLAND,National Records of Scotland (NRS) - Births Data,20.63,65.08,Not Rated,50.79,20.93,68.1,cd051ddc-b383-4583-aeca-b2e1fe5b17e3,Bronze
73.81,ALLIANCE > PUBLIC HEALTH ENGLAND,National Cancer Registration Dataset 2018,22.22,71.43,Bronze,65.08,23.26,75.28,cd0cc1de-f0bc-4247-9e67-47e162e2cc6b,Bronze
69.05,ALLIANCE > SCOTLAND,Child Health Systems Programme - 4-5 year review,15.87,80.95,Silver,77.78,20.93,74.06,ce9025c9-cf30-420b-8edb-f6ca438b099f,Bronze
69.05,ALLIANCE > SCOTLAND,Child Health Systems Programme - 27-30Months Review,17.46,80.16,Silver,77.78,23.26,72.89,ceca959a-11b1-4da3-8289-3cf22c9fc541,Bronze
26.19,ALLIANCE > HQIP,National Clinical Audit of Anxiety and Depression - spotlight audit on psychological therapies (clinical),33.33,44.45,Not Rated,22.22,32.56,46.81,cf3f4336-e52d-4b82-8cc5-647dedaaee57,Not Rated
50.0,ALLIANCE > CPRD,Quality of Life of Colorectal Cancer Survivors in England: Patient Reported Outcome Measures Survey for CPRD GOLD,39.68,61.91,Not Rated,63.49,46.51,51.75,cf81a42f-2611-4410-89e9-7e3770d03a15,Not Rated
69.05,ALLIANCE > TISSUE DIRECTORY,Cancer Group CTR Cardiff trials,20.63,69.84,Bronze,60.32,20.93,74.06,d272b783-8db3-4068-8d0f-05728f786d6d,Bronze
33.33,NHS Digital,Patient Reported Outcome Measures,49.21,48.41,Not Rated,46.03,51.16,41.09,d2af6a29-291b-4444-a17c-40f4208f1e1b,Not Rated
26.19,ALLIANCE > HQIP,Sentinel Stroke National Audit Programme Clinical Dataset,34.92,43.65,Not Rated,22.22,32.56,46.81,d3673b75-ec8f-4c2e-8c9b-6ef1d951f978,Not Rated
71.43,ALLIANCE > TISSUE DIRECTORY,MFT Biobank,20.63,71.43,Bronze,63.49,20.93,75.25,d3a3935f-b28e-4e74-9b15-9432d611f26c,Bronze
16.67,Oxford University Hospitals NHS Foundation Trust,JANUS,39.68,37.3,Not Rated,14.29,39.53,38.57,d3fd4dac-2d15-401c-8185-905ee108d9ce,Not Rated
71.43,ALLIANCE > TISSUE DIRECTORY,UK ME/CFS Biobank,20.63,71.43,Bronze,63.49,20.93,75.25,d51de39c-153a-462b-8de5-cd1424908e0c,Bronze
66.67,HUBS > BREATHE,Exploration of Pneumonia Related Policy Formation and Implementation in Pakistan,20.63,68.25,Bronze,57.14,18.6,74.03,d5446d68-2fb9-4f0f-962e-7b7ed484d534,Bronze
26.19,HUBS > PIONEER,Birmingham Out of Hours Research Database,34.92,43.65,Not Rated,22.22,32.56,46.81,d546521a-79be-4a53-83bd-ff008bda6171,Not Rated
16.67,Oxford University Hospitals NHS Foundation Trust,OUH Patient Master Index,39.68,37.3,Not Rated,14.29,39.53,38.57,d57a096a-4fa3-4529-b508-0b9df0f1893c,Not Rated
71.43,ALLIANCE > TISSUE DIRECTORY,NHS Grampian Biorepository,20.63,71.43,Bronze,63.49,20.93,75.25,d5ab658e-b474-4e22-95f8-92607c40792d,Bronze
88.1,ALLIANCE > NIHR BIORESOURCE,Health and Lifestyle Questionnaire,23.81,84.12,Silver,92.06,30.23,78.94,d7ec9584-cba3-46f9-9ef4-b1cb9eef2e7c,Silver
33.33,ALLIANCE > CPRD,Cancer Patient Experience Survey (CPES) for CPRD Aurum,38.1,46.83,Not Rated,31.75,41.86,45.73,d90830f4-5aaa-4075-8c8d-839627224d16,Not Rated
95.24,ALLIANCE > SAIL,Emergency Department Dataset Daily,15.87,92.06,Gold,100.0,16.28,89.48,d92fd972-10b7-4163-bcd3-43c941202615,Gold
61.9,ALLIANCE > SCOTLAND,Outpatient Appointments and Attendances - Scottish Morbidity Record (SMR00),22.22,65.88,Not Rated,53.97,23.26,69.32,d936d21f-6b78-470c-b623-6d1213f2a041,Bronze
26.19,ALLIANCE > HQIP,National Vascular Registry -  Abdominal Aortic Aneurysm Repair clinical dataset,31.75,45.23,Not Rated,22.22,30.23,47.98,da4d3e21-3d81-49e9-ada0-6175e2341190,Not Rated
64.29,NHS Digital,Mental Health Minimum Dataset v4.1 (Sensitive) Events,46.03,65.88,Not Rated,77.78,46.51,58.89,db113fcd-69a0-4357-9c6d-250085deb3f5,Not Rated
69.05,ALLIANCE > TISSUE DIRECTORY,interNational Anaplastic Thyroid Cancer Tissue Bank (iNATT),19.05,70.64,Bronze,60.32,18.6,75.22,dd7e56e7-2683-4b88-bed2-3a27ef3e4c9e,Bronze
26.19,ALLIANCE > HQIP,National Vascular Registry Audit Carotid Endarterectomy Clinical Dataset,31.75,45.23,Not Rated,22.22,30.23,47.98,ddc965e7-6f52-4eed-bed5-657e3e7bbeac,Not Rated
21.43,ALLIANCE > NIHR BIORESOURCE,NHS Digital data,36.51,40.48,Not Rated,17.46,34.88,43.28,de1179eb-89fe-45a3-9e3c-e54a2a36ebf0,Not Rated
26.19,ALLIANCE > HQIP,National Bowel Cancer Audit -  Organisational Survey dataset,33.33,44.45,Not Rated,22.22,32.56,46.81,de19b3ea-2600-4472-85e8-628e7beff76e,Not Rated
80.95,HUBS > BREATHE,UK Lung Volume Reduction Surgery,9.52,80.96,Silver,71.43,9.3,85.83,def6669b-0fac-485c-84b2-2ea83ec31123,Silver
57.14,ALLIANCE > SCOTLAND,National Records of Scotland (NRS) - Deaths Data,22.22,64.28,Not Rated,50.79,23.26,66.94,df63bdd2-712d-478e-8aae-36d01158a440,Bronze
64.29,HUBS > BREATHE,Klang Asthma Cohort,23.81,65.88,Not Rated,55.56,20.93,71.68,df63e893-f688-4bb4-956c-cc4354bb4001,Bronze
16.67,Oxford University Hospitals NHS Foundation Trust,Admitted Patient Care Dataset,39.68,37.3,Not Rated,14.29,39.53,38.57,dfb21b3b-7fd9-40c4-892e-810edd6dfc25,Not Rated
95.24,ALLIANCE > GENOMICS ENGLAND,GENOMICS ENGLAND 100K PHE LINKED DATA,22.22,88.89,Gold,100.0,25.58,84.83,e0c871f9-b63c-43a5-9fd6-e5731dae2343,Silver
95.24,ALLIANCE > SAIL,Brecon dataset,9.52,95.24,Gold,100.0,11.63,91.81,e0ed59e2-8fb5-44d4-b694-f31d46884954,Gold
26.19,ALLIANCE > HQIP,National Oesophago-Gastric Cancer Audit - clinical dataset,31.75,45.23,Not Rated,22.22,30.23,47.98,e10660af-b420-4e25-8fc9-ea451da1dcfb,Not Rated
26.19,ALLIANCE > HQIP,National Joint Registry - Primary Ankle Replacement dataset,31.75,45.23,Not Rated,22.22,30.23,47.98,e38c8d6c-8655-4432-b654-23f89c0bb495,Not Rated
28.57,HUBS > BREATHE,Unified Cohorts Research Network,33.33,45.24,Not Rated,23.81,30.23,49.17,e516a359-74a8-4932-b4df-f2cf75eef89d,Not Rated
92.86,ALLIANCE > SAIL,COVID-19 Symptom Tracker Dataset,9.52,93.66,Gold,96.83,13.95,89.45,e525b056-1bac-46ee-838c-6bef8a8815cb,Gold
95.24,ALLIANCE > CYSTIC FIBROSIS,Cystic Fibrosis Patient Sweat Tests,26.98,86.51,Gold,100.0,25.58,84.83,e66b726f-8e58-4411-be32-1d00ba1df13f,Silver
69.05,ALLIANCE > TISSUE DIRECTORY,Biobank for patients with retinal degenerations & dystrophies,20.63,69.84,Bronze,60.32,20.93,74.06,e678366e-bb53-4dbb-a228-05114e0b6eb3,Bronze
92.86,HUBS > DISCOVER NOW,North West London Community Data (NWL COM),20.63,88.1,Gold,96.83,20.93,85.97,e85e5c8c-b6be-4e8b-8a0b-13b785b457a2,Silver
69.05,ALLIANCE > TISSUE DIRECTORY,University of Liverpool - GCP Laboratory Facility,20.63,69.84,Bronze,60.32,20.93,74.06,e8f23004-f1f7-4a36-859f-25af6ca6433b,Bronze
16.67,ALLIANCE > DUNDEE,"NHS Tayside, A&E Drugs given during an A&E visit",36.51,38.89,Not Rated,14.29,37.21,39.73,e8f5b1b5-2c08-439a-b337-70b454aa40f3,Not Rated
76.19,ALLIANCE > TISSUE DIRECTORY,Research Donors Ltd,23.81,71.43,Bronze,66.67,25.58,75.31,ea07f115-9f70-4c21-a373-247a1ca906f0,Bronze
16.67,Oxford University Hospitals NHS Foundation Trust,Sunquest,39.68,37.3,Not Rated,14.29,39.53,38.57,eaca9ed1-30b6-4157-8894-8e53efc84849,Not Rated
71.43,ALLIANCE > TISSUE DIRECTORY,Tommy's National Reproductive Health Biobank,19.05,72.22,Bronze,63.49,18.6,76.42,eb19fcd9-2e9e-4e27-aa79-ad235952b1ac,Silver
64.29,HUBS > NHS DIGITRIALS,Diagnostic Imaging Dataset,34.92,71.43,Bronze,77.78,39.53,62.38,eb80104c-1292-49b7-9d18-58337353c4cc,Not Rated
95.24,ALLIANCE > GENOMICS ENGLAND,GENOMICS ENGLAND 100K QUICK VIEW,17.46,91.27,Gold,100.0,23.26,85.99,ecbe7275-82b5-43cd-9401-fd7ef4b55341,Silver
16.67,ALLIANCE > DUNDEE,Fife Microbiology: Isolations,36.51,38.89,Not Rated,14.29,37.21,39.73,edaf29f4-9857-4bb0-97b9-ae88b70a2a3c,Not Rated
78.57,HUBS > BREATHE,Its Not JUST Idiopathic pulmonary fibrosis Study (INJUSTIS),20.63,73.81,Bronze,68.25,20.93,78.82,edc8f0c6-64f8-4f6d-a1dd-41e05033d54e,Silver
71.43,ALLIANCE > TISSUE DIRECTORY,QTL Programme at MRC HGU,20.63,71.43,Bronze,63.49,20.93,75.25,ee5f4405-6930-4a7b-ba00-85a8e8c8a8b9,Bronze
95.24,ALLIANCE > SAIL,National Survey for Wales,9.52,95.24,Gold,100.0,13.95,90.64,ee78ce42-7f1f-4c97-80cc-ea6ad628e5da,Gold
71.43,ALLIANCE > TISSUE DIRECTORY,Manchester Cancer Research Centre (MCRC) Biobank,20.63,71.43,Bronze,63.49,20.93,75.25,eea147a4-4576-4f86-8ad1-c762137335fd,Bronze
83.33,ALLIANCE > CPRD,CPRD Aurum,22.22,84.13,Silver,90.48,27.91,77.71,ef42201e-deb1-4675-896a-8a0162fe52a8,Silver
26.19,ALLIANCE > HQIP,National Cardiac Audit Programme - National Heart Failure Audit,34.92,43.65,Not Rated,22.22,32.56,46.81,efbb3bf4-834b-417e-b002-03fc41715e58,Not Rated
26.19,HUBS > PIONEER,Society for Acute Medicine Benchmarking Audit,36.51,42.86,Not Rated,22.22,34.88,45.66,f075ceb7-5bed-4e6b-8e83-211aee945356,Not Rated
23.81,ALLIANCE > NIHR BIORESOURCE,SNP imputation data,36.51,42.06,Not Rated,20.63,34.88,44.47,f1a85970-bddc-499b-92e9-783706c60995,Not Rated
69.05,ALLIANCE > TISSUE DIRECTORY,Manchester Eye Tissue Repository,22.22,69.05,Bronze,60.32,23.26,72.89,f1a93b8f-6332-43a2-b2da-c86f68f7d24a,Bronze
88.1,ALLIANCE > NIHR BIORESOURCE,Case report form,33.33,79.37,Silver,92.06,34.88,76.61,f1d3b068-7dd0-4a28-bd64-3519dd104eb6,Silver
61.9,HUBS > PIONEER,PIONEER - Genomics Patients and related data,31.75,62.7,Not Rated,57.14,34.88,63.51,f202a9da-f036-4e8c-a069-a20ff6c8a9e1,Not Rated
50.0,ALLIANCE > CPRD,Practice postcode linked deprivation measures for CPRD Aurum,33.33,65.08,Not Rated,63.49,41.86,54.07,f3a53f7a-ea93-4b9e-bccd-afe762259044,Not Rated
26.19,ALLIANCE > LEICESTER,The Leicester City and County Chronic Kidney Disease Cohort,31.75,45.23,Not Rated,22.22,30.23,47.98,f3ade619-292e-4631-916a-9cd9d7938e48,Not Rated
69.05,ALLIANCE > TISSUE DIRECTORY,Bristol Biobank,22.22,69.05,Bronze,60.32,23.26,72.89,f42b9fa6-adad-4637-943e-6fa7508559a3,Bronze
71.43,ALLIANCE > HQIP,National Joint Registry - Primary Knee Replacement dataset,25.4,69.05,Bronze,63.49,25.58,72.93,f4915e4b-639c-45ae-9b0f-afab547e1104,Bronze
95.24,ALLIANCE > CYSTIC FIBROSIS,Cystic Fibrosis Patient Chronic Medication,30.16,84.92,Silver,100.0,27.91,83.66,f55dd7ed-cb11-4bb6-84a7-29ae83ffe3fc,Silver
69.05,ALLIANCE > TISSUE DIRECTORY,Leeds NIHR Biomarker Research Tissue Bank,20.63,69.84,Bronze,60.32,20.93,74.06,f5b57b56-a4ed-46d4-825f-d181e8db809d,Bronze
69.05,ALLIANCE > TISSUE DIRECTORY,Oxford Musculoskeletal Biobank,22.22,69.05,Bronze,60.32,23.26,72.89,f5ed34fa-154a-4613-a253-277547cfd8ca,Bronze
69.05,ALLIANCE > TISSUE DIRECTORY,NIHR Exeter Clinical Research Facility,22.22,69.05,Bronze,60.32,23.26,72.89,f621fcc9-e9ab-4da4-bd34-e4530d11b59d,Bronze
26.19,ALLIANCE > HQIP,National Diabetes Inpatient Audit - Harms clinical dataset,31.75,45.23,Not Rated,22.22,30.23,47.98,f69d1b15-a0b4-461a-8aff-dba56da0791f,Not Rated
69.05,ALLIANCE > TISSUE DIRECTORY,Generation Scotland,20.63,69.84,Bronze,60.32,20.93,74.06,f72798fb-d168-4c3c-abce-f8300cbcb8b3,Bronze
59.52,ALLIANCE > SCOTLAND,Scottish Cancer Registry (SMR06),23.81,64.28,Not Rated,52.38,25.58,66.97,f79d91c1-981e-4389-8626-b2cef391cf90,Bronze
83.33,ALLIANCE > NIHR BIORESOURCE,SNP chip data,26.98,80.95,Silver,88.89,30.23,76.55,f7c563c0-9625-47be-a070-c121fe734f3c,Silver
26.19,ALLIANCE > HQIP,National Maternity and Perinatal Audit clinical audit,31.75,45.23,Not Rated,22.22,30.23,47.98,f806fe65-79aa-4843-bc56-a08bf14ffcec,Not Rated
26.19,ALLIANCE > HQIP,"Maternal, Newborn and Infant Clinical Outcome Review Programme - perinatal surveillance dataset",33.33,44.45,Not Rated,22.22,32.56,46.81,f82b8ca5-5a52-4502-bf78-cfbb718cbe2f,Not Rated
90.48,ALLIANCE > IMPERIAL COLLEGE LONDON,National Neonatal Research Database,12.7,91.27,Gold,95.24,13.95,88.27,f89af2f4-e3cd-4eaa-835d-94aa347d8a92,Gold
16.67,ALLIANCE > BARTS,Maternity Services Dataset,39.68,37.3,Not Rated,14.29,39.53,38.57,f8bab14a-bc9b-4dd1-a6c6-c57588605849,Not Rated
69.05,ALLIANCE > TISSUE DIRECTORY,Multiple Sclerosis and Parkinson's Tissue Bank,20.63,69.84,Bronze,60.32,20.93,74.06,f8f6e9ea-65c0-48a6-9beb-6de80bbbefda,Bronze
76.19,HUBS > BREATHE,SpiroMeta Consortium Dataset,25.4,70.63,Bronze,66.67,25.58,75.31,f908efd6-c6ac-448b-89b9-222c50aec7c8,Bronze
71.43,ALLIANCE > TISSUE DIRECTORY,UCL / UCLH Biobank for Studying Health and Disease,19.05,72.22,Bronze,63.49,18.6,76.42,f9a712ae-9d41-41a6-b2ca-3127441b03ac,Silver
71.43,ALLIANCE > TISSUE DIRECTORY,"St Thomas' Hospitals Plasma, serum & DNA Bio bank from patients with antiphospholipid antibodies",23.81,69.84,Bronze,63.49,25.58,72.93,f9f3af0d-ca1c-4e8f-b5e8-20962e1e7b4e,Bronze
26.19,ALLIANCE > HQIP,National Cardiac Audit Programme - National Adult Cardiac Surgery Audit (NACSA),34.92,43.65,Not Rated,22.22,32.56,46.81,faf7ec31-999a-4d87-9d6d-8837ff2fa486,Not Rated
16.67,Oxford University Hospitals NHS Foundation Trust,CellPath,39.68,37.3,Not Rated,14.29,39.53,38.57,fc7b44f0-eb69-4257-8c07-7516c1210c46,Not Rated
71.43,ALLIANCE > TISSUE DIRECTORY,eLIXIR - Early Life Data Cross-Linkage in Research,20.63,71.43,Bronze,63.49,20.93,75.25,fcee6c99-a4bd-44b8-a28e-dc63337ce216,Bronze
95.24,ALLIANCE > SAIL,National Exercise Referral Scheme,9.52,95.24,Gold,100.0,11.63,91.81,fe3c7527-e802-4a51-9aa2-19e7d4d22783,Gold
26.19,ALLIANCE > HQIP,National Joint Registry - Primary Shoulder Replacement dataset,31.75,45.23,Not Rated,22.22,30.23,47.98,fe4662ad-9080-4bd8-8de4-51195d275d5b,Not Rated
26.19,ALLIANCE > HQIP,National Paediatric Diabetes Audit - Parent and Patient Recorded Experience measures,36.51,42.86,Not Rated,22.22,34.88,45.66,fe872375-2401-4de1-9650-d4139cf5793a,Not Rated
64.29,NHS Digital,Mental Health Minimum Dataset v4 (Non-Sensitive) Records,46.03,65.88,Not Rated,77.78,46.51,58.89,ff2c6982-00f3-4483-9fc2-19b3a7211d8d,Not Rated
