quality_rating,publisher,weighted_quality_score,quality_score,title,error_percent,weighted_quality_rating,completeness_percent,weighted_error_percent,weighted_completeness_percent,id
Bronze,ALLIANCE > TISSUE DIRECTORY,70.64,75.22,MDSBio,18.6,Bronze,69.05,19.05,60.32,9f45db59-b3c9-4c33-85bf-25c1b5242903
Not Rated,ALLIANCE > HQIP,43.65,46.81,National Early Inflammatory Arthritis Audit - patient survey,32.56,Not Rated,26.19,34.92,22.22,a05443cd-e292-4b5f-b1f1-95718e300d46
Not Rated,ALLIANCE > CPRD,61.11,51.75,Cancer registration data for CPRD GOLD,46.51,Not Rated,50.0,39.68,61.9,a0dad23c-c02d-4347-92ef-0019fa59eb3e
Bronze,NIHR Health Informatics Collaborative Renal Transplantation Theme,74.6,73.17,HIC Transplantation,46.51,Bronze,92.86,49.21,98.41,a0e0c0c2-072a-47ac-9252-e27b37ac024f
Bronze,HUBS > NHS DIGITRIALS,75.39,69.38,Hospital Episode Statistics Accident and Emergency,27.91,Bronze,66.67,25.4,76.19,a104ba06-be82-4f2d-b177-f13948643f84
Not Rated,NHS Digital,65.88,58.89,Mental Health Minimum Dataset v4.1 (Non-Sensitive) Events,46.51,Not Rated,64.29,46.03,77.78,a1a67182-e81b-4144-ac51-92a86f277eb2
Bronze,ALLIANCE > TISSUE DIRECTORY,69.84,74.06,Cam-UroOnc Biorepository,20.93,Bronze,69.05,20.63,60.32,a1f9315e-8561-4e7b-b1a7-1276bdeca14d
Bronze,ALLIANCE > TISSUE DIRECTORY,69.84,74.06,ICON9 Trial,20.93,Bronze,69.05,20.63,60.32,a2d94442-91c1-4626-b28f-700eb436a4c1
Not Rated,ALLIANCE > BARTS,37.3,38.57,Freetext Dataset,39.53,Not Rated,16.67,39.68,14.29,a429e699-4650-4feb-9392-f24aa3a3b7b6
Bronze,ALLIANCE > TISSUE DIRECTORY,71.43,75.31,Sheffield Brain Tissue Bank (SBTB),25.58,Bronze,76.19,23.81,66.67,a49a1145-4334-4c2a-81cb-90155e8f05c6
Bronze,ALLIANCE > TISSUE DIRECTORY,69.05,72.89,plasmaMATCH,23.26,Bronze,69.05,22.22,60.32,a617a37d-1813-49ad-8282-38169981a095
Not Rated,ALLIANCE > BARTS,37.3,38.57,Community Services Dataset,39.53,Not Rated,16.67,39.68,14.29,a675ac5e-ecc2-4899-9c3c-65c2f36432c5
Bronze,ALLIANCE > TISSUE DIRECTORY,69.05,72.89,UK primary Sjogren's syndrome Registry,23.26,Bronze,69.05,22.22,60.32,a6fb087d-1a90-4db0-9fcf-323c5b3cce51
Bronze,ALLIANCE > TISSUE DIRECTORY,70.64,74.09,Central England Haemato-oncology and oncology Research Biobank (CEHRB),23.26,Bronze,71.43,22.22,63.49,a7209348-c011-44d0-9c4f-35a2014c2542
Not Rated,Oxford University Hospitals NHS Foundation Trust,37.3,38.57,LIMS,39.53,Not Rated,16.67,39.68,14.29,a74f72ad-bf70-42e4-8933-069c7b53c7f9
Not Rated,ALLIANCE > CPRD,59.53,50.58,Quality of Life of Colorectal Cancer Survivors in England: Patient Reported Outcome Measures Survey for CPRD Aurum,48.84,Not Rated,50.0,44.44,63.49,a772b8dd-cb93-4f27-a349-329992e0b212
Not Rated,ALLIANCE > HQIP,42.86,45.66,National Asthma and COPD Audit Programme (NACAP): primary care workstream resources,34.88,Not Rated,26.19,36.51,22.22,a895be78-f41c-40b8-b2fa-678a071a6427
Not Rated,NHS Digital,65.88,58.89,Mental Health Minimum Dataset v3_3.5 (Non-Sensitive),46.51,Not Rated,64.29,46.03,77.78,aa019da2-0f2f-493c-95e8-7263ee735f46
Bronze,ALLIANCE > CPRD,74.61,68.25,HES Diagnostic Imaging Dataset for CPRD GOLD,32.56,Bronze,69.05,28.57,77.78,aa8c53e8-f91f-41f7-9522-7e2462a9a84b
Not Rated,NHS Digital,69.05,60.02,Mental Health Minimum Data Set,41.86,Bronze,61.9,36.51,74.6,acafb160-b18a-436e-90f1-dc4530a90267
Bronze,ALLIANCE > TISSUE DIRECTORY,69.84,74.06,REQUITE,20.93,Bronze,69.05,20.63,60.32,ace79a9e-1552-4287-9f6e-9d01f628252b
Bronze,ALLIANCE > TISSUE DIRECTORY,71.43,75.25,Cardiff University Biobank,20.93,Bronze,71.43,20.63,63.49,ad5c7693-983e-4f32-a979-9ab550f2084a
Not Rated,HUBS > BREATHE,57.94,63.37,Optimum Patient Care Research Database,23.26,Not Rated,50.0,25.4,41.27,ae4b8371-d037-46e8-bdcd-bf3de08ef38e
Bronze,ALLIANCE > TISSUE DIRECTORY,69.84,74.06,Cambridge Blood and Stem Cell Biobank,20.93,Bronze,69.05,20.63,60.32,ae4f0589-8679-48a1-ad04-2324a5001869
Not Rated,ALLIANCE > HQIP,45.23,47.98,National Audit of Care at the End of Life - Quality Survey,30.23,Not Rated,26.19,31.75,22.22,aeb2f1ea-c914-4b30-94c8-9fd3eb51b288
Silver,ALLIANCE > CYSTIC FIBROSIS,86.51,85.99,Cystic Fibrosis Patient NTM culture,23.26,Gold,95.24,26.98,100.0,af148400-1ec6-436d-910e-45350a54c390
Bronze,HUBS > BREATHE,67.47,72.84,Community perception on public health measures for COVID-19 prevention/control,18.6,Bronze,64.29,20.63,55.56,af238430-c257-4d60-9ff0-1de6b825f09e
Gold,HUBS > DISCOVER NOW,92.06,88.29,North West London Coordinate My Care (NWL CMC),16.28,Gold,92.86,12.7,96.83,af660e81-bb96-4e85-99a8-b85147c6ba79
Bronze,ALLIANCE > TISSUE DIRECTORY,71.43,75.25,RAPPER,20.93,Bronze,71.43,20.63,63.49,b0886a0c-7ddc-4c2b-a499-afd7262fbe56
Silver,ALLIANCE > GENOMICS ENGLAND,88.89,84.83,GENOMICS ENGLAND 100K RARE DISEASE & COMMON,25.58,Gold,95.24,22.22,100.0,b0a8085e-8cf0-45ee-b4a6-12a4a545ca70
Not Rated,ALLIANCE > DUNDEE,38.89,39.73,Patient SIMD Postcode,37.21,Not Rated,16.67,36.51,14.29,b2124786-9658-40cc-b5a3-6624885ce490
Gold,HUBS > DISCOVER NOW,90.48,87.13,North West London Patient Index (NWL PI),18.6,Gold,92.86,15.87,96.83,b232b32f-07d4-4fce-85a0-3834efd8757a
Gold,HUBS > DISCOVER NOW,91.27,87.13,North West London Admitted Patient Care Data (NWL APC),18.6,Gold,92.86,14.29,96.83,b339ea90-c3dd-44d8-a968-88eba9e3edb3
Silver,ALLIANCE > TISSUE DIRECTORY,72.22,76.42,York Tissue Bank,18.6,Bronze,71.43,19.05,63.49,b36202ad-7652-460c-8389-baa1a1c1ac46
Bronze,ALLIANCE > TISSUE DIRECTORY,69.05,72.89,HCV Research UK,23.26,Bronze,69.05,22.22,60.32,b3a10154-a409-491a-92fb-e7fac47ccd91
Silver,NIHR Health Informatics Collaborative Critical Care Theme,78.57,76.69,HIC ICU 8.3.2,41.86,Silver,95.24,42.86,100.0,b40777a2-468b-4b45-8b7d-2f62f912e950
Not Rated,ALLIANCE > BARTS,37.3,38.57,CDE Surginet Documentation,39.53,Not Rated,16.67,39.68,14.29,b41bb360-f2ed-49f0-a45b-b2fb05321975
Not Rated,ALLIANCE > CPRD,61.11,51.72,Systemic Anti-Cancer Treatment (SACT) data for CPRD Aurum,44.19,Not Rated,47.62,38.1,60.32,b4f6a5c2-e652-4972-9d06-510e9a469dfe
Not Rated,NHS Digital,64.28,57.7,Mental Health Minimum Dataset v4.1 (Non-Sensitive) Episodes,46.51,Not Rated,61.9,46.03,74.6,b53f716d-a5c3-4ad8-a2aa-cae09c12ac18
Bronze,ALLIANCE > TISSUE DIRECTORY,69.84,74.06,MRC Brain Banks Network,20.93,Bronze,69.05,20.63,60.32,b717d41e-9202-40ed-be1a-882ec0c47761
Bronze,ALLIANCE > TISSUE DIRECTORY,67.46,70.57,Tissue Solutions Ltd,27.91,Bronze,69.05,26.98,61.9,b730442a-72f3-4b0d-8ad3-4bdba046df7a
Silver,HUBS > DATA-CAN,84.13,82.47,Yorkshire Specialist Register of Cancer in Children and Young People,27.91,Silver,92.86,28.57,96.83,b765d514-1642-4762-a521-73463c977094
Bronze,ALLIANCE > TISSUE DIRECTORY,70.64,74.09,TRICON8,23.26,Bronze,71.43,22.22,63.49,b796b821-97cf-4aa1-bbc7-53e3c1fbc33f
Not Rated,ALLIANCE > DUNDEE,38.89,39.73,Tayside Radiology,37.21,Not Rated,16.67,36.51,14.29,b8107ec3-ba35-45ee-8231-cb610fe2ce48
Not Rated,ALLIANCE > DUNDEE,38.89,39.73,NHS Tayside and Fife Haematology (Lab Data Restructured),37.21,Not Rated,16.67,36.51,14.29,b9a2fe09-60b3-48a4-b252-9ed04a7dcc66
Not Rated,NHS Digital,65.88,58.89,Mental Health Minimum Dataset v4 (Non-Sensitive) Events,46.51,Not Rated,64.29,46.03,77.78,ba071b0b-5ef4-457b-b194-3a69c2c71a06
Bronze,HUBS > BREATHE,66.67,71.65,Assessment of ASHA’s workload and its determinants,18.6,Bronze,61.9,20.63,53.97,bab944af-e345-4893-8640-a88aaff97c72
Gold,HUBS > DISCOVER NOW,92.06,88.29,North West London Primary Care Events Data (NWL PCE),16.28,Gold,92.86,12.7,96.83,bc2d2a17-0f36-4cb0-85d3-b54e64460d75
Not Rated,ALLIANCE > CPRD,65.08,54.07,Patient postcode linked deprivation measures for CPRD GOLD,41.86,Not Rated,50.0,33.33,63.49,bc6ae5bc-7175-49e2-b093-337dde427736
Bronze,ALLIANCE > TISSUE DIRECTORY,69.84,74.06,Wales Cancer Bank,20.93,Bronze,69.05,20.63,60.32,bcfdc597-1bf0-41c2-8b68-779f9a115f83
Not Rated,NHS Digital,65.88,58.89,Mental Health & Learning Disabilities Dataset v 1 (Sensitive) Events,46.51,Not Rated,64.29,46.03,77.78,bdc17b2c-8b0f-4959-ab9b-e2de32d8a5f9
Not Rated,ALLIANCE > CPRD,65.87,55.28,Mother-Baby Link for CPRD GOLD,44.19,Not Rated,54.76,38.1,69.84,bdcbbb2b-df99-4ae7-b36e-f266cfe10ed3
Not Rated,ALLIANCE > HQIP,45.23,47.98,National Joint Registry - Revision Shoulder Replacement dataset,30.23,Not Rated,26.19,31.75,22.22,bddcc89d-028f-48a5-b568-7dccd574563b
Silver,HUBS > BREATHE,69.84,76.38,4 LMIC Asian Country ChrOnic: estimating respiratory disease burden in adults,16.28,Bronze,69.05,19.05,58.73,be9bf427-d96d-4b1a-b1d1-83bdc3e8790b
Not Rated,Oxford University Hospitals NHS Foundation Trust,36.51,37.41,TheatreEvents,41.86,Not Rated,16.67,41.27,14.29,bf83ada4-b72e-4789-b177-12a53aa763ea
Silver,ALLIANCE > SCOTLAND,83.34,77.69,Mental Health Inpatient and Day Case - Scottish Morbidity Record (SMR04),25.58,Silver,80.95,20.63,87.3,bfc6e7c5-a81b-4fe2-95b5-d108a48d7d67
Gold,ALLIANCE > SAIL,95.23,90.62,Daily Situation Report Data,11.63,Gold,92.86,7.94,98.41,c0da6801-6907-4c06-8fba-d21943c3a931
Bronze,ALLIANCE > TISSUE DIRECTORY,69.05,72.93,UCL Infection DNA Bank,25.58,Bronze,71.43,25.4,63.49,c10d6c3a-e405-4ee9-828f-02443c210879
Not Rated,HUBS > BREATHE,45.24,49.17,Vitamin D supplementation meta-analyses,30.23,Not Rated,28.57,33.33,23.81,c16605d7-6e6e-4461-bfab-107660e31427
Bronze,ALLIANCE > TISSUE DIRECTORY,70.64,75.22,STAMPEDE,18.6,Bronze,69.05,19.05,60.32,c182a3b6-8eea-43ef-be18-6cd444f150dc
Gold,HUBS > DISCOVER NOW,91.27,88.29,North West London Primary Care Prescriptions Data (NWL PCP),16.28,Gold,92.86,14.29,96.83,c1f947c3-4956-4e0b-93ef-23ce9abda000
Not Rated,ALLIANCE > DUNDEE,38.89,39.73,Fife Radiology,37.21,Not Rated,16.67,36.51,14.29,c22d8356-d51b-4d34-aadf-ed356d15fe46
Bronze,HUBS > BREATHE,68.25,74.03,Assessing the eDPSEEA model in seasonal pollen induced asthma in Islamabad,18.6,Bronze,66.67,20.63,57.14,c2548017-7913-40e1-bf98-aaa2e907b0ea
Not Rated,ALLIANCE > DUNDEE,38.89,39.73,Tayside Bowel Screening Dataset,37.21,Not Rated,16.67,36.51,14.29,c275f19e-2373-43dc-8e83-3318aaf8bfa4
Silver,ALLIANCE > TISSUE DIRECTORY,73.02,77.61,Arden Tissue Bank,18.6,Bronze,73.81,19.05,65.08,c29c3fbe-700e-4f85-8943-5557c30c1dfa
Not Rated,ALLIANCE > LEICESTER,45.24,48.0,Genvasc Primary Care Data,32.56,Not Rated,28.57,33.33,23.81,c324246a-22d9-45d8-9a7a-a513078be2d1
Not Rated,ALLIANCE > HQIP,43.65,46.81,Sentinel Stroke National Audit Programme Acute Organisational survey dataset,32.56,Not Rated,26.19,34.92,22.22,c3d84dfa-fe3a-4b86-a0f5-efbe45aa93ad
Gold,ALLIANCE > SAIL,98.41,94.13,COVID-19 Symptom Tracker Dataset,6.98,Gold,95.24,3.17,100.0,c42ceb2a-c9c2-491d-9f34-3da55413225f
Silver,HUBS > BREATHE,76.98,82.31,UK BiLEVE Consortium Dataset,13.95,Silver,78.57,15.87,69.84,c43363e5-a2cd-4990-a425-733dfe559a4f
Bronze,ALLIANCE > CPRD,74.61,68.25,HES Accident and Emergency data for CPRD GOLD,32.56,Bronze,69.05,28.57,77.78,c55b92d8-889d-435c-b0cb-2d9f7b432839
Bronze,ALLIANCE > CPRD,73.81,67.09,Death Registration data for CPRD Aurum,34.88,Bronze,69.05,30.16,77.78,c577669a-a84f-493e-8164-3fe02f618561
Not Rated,ALLIANCE > HQIP,44.45,46.81,National Audit of Psychosis - Audit on Early Intervention in Psychosis services - contextual data,32.56,Not Rated,26.19,33.33,22.22,c5994fae-9c4a-47eb-ba42-85bd76e92879
Not Rated,ALLIANCE > CPRD,65.08,54.07,Practice postcode linked deprivation measures for CPRD GOLD,41.86,Not Rated,50.0,33.33,63.49,c6117afd-bc4d-404b-8d58-9d87db936b4c
Bronze,ALLIANCE > TISSUE DIRECTORY,68.25,72.89,Barts CTU,23.26,Bronze,69.05,23.81,60.32,c6d6bbd3-74ed-46af-841d-ac5e05f4da41
Gold,OTHER > COG-UK,93.65,89.48,COG-UK Viral Genome Sequences,16.28,Gold,95.24,12.7,100.0,c6dc78fa-1543-4fbf-87d8-a3f48e7de813
Not Rated,NHS Digital,65.88,58.89,Mental Health & Learning Disabilities Dataset v 1 (Non-Sensitive) Episodes,46.51,Not Rated,64.29,46.03,77.78,c713773c-e961-400e-b44a-947002deb073
Bronze,HUBS > NHS DIGITRIALS,75.39,69.38,Hospital Episode Statistics Outpatients,27.91,Bronze,66.67,25.4,76.19,c720c89a-b2c6-4cd6-b606-df34ff22b1c8
Bronze,ALLIANCE > TISSUE DIRECTORY,70.64,75.28,RATHL Trial,23.26,Bronze,73.81,22.22,63.49,c83d2206-3778-400b-9b26-27c7588af930
Gold,ALLIANCE > SAIL,92.06,89.48,COVID-19 Shielded People list,16.28,Gold,95.24,15.87,100.0,c84321f3-caf3-4b40-a41a-5ccebe5bb1aa
Not Rated,ALLIANCE > DUNDEE,38.89,39.73,NHS Tayside and Fife Virology,37.21,Not Rated,16.67,36.51,14.29,c8ed8784-91ce-4823-8e80-fa3a4b732e11
Not Rated,NHS Digital,65.88,58.89,Mental Health Minimum Dataset v4.1 (Non-Sensitive) Records,46.51,Not Rated,64.29,46.03,77.78,c97b8058-a6a4-4c8d-92e1-6e9f4cddd301
Not Rated,ALLIANCE > HQIP,45.23,47.98,National Audit of Care at the End of Life - case note review,30.23,Not Rated,26.19,31.75,22.22,cabb1db1-ee3e-42ce-a40b-468282e2011d
Not Rated,ALLIANCE > HQIP,43.65,46.81,National Early Inflammatory Arthritis Audit - organisational survey dataset,32.56,Not Rated,26.19,34.92,22.22,cbda5643-96b7-4914-b990-a872e693ff29
Not Rated,NHS Digital,65.88,58.89,Mental Health Minimum Dataset v4.1 (Sensitive) Records,46.51,Not Rated,64.29,46.03,77.78,cc383a3f-1c47-4b7d-99cf-be8ee0afe401
Bronze,ALLIANCE > CPRD,74.61,68.28,HES Admitted Patient Care data for CPRD Aurum,34.88,Bronze,71.43,30.16,79.37,cc3e20da-aca5-471d-a4bb-38e13f350f10
Not Rated,ALLIANCE > HQIP,44.45,46.81,National Clinical Audit of Anxiety and Depression - spotlight audit on psychological therapies (clinical),32.56,Not Rated,26.19,33.33,22.22,cf3f4336-e52d-4b82-8cc5-647dedaaee57
Not Rated,ALLIANCE > CPRD,59.53,50.58,Quality of Life of Colorectal Cancer Survivors in England: Patient Reported Outcome Measures Survey for CPRD GOLD,48.84,Not Rated,50.0,44.44,63.49,cf81a42f-2611-4410-89e9-7e3770d03a15
Silver,ALLIANCE > CYSTIC FIBROSIS,86.51,85.99,Cystic Fibrosis Patient Microbiology Cultures,23.26,Gold,95.24,26.98,100.0,d0468470-a88f-4692-a19d-c9ac0b9868f3
Gold,ALLIANCE > SAIL,95.24,91.81,Welsh Cancer Intelligence and Surveillance Unit (WCISU),11.63,Gold,95.24,9.52,100.0,d2667c43-adfd-4a61-b090-38d39e35a392
Bronze,ALLIANCE > TISSUE DIRECTORY,69.84,74.06,Cancer Group CTR Cardiff trials,20.93,Bronze,69.05,20.63,60.32,d272b783-8db3-4068-8d0f-05728f786d6d
Not Rated,NHS Digital,48.41,41.09,Patient Reported Outcome Measures,51.16,Not Rated,33.33,49.21,46.03,d2af6a29-291b-4444-a17c-40f4208f1e1b
Not Rated,ALLIANCE > HQIP,43.65,46.81,Sentinel Stroke National Audit Programme Clinical Dataset,32.56,Not Rated,26.19,34.92,22.22,d3673b75-ec8f-4c2e-8c9b-6ef1d951f978
Bronze,ALLIANCE > TISSUE DIRECTORY,71.43,75.25,MFT Biobank,20.93,Bronze,71.43,20.63,63.49,d3a3935f-b28e-4e74-9b15-9432d611f26c
Bronze,HUBS > BREATHE,65.08,69.3,Strategy introducing Pulmonary Rehabilitation for COPD management in rural India,20.93,Not Rated,59.52,22.22,52.38,d3e859ba-cfb0-4eda-a14c-34b08d113cd9
Not Rated,Oxford University Hospitals NHS Foundation Trust,37.3,38.57,JANUS,39.53,Not Rated,16.67,39.68,14.29,d3fd4dac-2d15-401c-8185-905ee108d9ce
Bronze,ALLIANCE > TISSUE DIRECTORY,71.43,75.25,UK ME/CFS Biobank,20.93,Bronze,71.43,20.63,63.49,d51de39c-153a-462b-8de5-cd1424908e0c
Bronze,HUBS > BREATHE,68.25,74.03,Exploration of Pneumonia Related Policy Formation and Implementation in Pakistan,18.6,Bronze,66.67,20.63,57.14,d5446d68-2fb9-4f0f-962e-7b7ed484d534
Not Rated,HUBS > PIONEER,43.65,46.81,Birmingham Out of Hours Research Database,32.56,Not Rated,26.19,34.92,22.22,d546521a-79be-4a53-83bd-ff008bda6171
Not Rated,Oxford University Hospitals NHS Foundation Trust,37.3,38.57,OUH Patient Master Index,39.53,Not Rated,16.67,39.68,14.29,d57a096a-4fa3-4529-b508-0b9df0f1893c
Bronze,ALLIANCE > TISSUE DIRECTORY,71.43,75.25,NHS Grampian Biorepository,20.93,Bronze,71.43,20.63,63.49,d5ab658e-b474-4e22-95f8-92607c40792d
Silver,ALLIANCE > NIHR BIORESOURCE,84.12,78.94,Health and Lifestyle Questionnaire,30.23,Silver,88.1,23.81,92.06,d7ec9584-cba3-46f9-9ef4-b1cb9eef2e7c
Not Rated,ALLIANCE > CPRD,46.83,45.73,Cancer Patient Experience Survey (CPES) for CPRD Aurum,41.86,Not Rated,33.33,38.1,31.75,d90830f4-5aaa-4075-8c8d-839627224d16
Not Rated,ALLIANCE > HQIP,45.23,47.98,National Vascular Registry -  Abdominal Aortic Aneurysm Repair clinical dataset,30.23,Not Rated,26.19,31.75,22.22,da4d3e21-3d81-49e9-ada0-6175e2341190
Not Rated,NHS Digital,65.88,58.89,Mental Health Minimum Dataset v4.1 (Sensitive) Events,46.51,Not Rated,64.29,46.03,77.78,db113fcd-69a0-4357-9c6d-250085deb3f5
Bronze,ALLIANCE > TISSUE DIRECTORY,70.64,75.22,interNational Anaplastic Thyroid Cancer Tissue Bank (iNATT),18.6,Bronze,69.05,19.05,60.32,dd7e56e7-2683-4b88-bed2-3a27ef3e4c9e
Not Rated,ALLIANCE > HQIP,45.23,47.98,National Vascular Registry Audit Carotid Endarterectomy Clinical Dataset,30.23,Not Rated,26.19,31.75,22.22,ddc965e7-6f52-4eed-bed5-657e3e7bbeac
Not Rated,ALLIANCE > NIHR BIORESOURCE,40.48,43.28,NHS Digital data,34.88,Not Rated,21.43,36.51,17.46,de1179eb-89fe-45a3-9e3c-e54a2a36ebf0
Not Rated,ALLIANCE > HQIP,44.45,46.81,National Bowel Cancer Audit -  Organisational Survey dataset,32.56,Not Rated,26.19,33.33,22.22,de19b3ea-2600-4472-85e8-628e7beff76e
Silver,HUBS > BREATHE,80.96,85.83,UK Lung Volume Reduction Surgery,9.3,Silver,80.95,9.52,71.43,def6669b-0fac-485c-84b2-2ea83ec31123
Bronze,HUBS > BREATHE,65.88,71.68,Klang Asthma Cohort,20.93,Not Rated,64.29,23.81,55.56,df63e893-f688-4bb4-956c-cc4354bb4001
Not Rated,Oxford University Hospitals NHS Foundation Trust,37.3,38.57,Admitted Patient Care Dataset,39.53,Not Rated,16.67,39.68,14.29,dfb21b3b-7fd9-40c4-892e-810edd6dfc25
Silver,ALLIANCE > GENOMICS ENGLAND,88.89,84.83,GENOMICS ENGLAND 100K PHE LINKED DATA,25.58,Gold,95.24,22.22,100.0,e0c871f9-b63c-43a5-9fd6-e5731dae2343
Gold,ALLIANCE > SAIL,95.24,91.81,Brecon dataset,11.63,Gold,95.24,9.52,100.0,e0ed59e2-8fb5-44d4-b694-f31d46884954
Not Rated,ALLIANCE > HQIP,45.23,47.98,National Oesophago-Gastric Cancer Audit - clinical dataset,30.23,Not Rated,26.19,31.75,22.22,e10660af-b420-4e25-8fc9-ea451da1dcfb
Not Rated,ALLIANCE > HQIP,45.23,47.98,National Joint Registry - Primary Ankle Replacement dataset,30.23,Not Rated,26.19,31.75,22.22,e38c8d6c-8655-4432-b654-23f89c0bb495
Silver,ALLIANCE > CYSTIC FIBROSIS,86.51,85.99,Cystic Fibrosis Patient Tendon Rupture,23.26,Gold,95.24,26.98,100.0,e432737f-43c0-43c1-aef5-71cb204d770c
Not Rated,HUBS > BREATHE,45.24,49.17,Unified Cohorts Research Network,30.23,Not Rated,28.57,33.33,23.81,e516a359-74a8-4932-b4df-f2cf75eef89d
Silver,ALLIANCE > CYSTIC FIBROSIS,86.51,84.83,Cystic Fibrosis Patient Sweat Tests,25.58,Gold,95.24,26.98,100.0,e66b726f-8e58-4411-be32-1d00ba1df13f
Bronze,ALLIANCE > TISSUE DIRECTORY,69.84,74.06,Biobank for patients with retinal degenerations & dystrophies,20.93,Bronze,69.05,20.63,60.32,e678366e-bb53-4dbb-a228-05114e0b6eb3
Silver,HUBS > DISCOVER NOW,88.1,85.97,North West London Community Data (NWL COM),20.93,Gold,92.86,20.63,96.83,e85e5c8c-b6be-4e8b-8a0b-13b785b457a2
Bronze,ALLIANCE > TISSUE DIRECTORY,69.84,74.06,University of Liverpool - GCP Laboratory Facility,20.93,Bronze,69.05,20.63,60.32,e8f23004-f1f7-4a36-859f-25af6ca6433b
Not Rated,ALLIANCE > DUNDEE,38.89,39.73,"NHS Tayside, A&E Drugs given during an A&E visit",37.21,Not Rated,16.67,36.51,14.29,e8f5b1b5-2c08-439a-b337-70b454aa40f3
Bronze,ALLIANCE > SCOTLAND,67.46,71.65,Scottish Immunisation Recall System (SIRS),18.6,Bronze,61.9,19.05,53.97,e9d504fc-4b61-4419-a400-ffda998fc377
Bronze,ALLIANCE > TISSUE DIRECTORY,71.43,75.31,Research Donors Ltd,25.58,Bronze,76.19,23.81,66.67,ea07f115-9f70-4c21-a373-247a1ca906f0
Not Rated,Oxford University Hospitals NHS Foundation Trust,37.3,38.57,Sunquest,39.53,Not Rated,16.67,39.68,14.29,eaca9ed1-30b6-4157-8894-8e53efc84849
Silver,ALLIANCE > TISSUE DIRECTORY,72.22,76.42,Tommy's National Reproductive Health Biobank,18.6,Bronze,71.43,19.05,63.49,eb19fcd9-2e9e-4e27-aa79-ad235952b1ac
Silver,ALLIANCE > SAIL,86.51,83.58,Higher Education Statistics Agency (HESA) Student Data,20.93,Gold,88.1,20.63,93.65,ec8e4933-2118-4366-a61a-090748e49be7
Silver,ALLIANCE > GENOMICS ENGLAND,91.27,85.99,GENOMICS ENGLAND 100K QUICK VIEW,23.26,Gold,95.24,17.46,100.0,ecbe7275-82b5-43cd-9401-fd7ef4b55341
Bronze,HUBS > BREATHE,65.08,69.3,"Introducing pulse oximetry in IMNCI, primary health facilities in Pune India",20.93,Not Rated,59.52,22.22,52.38,ecc4daf2-e58a-4ebc-9608-4bc741231fb9
Not Rated,ALLIANCE > DUNDEE,38.89,39.73,Fife Microbiology: Isolations,37.21,Not Rated,16.67,36.51,14.29,edaf29f4-9857-4bb0-97b9-ae88b70a2a3c
Silver,HUBS > BREATHE,73.81,78.82,Its Not JUST Idiopathic pulmonary fibrosis Study (INJUSTIS),20.93,Bronze,78.57,20.63,68.25,edc8f0c6-64f8-4f6d-a1dd-41e05033d54e
Bronze,ALLIANCE > TISSUE DIRECTORY,71.43,75.25,QTL Programme at MRC HGU,20.93,Bronze,71.43,20.63,63.49,ee5f4405-6930-4a7b-ba00-85a8e8c8a8b9
Gold,ALLIANCE > SAIL,92.86,89.48,National Survey for Wales,16.28,Gold,95.24,14.29,100.0,ee78ce42-7f1f-4c97-80cc-ea6ad628e5da
Bronze,ALLIANCE > TISSUE DIRECTORY,71.43,75.25,Manchester Cancer Research Centre (MCRC) Biobank,20.93,Bronze,71.43,20.63,63.49,eea147a4-4576-4f86-8ad1-c762137335fd
Gold,ALLIANCE > SAIL,93.65,90.64,Emergency Department Dataset Daily,13.95,Gold,95.24,12.7,100.0,eebb647a-63eb-4e62-b052-26cb2eb4799d
Silver,ALLIANCE > CPRD,84.13,77.71,CPRD Aurum,27.91,Silver,83.33,22.22,90.48,ef42201e-deb1-4675-896a-8a0162fe52a8
Not Rated,ALLIANCE > HQIP,43.65,46.81,National Cardiac Audit Programme - National Heart Failure Audit,32.56,Not Rated,26.19,34.92,22.22,efbb3bf4-834b-417e-b002-03fc41715e58
Gold,ALLIANCE > SAIL,92.85,89.45,COVID-19 Consolidated Deaths,13.95,Gold,92.86,12.7,98.41,efc2bb06-d502-4424-ac92-72834459fbaa
Bronze,HUBS > BREATHE,64.29,69.27,The Malaysian Asthma Hajj Study,18.6,Not Rated,57.14,20.63,49.21,eff41dbc-0ce4-4bfe-b51f-7b2753750332
Not Rated,HUBS > PIONEER,42.86,45.66,Society for Acute Medicine Benchmarking Audit,34.88,Not Rated,26.19,36.51,22.22,f075ceb7-5bed-4e6b-8e83-211aee945356
Not Rated,ALLIANCE > NIHR BIORESOURCE,42.06,44.47,SNP imputation data,34.88,Not Rated,23.81,36.51,20.63,f1a85970-bddc-499b-92e9-783706c60995
Bronze,ALLIANCE > TISSUE DIRECTORY,69.05,72.89,Manchester Eye Tissue Repository,23.26,Bronze,69.05,22.22,60.32,f1a93b8f-6332-43a2-b2da-c86f68f7d24a
Silver,ALLIANCE > NIHR BIORESOURCE,79.37,76.61,Case report form,34.88,Silver,88.1,33.33,92.06,f1d3b068-7dd0-4a28-bd64-3519dd104eb6
Not Rated,HUBS > PIONEER,62.7,63.51,PIONEER - Genomics Patients and related data,34.88,Not Rated,61.9,31.75,57.14,f202a9da-f036-4e8c-a069-a20ff6c8a9e1
Not Rated,ALLIANCE > CPRD,65.08,54.07,Practice postcode linked deprivation measures for CPRD Aurum,41.86,Not Rated,50.0,33.33,63.49,f3a53f7a-ea93-4b9e-bccd-afe762259044
Not Rated,ALLIANCE > LEICESTER,45.23,47.98,The Leicester City and County Chronic Kidney Disease Cohort,30.23,Not Rated,26.19,31.75,22.22,f3ade619-292e-4631-916a-9cd9d7938e48
Bronze,ALLIANCE > TISSUE DIRECTORY,69.05,72.89,Bristol Biobank,23.26,Bronze,69.05,22.22,60.32,f42b9fa6-adad-4637-943e-6fa7508559a3
Bronze,ALLIANCE > HQIP,69.05,72.93,National Joint Registry - Primary Knee Replacement dataset,25.58,Bronze,71.43,25.4,63.49,f4915e4b-639c-45ae-9b0f-afab547e1104
Bronze,ALLIANCE > TISSUE DIRECTORY,69.84,74.06,Leeds NIHR Biomarker Research Tissue Bank,20.93,Bronze,69.05,20.63,60.32,f5b57b56-a4ed-46d4-825f-d181e8db809d
Bronze,ALLIANCE > TISSUE DIRECTORY,69.05,72.89,Oxford Musculoskeletal Biobank,23.26,Bronze,69.05,22.22,60.32,f5ed34fa-154a-4613-a253-277547cfd8ca
Bronze,ALLIANCE > TISSUE DIRECTORY,69.05,72.89,NIHR Exeter Clinical Research Facility,23.26,Bronze,69.05,22.22,60.32,f621fcc9-e9ab-4da4-bd34-e4530d11b59d
Not Rated,ALLIANCE > HQIP,45.23,47.98,National Diabetes Inpatient Audit - Harms clinical dataset,30.23,Not Rated,26.19,31.75,22.22,f69d1b15-a0b4-461a-8aff-dba56da0791f
Bronze,ALLIANCE > NIHR BIORESOURCE,78.57,75.38,SNP chip data,32.56,Silver,83.33,31.75,88.89,f7c563c0-9625-47be-a070-c121fe734f3c
Not Rated,ALLIANCE > HQIP,45.23,47.98,National Maternity and Perinatal Audit clinical audit,30.23,Not Rated,26.19,31.75,22.22,f806fe65-79aa-4843-bc56-a08bf14ffcec
Not Rated,ALLIANCE > HQIP,44.45,46.81,"Maternal, Newborn and Infant Clinical Outcome Review Programme - perinatal surveillance dataset",32.56,Not Rated,26.19,33.33,22.22,f82b8ca5-5a52-4502-bf78-cfbb718cbe2f
Gold,ALLIANCE > IMPERIAL COLLEGE LONDON,91.27,88.27,National Neonatal Research Database,13.95,Gold,90.48,12.7,95.24,f89af2f4-e3cd-4eaa-835d-94aa347d8a92
Not Rated,ALLIANCE > BARTS,37.3,38.57,Maternity Services Dataset,39.53,Not Rated,16.67,39.68,14.29,f8bab14a-bc9b-4dd1-a6c6-c57588605849
Bronze,ALLIANCE > TISSUE DIRECTORY,69.84,74.06,Multiple Sclerosis and Parkinson's Tissue Bank,20.93,Bronze,69.05,20.63,60.32,f8f6e9ea-65c0-48a6-9beb-6de80bbbefda
Silver,ALLIANCE > TISSUE DIRECTORY,72.22,76.42,UCL / UCLH Biobank for Studying Health and Disease,18.6,Bronze,71.43,19.05,63.49,f9a712ae-9d41-41a6-b2ca-3127441b03ac
Bronze,ALLIANCE > TISSUE DIRECTORY,69.84,72.93,"St Thomas' Hospitals Plasma, serum & DNA Bio bank from patients with antiphospholipid antibodies",25.58,Bronze,71.43,23.81,63.49,f9f3af0d-ca1c-4e8f-b5e8-20962e1e7b4e
Not Rated,ALLIANCE > HQIP,43.65,46.81,National Cardiac Audit Programme - National Adult Cardiac Surgery Audit (NACSA),32.56,Not Rated,26.19,34.92,22.22,faf7ec31-999a-4d87-9d6d-8837ff2fa486
Silver,ALLIANCE > SCOTLAND,84.93,78.88,Outpatient Appointments and Attendances - Scottish Morbidity Record (SMR00),25.58,Silver,83.33,20.63,90.48,fb0e3d82-dcdb-4854-bdf5-99f03514a083
Not Rated,Oxford University Hospitals NHS Foundation Trust,37.3,38.57,CellPath,39.53,Not Rated,16.67,39.68,14.29,fc7b44f0-eb69-4257-8c07-7516c1210c46
Bronze,ALLIANCE > TISSUE DIRECTORY,71.43,75.25,eLIXIR - Early Life Data Cross-Linkage in Research,20.93,Bronze,71.43,20.63,63.49,fcee6c99-a4bd-44b8-a28e-dc63337ce216
Gold,ALLIANCE > SAIL,95.24,91.81,National Exercise Referral Scheme,11.63,Gold,95.24,9.52,100.0,fe3c7527-e802-4a51-9aa2-19e7d4d22783
Not Rated,ALLIANCE > HQIP,45.23,47.98,National Joint Registry - Primary Shoulder Replacement dataset,30.23,Not Rated,26.19,31.75,22.22,fe4662ad-9080-4bd8-8de4-51195d275d5b
