error_percent,completeness_percent,weighted_completeness_percent,quality_score,quality_rating,publisher,weighted_error_percent,weighted_quality_score,weighted_quality_rating,title,id
18.6,57.14,49.21,69.27,Bronze,HUBS > BREATHE,20.63,64.29,Not Rated,The Malaysian Asthma Hajj Study,eff41dbc-0ce4-4bfe-b51f-7b2753750332
27.91,78.57,85.71,75.33,Bronze,HUB > NHS DIGITRIALS,23.81,80.95,Silver,Hospital Episode Statistics Critical Care,f0392b68-5075-4557-adaa-2fb24b5dec4d
34.88,26.19,22.22,45.66,Not Rated,HUBS > PIONEER,36.51,42.86,Not Rated,Society for Acute Medicine Benchmarking Audit,f075ceb7-5bed-4e6b-8e83-211aee945356
34.88,23.81,20.63,44.47,Not Rated,ALLIANCE > NIHR BIORESOURCE,36.51,42.06,Not Rated,SNP imputation data,f1a85970-bddc-499b-92e9-783706c60995
23.26,69.05,60.32,72.89,Bronze,ALLIANCE > TISSUE DIRECTORY,22.22,69.05,Bronze,Manchester Eye Tissue Repository,f1a93b8f-6332-43a2-b2da-c86f68f7d24a
34.88,88.1,92.06,76.61,Silver,ALLIANCE > NIHR BIORESOURCE,33.33,79.37,Silver,Case report form,f1d3b068-7dd0-4a28-bd64-3519dd104eb6
34.88,61.9,57.14,63.51,Not Rated,HUBS > PIONEER,31.75,62.7,Not Rated,PIONEER - Genomics Patients and related data,f202a9da-f036-4e8c-a069-a20ff6c8a9e1
41.86,50.0,63.49,54.07,Not Rated,ALLIANCE > CPRD,33.33,65.08,Not Rated,Practice postcode linked deprivation measures for CPRD Aurum,f3a53f7a-ea93-4b9e-bccd-afe762259044
30.23,26.19,22.22,47.98,Not Rated,ALLIANCE > LEICESTER,31.75,45.23,Not Rated,The Leicester City and County Chronic Kidney Disease Cohort,f3ade619-292e-4631-916a-9cd9d7938e48
23.26,69.05,76.19,72.89,Bronze,ALLIANCE > NHS DIGITAL,20.63,77.78,Silver,Pillar 2 - Covid-19 UK Non-hospital Antigen Testing Results,f3b4817a-7924-460c-a1c5-0b24acd81a7d
23.26,69.05,60.32,72.89,Bronze,ALLIANCE > TISSUE DIRECTORY,22.22,69.05,Bronze,Bristol Biobank,f42b9fa6-adad-4637-943e-6fa7508559a3
25.58,71.43,63.49,72.93,Bronze,ALLIANCE > HQIP,25.4,69.05,Bronze,National Joint Registry - Primary Knee Replacement dataset,f4915e4b-639c-45ae-9b0f-afab547e1104
20.93,69.05,60.32,74.06,Bronze,ALLIANCE > TISSUE DIRECTORY,20.63,69.84,Bronze,Leeds NIHR Biomarker Research Tissue Bank,f5b57b56-a4ed-46d4-825f-d181e8db809d
23.26,69.05,60.32,72.89,Bronze,ALLIANCE > TISSUE DIRECTORY,22.22,69.05,Bronze,Oxford Musculoskeletal Biobank,f5ed34fa-154a-4613-a253-277547cfd8ca
23.26,69.05,60.32,72.89,Bronze,ALLIANCE > TISSUE DIRECTORY,22.22,69.05,Bronze,NIHR Exeter Clinical Research Facility,f621fcc9-e9ab-4da4-bd34-e4530d11b59d
30.23,26.19,22.22,47.98,Not Rated,ALLIANCE > HQIP,31.75,45.23,Not Rated,National Diabetes Inpatient Audit - Harms clinical dataset,f69d1b15-a0b4-461a-8aff-dba56da0791f
25.58,66.67,57.14,70.55,Bronze,HUB > BREATHE,26.98,65.08,Not Rated,Developing and evaluating interventions to improve asthma care: HEAL ASTHMA,f73627e3-bd7c-4be2-81b4-3baf846ab787
32.56,83.33,88.89,75.38,Bronze,ALLIANCE > NIHR BIORESOURCE,31.75,78.57,Silver,SNP chip data,f7c563c0-9625-47be-a070-c121fe734f3c
30.23,26.19,22.22,47.98,Not Rated,ALLIANCE > HQIP,31.75,45.23,Not Rated,National Maternity and Perinatal Audit clinical audit,f806fe65-79aa-4843-bc56-a08bf14ffcec
32.56,26.19,22.22,46.81,Not Rated,ALLIANCE > HQIP,33.33,44.45,Not Rated,"Maternal, Newborn and Infant Clinical Outcome Review Programme - perinatal surveillance dataset",f82b8ca5-5a52-4502-bf78-cfbb718cbe2f
13.95,90.48,95.24,88.27,Gold,ALLIANCE > IMPERIAL COLLEGE LONDON,12.7,91.27,Gold,National Neonatal Research Database,f89af2f4-e3cd-4eaa-835d-94aa347d8a92
39.53,16.67,14.29,38.57,Not Rated,ALLIANCE > BARTS,39.68,37.3,Not Rated,Maternity Services Dataset,f8bab14a-bc9b-4dd1-a6c6-c57588605849
20.93,69.05,60.32,74.06,Bronze,ALLIANCE > TISSUE DIRECTORY,20.63,69.84,Bronze,Multiple Sclerosis and Parkinson's Tissue Bank,f8f6e9ea-65c0-48a6-9beb-6de80bbbefda
18.6,71.43,63.49,76.42,Silver,ALLIANCE > TISSUE DIRECTORY,19.05,72.22,Bronze,UCL / UCLH Biobank for Studying Health and Disease,f9a712ae-9d41-41a6-b2ca-3127441b03ac
25.58,71.43,63.49,72.93,Bronze,ALLIANCE > TISSUE DIRECTORY,23.81,69.84,Bronze,"St Thomas' Hospitals Plasma, serum & DNA Bio bank from patients with antiphospholipid antibodies",f9f3af0d-ca1c-4e8f-b5e8-20962e1e7b4e
32.56,26.19,22.22,46.81,Not Rated,ALLIANCE > HQIP,34.92,43.65,Not Rated,National Cardiac Audit Programme - National Adult Cardiac Surgery Audit (NACSA),faf7ec31-999a-4d87-9d6d-8837ff2fa486
39.53,16.67,14.29,38.57,Not Rated,ALLIANCE > OUH,39.68,37.3,Not Rated,CellPath,fc7b44f0-eb69-4257-8c07-7516c1210c46
20.93,71.43,63.49,75.25,Bronze,ALLIANCE > TISSUE DIRECTORY,20.63,71.43,Bronze,eLIXIR - Early Life Data Cross-Linkage in Research,fcee6c99-a4bd-44b8-a28e-dc63337ce216
11.63,95.24,100.0,91.81,Gold,ALLIANCE > SAIL,9.52,95.24,Gold,National Exercise Referral Scheme,fe3c7527-e802-4a51-9aa2-19e7d4d22783
30.23,26.19,22.22,47.98,Not Rated,ALLIANCE > HQIP,31.75,45.23,Not Rated,National Joint Registry - Primary Shoulder Replacement dataset,fe4662ad-9080-4bd8-8de4-51195d275d5b
34.88,26.19,22.22,45.66,Not Rated,ALLIANCE > HQIP,36.51,42.86,Not Rated,National Paediatric Diabetes Audit - Parent and Patient Recorded Experience measures,fe872375-2401-4de1-9650-d4139cf5793a
13.95,92.86,98.41,89.45,Gold,ALLIANCE > SAIL,9.52,94.44,Gold,Welsh Dispensing Dataset,fea0b4be-4097-4c2e-86f2-03dc1ee2877b
46.51,64.29,77.78,58.89,Not Rated,NHS Digital,46.03,65.88,Not Rated,Mental Health Minimum Dataset v4 (Non-Sensitive) Records,ff2c6982-00f3-4483-9fc2-19b3a7211d8d
11.63,95.24,100.0,91.81,Gold,ALLIANCE > SAIL,7.94,96.03,Gold,COVID-19 Symptom Tracker Dataset,ff88d11a-d29b-4d94-92f2-2bbf7dd7d03a
18.6,64.29,55.56,72.84,Bronze,HUBS > BREATHE,20.63,67.47,Bronze,Teleconsultation in remote rural India: management of COPD and Asthma,ffc34689-1a81-4f56-9c3f-e62b76d8445b
