id,quality_rating,publisher,weighted_error_percent,error_percent,weighted_quality_score,weighted_quality_rating,completeness_percent,weighted_completeness_percent,quality_score,title
0048a401-e54c-49d7-8afc-6c5390fb66b9,Silver,HUB > PIONEER,26.98,30.23,82.54,Silver,83.33,92.06,76.55,Acute care patients within the 100K Genome project
004d1932-f06e-49d2-b87a-e5e4140ffbb3,Not Rated,ALLIANCE > NIHR BIORESOURCE,34.92,32.56,43.65,Not Rated,26.19,22.22,46.81,Metabolite data
0092dc60-a0af-4d45-801c-b888210d6609,Not Rated,ALLIANCE > HQIP,31.75,30.23,45.23,Not Rated,26.19,22.22,47.98,National Joint Registry - Primary Elbow Replacement dataset
014bc853-1b27-4d97-9e5e-97fe28b84769,Not Rated,ALLIANCE > DUNDEE,36.51,37.21,38.89,Not Rated,16.67,14.29,39.73,Tayside Pathology
0150353c-d33d-4af0-b177-8ef0adf867f4,Not Rated,HUB > BREATHE,23.81,23.26,61.11,Not Rated,52.38,46.03,64.56,Estimating Chronic Respiratory Disease burden in adults in Asian LMICs
0217114b-6847-4aae-9d76-4d52acea2bcc,Not Rated,ALLIANCE > HQIP,34.92,32.56,43.65,Not Rated,26.19,22.22,46.81,Paediatric Intensive Care Audit Network - core dataset (admission)
022cedb4-650d-4566-be41-8d7ed07a5112,Bronze,ALLIANCE > HSCNI,30.16,32.56,72.22,Bronze,66.67,74.6,67.06,COVID antigen  testing - Pillar 2
0266f904-b168-488a-a9e7-d318443584ef,Bronze,ALLIANCE > CPRD,28.57,32.56,74.61,Bronze,69.05,77.78,68.25,HES Diagnostic Imaging Dataset for CPRD Aurum
03db4df3-f482-4bdd-a335-546ffffbeaab,Gold,ALLIANCE > SAIL,15.87,16.28,92.06,Gold,95.24,100.0,89.48,Annual District Death Extract
0477b06f-cbed-4949-982e-ce248a47ed1a,Not Rated,ALLIANCE > OUH,39.68,39.53,37.3,Not Rated,16.67,14.29,38.57,SOLUS
04b1648d-eeb7-4072-8dd2-806c3ae4e20d,Not Rated,ALLIANCE > HQIP,36.51,34.88,42.86,Not Rated,26.19,22.22,45.66,National Cardiac Audit Programme - Myocardial Ischaemia National Audit Project (MINAP)
04f4604e-6d0b-4100-977b-59c3b69b0cfc,Not Rated,ALLIANCE > BARTS,39.68,39.53,37.3,Not Rated,16.67,14.29,38.57,Sectra PACS
0534b41b-9877-4e30-b3ce-e604b29d4990,Bronze,ALLIANCE > TISSUE DIRECTORY,20.63,20.93,69.84,Bronze,69.05,60.32,74.06,Infectious Diseases BioBank at King's College London
05716e41-9842-4c07-8ddd-af9f9231e056,Gold,ALLIANCE > SAIL,11.11,13.95,94.44,Gold,95.24,100.0,90.64,Bowel Screening Wales
05ade19c-75f5-4623-ade6-99fb21c2d4e3,Not Rated,ALLIANCE > LEICESTER,33.33,32.56,44.45,Not Rated,26.19,22.22,46.81,The Primary-Secondary Care Partnership to Improve Outcomes in Chronic Kidney Disease
0692d86c-1f24-43a4-9508-005d00bd7259,Bronze,HUBS > BREATHE,22.22,20.93,62.7,Not Rated,54.76,47.62,66.91,CuT-AsthMa: Culturally tailored school-based intervention for asthma in Malaysia
0711cc7e-80d5-4781-a1ab-2637ea176ceb,Not Rated,ALLIANCE > OUH,39.68,39.53,37.3,Not Rated,16.67,14.29,38.57,Millennium Clinical Events
0756c167-e778-486f-9b96-94bd12af89cf,Not Rated,ALLIANCE > NHS DIGITAL,26.98,30.23,69.84,Bronze,57.14,66.67,63.45,Pillar 1 - England (Second Generation Surveillance Systems)
07abf678-a2c0-4d8b-8d25-8b9f180f9ff2,Not Rated,ALLIANCE > NIHR BIORESOURCE,39.68,39.53,37.3,Not Rated,16.67,14.29,38.57,Returned datasets
08846261-45f0-4bcf-9801-fe785dcef1c9,Silver,ALLIANCE > SAIL,17.46,20.93,85.72,Silver,80.95,88.89,80.01,Careers Wales dataset
08fd6103-be40-4380-9399-aecaeb216d33,Not Rated,OTHER > Office for National Statistics,36.51,34.88,43.65,Not Rated,28.57,23.81,46.84,Labour Force Survey (Household)
09586db0-4da4-47f8-9434-13cbd2da2bb9,Not Rated,ALLIANCE > HQIP,34.92,32.56,43.65,Not Rated,26.19,22.22,46.81,Paediatric Intensive Care Audit Network - customised data collection
0985f58b-87e0-42d2-9ee7-efd618abcd51,Bronze,HUBS > BREATHE,20.63,18.6,68.25,Bronze,66.67,57.14,74.03,Development of spirometry predictive values for Indian population
09e8e407-82b4-4ed4-b296-53810472cbe9,Silver,HUBS > BREATHE,19.05,16.28,69.84,Bronze,69.05,58.73,76.38,Reasons for delay in seeking care for pneumonia in children under five
0a418d30-c13c-404a-9f4c-39334d889b9c,Not Rated,ALLIANCE > HQIP,34.92,32.56,43.65,Not Rated,26.19,22.22,46.81,Paediatric Intensive Care Audit Network - core dataset (transport)
0a4f19cc-8565-410b-ac02-2751f5284a9b,Bronze,ALLIANCE > TISSUE DIRECTORY,20.63,20.93,69.84,Bronze,69.05,60.32,74.06,Tayside Biorepository
0a524760-0efc-477e-8a3b-805e1a0f67ec,Gold,HUBS > DISCOVER NOW,17.46,18.6,89.69,Gold,92.86,96.83,87.13,North West London Accident and Emergency Data (NWL A&E)
0b794715-53f3-422f-817a-92be3392c735,Silver,ALLIANCE > SCOTLAND,19.05,23.26,86.5,Gold,85.71,92.06,81.22,Prescribing Information System (PIS)
0bb202c7-80e8-4532-8042-1351576e6c94,Not Rated,ALLIANCE > HQIP,36.51,34.88,42.86,Not Rated,26.19,22.22,45.66,National Asthma and COPD Audit Programme (NACAP): Pulmonary rehabilitation - clinical audit
0c98200b-48b5-418a-b8d0-a7708abc1f39,Not Rated,NHS Digital,36.51,39.53,54.76,Not Rated,47.62,46.03,54.05,Mental Health Services Data Set - Community
0cfe60cd-038d-4c03-9a95-894c52135922,Not Rated,ALLIANCE > BARTS,39.68,39.53,37.3,Not Rated,16.67,14.29,38.57,ARIA Dataset
0d0ce21e-afc1-4d9f-bf54-e0545363a0cc,Bronze,HUBS > BREATHE,20.63,18.6,68.25,Bronze,66.67,57.14,74.03,Research on use of an online learning platform on under-five pneumonia
0d89c503-1c79-4e2a-baf6-02f12e68805b,Not Rated,ALLIANCE > HQIP,31.75,30.23,45.23,Not Rated,26.19,22.22,47.98,National Neonatal Audit Programme - clinical audit
0df3a0a9-d261-47ff-99e5-9c7e67410712,Bronze,ALLIANCE > TISSUE DIRECTORY,20.63,20.93,71.43,Bronze,71.43,63.49,75.25,IMPORT HIGH trial blood samples
0e24f325-fdd3-4cb3-9374-8852c77cef98,Gold,ALLIANCE > SAIL,12.7,16.28,92.85,Gold,92.86,98.41,88.29,Welsh Dispensing Dataset
0e59698c-1532-4155-ab0e-af11b3d9e7b1,Bronze,ALLIANCE > CPRD,30.16,34.88,74.61,Bronze,71.43,79.37,68.28,HES Accident and Emergency data for CPRD Aurum
0e6e6ed5-ab81-4d7f-b06a-768bf33357ca,Not Rated,NHS Digital,46.03,46.51,65.88,Not Rated,64.29,77.78,58.89,Mental Health Minimum Dataset v4 (Sensitive) Episodes
0e8546e9-c841-4a99-a3f8-bb9020c6782c,Bronze,HUBS > BREATHE,22.22,20.93,62.7,Not Rated,54.76,47.62,66.91,Developing and Evaluating Interventions to Improve Asthma Care
0fbd11c2-c44b-430f-b527-63cb82fcee63,Not Rated,ALLIANCE > CPRD,33.33,41.86,63.5,Not Rated,47.62,60.32,52.88,National Radiotherapy Dataset (RTDS) for CPRD Aurum
0fc61ace-397d-4489-9e62-77f88082e775,Not Rated,NHS Digital,46.03,46.51,65.88,Not Rated,64.29,77.78,58.89,Mental Health & Learning Disabilities Dataset v 1 (Non-Sensitive) Events
0ff88499-931b-4614-9f81-facf21f28174,Not Rated,ALLIANCE > DUNDEE,36.51,37.21,38.89,Not Rated,16.67,14.29,39.73,Tayside & Fife Diabetes – Summary and a range of diabetes related datasets.
1048c3d9-42f6-4950-89be-c51fe7421753,Silver,ALLIANCE > CYSTIC FIBROSIS TRUST,26.98,23.26,86.51,Gold,95.24,100.0,85.99,Cystic Fibrosis Patient Liver Enzyme
11571357-b9fc-45ed-ab40-3bb3d7443245,Not Rated,ALLIANCE > HQIP,31.75,30.23,45.23,Not Rated,26.19,22.22,47.98,National Audit of Dementia Round 4 - carer experience survey
117aa9f5-db76-48f9-9dd2-19e2d00a1b45,Silver,ALLIANCE > SCOTLAND,15.87,20.93,84.92,Silver,78.57,85.71,78.82,Unscheduled Care Datamart
12690263-f5d3-435b-9582-de1a88064e1e,Not Rated,ALLIANCE > HQIP,31.75,30.23,45.23,Not Rated,26.19,22.22,47.98,National Vascular Registry Audit Carotid Lower Limb Amputation clinical dataset
12c5b83c-6e4a-442e-b6c2-2f6b7165fe6b,Not Rated,ALLIANCE > HQIP,31.75,30.23,45.23,Not Rated,26.19,22.22,47.98,National Joint Registry - Revision Hip Replacement dataset
12d23c2c-5f35-4f59-80e3-584636c7cacb,Silver,ALLIANCE > SCOTLAND,14.29,18.6,86.5,Gold,80.95,87.3,81.18,Child Health Systems Programme - First Visit
13a931c1-18cf-4d60-be79-a527acb0a36d,Bronze,ALLIANCE > TISSUE DIRECTORY,20.63,20.93,69.84,Bronze,69.05,60.32,74.06,Obesity Research Biobank Syndicate (ORBiS)
14855eb1-6563-4e56-89e5-aecd51f100ad,Bronze,ALLIANCE > TISSUE DIRECTORY,20.63,20.93,69.84,Bronze,69.05,60.32,74.06,Watch and Wait Trial
148a3896-e4ed-48ef-8643-48df726041e1,Not Rated,ALLIANCE > HQIP,34.92,32.56,43.65,Not Rated,26.19,22.22,46.81,Paediatric Intensive Care Audit Network - core dataset (referral)
15a7c12f-145c-46fc-acc9-c27e83ed2c4d,Silver,ALLIANCE > GENOMICS ENGLAND,22.22,25.58,88.89,Gold,95.24,100.0,84.83,GENOMICS ENGLAND 100K NHSD LINKED DATA
16341d43-0e79-4afa-a84f-67db018e449f,Bronze,ALLIANCE > TISSUE DIRECTORY,20.63,20.93,69.84,Bronze,69.05,60.32,74.06,INCA Trial
172242ce-a1c5-4915-9c71-686f6e7d5789,Not Rated,ALLIANCE > OUH,39.68,39.53,37.3,Not Rated,16.67,14.29,38.57,ARIA Medonc
179c21cd-41e0-489b-82c4-1bec011c562f,Bronze,ALLIANCE > TISSUE DIRECTORY,20.63,20.93,71.43,Bronze,71.43,63.49,75.25,IDRIS Trial
1841e7c9-39e1-4eff-9d2f-da3dede71f86,Not Rated,ALLIANCE > CPRD,33.33,41.86,65.08,Not Rated,50.0,63.49,54.07,Rural-Urban classification for CPRD GOLD
184b973d-ac38-4fc5-8203-f2a244574b4f,Bronze,HUBS > BREATHE,19.05,16.28,69.05,Bronze,66.67,57.14,75.19,Asthma and COPD: practices and perceptions of GPs in rural India
18603ae7-a056-4fd6-a3e5-d32a2440dd26,Not Rated,ALLIANCE > HQIP,33.33,32.56,44.45,Not Rated,26.19,22.22,46.81,National Audit of Psychosis - Audit on Early Intervention in Psychosis services - case note audit
191c1e3f-4eff-41b9-bff1-c6510f7c6c3d,Silver,HUBS > BREATHE,20.63,18.6,69.05,Bronze,71.43,58.73,76.42,Early Pandemic Evaluation and Enhanced Surveillance of COVID-19 (EAVE II)
1a0af437-ec80-4db7-9c76-a2418cc8c5c8,Not Rated,ALLIANCE > HQIP,36.51,34.88,42.86,Not Rated,26.19,22.22,45.66,National Asthma and COPD Audit Programme (NACAP): COPD secondary care clinical dataset
1aa60c9f-a458-454d-802a-e4c4628f3870,Not Rated,ALLIANCE > DUNDEE,36.51,37.21,38.89,Not Rated,16.67,14.29,39.73,NHS Tayside and Fife Accident & Emergency Dataset (ISD/National)
1b80d25c-4f0f-497b-8614-4d1a8c4d1cd3,Not Rated,HUBS > BREATHE,22.22,20.93,61.91,Not Rated,52.38,46.03,65.72,Air Quality Study: An ecological analysis of asthma health outcomes in Malaysia
1bb2c353-8d91-4989-a21b-26182262b807,Bronze,ALLIANCE > TISSUE DIRECTORY,25.4,25.58,69.05,Bronze,71.43,63.49,72.93,DARWIN1 Trial
1bfdab55-3e6a-4b26-bff1-0105ad416cea,Bronze,OTHER > Office for National Statistics,28.57,30.23,77.78,Silver,76.19,84.13,72.98,Linked Census and death occurrences
1c17f45b-ba0f-4e97-a0f0-34a600844d4f,Bronze,ALLIANCE > TISSUE DIRECTORY,22.22,23.26,69.05,Bronze,69.05,60.32,72.89,NICAM: Nilotinib treatment for c-KIT mutated advanced AMM
1cb31e11-505b-4ff6-ae20-5c468c9ad296,Bronze,ALLIANCE > TISSUE DIRECTORY,22.22,20.93,69.05,Bronze,69.05,60.32,74.06,HPB Biobank
1d1244b6-aeeb-4655-b5a2-2357ed28227a,Not Rated,HUBS > PIONEER,34.92,32.56,43.65,Not Rated,26.19,22.22,46.81,University Hospitals Birmingham PICS data
1d2a94c4-b18d-47c4-9b48-cfab8e67f126,Bronze,ALLIANCE > TISSUE DIRECTORY,20.63,20.93,69.84,Bronze,69.05,60.32,74.06,National Diet and Nutrition Survey (NDNS)
1d5e3b05-8ce3-4f80-ae3a-f6031ad8cf69,Not Rated,NHS Digital,36.51,39.53,54.76,Not Rated,47.62,46.03,54.05,Mental Health Services Data Set - Service Users
1da704e3-f5ee-4614-8880-10541637a0b7,Not Rated,ALLIANCE > HQIP,36.51,34.88,42.86,Not Rated,26.19,22.22,45.66,National Cardiac Audit Programme - National Audit of Percutaneous Coronary Interventions (PCI)
1f55cfcc-1c5d-44e3-9d60-3bedeb033f0a,Silver,ALLIANCE > CYSTIC FIBROSIS TRUST,25.4,25.58,87.3,Gold,95.24,100.0,84.83,Cystic Fibrosis Patient Demographics
201602df-7432-4710-98a7-18f59e4f211e,Bronze,ALLIANCE > TISSUE DIRECTORY,20.63,20.93,69.84,Bronze,69.05,60.32,74.06,University of Southampton Faculty of Medicine Tissue Bank
209f42a8-4581-49e1-a0c2-25069a37f230,Bronze,ALLIANCE > TISSUE DIRECTORY,23.81,25.58,69.84,Bronze,73.81,63.49,74.12,RIO
20c2a274-843c-43fa-9b76-38ef2f8a3d64,Bronze,ALLIANCE > TISSUE DIRECTORY,22.22,23.26,69.05,Bronze,69.05,60.32,72.89,TNT: Triple Negative breast cancer Trial
21cd4b8e-f4f5-44a6-83eb-b7799e98ba55,Bronze,ALLIANCE > SLaM,41.27,41.86,65.08,Not Rated,80.95,71.43,69.55,South London and Maudsley NHS Foundation Trust (SLaM) Clinical Record Interactive Search (CRIS) platform
21d58202-15a2-4ec8-9f36-3080de3905a5,Silver,HUBS > DISCOVER NOW,20.63,20.93,88.1,Gold,92.86,96.83,85.97,North West London Mental Health Data (NWL MH)
226fb3f1-4471-400a-8c39-2b66d46a39b6,Not Rated,ALLIANCE > BARTS,39.68,39.53,37.3,Not Rated,16.67,14.29,38.57,Emergency Care Dataset (ECDS)
22a99111-46ad-4d3f-a2d5-09351e851350,Gold,HUBS > DISCOVER NOW,17.46,18.6,89.69,Gold,92.86,96.83,87.13,North West London Pathology (NWL PATH)
22fe7168-89af-4d93-89c8-afa03cf2031a,Silver,ALLIANCE > CYSTIC FIBROSIS TRUST,26.98,23.26,86.51,Gold,95.24,100.0,85.99,Cystic Fibrosis Patient Chronic Medication
23330792-fe18-4331-a101-b246657a03ae,Not Rated,ALLIANCE > HQIP,31.75,30.23,45.23,Not Rated,26.19,22.22,47.98,National Joint Registry - Revision Knee Replacement dataset
236108a2-5e2c-4acb-86e7-6ec793aef8ab,Bronze,ALLIANCE > TISSUE DIRECTORY,20.63,20.93,69.84,Bronze,69.05,60.32,74.06,Human Biomaterials Resource Centre
237e724d-03b2-478c-a92d-85a1baa6ae53,Not Rated,ALLIANCE > HQIP,36.51,34.88,42.86,Not Rated,26.19,22.22,45.66,Falls and Fragility Fracture Audit Programme Fracture Liaison Service Database clinical dataset
24b82645-1854-438a-97b2-911bba469d3d,Silver,HUBS > BREATHE,12.7,11.63,79.37,Silver,80.95,71.43,84.66,Idiopathic Pulmonary Fibrosis (IPF) Genome-wide Association Study
2537007c-9e9e-4441-a0d1-59fa400566c5,Silver,ALLIANCE > PUBLIC HEALTH SCOTLAND,15.87,20.93,87.31,Gold,83.33,90.48,81.2,General Acute Inpatient and Day Case - Scottish Morbidity Record (SMR01)
2542abf8-e50b-4962-9fa1-6dba1b7e8439,Bronze,HUBS > BREATHE,19.05,16.28,69.05,Bronze,66.67,57.14,75.19,mHealth for pneumonia prevention
258c9577-76cd-45c7-a6b5-8e7eed07ce9e,Gold,ALLIANCE > SAIL,11.11,13.95,94.44,Gold,95.24,100.0,90.64,Maternity Indicators Dataset
263ad0a8-ae90-4c1d-85d6-c3d2470eb2b7,Not Rated,NHS Digital,46.03,46.51,65.88,Not Rated,64.29,77.78,58.89,Mental Health Minimum Dataset v4 (Non-Sensitive) Episodes
263f28a4-9835-4856-b1c3-0a0d4085f207,Not Rated,NHS Digital,46.03,46.51,65.88,Not Rated,64.29,77.78,58.89,Mental Health Minimum Dataset v2.6 (Sensitive)
2684706f-1d43-4263-99b7-b54279614c76,Not Rated,ALLIANCE > BARTS,38.1,37.21,38.88,Not Rated,19.05,15.87,40.92,CDE Patient Demographics
26da4493-a78b-4090-ba18-e6c600d2c375,Gold,ALLIANCE > SAIL,15.87,16.28,92.06,Gold,95.24,100.0,89.48,Pathology Data from WRRS
278c3fb2-6b1e-46db-a529-9fc7ddaf4461,Not Rated,ALLIANCE > HQIP,36.51,34.88,42.86,Not Rated,26.19,22.22,45.66,National Asthma and COPD Audit Programme (NACAP): secondary care workstream – children and young people asthma (clinical)
27910ce4-f74f-4fab-8649-19d5ec292ad8,Gold,ALLIANCE > CYSTIC FIBROSIS TRUST,19.05,18.6,90.47,Gold,95.24,100.0,88.32,Cystic Fibrosis Patient Annual Review Encounters
2a5d2a42-803c-4c96-bcd6-a4289d2b664a,Bronze,ALLIANCE > TISSUE DIRECTORY,22.22,23.26,69.05,Bronze,69.05,60.32,72.89,IoN Trial
2a725f9d-c4a9-4c89-aa37-b3c25cc83389,Not Rated,NHS Digital,46.03,46.51,65.88,Not Rated,64.29,77.78,58.89,Mental Health & Learning Disabilities Dataset v 1 (Sensitive) Records
2aa58bb8-83d8-455a-87e6-d567ae4a379c,Bronze,ALLIANCE > TISSUE DIRECTORY,22.22,23.26,69.05,Bronze,69.05,60.32,72.89,ESPAC-TPlus
2aabcea9-d0dd-4780-b162-3c7ed3ee9888,Bronze,ALLIANCE > HSCNI,22.22,27.91,79.37,Silver,73.81,80.95,72.95,Admissions & Discharges
2b06afa3-dfc7-424b-8b9a-9325df6cfc19,Bronze,ALLIANCE > SCOTLAND,19.05,18.6,69.05,Bronze,64.29,57.14,72.84,Scottish Stillbirth and Infant Death Survey
2b09ea87-5b22-4049-b7dd-de0889699115,Gold,ALLIANCE > SAIL,17.46,18.6,90.47,Gold,92.86,98.41,87.13,Millennium Cohort Study
2b198886-ccab-4276-b6b9-22c344df8304,Bronze,ALLIANCE > TISSUE DIRECTORY,23.81,23.26,68.25,Bronze,69.05,60.32,72.89,NIHR Nottingham Digestive Diseases Collection
2bf53952-e77c-4746-b36f-5ccb1574f6a7,Bronze,ALLIANCE > TISSUE DIRECTORY,20.63,20.93,71.43,Bronze,71.43,63.49,75.25,BRAIN UK
2c0e04bc-2f16-4903-90dc-c9d57ab40efb,Not Rated,ALLIANCE > HQIP,31.75,30.23,45.23,Not Rated,26.19,22.22,47.98,National Joint Registry - Revision Ankle Replacement dataset
2c53d1f7-4540-4c57-8e93-8115b8abc6a9,Not Rated,ALLIANCE > HQIP,31.75,30.23,45.23,Not Rated,26.19,22.22,47.98,National Diabetes Inpatient Audit Hospital Characteristics Survey dataset
2d23ad3c-0541-453c-8bf7-9dc42e1aba65,Not Rated,ALLIANCE > CPRD,33.33,41.86,65.08,Not Rated,50.0,63.49,54.07,Rural-Urban classification for CPRD Aurum
2d3302d1-b6fc-4883-8168-010da0d48638,Not Rated,ALLIANCE > CPRD,39.68,46.51,61.91,Not Rated,50.0,63.49,51.75,Quality of Life of Cancer Survivors in England: Pilot Patient Reported Outcomes Measures Survey (2011) for CPRD Aurum
2dbd2e38-a4bb-4f8c-b401-ebec10f0d89e,Not Rated,ALLIANCE > HQIP,36.51,34.88,42.86,Not Rated,26.19,22.22,45.66,Falls and Fragility Fracture Audit Programme National Hip Database Facilities Survey 2019
2dc79612-0e0d-4336-aaa1-6abd90d28589,Bronze,HUBS > BREATHE,22.22,20.93,65.08,Not Rated,59.52,52.38,69.3,"4 Country ChrOnic: estimating respiratory disease burden in adults, South India"
2e20b776-a0bc-44ed-9882-ad63855a0ec4,Bronze,ALLIANCE > TISSUE DIRECTORY,20.63,20.93,71.43,Bronze,71.43,63.49,75.25,NHS Greater Glasgow & Clyde Bio-Repository
2e8cc70b-bd57-4b64-bd12-fbc07e0f240f,Not Rated,ALLIANCE > CPRD,42.86,46.51,60.31,Not Rated,50.0,63.49,51.75,Mental Health Dataset (MHDS) for CPRD Aurum
2f57c592-c65c-4d1c-b92d-d19d2a11c02e,Bronze,ALLIANCE > TISSUE DIRECTORY,20.63,20.93,69.84,Bronze,69.05,60.32,74.06,BioDock
301233da-53f8-4cea-8f74-4d4aa8d8c42c,Not Rated,ALLIANCE > GENERATION SCOTLAND,23.81,23.26,59.52,Not Rated,50.0,42.86,63.37,Generation Scotland: Scottish Family Health Study
304430ff-0aff-4d36-91e5-94be251a409a,Not Rated,ALLIANCE > HQIP,31.75,30.23,45.23,Not Rated,26.19,22.22,47.98,National Audit of Dementia Round 4 - casenote audit
319a2a77-3f4d-497e-bc3e-33002f316cae,Bronze,ALLIANCE > TISSUE DIRECTORY,20.63,20.93,71.43,Bronze,71.43,63.49,75.25,PHOTO Translational bladder cancer biorepository
31fd27d5-c08d-49c3-b7f1-0af71ad219aa,Bronze,ALLIANCE > NHS DIGITAL,22.22,25.58,80.95,Silver,76.19,84.13,75.31,Covid-19 Second Generation Surveillance System
32b5d90f-6bad-40f8-96d7-69b11df6d5ff,Bronze,ALLIANCE > TISSUE DIRECTORY,20.63,20.93,69.84,Bronze,69.05,60.32,74.06,LBIH Biobank
342bef6e-8fa2-49f0-bdbb-c95d866aa145,Silver,ALLIANCE > TISSUE DIRECTORY,22.22,23.26,72.22,Bronze,76.19,66.67,76.47,Scottish Human Papillomavirus Archive
355de4ca-1ce9-4ba4-8e07-2d51bb82bfbf,Bronze,ALLIANCE > TISSUE DIRECTORY,20.63,20.93,69.84,Bronze,69.05,60.32,74.06,Human Developmental Biology Resource (HDBR)
36047c5f-7d57-4d25-a114-2bcc6c11708f,Not Rated,NHS Digital,46.03,46.51,65.88,Not Rated,64.29,77.78,58.89,Mental Health Minimum Dataset v3_3.5 (Sensitive)
3784d68e-d213-43a7-bf30-8f4d34de022c,Bronze,ALLIANCE > TISSUE DIRECTORY,20.63,20.93,69.84,Bronze,69.05,60.32,74.06,NIMRAD-TRANS
37eb2884-d7df-489f-a3ad-f02f1e510475,Bronze,HUBS > BREATHE,20.63,18.6,62.7,Not Rated,52.38,46.03,66.89,Exploring psychological issues of primary care teams in Malaysia amidst COVID-19
37fe2488-f4c3-4471-a1e0-7d4a4204f063,Bronze,ALLIANCE > TISSUE DIRECTORY,20.63,20.93,69.84,Bronze,69.05,60.32,74.06,"Leeds Dental Institute/School of Dentistry Leeds, Skeletal Tissues Bank"
380cbddb-e64e-42b9-a364-47c550262b6a,Bronze,ALLIANCE > NHS SCOTLAND,33.33,30.23,73.81,Bronze,73.81,80.95,71.79,RAPID (Hospital Stay Level Data)
3932ee85-69cb-414a-b4a0-b763010d90a5,Silver,HUBS > DISCOVER NOW,20.63,20.93,88.1,Gold,92.86,96.83,85.97,North West London High Cost Drugs Data (NWL HCD)
3935e2fd-0c30-4f56-8388-45a02e0499b4,Not Rated,NHS Digital,39.68,41.86,69.05,Bronze,64.29,77.78,61.22,Bridge file: Hospital Episode Statistics to Diagnostic Imaging Dataset
3943e6de-6c32-43dd-8090-16ec9ca0902f,Not Rated,ALLIANCE > CPRD,33.33,41.86,63.5,Not Rated,47.62,60.32,52.88,National Radiotherapy Dataset (RTDS) for CPRD GOLD
395262e7-9846-4d9d-a288-8b0ebea782b9,Not Rated,ALLIANCE > HQIP,34.92,32.56,43.65,Not Rated,26.19,22.22,46.81,National Cardiac Audit Programme - Cardiac Rhythm Management (CRM)
39537838-164a-4aee-8859-957f0a347390,Bronze,OTHER > Office for National Statistics,23.81,25.58,64.28,Not Rated,59.52,52.38,66.97,Business Impact of COVID-19 Survey (BICS)
395d4311-da00-49a4-b78e-5387c961d803,Silver,HUBS > DATA-CAN,25.4,27.91,85.72,Silver,92.86,96.83,82.47,Children’s Kidney Cancers - Great Ormond Street Hospital
3983f3ec-ce63-4142-b73e-93130654710b,Bronze,ALLIANCE > TISSUE DIRECTORY,22.22,23.26,70.64,Bronze,71.43,63.49,74.09,The Cleft Collective
3a0599ed-5452-4299-956c-af5a30bbef23,Bronze,ALLIANCE > TISSUE DIRECTORY,22.22,23.26,70.64,Bronze,71.43,63.49,74.09,PHOENIX DDR-Anti-PD-L1 Trial
3a23e7dc-d814-4772-a6f8-a814c8e0128b,Bronze,ALLIANCE > TISSUE DIRECTORY,22.22,23.26,69.05,Bronze,69.05,60.32,72.89,SWIFT-RTB
3a51b861-026d-45ed-abe6-30d9cc07b516,Not Rated,ALLIANCE > HQIP,31.75,30.23,45.23,Not Rated,26.19,22.22,47.98,Epilepsy 12 - clinical audit
3a9ab245-5fcc-49a0-ae58-12ebab9b0053,Not Rated,ALLIANCE > HQIP,36.51,34.88,42.86,Not Rated,26.19,22.22,45.66,National Paediatric Diabetes Audit - Spotlight survey of workforce in Paediatric Diabetes Units
3aa01779-831e-478f-b4e3-7c111d642b18,Bronze,HUBS > BREATHE,19.05,16.28,68.25,Bronze,64.29,55.56,74.0,COVID-19 Detection from Chest X-Rays using Deep Learning
3ab70331-aa54-4f0d-aa95-ea2b95bed9d5,Gold,ALLIANCE > SAIL,15.87,16.28,92.06,Gold,95.24,100.0,89.48,Annual District Birth Extract
3bd6cd26-edc2-420a-86c5-f3e05606edfd,Gold,ALLIANCE > SAIL,12.7,16.28,93.65,Gold,95.24,100.0,89.48,GP dataset - Welsh Primary Care
3c430204-f632-4add-9fcb-f0ff88caea13,Gold,ALLIANCE > SAIL,9.52,11.63,95.24,Gold,95.24,100.0,91.81,Congenital Anomaly Register and Information Service
3c9e8226-f12c-4824-9996-29a667b9609c,Bronze,ALLIANCE > PUBLIC HEALTH SCOTLAND,26.98,25.58,77.78,Silver,73.81,82.54,74.12,SICSAG Episodes (Scottish Intensive Care Audit Group)
3cd53c68-7e56-4c3e-b7c2-bd7e18040ec5,Not Rated,ALLIANCE > BARTS,39.68,39.53,37.3,Not Rated,16.67,14.29,38.57,"Problems, Diagnosis and Procedures"
3d42b7e1-89b0-4bef-9e42-18edc328f28f,Not Rated,ALLIANCE > DUNDEE,36.51,37.21,38.89,Not Rated,16.67,14.29,39.73,Renal Register – ISD National dataset
3e89692b-7aa2-49d6-b802-82921bd7e006,Not Rated,ALLIANCE > HQIP,33.33,32.56,44.45,Not Rated,26.19,22.22,46.81,National Clinical Audit of Anxiety and Depression - spotlight audit on psychological therapies (patient experience survey)
3ee52adc-b97e-4f7b-a251-a1c9841a380c,Silver,HUBS > BREATHE,20.63,23.26,89.69,Gold,95.24,100.0,85.99,"Extended Cohort for E-health, Environment and DNA (EXCEED)"
3f299029-3126-4ce0-893c-4a759cbe90b1,Not Rated,ALLIANCE > HQIP,34.92,32.56,43.65,Not Rated,26.19,22.22,46.81,National Emergency Laparotomy Audit - Patient Audit Dataset
3fceb952-0b21-40f4-bd69-fa5cd7ad7df9,Gold,ALLIANCE > SAIL,11.11,13.95,94.44,Gold,95.24,100.0,90.64,Cafcass Wales
3fd5f728-fdb4-4ce2-86ec-f626787d455c,Not Rated,ALLIANCE > DUNDEE,36.51,37.21,38.89,Not Rated,16.67,14.29,39.73,Walker Study Data
40573895-497b-4d47-90e1-6aafe70b93f6,Not Rated,ALLIANCE > OUH,39.68,39.53,37.3,Not Rated,16.67,14.29,38.57,Endobase
406e7ae7-554b-4807-b3a5-a4d81316cf9c,Bronze,ALLIANCE > TISSUE DIRECTORY,20.63,20.93,71.43,Bronze,71.43,63.49,75.25,Bloodwise Childhood Leukaemia Cell Bank
41a7adba-8771-46e2-8083-047d6a4cb877,Gold,HUBS > DISCOVER NOW,14.29,18.6,91.27,Gold,92.86,96.83,87.13,North West London Outpatient Care Data (NWL OP)
4262e057-6978-4e4c-a05d-c4f328422090,Not Rated,NHS Digital,36.51,41.86,69.05,Bronze,61.9,74.6,60.02,Mental Health and Learning Disabilities Data Set
4271bc64-b139-40b0-98de-5f2e94e2d026,Not Rated,ALLIANCE > HQIP,31.75,30.23,45.23,Not Rated,26.19,22.22,47.98,National Neonatal Audit Programme - 2 year outcomes audit
42780b16-32e3-442e-92cd-1810bf30dab8,Not Rated,ALLIANCE > CPRD,31.75,34.88,69.84,Bronze,61.9,71.43,63.51,HES Patient Reported Outcomes Measures (PROMs) data for CPRD Aurum
430331ef-fa66-485b-b090-e4e83def9136,Not Rated,ALLIANCE > HQIP,36.51,34.88,42.86,Not Rated,26.19,22.22,45.66,Falls and Fragility Fracture Audit Programme National Audit of Inpatient Falls clinical dataset
4481aab8-9b4f-43dd-9cd4-1e427561a2a5,Silver,ALLIANCE > SCOTLAND,20.63,25.58,84.93,Silver,83.33,90.48,78.88,Scottish Cancer Registry (SMR06)
46493a09-b3bb-4c0e-b944-82665ee21508,Not Rated,NHS Digital,46.03,46.51,65.88,Not Rated,64.29,77.78,58.89,Mental Health Minimum Dataset v4 (Sensitive) Events
464b06d6-239a-4c6d-a626-242ba7e79e05,Not Rated,ALLIANCE > DUNDEE,36.51,37.21,38.89,Not Rated,16.67,14.29,39.73,Deaths General Registrar Office – National Records Scotland
46568011-ae01-4e3a-9ef7-187606316668,Gold,ALLIANCE > SAIL,11.11,13.95,94.44,Gold,95.24,100.0,90.64,Welsh Demographic Service (WDS)
4660884b-e40a-4251-ad19-40872641fa8c,Bronze,ALLIANCE > SCOTLAND,20.63,20.93,68.25,Bronze,64.29,57.14,71.68,Child Health Systems Programme - School
4678a81d-dfb6-478a-a373-d5510866b3d0,Not Rated,ALLIANCE > HQIP,31.75,30.23,45.23,Not Rated,26.19,22.22,47.98,National Vascular Registry - Organisational Audit dataset
46e4c3ba-dae2-453d-832a-88ea603110f1,Not Rated,ALLIANCE > HQIP,36.51,34.88,42.86,Not Rated,26.19,22.22,45.66,National Cardiac Audit Programme - National Congenital Heart Disease Audit (NCHDA)
47bec08b-57b7-450e-9be7-af19bab99b58,Not Rated,ALLIANCE > HQIP,31.75,30.23,45.23,Not Rated,26.19,22.22,47.98,National Vascular Registry Audit - Lower Limb Bypass clinical dataset
47e9fa0a-d74f-43bc-ae63-0eb33f354f01,Bronze,HUBS > BREATHE,20.63,18.6,66.67,Bronze,61.9,53.97,71.65,Theory of Planned Behaviour Intervention: respiratory disease in South India
49dc6bfb-37f7-4f18-92e7-1a06ab80633e,Silver,HUBS > DATA-CAN,25.4,25.58,87.3,Gold,95.24,100.0,84.83,Comprehensive Patient Records for Cancer Outcomes
4a295c54-ccbb-4aef-9ea9-8fc46749b123,Not Rated,ALLIANCE > DUNDEE,36.51,37.21,38.89,Not Rated,16.67,14.29,39.73,Tayside Microbiology: Isolations
4a813fda-a3c4-422e-9d11-c031ebc1f74f,Bronze,HUB > NHS DIGITRIALS,23.81,27.91,80.95,Silver,78.57,85.71,75.33,Hospital Episode Statistics Admitted Patient Care
