error_percent,weighted_error_percent,weighted_quality_score,completeness_percent,title,weighted_quality_rating,publisher,quality_rating,weighted_completeness_percent,id,quality_score
34.88,36.51,42.86,26.19,National Paediatric Diabetes Audit - Parent and Patient Recorded Experience measures,Not Rated,ALLIANCE > HQIP,Not Rated,22.22,fe872375-2401-4de1-9650-d4139cf5793a,45.66
13.95,9.52,94.44,92.86,Welsh Dispensing Dataset,Gold,ALLIANCE > SAIL,Gold,98.41,fea0b4be-4097-4c2e-86f2-03dc1ee2877b,89.45
23.26,23.81,69.05,69.05,National Records of Scotland (NRS) - Deaths Data,Bronze,ALLIANCE > SCOTLAND,Bronze,61.9,ff0500de-acdf-4db6-b12f-263324696d47,72.89
46.51,46.03,65.88,64.29,Mental Health Minimum Dataset v4 (Non-Sensitive) Records,Not Rated,NHS Digital,Not Rated,77.78,ff2c6982-00f3-4483-9fc2-19b3a7211d8d,58.89
18.6,20.63,67.47,64.29,Teleconsultation in remote rural India: management of COPD and Asthma,Bronze,HUBS > BREATHE,Bronze,55.56,ffc34689-1a81-4f56-9c3f-e62b76d8445b,72.84
