weighted_quality_score,title,error_percent,publisher,weighted_quality_rating,weighted_error_percent,weighted_completeness_percent,quality_score,completeness_percent,quality_rating,id
61.11,Mental Health Minimum Dataset v4 (Sensitive) Records,51.16,NHS Digital,Not Rated,55.56,77.78,56.57,64.29,Not Rated,97fa09e6-5ea5-41cd-baf8-20366db13a3f
69.84,Public Health England Seroepidemiology Unit,20.93,ALLIANCE > TISSUE DIRECTORY,Bronze,20.63,60.32,74.06,69.05,Bronze,98a03f2b-1a67-4653-a4f5-f9db7262a94d
80.16,GP Out of Hours,27.91,ALLIANCE > SCOTLAND,Silver,28.57,88.89,76.52,80.95,Silver,98babf8f-a557-410a-9075-640db283c9a3
57.94,Quality of Life of Cancer Survivors in England: Pilot Patient Reported Outcomes Measures Survey (2011) for CPRD GOLD,48.84,ALLIANCE > CPRD,Not Rated,44.44,60.32,49.39,47.62,Not Rated,992c8fe6-f460-490c-b202-8d4d9c434425
38.89,Tayside Microbiology: Tests,37.21,ALLIANCE > DUNDEE,Not Rated,36.51,14.29,39.73,16.67,Not Rated,992d45d6-c80e-474d-87ff-4503ee1210a2
79.37,Child Health Systems Programme - 4-5 year review,23.26,ALLIANCE > SCOTLAND,Silver,23.81,82.54,76.47,76.19,Silver,995c0f8d-f5ef-470a-8ffe-6bdb956bdbc0
44.45,National Bowel Cancer Audit - clinical dataset,32.56,ALLIANCE > HQIP,Not Rated,33.33,22.22,46.81,26.19,Not Rated,9a4ef776-6b4b-40cd-9c88-cbf1128780e9
58.73,Cancer Patient Experience Survey (CPES) for CPRD GOLD,46.51,ALLIANCE > CPRD,Not Rated,42.86,60.32,50.55,47.62,Not Rated,9a58219f-8cea-479c-bb5f-c68cae23136b
78.57,COVID-19 Clinical Information Network (CO-CIN),23.26,ALLIANCE > ISARIC 4C,Silver,28.57,85.71,78.84,80.95,Silver,9a85b69e-fd3e-4522-bc68-48024df0ea3e
54.76,Mental Health Services Data Set - Currencies,39.53,NHS Digital,Not Rated,36.51,46.03,54.05,47.62,Not Rated,9b7f7994-0b9c-4809-b67d-45ae1f04ec5c
65.08,HES Patient Reported Outcomes Measures (PROMs) data for CPRD GOLD,39.53,ALLIANCE > CPRD,Not Rated,41.27,71.43,61.19,61.9,Not Rated,9bc66d1b-68a2-4d4e-a54a-cc3842ff95c7
41.27,National Asthma and COPD Audit Programme (NACAP):COPD and adult asthma secondary care organisational dataset,37.21,ALLIANCE > HQIP,Not Rated,38.1,20.63,43.3,23.81,Not Rated,9beca627-12cd-4231-8638-93cf0bdfa413
76.98,Sample holding,37.21,ALLIANCE > NIHR BIORESOURCE,Silver,38.1,92.06,75.44,88.1,Bronze,9bfcf24b-5b13-4997-9062-6c58583e69cd
66.67,Avon Longitudinal Study of Parents and Children,30.23,ALLIANCE > ALSPAC,Bronze,28.57,61.9,70.6,71.43,Bronze,9c07be99-54a1-4a23-8de2-492e8dfea55a
42.86,Falls and Fragility Fracture Audit Programme National Hip Database clinical dataset,34.88,ALLIANCE > HQIP,Not Rated,36.51,22.22,45.66,26.19,Not Rated,9c0f13ca-5831-4d9b-860a-7d856be7a9f1
68.25,Tissue Access for Patient Benefit (TAPb),23.26,ALLIANCE > TISSUE DIRECTORY,Bronze,23.81,60.32,72.89,69.05,Bronze,9cb10184-7459-4ca5-ac30-d2364e70821d
43.65,Full Blood Counts,32.56,ALLIANCE > NIHR BIORESOURCE,Not Rated,34.92,22.22,46.81,26.19,Not Rated,9ccfde56-dd13-4606-a6c1-1e797d3b8d82
69.84,POUT-T,20.93,ALLIANCE > TISSUE DIRECTORY,Bronze,20.63,60.32,74.06,69.05,Bronze,9e8982cb-6e2b-4c6e-b9d5-80a3794eb1dc
77.78,The impact of COVID on hospitalised patients with COPD; a dataset in OMOP,27.91,HUB > PIONEER,Silver,26.98,82.54,72.95,73.81,Bronze,9e965a9f-4213-43f3-9033-c7df1610ceb5
64.28,Death registration data - Provisional Monthly Extracts,25.58,OTHER > Office for National Statistics,Not Rated,23.81,52.38,66.97,59.52,Bronze,9f34263d-ea74-4ddf-84df-b8dedd4baf6d
70.64,MDSBio,18.6,ALLIANCE > TISSUE DIRECTORY,Bronze,19.05,60.32,75.22,69.05,Bronze,9f45db59-b3c9-4c33-85bf-25c1b5242903
35.71,NHS Scotland General Practice (GP) Contact Data - Subset,37.21,ALLIANCE > NHS SCOTLAND,Not Rated,38.1,9.52,37.34,11.9,Not Rated,a021f150-41e6-48c3-807c-a0cefa4cb2c2
43.65,National Early Inflammatory Arthritis Audit - patient survey,32.56,ALLIANCE > HQIP,Not Rated,34.92,22.22,46.81,26.19,Not Rated,a05443cd-e292-4b5f-b1f1-95718e300d46
56.34,Cancer registration data for CPRD GOLD,51.16,ALLIANCE > CPRD,Not Rated,49.21,61.9,49.42,50.0,Not Rated,a0dad23c-c02d-4347-92ef-0019fa59eb3e
69.84,HIC Transplantation,51.16,NIHR Health Informatics Collaborative Renal Transplantation Theme,Bronze,58.73,98.41,70.85,92.86,Bronze,a0e0c0c2-072a-47ac-9252-e27b37ac024f
61.11,Mental Health Minimum Dataset v4.1 (Non-Sensitive) Events,51.16,NHS Digital,Not Rated,55.56,77.78,56.57,64.29,Not Rated,a1a67182-e81b-4144-ac51-92a86f277eb2
89.69,Brecon dataset,18.6,ALLIANCE > SAIL,Gold,20.63,100.0,88.32,95.24,Gold,a1e1ec62-d78c-40ac-9f90-66ef1dd865b2
69.84,Cam-UroOnc Biorepository,20.93,ALLIANCE > TISSUE DIRECTORY,Bronze,20.63,60.32,74.06,69.05,Bronze,a1f9315e-8561-4e7b-b1a7-1276bdeca14d
81.75,North West London Community Data (NWL COM),27.91,HUB > DISCOVER NOW,Silver,33.33,96.83,82.47,92.86,Silver,a1ff2a5a-604a-45e8-98de-858afd9a8acb
69.84,ICON9 Trial,20.93,ALLIANCE > TISSUE DIRECTORY,Bronze,20.63,60.32,74.06,69.05,Bronze,a2d94442-91c1-4626-b28f-700eb436a4c1
71.43,ECOSS (-/+VE tested patients only),32.56,ALLIANCE > SCOTLAND,Bronze,41.27,84.13,71.81,76.19,Bronze,a3b9cfd3-abd1-4d18-99cc-360cd9d543c2
74.61,"Deeply phenotyped sepsis patients within hospital: onset, treatments & outcomes",30.23,HUB > PIONEER - HDR-UK Health data Hub in Acute Care,Bronze,30.16,79.37,70.6,71.43,Bronze,a4109f11-4ece-4173-bd12-689616c24b88
37.3,Freetext Dataset,39.53,ALLIANCE > BARTS,Not Rated,39.68,14.29,38.57,16.67,Not Rated,a429e699-4650-4feb-9392-f24aa3a3b7b6
89.69,Care Home Dataset,18.6,ALLIANCE > SAIL,Gold,20.63,100.0,88.32,95.24,Gold,a45acd02-82d7-4bfe-9845-6b4df683bba8
71.43,Sheffield Brain Tissue Bank (SBTB),25.58,ALLIANCE > TISSUE DIRECTORY,Bronze,23.81,66.67,75.31,76.19,Bronze,a49a1145-4334-4c2a-81cb-90155e8f05c6
69.05,plasmaMATCH,23.26,ALLIANCE > TISSUE DIRECTORY,Bronze,22.22,60.32,72.89,69.05,Bronze,a617a37d-1813-49ad-8282-38169981a095
37.3,Community Services Dataset,39.53,ALLIANCE > BARTS,Not Rated,39.68,14.29,38.57,16.67,Not Rated,a675ac5e-ecc2-4899-9c3c-65c2f36432c5
69.05,UK primary Sjogren's syndrome Registry,23.26,ALLIANCE > TISSUE DIRECTORY,Bronze,22.22,60.32,72.89,69.05,Bronze,a6fb087d-1a90-4db0-9fcf-323c5b3cce51
70.64,Central England Haemato-oncology and oncology Research Biobank (CEHRB),23.26,ALLIANCE > TISSUE DIRECTORY,Bronze,22.22,63.49,74.09,71.43,Bronze,a7209348-c011-44d0-9c4f-35a2014c2542
37.3,LIMS,39.53,ALLIANCE > OUH,Not Rated,39.68,14.29,38.57,16.67,Not Rated,a74f72ad-bf70-42e4-8933-069c7b53c7f9
57.14,Quality of Life of Colorectal Cancer Survivors in England: Patient Reported Outcome Measures Survey for CPRD Aurum,51.16,ALLIANCE > CPRD,Not Rated,49.21,63.49,49.42,50.0,Not Rated,a772b8dd-cb93-4f27-a349-329992e0b212
88.89,GP dataset - Welsh Primary Care,20.93,ALLIANCE > SAIL,Gold,22.22,100.0,87.16,95.24,Gold,a79dbdef-eac1-49d7-9fdb-150ed5340481
42.86,National Asthma and COPD Audit Programme (NACAP): primary care workstream resources,34.88,ALLIANCE > HQIP,Not Rated,36.51,22.22,45.66,26.19,Not Rated,a895be78-f41c-40b8-b2fa-678a071a6427
61.11,Mental Health Minimum Dataset v3_3.5 (Non-Sensitive),51.16,NHS Digital,Not Rated,55.56,77.78,56.57,64.29,Not Rated,aa019da2-0f2f-493c-95e8-7263ee735f46
69.84,HES Diagnostic Imaging Dataset for CPRD GOLD,37.21,ALLIANCE > CPRD,Bronze,38.1,77.78,65.92,69.05,Not Rated,aa8c53e8-f91f-41f7-9522-7e2462a9a84b
77.78,National Diabetes Audit,30.23,HUB > NHS DIGITRIALS,Silver,31.75,87.3,75.36,80.95,Bronze,aafe3a2f-c0f3-44f2-b50e-d1120d5f2e93
64.28,Mental Health Minimum Data Set,46.51,NHS Digital,Not Rated,46.03,74.6,57.7,61.9,Not Rated,acafb160-b18a-436e-90f1-dc4530a90267
69.84,REQUITE,20.93,ALLIANCE > TISSUE DIRECTORY,Bronze,20.63,60.32,74.06,69.05,Bronze,ace79a9e-1552-4287-9f6e-9d01f628252b
71.43,Cardiff University Biobank,20.93,ALLIANCE > TISSUE DIRECTORY,Bronze,20.63,63.49,75.25,71.43,Bronze,ad5c7693-983e-4f32-a979-9ab550f2084a
57.94,Optimum Patient Care Research Database,23.26,HUBS > BREATHE,Not Rated,25.4,41.27,63.37,50.0,Not Rated,ae4b8371-d037-46e8-bdcd-bf3de08ef38e
69.84,Cambridge Blood and Stem Cell Biobank,20.93,ALLIANCE > TISSUE DIRECTORY,Bronze,20.63,60.32,74.06,69.05,Bronze,ae4f0589-8679-48a1-ad04-2324a5001869
45.23,National Audit of Care at the End of Life - Quality Survey,30.23,ALLIANCE > HQIP,Not Rated,31.75,22.22,47.98,26.19,Not Rated,aeb2f1ea-c914-4b30-94c8-9fd3eb51b288
81.75,Cystic Fibrosis Patient NTM culture,27.91,ALLIANCE > CYSTIC FIBROSIS TRUST,Silver,36.51,100.0,83.66,95.24,Silver,af148400-1ec6-436d-910e-45350a54c390
67.47,Community perception on public health measures for COVID-19 prevention/control,18.6,HUBS > BREATHE,Bronze,20.63,55.56,72.84,64.29,Bronze,af238430-c257-4d60-9ff0-1de6b825f09e
71.43,RAPPER,20.93,ALLIANCE > TISSUE DIRECTORY,Bronze,20.63,63.49,75.25,71.43,Bronze,b0886a0c-7ddc-4c2b-a499-afd7262fbe56
76.19,"Deeply-phenotyped hospital COVID patients: severity, acuity, therapies, outcomes",27.91,HUB > PIONEER,Silver,28.57,80.95,72.95,73.81,Bronze,b095d7ad-5fac-4279-94b0-3c0b0c260acf
84.12,GENOMICS ENGLAND 100K RARE DISEASE & COMMON,30.23,ALLIANCE > GENOMICS ENGLAND,Silver,31.75,100.0,82.5,95.24,Silver,b0a8085e-8cf0-45ee-b4a6-12a4a545ca70
82.54,North West London High Cost Drugs Data (NWL HCD),25.58,HUB > DISCOVER NOW,Silver,31.75,96.83,83.64,92.86,Silver,b14a19db-f3fd-4298-93e9-9732d99d8ee9
38.89,Patient SIMD Postcode,37.21,ALLIANCE > DUNDEE,Not Rated,36.51,14.29,39.73,16.67,Not Rated,b2124786-9658-40cc-b5a3-6624885ce490
72.22,York Tissue Bank,18.6,ALLIANCE > TISSUE DIRECTORY,Bronze,19.05,63.49,76.42,71.43,Silver,b36202ad-7652-460c-8389-baa1a1c1ac46
69.05,HCV Research UK,23.26,ALLIANCE > TISSUE DIRECTORY,Bronze,22.22,60.32,72.89,69.05,Bronze,b3a10154-a409-491a-92fb-e7fac47ccd91
73.81,HIC ICU 8.3.2,46.51,NIHR Health Informatics Collaborative Critical Care Theme,Bronze,52.38,100.0,74.36,95.24,Bronze,b40777a2-468b-4b45-8b7d-2f62f912e950
37.3,CDE Surginet Documentation,39.53,ALLIANCE > BARTS,Not Rated,39.68,14.29,38.57,16.67,Not Rated,b41bb360-f2ed-49f0-a45b-b2fb05321975
76.19,UK Cystic Fibrosis Registry (CYFI),30.23,ALLIANCE > SAIL,Silver,36.51,88.89,75.36,80.95,Bronze,b43309eb-7860-49b7-9f11-1a7a0fd5532e
56.35,Systemic Anti-Cancer Treatment (SACT) data for CPRD Aurum,48.84,ALLIANCE > CPRD,Not Rated,47.62,60.32,49.39,47.62,Not Rated,b4f6a5c2-e652-4972-9d06-510e9a469dfe
84.13,North West London Primary Care Prescriptions Data (NWL PCP),25.58,HUB > DISCOVER NOW,Silver,28.57,96.83,83.64,92.86,Silver,b51be1a2-3d25-43ad-9acb-58d291332367
59.52,Mental Health Minimum Dataset v4.1 (Non-Sensitive) Episodes,51.16,NHS Digital,Not Rated,55.56,74.6,55.37,61.9,Not Rated,b53f716d-a5c3-4ad8-a2aa-cae09c12ac18
69.84,MRC Brain Banks Network,20.93,ALLIANCE > TISSUE DIRECTORY,Bronze,20.63,60.32,74.06,69.05,Bronze,b717d41e-9202-40ed-be1a-882ec0c47761
89.69,Welsh Demographic Service (WDS),18.6,ALLIANCE > SAIL,Gold,20.63,100.0,88.32,95.24,Gold,b724a905-e8ae-4ab5-b543-91435f8d3514
67.46,Tissue Solutions Ltd,27.91,ALLIANCE > TISSUE DIRECTORY,Bronze,26.98,61.9,70.57,69.05,Bronze,b730442a-72f3-4b0d-8ad3-4bdba046df7a
79.36,Yorkshire Specialist Register of Cancer in Children and Young People,32.56,HUBS > DATA-CAN,Silver,38.1,96.83,80.15,92.86,Silver,b765d514-1642-4762-a521-73463c977094
70.64,TRICON8,23.26,ALLIANCE > TISSUE DIRECTORY,Bronze,22.22,63.49,74.09,71.43,Bronze,b796b821-97cf-4aa1-bbc7-53e3c1fbc33f
62.69,PIONEER - COVID ACUITY,25.58,HUB > PIONEER,Not Rated,25.4,50.79,64.59,54.76,Not Rated,b7d5bae7-f047-454c-91c3-81fa5e5543eb
38.89,Tayside Radiology,37.21,ALLIANCE > DUNDEE,Not Rated,36.51,14.29,39.73,16.67,Not Rated,b8107ec3-ba35-45ee-8231-cb610fe2ce48
88.89,Welsh Ambulance Services NHS Trust,18.6,ALLIANCE > SAIL,Gold,20.63,98.41,87.13,92.86,Gold,b8e0b4a8-aab6-47fc-ac6f-76cd5cdc933d
81.75,North West London Accident and Emergency Data (NWL A&E),27.91,HUB > DISCOVER NOW,Silver,33.33,96.83,82.47,92.86,Silver,b9a2cd90-2724-4c7b-a26f-6f5b30a36a00
38.89,NHS Tayside and Fife Haematology (Lab Data Restructured),37.21,ALLIANCE > DUNDEE,Not Rated,36.51,14.29,39.73,16.67,Not Rated,b9a2fe09-60b3-48a4-b252-9ed04a7dcc66
61.11,Mental Health Minimum Dataset v4 (Non-Sensitive) Events,51.16,NHS Digital,Not Rated,55.56,77.78,56.57,64.29,Not Rated,ba071b0b-5ef4-457b-b194-3a69c2c71a06
66.67,Assessment of ASHA’s workload and its determinants,18.6,HUBS > BREATHE,Bronze,20.63,53.97,71.65,61.9,Bronze,bab944af-e345-4893-8640-a88aaff97c72
52.39,Cancer Registration Data,41.86,ALLIANCE > NHS DIGITAL,Not Rated,44.44,49.21,46.92,35.71,Not Rated,bc30732b-32cb-4f66-8794-e6e6691c79e7
60.31,Patient postcode linked deprivation measures for CPRD GOLD,46.51,ALLIANCE > CPRD,Not Rated,42.86,63.49,51.75,50.0,Not Rated,bc6ae5bc-7175-49e2-b093-337dde427736
69.84,Wales Cancer Bank,20.93,ALLIANCE > TISSUE DIRECTORY,Bronze,20.63,60.32,74.06,69.05,Bronze,bcfdc597-1bf0-41c2-8b68-779f9a115f83
87.3,Emergency Department Data Set,20.93,ALLIANCE > SAIL,Gold,25.4,100.0,87.16,95.24,Gold,bd2d56db-f24b-4ac6-9201-3d68c65472b5
61.11,Mental Health & Learning Disabilities Dataset v 1 (Sensitive) Events,51.16,NHS Digital,Not Rated,55.56,77.78,56.57,64.29,Not Rated,bdc17b2c-8b0f-4959-ab9b-e2de32d8a5f9
61.11,Mother-Baby Link for CPRD GOLD,48.84,ALLIANCE > CPRD,Not Rated,47.62,69.84,52.96,54.76,Not Rated,bdcbbb2b-df99-4ae7-b36e-f266cfe10ed3
45.23,National Joint Registry - Revision Shoulder Replacement dataset,30.23,ALLIANCE > HQIP,Not Rated,31.75,22.22,47.98,26.19,Not Rated,bddcc89d-028f-48a5-b568-7dccd574563b
69.84,4 LMIC Asian Country ChrOnic: estimating respiratory disease burden in adults,16.28,HUBS > BREATHE,Bronze,19.05,58.73,76.38,69.05,Silver,be9bf427-d96d-4b1a-b1d1-83bdc3e8790b
84.92,"OMOP dataset: Hospital COVID patients: severity, acuity, therapies, outcomes",25.58,HUB > PIONEER,Silver,26.98,96.83,82.45,90.48,Silver,bf607b38-bedf-4bda-a3ce-e6b1bb68d1df
36.51,TheatreEvents,41.86,ALLIANCE > OUH,Not Rated,41.27,14.29,37.41,16.67,Not Rated,bf83ada4-b72e-4789-b177-12a53aa763ea
78.57,Mental Health Inpatient and Day Case - Scottish Morbidity Record (SMR04),30.23,ALLIANCE > SCOTLAND,Silver,30.16,87.3,75.36,80.95,Bronze,bfc6e7c5-a81b-4fe2-95b5-d108a48d7d67
69.05,UCL Infection DNA Bank,25.58,ALLIANCE > TISSUE DIRECTORY,Bronze,25.4,63.49,72.93,71.43,Bronze,c10d6c3a-e405-4ee9-828f-02443c210879
45.24,Vitamin D supplementation meta-analyses,30.23,HUBS > BREATHE,Not Rated,33.33,23.81,49.17,28.57,Not Rated,c16605d7-6e6e-4461-bfab-107660e31427
70.64,STAMPEDE,18.6,ALLIANCE > TISSUE DIRECTORY,Bronze,19.05,60.32,75.22,69.05,Bronze,c182a3b6-8eea-43ef-be18-6cd444f150dc
38.89,Fife Radiology,37.21,ALLIANCE > DUNDEE,Not Rated,36.51,14.29,39.73,16.67,Not Rated,c22d8356-d51b-4d34-aadf-ed356d15fe46
68.25,Assessing the eDPSEEA model in seasonal pollen induced asthma in Islamabad,18.6,HUBS > BREATHE,Bronze,20.63,57.14,74.03,66.67,Bronze,c2548017-7913-40e1-bf98-aaa2e907b0ea
38.89,Tayside Bowel Screening Dataset,37.21,ALLIANCE > DUNDEE,Not Rated,36.51,14.29,39.73,16.67,Not Rated,c275f19e-2373-43dc-8e83-3318aaf8bfa4
73.02,Arden Tissue Bank,18.6,ALLIANCE > TISSUE DIRECTORY,Bronze,19.05,65.08,77.61,73.81,Silver,c29c3fbe-700e-4f85-8943-5557c30c1dfa
87.3,Outpatient Referral,20.93,ALLIANCE > SAIL,Gold,25.4,100.0,87.16,95.24,Gold,c2ddca9f-f144-437b-ac7a-0a628a50ba1a
73.8,Diagnostic Imaging Dataset,34.88,HUB > NHS DIGITRIALS,Bronze,38.1,85.71,71.84,78.57,Bronze,c2f15f59-8e0d-4e90-9277-342497a6d961
45.24,Genvasc Primary Care Data,32.56,ALLIANCE > LEICESTER,Not Rated,33.33,23.81,48.0,28.57,Not Rated,c324246a-22d9-45d8-9a7a-a513078be2d1
43.65,Sentinel Stroke National Audit Programme Acute Organisational survey dataset,32.56,ALLIANCE > HQIP,Not Rated,34.92,22.22,46.81,26.19,Not Rated,c3d84dfa-fe3a-4b86-a0f5-efbe45aa93ad
76.98,UK BiLEVE Consortium Dataset,13.95,HUBS > BREATHE,Silver,15.87,69.84,82.31,78.57,Silver,c43363e5-a2cd-4990-a425-733dfe559a4f
69.84,HES Accident and Emergency data for CPRD GOLD,37.21,ALLIANCE > CPRD,Bronze,38.1,77.78,65.92,69.05,Not Rated,c55b92d8-889d-435c-b0cb-2d9f7b432839
69.05,Death Registration data for CPRD Aurum,39.53,ALLIANCE > CPRD,Bronze,39.68,77.78,64.76,69.05,Not Rated,c577669a-a84f-493e-8164-3fe02f618561
44.45,National Audit of Psychosis - Audit on Early Intervention in Psychosis services - contextual data,32.56,ALLIANCE > HQIP,Not Rated,33.33,22.22,46.81,26.19,Not Rated,c5994fae-9c4a-47eb-ba42-85bd76e92879
60.31,Practice postcode linked deprivation measures for CPRD GOLD,46.51,ALLIANCE > CPRD,Not Rated,42.86,63.49,51.75,50.0,Not Rated,c6117afd-bc4d-404b-8d58-9d87db936b4c
68.25,Barts CTU,23.26,ALLIANCE > TISSUE DIRECTORY,Bronze,23.81,60.32,72.89,69.05,Bronze,c6d6bbd3-74ed-46af-841d-ac5e05f4da41
88.89,COG-UK Viral Genome Sequences,20.93,OTHER > COG-UK,Gold,22.22,100.0,87.16,95.24,Gold,c6dc78fa-1543-4fbf-87d8-a3f48e7de813
61.11,Mental Health & Learning Disabilities Dataset v 1 (Non-Sensitive) Episodes,51.16,NHS Digital,Not Rated,55.56,77.78,56.57,64.29,Not Rated,c713773c-e961-400e-b44a-947002deb073
87.3,COVID-19 Consolidated Deaths,20.93,ALLIANCE > SAIL,Gold,25.4,100.0,87.16,95.24,Gold,c809126e-315b-4bcc-8fa3-741317bf9a4e
70.64,RATHL Trial,23.26,ALLIANCE > TISSUE DIRECTORY,Bronze,22.22,63.49,75.28,73.81,Bronze,c83d2206-3778-400b-9b26-27c7588af930
38.89,NHS Tayside and Fife Virology,37.21,ALLIANCE > DUNDEE,Not Rated,36.51,14.29,39.73,16.67,Not Rated,c8ed8784-91ce-4823-8e80-fa3a4b732e11
61.11,Mental Health Minimum Dataset v4.1 (Non-Sensitive) Records,51.16,NHS Digital,Not Rated,55.56,77.78,56.57,64.29,Not Rated,c97b8058-a6a4-4c8d-92e1-6e9f4cddd301
45.23,National Audit of Care at the End of Life - case note review,30.23,ALLIANCE > HQIP,Not Rated,31.75,22.22,47.98,26.19,Not Rated,cabb1db1-ee3e-42ce-a40b-468282e2011d
80.16,Personal Demographic Service,25.58,HUB > NHS DIGITRIALS,Silver,25.4,85.71,76.5,78.57,Silver,caf619c9-3e9c-4873-a7ba-c0df8f4a62c2
43.65,National Early Inflammatory Arthritis Audit - organisational survey dataset,32.56,ALLIANCE > HQIP,Not Rated,34.92,22.22,46.81,26.19,Not Rated,cbda5643-96b7-4914-b990-a872e693ff29
61.11,Mental Health Minimum Dataset v4.1 (Sensitive) Records,51.16,NHS Digital,Not Rated,55.56,77.78,56.57,64.29,Not Rated,cc383a3f-1c47-4b7d-99cf-be8ee0afe401
69.84,HES Admitted Patient Care data for CPRD Aurum,39.53,ALLIANCE > CPRD,Bronze,39.68,79.37,65.95,71.43,Not Rated,cc3e20da-aca5-471d-a4bb-38e13f350f10
74.61,Clinical response thresholds (acuity) in acutely unwell patients: onset-outcome,30.23,HUB > PIONEER - HDR-UK Health data Hub in Acute Care,Bronze,30.16,79.37,70.6,71.43,Bronze,cce4a8d0-4110-4490-8ffa-485d059b7dcf
86.5,Postponed Admitted Procedures,20.93,ALLIANCE > SAIL,Gold,25.4,98.41,85.97,92.86,Silver,ce192e2e-4f31-4bb0-9c1f-5c4173c03011
55.56,Improving Access to Psychological Therapies Data Set,27.91,ALLIANCE > NHS DIGITAL,Not Rated,26.98,38.1,57.48,42.86,Not Rated,cef00323-8756-4ea5-99e4-f12dcb2c6297
44.45,National Clinical Audit of Anxiety and Depression - spotlight audit on psychological therapies (clinical),32.56,ALLIANCE > HQIP,Not Rated,33.33,22.22,46.81,26.19,Not Rated,cf3f4336-e52d-4b82-8cc5-647dedaaee57
57.14,Quality of Life of Colorectal Cancer Survivors in England: Patient Reported Outcome Measures Survey for CPRD GOLD,51.16,ALLIANCE > CPRD,Not Rated,49.21,63.49,49.42,50.0,Not Rated,cf81a42f-2611-4410-89e9-7e3770d03a15
86.5,Referral to Treatment Times,20.93,ALLIANCE > SAIL,Gold,25.4,98.41,85.97,92.86,Silver,cfdb9fbd-9f67-435c-b257-6b51430451bb
81.75,Cystic Fibrosis Patient Microbiology Cultures,27.91,ALLIANCE > CYSTIC FIBROSIS TRUST,Silver,36.51,100.0,83.66,95.24,Silver,d0468470-a88f-4692-a19d-c9ac0b9868f3
69.84,Cancer Group CTR Cardiff trials,20.93,ALLIANCE > TISSUE DIRECTORY,Bronze,20.63,60.32,74.06,69.05,Bronze,d272b783-8db3-4068-8d0f-05728f786d6d
43.65,Patient Reported Outcome Measures,55.81,NHS Digital,Not Rated,58.73,46.03,38.76,33.33,Not Rated,d2af6a29-291b-4444-a17c-40f4208f1e1b
84.12,Education - Wales,25.58,ALLIANCE > SAIL,Silver,31.75,100.0,84.83,95.24,Silver,d2da2750-7482-4ce9-ae5c-2ab393408a67
84.13,North West London Coordinate My Care (NWL CMC),25.58,HUB > DISCOVER NOW,Silver,28.57,96.83,83.64,92.86,Silver,d30304ab-9f5d-478a-8bac-afcda09ef2e8
43.65,Sentinel Stroke National Audit Programme Clinical Dataset,32.56,ALLIANCE > HQIP,Not Rated,34.92,22.22,46.81,26.19,Not Rated,d3673b75-ec8f-4c2e-8c9b-6ef1d951f978
71.43,MFT Biobank,20.93,ALLIANCE > TISSUE DIRECTORY,Bronze,20.63,63.49,75.25,71.43,Bronze,d3a3935f-b28e-4e74-9b15-9432d611f26c
71.42,PIONEER - COVID,25.58,HUB > PIONEER,Bronze,25.4,68.25,75.31,76.19,Bronze,d3d1cdf1-3a36-49d1-ba73-b02ebeceab9b
65.08,Strategy introducing Pulmonary Rehabilitation for COPD management in rural India,20.93,HUBS > BREATHE,Not Rated,22.22,52.38,69.3,59.52,Bronze,d3e859ba-cfb0-4eda-a14c-34b08d113cd9
37.3,JANUS,39.53,ALLIANCE > OUH,Not Rated,39.68,14.29,38.57,16.67,Not Rated,d3fd4dac-2d15-401c-8185-905ee108d9ce
71.43,UK ME/CFS Biobank,20.93,ALLIANCE > TISSUE DIRECTORY,Bronze,20.63,63.49,75.25,71.43,Bronze,d51de39c-153a-462b-8de5-cd1424908e0c
68.25,Exploration of Pneumonia Related Policy Formation and Implementation in Pakistan,18.6,HUBS > BREATHE,Bronze,20.63,57.14,74.03,66.67,Bronze,d5446d68-2fb9-4f0f-962e-7b7ed484d534
37.3,OUH Patient Master Index,39.53,ALLIANCE > OUH,Not Rated,39.68,14.29,38.57,16.67,Not Rated,d57a096a-4fa3-4529-b508-0b9df0f1893c
59.52,INTERVAL,25.58,OTHER > The University of Cambridge,Not Rated,23.81,42.86,61.02,47.62,Not Rated,d58d02f1-47c2-44fc-b16e-4f6cbbb46e62
71.43,NHS Grampian Biorepository,20.93,ALLIANCE > TISSUE DIRECTORY,Bronze,20.63,63.49,75.25,71.43,Bronze,d5ab658e-b474-4e22-95f8-92607c40792d
90.47,HDR UK Papers & Preprints,11.63,OTHER > HEALTH DATA RESEARCH UK,Gold,19.05,100.0,91.81,95.24,Gold,d5faf9c6-6c34-46d7-93c4-7706a5436ed9
69.05,Mental Health Services Data Set,39.53,HUB > NHS DIGITRIALS,Bronze,42.86,80.95,67.14,73.81,Bronze,d612e29a-c26a-4512-99d4-548514b60c76
79.37,Health and Lifestyle Questionnaire,34.88,ALLIANCE > NIHR BIORESOURCE,Silver,33.33,92.06,76.61,88.1,Silver,d7ec9584-cba3-46f9-9ef4-b1cb9eef2e7c
82.54,Outpatient Appointments and Attendances - Scottish Morbidity Record (SMR00),25.58,ALLIANCE > SCOTLAND,Silver,25.4,90.48,78.88,83.33,Silver,d8043751-28d6-4cfe-b860-757e592ab3cb
46.83,Cancer Patient Experience Survey (CPES) for CPRD Aurum,41.86,ALLIANCE > CPRD,Not Rated,38.1,31.75,45.73,33.33,Not Rated,d90830f4-5aaa-4075-8c8d-839627224d16
45.23,National Vascular Registry -  Abdominal Aortic Aneurysm Repair clinical dataset,30.23,ALLIANCE > HQIP,Not Rated,31.75,22.22,47.98,26.19,Not Rated,da4d3e21-3d81-49e9-ada0-6175e2341190
89.69,Looked After Children Wales,18.6,ALLIANCE > SAIL,Gold,20.63,100.0,88.32,95.24,Gold,da5098df-414f-48e0-aaa7-7e2277f80eb7
61.11,Mental Health Minimum Dataset v4.1 (Sensitive) Events,51.16,NHS Digital,Not Rated,55.56,77.78,56.57,64.29,Not Rated,db113fcd-69a0-4357-9c6d-250085deb3f5
76.19,ONS 2011 Census Wales (CENW),30.23,ALLIANCE > SAIL,Silver,36.51,88.89,75.36,80.95,Bronze,dbd69f22-2638-42a6-a936-069386e8eb7e
70.64,interNational Anaplastic Thyroid Cancer Tissue Bank (iNATT),18.6,ALLIANCE > TISSUE DIRECTORY,Bronze,19.05,60.32,75.22,69.05,Bronze,dd7e56e7-2683-4b88-bed2-3a27ef3e4c9e
45.23,National Vascular Registry Audit Carotid Endarterectomy Clinical Dataset,30.23,ALLIANCE > HQIP,Not Rated,31.75,22.22,47.98,26.19,Not Rated,ddc965e7-6f52-4eed-bed5-657e3e7bbeac
40.48,NHS Digital data,34.88,ALLIANCE > NIHR BIORESOURCE,Not Rated,36.51,17.46,43.28,21.43,Not Rated,de1179eb-89fe-45a3-9e3c-e54a2a36ebf0
44.45,National Bowel Cancer Audit -  Organisational Survey dataset,32.56,ALLIANCE > HQIP,Not Rated,33.33,22.22,46.81,26.19,Not Rated,de19b3ea-2600-4472-85e8-628e7beff76e
80.96,UK Lung Volume Reduction Surgery,9.3,HUBS > BREATHE,Silver,9.52,71.43,85.83,80.95,Silver,def6669b-0fac-485c-84b2-2ea83ec31123
78.57,School Workforce Annual Census (SWAC),27.91,ALLIANCE > SAIL,Silver,31.75,88.89,76.52,80.95,Silver,df514642-bf9d-432f-bf15-4d870fe4ae08
65.88,Klang Asthma Cohort,20.93,HUBS > BREATHE,Not Rated,23.81,55.56,71.68,64.29,Bronze,df63e893-f688-4bb4-956c-cc4354bb4001
37.3,Admitted Patient Care Dataset,39.53,ALLIANCE > OUH,Not Rated,39.68,14.29,38.57,16.67,Not Rated,dfb21b3b-7fd9-40c4-892e-810edd6dfc25
70.63,Civil Registration - Deaths,39.53,ALLIANCE > NHS DIGITAL,Bronze,44.44,85.71,69.52,78.57,Bronze,e09ddabc-b0b9-4f9d-af32-97293e0e6cb7
84.12,GENOMICS ENGLAND 100K PHE LINKED DATA,30.23,ALLIANCE > GENOMICS ENGLAND,Silver,31.75,100.0,82.5,95.24,Silver,e0c871f9-b63c-43a5-9fd6-e5731dae2343
45.23,National Oesophago-Gastric Cancer Audit - clinical dataset,30.23,ALLIANCE > HQIP,Not Rated,31.75,22.22,47.98,26.19,Not Rated,e10660af-b420-4e25-8fc9-ea451da1dcfb
88.09,Healthcare Workers Risk Assessment,20.93,ALLIANCE > SAIL,Gold,22.22,98.41,85.97,92.86,Silver,e2f05904-723a-4d5c-8746-7ab3d1d94eef
45.23,National Joint Registry - Primary Ankle Replacement dataset,30.23,ALLIANCE > HQIP,Not Rated,31.75,22.22,47.98,26.19,Not Rated,e38c8d6c-8655-4432-b654-23f89c0bb495
81.75,Cystic Fibrosis Patient Tendon Rupture,27.91,ALLIANCE > CYSTIC FIBROSIS TRUST,Silver,36.51,100.0,83.66,95.24,Silver,e432737f-43c0-43c1-aef5-71cb204d770c
45.24,Unified Cohorts Research Network,30.23,HUBS > BREATHE,Not Rated,33.33,23.81,49.17,28.57,Not Rated,e516a359-74a8-4932-b4df-f2cf75eef89d
77.78,National Records of Scotland (NRS) - Deaths Data,27.91,ALLIANCE > PUBLIC HEALTH SCOTLAND,Silver,36.51,92.06,78.9,85.71,Silver,e61fce14-617d-4f7b-80aa-468d94c6d897
81.75,Cystic Fibrosis Patient Sweat Tests,30.23,ALLIANCE > CYSTIC FIBROSIS TRUST,Silver,36.51,100.0,82.5,95.24,Silver,e66b726f-8e58-4411-be32-1d00ba1df13f
69.84,Biobank for patients with retinal degenerations & dystrophies,20.93,ALLIANCE > TISSUE DIRECTORY,Bronze,20.63,60.32,74.06,69.05,Bronze,e678366e-bb53-4dbb-a228-05114e0b6eb3
75.39,Lifelong Learning Wales Record (LLWR),32.56,ALLIANCE > SAIL,Bronze,34.92,85.71,71.81,76.19,Bronze,e7fc3bb6-446b-4267-b563-bf6f94e8dee2
69.84,University of Liverpool - GCP Laboratory Facility,20.93,ALLIANCE > TISSUE DIRECTORY,Bronze,20.63,60.32,74.06,69.05,Bronze,e8f23004-f1f7-4a36-859f-25af6ca6433b
