error_percent,weighted_quality_rating,weighted_error_percent,id,completeness_percent,title,weighted_completeness_percent,quality_score,weighted_quality_score,quality_rating,publisher
23.26,Gold,26.98,af148400-1ec6-436d-910e-45350a54c390,95.24,Cystic Fibrosis Patient NTM culture,100.0,85.99,86.51,Silver,ALLIANCE > CYSTIC FIBROSIS
18.6,Bronze,20.63,af238430-c257-4d60-9ff0-1de6b825f09e,64.29,Community perception on public health measures for COVID-19 prevention/control,55.56,72.84,67.47,Bronze,HUBS > BREATHE
16.28,Gold,12.7,af660e81-bb96-4e85-99a8-b85147c6ba79,92.86,North West London Coordinate My Care (NWL CMC),96.83,88.29,92.06,Gold,HUBS > DISCOVER NOW
20.93,Bronze,20.63,b0886a0c-7ddc-4c2b-a499-afd7262fbe56,71.43,RAPPER,63.49,75.25,71.43,Bronze,ALLIANCE > TISSUE DIRECTORY
25.58,Gold,22.22,b0a8085e-8cf0-45ee-b4a6-12a4a545ca70,95.24,GENOMICS ENGLAND 100K RARE DISEASE & COMMON,100.0,84.83,88.89,Silver,ALLIANCE > GENOMICS ENGLAND
37.21,Not Rated,36.51,b2124786-9658-40cc-b5a3-6624885ce490,16.67,Patient SIMD Postcode,14.29,39.73,38.89,Not Rated,ALLIANCE > DUNDEE
18.6,Gold,15.87,b232b32f-07d4-4fce-85a0-3834efd8757a,92.86,North West London Patient Index (NWL PI),96.83,87.13,90.48,Gold,HUBS > DISCOVER NOW
16.28,Gold,9.52,b339ea90-c3dd-44d8-a968-88eba9e3edb3,92.86,North West London Admitted Patient Care Data (NWL APC),96.83,88.29,93.66,Gold,HUBS > DISCOVER NOW
18.6,Bronze,19.05,b36202ad-7652-460c-8389-baa1a1c1ac46,71.43,York Tissue Bank,63.49,76.42,72.22,Silver,ALLIANCE > TISSUE DIRECTORY
23.26,Bronze,22.22,b3a10154-a409-491a-92fb-e7fac47ccd91,69.05,HCV Research UK,60.32,72.89,69.05,Bronze,ALLIANCE > TISSUE DIRECTORY
41.86,Silver,42.86,b40777a2-468b-4b45-8b7d-2f62f912e950,95.24,HIC ICU 8.3.2,100.0,76.69,78.57,Silver,NIHR Health Informatics Collaborative Critical Care Theme
39.53,Not Rated,39.68,b41bb360-f2ed-49f0-a45b-b2fb05321975,16.67,CDE Surginet Documentation,14.29,38.57,37.3,Not Rated,ALLIANCE > BARTS
44.19,Not Rated,38.1,b4f6a5c2-e652-4972-9d06-510e9a469dfe,47.62,Systemic Anti-Cancer Treatment (SACT) data for CPRD Aurum,60.32,51.72,61.11,Not Rated,ALLIANCE > CPRD
46.51,Not Rated,46.03,b53f716d-a5c3-4ad8-a2aa-cae09c12ac18,61.9,Mental Health Minimum Dataset v4.1 (Non-Sensitive) Episodes,74.6,57.7,64.28,Not Rated,NHS Digital
20.93,Bronze,20.63,b717d41e-9202-40ed-be1a-882ec0c47761,69.05,MRC Brain Banks Network,60.32,74.06,69.84,Bronze,ALLIANCE > TISSUE DIRECTORY
27.91,Bronze,26.98,b730442a-72f3-4b0d-8ad3-4bdba046df7a,69.05,Tissue Solutions Ltd,61.9,70.57,67.46,Bronze,ALLIANCE > TISSUE DIRECTORY
23.26,Bronze,22.22,b796b821-97cf-4aa1-bbc7-53e3c1fbc33f,71.43,TRICON8,63.49,74.09,70.64,Bronze,ALLIANCE > TISSUE DIRECTORY
37.21,Not Rated,36.51,b8107ec3-ba35-45ee-8231-cb610fe2ce48,16.67,Tayside Radiology,14.29,39.73,38.89,Not Rated,ALLIANCE > DUNDEE
37.21,Not Rated,36.51,b9a2fe09-60b3-48a4-b252-9ed04a7dcc66,16.67,NHS Tayside and Fife Haematology (Lab Data Restructured),14.29,39.73,38.89,Not Rated,ALLIANCE > DUNDEE
46.51,Not Rated,46.03,ba071b0b-5ef4-457b-b194-3a69c2c71a06,64.29,Mental Health Minimum Dataset v4 (Non-Sensitive) Events,77.78,58.89,65.88,Not Rated,NHS Digital
18.6,Bronze,20.63,bab944af-e345-4893-8640-a88aaff97c72,61.9,Assessment of ASHA’s workload and its determinants,53.97,71.65,66.67,Bronze,HUBS > BREATHE
16.28,Gold,12.7,bc2d2a17-0f36-4cb0-85d3-b54e64460d75,92.86,North West London Primary Care Events Data (NWL PCE),96.83,88.29,92.06,Gold,HUBS > DISCOVER NOW
41.86,Not Rated,33.33,bc6ae5bc-7175-49e2-b093-337dde427736,50.0,Patient postcode linked deprivation measures for CPRD GOLD,63.49,54.07,65.08,Not Rated,ALLIANCE > CPRD
20.93,Bronze,20.63,bcfdc597-1bf0-41c2-8b68-779f9a115f83,69.05,Wales Cancer Bank,60.32,74.06,69.84,Bronze,ALLIANCE > TISSUE DIRECTORY
46.51,Not Rated,46.03,bdc17b2c-8b0f-4959-ab9b-e2de32d8a5f9,64.29,Mental Health & Learning Disabilities Dataset v 1 (Sensitive) Events,77.78,58.89,65.88,Not Rated,NHS Digital
44.19,Not Rated,38.1,bdcbbb2b-df99-4ae7-b36e-f266cfe10ed3,54.76,Mother-Baby Link for CPRD GOLD,69.84,55.28,65.87,Not Rated,ALLIANCE > CPRD
30.23,Not Rated,31.75,bddcc89d-028f-48a5-b568-7dccd574563b,26.19,National Joint Registry - Revision Shoulder Replacement dataset,22.22,47.98,45.23,Not Rated,ALLIANCE > HQIP
23.26,Silver,17.46,be170751-3ab2-4cb6-a59f-d5d5867e0bfd,69.05,Unscheduled Care Datamart,77.78,72.89,80.16,Bronze,ALLIANCE > SCOTLAND
16.28,Bronze,19.05,be9bf427-d96d-4b1a-b1d1-83bdc3e8790b,69.05,4 LMIC Asian Country ChrOnic: estimating respiratory disease burden in adults,58.73,76.38,69.84,Silver,HUBS > BREATHE
41.86,Not Rated,41.27,bf83ada4-b72e-4789-b177-12a53aa763ea,16.67,TheatreEvents,14.29,37.41,36.51,Not Rated,Oxford University Hospitals NHS Foundation Trust
25.58,Bronze,25.4,c10d6c3a-e405-4ee9-828f-02443c210879,71.43,UCL Infection DNA Bank,63.49,72.93,69.05,Bronze,ALLIANCE > TISSUE DIRECTORY
30.23,Not Rated,33.33,c16605d7-6e6e-4461-bfab-107660e31427,28.57,Vitamin D supplementation meta-analyses,23.81,49.17,45.24,Not Rated,HUBS > BREATHE
18.6,Bronze,19.05,c182a3b6-8eea-43ef-be18-6cd444f150dc,69.05,STAMPEDE,60.32,75.22,70.64,Bronze,ALLIANCE > TISSUE DIRECTORY
16.28,Gold,14.29,c1f947c3-4956-4e0b-93ef-23ce9abda000,92.86,North West London Primary Care Prescriptions Data (NWL PCP),96.83,88.29,91.27,Gold,HUBS > DISCOVER NOW
37.21,Not Rated,36.51,c22d8356-d51b-4d34-aadf-ed356d15fe46,16.67,Fife Radiology,14.29,39.73,38.89,Not Rated,ALLIANCE > DUNDEE
27.91,Bronze,25.4,c23c588f-7ab6-4c19-af4d-fe1e4d181102,66.67,National Diabetes Audit,76.19,69.38,75.39,Bronze,HUBS > NHS DIGITRIALS
18.6,Bronze,20.63,c2548017-7913-40e1-bf98-aaa2e907b0ea,66.67,Assessing the eDPSEEA model in seasonal pollen induced asthma in Islamabad,57.14,74.03,68.25,Bronze,HUBS > BREATHE
37.21,Not Rated,36.51,c275f19e-2373-43dc-8e83-3318aaf8bfa4,16.67,Tayside Bowel Screening Dataset,14.29,39.73,38.89,Not Rated,ALLIANCE > DUNDEE
18.6,Bronze,19.05,c29c3fbe-700e-4f85-8943-5557c30c1dfa,73.81,Arden Tissue Bank,65.08,77.61,73.02,Silver,ALLIANCE > TISSUE DIRECTORY
32.56,Not Rated,33.33,c324246a-22d9-45d8-9a7a-a513078be2d1,28.57,Genvasc Primary Care Data,23.81,48.0,45.24,Not Rated,ALLIANCE > LEICESTER
32.56,Not Rated,34.92,c3d84dfa-fe3a-4b86-a0f5-efbe45aa93ad,26.19,Sentinel Stroke National Audit Programme Acute Organisational survey dataset,22.22,46.81,43.65,Not Rated,ALLIANCE > HQIP
6.98,Gold,3.17,c42ceb2a-c9c2-491d-9f34-3da55413225f,95.24,COVID-19 Symptom Tracker Dataset,100.0,94.13,98.41,Gold,ALLIANCE > SAIL
13.95,Silver,15.87,c43363e5-a2cd-4990-a425-733dfe559a4f,78.57,UK BiLEVE Consortium Dataset,69.84,82.31,76.98,Silver,HUBS > BREATHE
32.56,Bronze,28.57,c55b92d8-889d-435c-b0cb-2d9f7b432839,69.05,HES Accident and Emergency data for CPRD GOLD,77.78,68.25,74.61,Bronze,ALLIANCE > CPRD
34.88,Bronze,30.16,c577669a-a84f-493e-8164-3fe02f618561,69.05,Death Registration data for CPRD Aurum,77.78,67.09,73.81,Bronze,ALLIANCE > CPRD
32.56,Not Rated,33.33,c5994fae-9c4a-47eb-ba42-85bd76e92879,26.19,National Audit of Psychosis - Audit on Early Intervention in Psychosis services - contextual data,22.22,46.81,44.45,Not Rated,ALLIANCE > HQIP
41.86,Not Rated,33.33,c6117afd-bc4d-404b-8d58-9d87db936b4c,50.0,Practice postcode linked deprivation measures for CPRD GOLD,63.49,54.07,65.08,Not Rated,ALLIANCE > CPRD
23.26,Bronze,23.81,c6d6bbd3-74ed-46af-841d-ac5e05f4da41,69.05,Barts CTU,60.32,72.89,68.25,Bronze,ALLIANCE > TISSUE DIRECTORY
16.28,Gold,12.7,c6dc78fa-1543-4fbf-87d8-a3f48e7de813,95.24,COG-UK Viral Genome Sequences,100.0,89.48,93.65,Gold,OTHER > COG-UK
46.51,Not Rated,46.03,c713773c-e961-400e-b44a-947002deb073,64.29,Mental Health & Learning Disabilities Dataset v 1 (Non-Sensitive) Episodes,77.78,58.89,65.88,Not Rated,NHS Digital
27.91,Bronze,25.4,c720c89a-b2c6-4cd6-b606-df34ff22b1c8,66.67,Hospital Episode Statistics Outpatients,76.19,69.38,75.39,Bronze,HUBS > NHS DIGITRIALS
23.26,Bronze,22.22,c83d2206-3778-400b-9b26-27c7588af930,73.81,RATHL Trial,63.49,75.28,70.64,Bronze,ALLIANCE > TISSUE DIRECTORY
37.21,Not Rated,36.51,c8ed8784-91ce-4823-8e80-fa3a4b732e11,16.67,NHS Tayside and Fife Virology,14.29,39.73,38.89,Not Rated,ALLIANCE > DUNDEE
46.51,Not Rated,46.03,c97b8058-a6a4-4c8d-92e1-6e9f4cddd301,64.29,Mental Health Minimum Dataset v4.1 (Non-Sensitive) Records,77.78,58.89,65.88,Not Rated,NHS Digital
30.23,Not Rated,31.75,cabb1db1-ee3e-42ce-a40b-468282e2011d,26.19,National Audit of Care at the End of Life - case note review,22.22,47.98,45.23,Not Rated,ALLIANCE > HQIP
32.56,Not Rated,34.92,cbda5643-96b7-4914-b990-a872e693ff29,26.19,National Early Inflammatory Arthritis Audit - organisational survey dataset,22.22,46.81,43.65,Not Rated,ALLIANCE > HQIP
46.51,Not Rated,46.03,cc383a3f-1c47-4b7d-99cf-be8ee0afe401,64.29,Mental Health Minimum Dataset v4.1 (Sensitive) Records,77.78,58.89,65.88,Not Rated,NHS Digital
34.88,Bronze,30.16,cc3e20da-aca5-471d-a4bb-38e13f350f10,71.43,HES Admitted Patient Care data for CPRD Aurum,79.37,68.28,74.61,Bronze,ALLIANCE > CPRD
20.93,Not Rated,20.63,cd051ddc-b383-4583-aeca-b2e1fe5b17e3,57.14,National Records of Scotland (NRS) - Births Data,50.79,68.1,65.08,Bronze,ALLIANCE > SCOTLAND
23.26,Bronze,22.22,cd0cc1de-f0bc-4247-9e67-47e162e2cc6b,73.81,National Cancer Registration Dataset 2018,65.08,75.28,71.43,Bronze,ALLIANCE > PUBLIC HEALTH ENGLAND
20.93,Silver,15.87,ce9025c9-cf30-420b-8edb-f6ca438b099f,69.05,Child Health Systems Programme - 4-5 year review,77.78,74.06,80.95,Bronze,ALLIANCE > SCOTLAND
23.26,Silver,17.46,ceca959a-11b1-4da3-8289-3cf22c9fc541,69.05,Child Health Systems Programme - 27-30Months Review,77.78,72.89,80.16,Bronze,ALLIANCE > SCOTLAND
32.56,Not Rated,33.33,cf3f4336-e52d-4b82-8cc5-647dedaaee57,26.19,National Clinical Audit of Anxiety and Depression - spotlight audit on psychological therapies (clinical),22.22,46.81,44.45,Not Rated,ALLIANCE > HQIP
46.51,Not Rated,39.68,cf81a42f-2611-4410-89e9-7e3770d03a15,50.0,Quality of Life of Colorectal Cancer Survivors in England: Patient Reported Outcome Measures Survey for CPRD GOLD,63.49,51.75,61.91,Not Rated,ALLIANCE > CPRD
23.26,Gold,26.98,d0468470-a88f-4692-a19d-c9ac0b9868f3,95.24,Cystic Fibrosis Patient Microbiology Cultures,100.0,85.99,86.51,Silver,ALLIANCE > CYSTIC FIBROSIS
20.93,Bronze,20.63,d272b783-8db3-4068-8d0f-05728f786d6d,69.05,Cancer Group CTR Cardiff trials,60.32,74.06,69.84,Bronze,ALLIANCE > TISSUE DIRECTORY
51.16,Not Rated,49.21,d2af6a29-291b-4444-a17c-40f4208f1e1b,33.33,Patient Reported Outcome Measures,46.03,41.09,48.41,Not Rated,NHS Digital
32.56,Not Rated,34.92,d3673b75-ec8f-4c2e-8c9b-6ef1d951f978,26.19,Sentinel Stroke National Audit Programme Clinical Dataset,22.22,46.81,43.65,Not Rated,ALLIANCE > HQIP
20.93,Bronze,20.63,d3a3935f-b28e-4e74-9b15-9432d611f26c,71.43,MFT Biobank,63.49,75.25,71.43,Bronze,ALLIANCE > TISSUE DIRECTORY
20.93,Not Rated,22.22,d3e859ba-cfb0-4eda-a14c-34b08d113cd9,59.52,Strategy introducing Pulmonary Rehabilitation for COPD management in rural India,52.38,69.3,65.08,Bronze,HUBS > BREATHE
39.53,Not Rated,39.68,d3fd4dac-2d15-401c-8185-905ee108d9ce,16.67,JANUS,14.29,38.57,37.3,Not Rated,Oxford University Hospitals NHS Foundation Trust
20.93,Bronze,20.63,d51de39c-153a-462b-8de5-cd1424908e0c,71.43,UK ME/CFS Biobank,63.49,75.25,71.43,Bronze,ALLIANCE > TISSUE DIRECTORY
18.6,Bronze,20.63,d5446d68-2fb9-4f0f-962e-7b7ed484d534,66.67,Exploration of Pneumonia Related Policy Formation and Implementation in Pakistan,57.14,74.03,68.25,Bronze,HUBS > BREATHE
32.56,Not Rated,34.92,d546521a-79be-4a53-83bd-ff008bda6171,26.19,Birmingham Out of Hours Research Database,22.22,46.81,43.65,Not Rated,HUBS > PIONEER
39.53,Not Rated,39.68,d57a096a-4fa3-4529-b508-0b9df0f1893c,16.67,OUH Patient Master Index,14.29,38.57,37.3,Not Rated,Oxford University Hospitals NHS Foundation Trust
20.93,Bronze,20.63,d5ab658e-b474-4e22-95f8-92607c40792d,71.43,NHS Grampian Biorepository,63.49,75.25,71.43,Bronze,ALLIANCE > TISSUE DIRECTORY
30.23,Silver,23.81,d7ec9584-cba3-46f9-9ef4-b1cb9eef2e7c,88.1,Health and Lifestyle Questionnaire,92.06,78.94,84.12,Silver,ALLIANCE > NIHR BIORESOURCE
32.56,Bronze,31.75,d83cc514-3e36-41a8-b9bc-c288265e66cf,66.67,Civil Registration - Deaths,74.6,67.06,71.42,Bronze,HUBS > NHS DIGITRIALS
41.86,Not Rated,38.1,d90830f4-5aaa-4075-8c8d-839627224d16,33.33,Cancer Patient Experience Survey (CPES) for CPRD Aurum,31.75,45.73,46.83,Not Rated,ALLIANCE > CPRD
23.26,Not Rated,22.22,d936d21f-6b78-470c-b623-6d1213f2a041,61.9,Outpatient Appointments and Attendances - Scottish Morbidity Record (SMR00),53.97,69.32,65.88,Bronze,ALLIANCE > SCOTLAND
30.23,Not Rated,31.75,da4d3e21-3d81-49e9-ada0-6175e2341190,26.19,National Vascular Registry -  Abdominal Aortic Aneurysm Repair clinical dataset,22.22,47.98,45.23,Not Rated,ALLIANCE > HQIP
46.51,Not Rated,46.03,db113fcd-69a0-4357-9c6d-250085deb3f5,64.29,Mental Health Minimum Dataset v4.1 (Sensitive) Events,77.78,58.89,65.88,Not Rated,NHS Digital
18.6,Bronze,19.05,dd7e56e7-2683-4b88-bed2-3a27ef3e4c9e,69.05,interNational Anaplastic Thyroid Cancer Tissue Bank (iNATT),60.32,75.22,70.64,Bronze,ALLIANCE > TISSUE DIRECTORY
30.23,Not Rated,31.75,ddc965e7-6f52-4eed-bed5-657e3e7bbeac,26.19,National Vascular Registry Audit Carotid Endarterectomy Clinical Dataset,22.22,47.98,45.23,Not Rated,ALLIANCE > HQIP
34.88,Not Rated,36.51,de1179eb-89fe-45a3-9e3c-e54a2a36ebf0,21.43,NHS Digital data,17.46,43.28,40.48,Not Rated,ALLIANCE > NIHR BIORESOURCE
32.56,Not Rated,33.33,de19b3ea-2600-4472-85e8-628e7beff76e,26.19,National Bowel Cancer Audit -  Organisational Survey dataset,22.22,46.81,44.45,Not Rated,ALLIANCE > HQIP
9.3,Silver,9.52,def6669b-0fac-485c-84b2-2ea83ec31123,80.95,UK Lung Volume Reduction Surgery,71.43,85.83,80.96,Silver,HUBS > BREATHE
23.26,Not Rated,22.22,df63bdd2-712d-478e-8aae-36d01158a440,57.14,National Records of Scotland (NRS) - Deaths Data,50.79,66.94,64.28,Bronze,ALLIANCE > SCOTLAND
20.93,Not Rated,23.81,df63e893-f688-4bb4-956c-cc4354bb4001,64.29,Klang Asthma Cohort,55.56,71.68,65.88,Bronze,HUBS > BREATHE
39.53,Not Rated,39.68,dfb21b3b-7fd9-40c4-892e-810edd6dfc25,16.67,Admitted Patient Care Dataset,14.29,38.57,37.3,Not Rated,Oxford University Hospitals NHS Foundation Trust
25.58,Gold,22.22,e0c871f9-b63c-43a5-9fd6-e5731dae2343,95.24,GENOMICS ENGLAND 100K PHE LINKED DATA,100.0,84.83,88.89,Silver,ALLIANCE > GENOMICS ENGLAND
11.63,Gold,9.52,e0ed59e2-8fb5-44d4-b694-f31d46884954,95.24,Brecon dataset,100.0,91.81,95.24,Gold,ALLIANCE > SAIL
30.23,Not Rated,31.75,e10660af-b420-4e25-8fc9-ea451da1dcfb,26.19,National Oesophago-Gastric Cancer Audit - clinical dataset,22.22,47.98,45.23,Not Rated,ALLIANCE > HQIP
30.23,Not Rated,31.75,e38c8d6c-8655-4432-b654-23f89c0bb495,26.19,National Joint Registry - Primary Ankle Replacement dataset,22.22,47.98,45.23,Not Rated,ALLIANCE > HQIP
23.26,Gold,26.98,e432737f-43c0-43c1-aef5-71cb204d770c,95.24,Cystic Fibrosis Patient Tendon Rupture,100.0,85.99,86.51,Silver,ALLIANCE > CYSTIC FIBROSIS
30.23,Not Rated,33.33,e516a359-74a8-4932-b4df-f2cf75eef89d,28.57,Unified Cohorts Research Network,23.81,49.17,45.24,Not Rated,HUBS > BREATHE
25.58,Gold,26.98,e66b726f-8e58-4411-be32-1d00ba1df13f,95.24,Cystic Fibrosis Patient Sweat Tests,100.0,84.83,86.51,Silver,ALLIANCE > CYSTIC FIBROSIS
20.93,Bronze,20.63,e678366e-bb53-4dbb-a228-05114e0b6eb3,69.05,Biobank for patients with retinal degenerations & dystrophies,60.32,74.06,69.84,Bronze,ALLIANCE > TISSUE DIRECTORY
20.93,Gold,20.63,e85e5c8c-b6be-4e8b-8a0b-13b785b457a2,92.86,North West London Community Data (NWL COM),96.83,85.97,88.1,Silver,HUBS > DISCOVER NOW
20.93,Bronze,20.63,e8f23004-f1f7-4a36-859f-25af6ca6433b,69.05,University of Liverpool - GCP Laboratory Facility,60.32,74.06,69.84,Bronze,ALLIANCE > TISSUE DIRECTORY
37.21,Not Rated,36.51,e8f5b1b5-2c08-439a-b337-70b454aa40f3,16.67,"NHS Tayside, A&E Drugs given during an A&E visit",14.29,39.73,38.89,Not Rated,ALLIANCE > DUNDEE
25.58,Bronze,23.81,ea07f115-9f70-4c21-a373-247a1ca906f0,76.19,Research Donors Ltd,66.67,75.31,71.43,Bronze,ALLIANCE > TISSUE DIRECTORY
39.53,Not Rated,39.68,eaca9ed1-30b6-4157-8894-8e53efc84849,16.67,Sunquest,14.29,38.57,37.3,Not Rated,Oxford University Hospitals NHS Foundation Trust
18.6,Bronze,19.05,eb19fcd9-2e9e-4e27-aa79-ad235952b1ac,71.43,Tommy's National Reproductive Health Biobank,63.49,76.42,72.22,Silver,ALLIANCE > TISSUE DIRECTORY
23.26,Gold,17.46,ecbe7275-82b5-43cd-9401-fd7ef4b55341,95.24,GENOMICS ENGLAND 100K QUICK VIEW,100.0,85.99,91.27,Silver,ALLIANCE > GENOMICS ENGLAND
20.93,Not Rated,22.22,ecc4daf2-e58a-4ebc-9608-4bc741231fb9,59.52,"Introducing pulse oximetry in IMNCI, primary health facilities in Pune India",52.38,69.3,65.08,Bronze,HUBS > BREATHE
37.21,Not Rated,36.51,edaf29f4-9857-4bb0-97b9-ae88b70a2a3c,16.67,Fife Microbiology: Isolations,14.29,39.73,38.89,Not Rated,ALLIANCE > DUNDEE
20.93,Bronze,20.63,edc8f0c6-64f8-4f6d-a1dd-41e05033d54e,78.57,Its Not JUST Idiopathic pulmonary fibrosis Study (INJUSTIS),68.25,78.82,73.81,Silver,HUBS > BREATHE
20.93,Bronze,20.63,ee5f4405-6930-4a7b-ba00-85a8e8c8a8b9,71.43,QTL Programme at MRC HGU,63.49,75.25,71.43,Bronze,ALLIANCE > TISSUE DIRECTORY
13.95,Gold,9.52,ee78ce42-7f1f-4c97-80cc-ea6ad628e5da,95.24,National Survey for Wales,100.0,90.64,95.24,Gold,ALLIANCE > SAIL
20.93,Bronze,20.63,eea147a4-4576-4f86-8ad1-c762137335fd,71.43,Manchester Cancer Research Centre (MCRC) Biobank,63.49,75.25,71.43,Bronze,ALLIANCE > TISSUE DIRECTORY
13.95,Gold,12.7,eebb647a-63eb-4e62-b052-26cb2eb4799d,95.24,Emergency Department Dataset Daily,100.0,90.64,93.65,Gold,ALLIANCE > SAIL
27.91,Silver,22.22,ef42201e-deb1-4675-896a-8a0162fe52a8,83.33,CPRD Aurum,90.48,77.71,84.13,Silver,ALLIANCE > CPRD
32.56,Not Rated,34.92,efbb3bf4-834b-417e-b002-03fc41715e58,26.19,National Cardiac Audit Programme - National Heart Failure Audit,22.22,46.81,43.65,Not Rated,ALLIANCE > HQIP
13.95,Gold,12.7,efc2bb06-d502-4424-ac92-72834459fbaa,92.86,COVID-19 Consolidated Deaths,98.41,89.45,92.85,Gold,ALLIANCE > SAIL
34.88,Not Rated,36.51,f075ceb7-5bed-4e6b-8e83-211aee945356,26.19,Society for Acute Medicine Benchmarking Audit,22.22,45.66,42.86,Not Rated,HUBS > PIONEER
34.88,Not Rated,36.51,f1a85970-bddc-499b-92e9-783706c60995,23.81,SNP imputation data,20.63,44.47,42.06,Not Rated,ALLIANCE > NIHR BIORESOURCE
23.26,Bronze,22.22,f1a93b8f-6332-43a2-b2da-c86f68f7d24a,69.05,Manchester Eye Tissue Repository,60.32,72.89,69.05,Bronze,ALLIANCE > TISSUE DIRECTORY
34.88,Silver,33.33,f1d3b068-7dd0-4a28-bd64-3519dd104eb6,88.1,Case report form,92.06,76.61,79.37,Silver,ALLIANCE > NIHR BIORESOURCE
34.88,Not Rated,31.75,f202a9da-f036-4e8c-a069-a20ff6c8a9e1,61.9,PIONEER - Genomics Patients and related data,57.14,63.51,62.7,Not Rated,HUBS > PIONEER
41.86,Not Rated,33.33,f3a53f7a-ea93-4b9e-bccd-afe762259044,50.0,Practice postcode linked deprivation measures for CPRD Aurum,63.49,54.07,65.08,Not Rated,ALLIANCE > CPRD
30.23,Not Rated,31.75,f3ade619-292e-4631-916a-9cd9d7938e48,26.19,The Leicester City and County Chronic Kidney Disease Cohort,22.22,47.98,45.23,Not Rated,ALLIANCE > LEICESTER
23.26,Bronze,22.22,f42b9fa6-adad-4637-943e-6fa7508559a3,69.05,Bristol Biobank,60.32,72.89,69.05,Bronze,ALLIANCE > TISSUE DIRECTORY
25.58,Bronze,25.4,f4915e4b-639c-45ae-9b0f-afab547e1104,71.43,National Joint Registry - Primary Knee Replacement dataset,63.49,72.93,69.05,Bronze,ALLIANCE > HQIP
20.93,Bronze,20.63,f5b57b56-a4ed-46d4-825f-d181e8db809d,69.05,Leeds NIHR Biomarker Research Tissue Bank,60.32,74.06,69.84,Bronze,ALLIANCE > TISSUE DIRECTORY
23.26,Bronze,22.22,f5ed34fa-154a-4613-a253-277547cfd8ca,69.05,Oxford Musculoskeletal Biobank,60.32,72.89,69.05,Bronze,ALLIANCE > TISSUE DIRECTORY
23.26,Bronze,22.22,f621fcc9-e9ab-4da4-bd34-e4530d11b59d,69.05,NIHR Exeter Clinical Research Facility,60.32,72.89,69.05,Bronze,ALLIANCE > TISSUE DIRECTORY
30.23,Not Rated,31.75,f69d1b15-a0b4-461a-8aff-dba56da0791f,26.19,National Diabetes Inpatient Audit - Harms clinical dataset,22.22,47.98,45.23,Not Rated,ALLIANCE > HQIP
20.93,Bronze,20.63,f72798fb-d168-4c3c-abce-f8300cbcb8b3,69.05,Generation Scotland,60.32,74.06,69.84,Bronze,ALLIANCE > TISSUE DIRECTORY
25.58,Not Rated,23.81,f79d91c1-981e-4389-8626-b2cef391cf90,59.52,Scottish Cancer Registry (SMR06),52.38,66.97,64.28,Bronze,ALLIANCE > SCOTLAND
30.23,Silver,26.98,f7c563c0-9625-47be-a070-c121fe734f3c,83.33,SNP chip data,88.89,76.55,80.95,Silver,ALLIANCE > NIHR BIORESOURCE
30.23,Not Rated,31.75,f806fe65-79aa-4843-bc56-a08bf14ffcec,26.19,National Maternity and Perinatal Audit clinical audit,22.22,47.98,45.23,Not Rated,ALLIANCE > HQIP
32.56,Not Rated,33.33,f82b8ca5-5a52-4502-bf78-cfbb718cbe2f,26.19,"Maternal, Newborn and Infant Clinical Outcome Review Programme - perinatal surveillance dataset",22.22,46.81,44.45,Not Rated,ALLIANCE > HQIP
13.95,Gold,12.7,f89af2f4-e3cd-4eaa-835d-94aa347d8a92,90.48,National Neonatal Research Database,95.24,88.27,91.27,Gold,ALLIANCE > IMPERIAL COLLEGE LONDON
39.53,Not Rated,39.68,f8bab14a-bc9b-4dd1-a6c6-c57588605849,16.67,Maternity Services Dataset,14.29,38.57,37.3,Not Rated,ALLIANCE > BARTS
20.93,Bronze,20.63,f8f6e9ea-65c0-48a6-9beb-6de80bbbefda,69.05,Multiple Sclerosis and Parkinson's Tissue Bank,60.32,74.06,69.84,Bronze,ALLIANCE > TISSUE DIRECTORY
25.58,Bronze,25.4,f908efd6-c6ac-448b-89b9-222c50aec7c8,76.19,SpiroMeta Consortium Dataset,66.67,75.31,70.63,Bronze,HUBS > BREATHE
18.6,Bronze,19.05,f9a712ae-9d41-41a6-b2ca-3127441b03ac,71.43,UCL / UCLH Biobank for Studying Health and Disease,63.49,76.42,72.22,Silver,ALLIANCE > TISSUE DIRECTORY
25.58,Bronze,23.81,f9f3af0d-ca1c-4e8f-b5e8-20962e1e7b4e,71.43,"St Thomas' Hospitals Plasma, serum & DNA Bio bank from patients with antiphospholipid antibodies",63.49,72.93,69.84,Bronze,ALLIANCE > TISSUE DIRECTORY
13.95,Gold,9.52,faad83e3-3ba2-4324-aee2-2ddcc6fdaab9,95.24,COVID-19 Test results,100.0,90.64,95.24,Gold,ALLIANCE > SAIL
32.56,Not Rated,34.92,faf7ec31-999a-4d87-9d6d-8837ff2fa486,26.19,National Cardiac Audit Programme - National Adult Cardiac Surgery Audit (NACSA),22.22,46.81,43.65,Not Rated,ALLIANCE > HQIP
39.53,Not Rated,39.68,fc7b44f0-eb69-4257-8c07-7516c1210c46,16.67,CellPath,14.29,38.57,37.3,Not Rated,Oxford University Hospitals NHS Foundation Trust
20.93,Bronze,20.63,fcee6c99-a4bd-44b8-a28e-dc63337ce216,71.43,eLIXIR - Early Life Data Cross-Linkage in Research,63.49,75.25,71.43,Bronze,ALLIANCE > TISSUE DIRECTORY
11.63,Gold,9.52,fe3c7527-e802-4a51-9aa2-19e7d4d22783,95.24,National Exercise Referral Scheme,100.0,91.81,95.24,Gold,ALLIANCE > SAIL
30.23,Not Rated,31.75,fe4662ad-9080-4bd8-8de4-51195d275d5b,26.19,National Joint Registry - Primary Shoulder Replacement dataset,22.22,47.98,45.23,Not Rated,ALLIANCE > HQIP
34.88,Not Rated,36.51,fe872375-2401-4de1-9650-d4139cf5793a,26.19,National Paediatric Diabetes Audit - Parent and Patient Recorded Experience measures,22.22,45.66,42.86,Not Rated,ALLIANCE > HQIP
13.95,Gold,9.52,fea0b4be-4097-4c2e-86f2-03dc1ee2877b,92.86,Welsh Dispensing Dataset,98.41,89.45,94.44,Gold,ALLIANCE > SAIL
46.51,Not Rated,46.03,ff2c6982-00f3-4483-9fc2-19b3a7211d8d,64.29,Mental Health Minimum Dataset v4 (Non-Sensitive) Records,77.78,58.89,65.88,Not Rated,NHS Digital
18.6,Bronze,20.63,ffc34689-1a81-4f56-9c3f-e62b76d8445b,64.29,Teleconsultation in remote rural India: management of COPD and Asthma,55.56,72.84,67.47,Bronze,HUBS > BREATHE
