weighted_quality_score,title,error_percent,publisher,weighted_quality_rating,weighted_error_percent,weighted_completeness_percent,quality_score,completeness_percent,quality_rating,id
43.65,Metabolite data,32.56,ALLIANCE > NIHR BIORESOURCE,Not Rated,34.92,22.22,46.81,26.19,Not Rated,004d1932-f06e-49d2-b87a-e5e4140ffbb3
45.23,National Joint Registry - Primary Elbow Replacement dataset,30.23,ALLIANCE > HQIP,Not Rated,31.75,22.22,47.98,26.19,Not Rated,0092dc60-a0af-4d45-801c-b888210d6609
38.89,Tayside Pathology,37.21,ALLIANCE > DUNDEE,Not Rated,36.51,14.29,39.73,16.67,Not Rated,014bc853-1b27-4d97-9e5e-97fe28b84769
61.11,Estimating Chronic Respiratory Disease burden in adults in Asian LMICs,23.26,HUB > BREATHE,Not Rated,23.81,46.03,64.56,52.38,Not Rated,0150353c-d33d-4af0-b177-8ef0adf867f4
43.65,Paediatric Intensive Care Audit Network - core dataset (admission),32.56,ALLIANCE > HQIP,Not Rated,34.92,22.22,46.81,26.19,Not Rated,0217114b-6847-4aae-9d76-4d52acea2bcc
67.46,COVID antigen  testing - Pillar 2,37.21,ALLIANCE > HSCNI,Bronze,39.68,74.6,64.73,66.67,Not Rated,022cedb4-650d-4566-be41-8d7ed07a5112
69.84,HES Diagnostic Imaging Dataset for CPRD Aurum,37.21,ALLIANCE > CPRD,Bronze,38.1,77.78,65.92,69.05,Not Rated,0266f904-b168-488a-a9e7-d318443584ef
87.3,Annual District Death Extract,20.93,ALLIANCE > SAIL,Gold,25.4,100.0,87.16,95.24,Gold,03db4df3-f482-4bdd-a335-546ffffbeaab
37.3,SOLUS,39.53,ALLIANCE > OUH,Not Rated,39.68,14.29,38.57,16.67,Not Rated,0477b06f-cbed-4949-982e-ce248a47ed1a
42.86,National Cardiac Audit Programme - Myocardial Ischaemia National Audit Project (MINAP),34.88,ALLIANCE > HQIP,Not Rated,36.51,22.22,45.66,26.19,Not Rated,04b1648d-eeb7-4072-8dd2-806c3ae4e20d
37.3,Sectra PACS,39.53,ALLIANCE > BARTS,Not Rated,39.68,14.29,38.57,16.67,Not Rated,04f4604e-6d0b-4100-977b-59c3b69b0cfc
69.84,Infectious Diseases BioBank at King's College London,20.93,ALLIANCE > TISSUE DIRECTORY,Bronze,20.63,60.32,74.06,69.05,Bronze,0534b41b-9877-4e30-b3ce-e604b29d4990
89.69,Bowel Screening Wales,18.6,ALLIANCE > SAIL,Gold,20.63,100.0,88.32,95.24,Gold,05716e41-9842-4c07-8ddd-af9f9231e056
44.45,The Primary-Secondary Care Partnership to Improve Outcomes in Chronic Kidney Disease,32.56,ALLIANCE > LEICESTER,Not Rated,33.33,22.22,46.81,26.19,Not Rated,05ade19c-75f5-4623-ade6-99fb21c2d4e3
65.08,PANTHER study,32.56,ALLIANCE > University of Nottingham,Not Rated,36.51,66.67,62.29,57.14,Not Rated,0600a271-4a24-414f-a2d0-4b12e5c47d72
62.7,CuT-AsthMa: Culturally tailored school-based intervention for asthma in Malaysia,20.93,HUBS > BREATHE,Not Rated,22.22,47.62,66.91,54.76,Bronze,0692d86c-1f24-43a4-9508-005d00bd7259
37.3,Millennium Clinical Events,39.53,ALLIANCE > OUH,Not Rated,39.68,14.29,38.57,16.67,Not Rated,0711cc7e-80d5-4781-a1ab-2637ea176ceb
83.34,North West London Mental Health Data (NWL MH),23.26,HUB > DISCOVER NOW,Silver,30.16,96.83,84.8,92.86,Silver,07169a48-2e59-4ef6-ad77-f272d60b5a83
65.08,Pillar 1 - England (Second Generation Surveillance Systems),34.88,ALLIANCE > NHS DIGITAL,Not Rated,36.51,66.67,61.13,57.14,Not Rated,0756c167-e778-486f-9b96-94bd12af89cf
37.3,Returned datasets,39.53,ALLIANCE > NIHR BIORESOURCE,Not Rated,39.68,14.29,38.57,16.67,Not Rated,07abf678-a2c0-4d8b-8d25-8b9f180f9ff2
80.95,Careers Wales dataset,25.58,ALLIANCE > SAIL,Silver,26.98,88.89,77.69,80.95,Silver,08846261-45f0-4bcf-9801-fe785dcef1c9
43.65,Labour Force Survey (Household),34.88,OTHER > Office for National Statistics,Not Rated,36.51,23.81,46.84,28.57,Not Rated,08fd6103-be40-4380-9399-aecaeb216d33
43.65,Paediatric Intensive Care Audit Network - customised data collection,32.56,ALLIANCE > HQIP,Not Rated,34.92,22.22,46.81,26.19,Not Rated,09586db0-4da4-47f8-9434-13cbd2da2bb9
68.25,Development of spirometry predictive values for Indian population,18.6,HUBS > BREATHE,Bronze,20.63,57.14,74.03,66.67,Bronze,0985f58b-87e0-42d2-9ee7-efd618abcd51
69.84,Reasons for delay in seeking care for pneumonia in children under five,16.28,HUBS > BREATHE,Bronze,19.05,58.73,76.38,69.05,Silver,09e8e407-82b4-4ed4-b296-53810472cbe9
43.65,Paediatric Intensive Care Audit Network - core dataset (transport),32.56,ALLIANCE > HQIP,Not Rated,34.92,22.22,46.81,26.19,Not Rated,0a418d30-c13c-404a-9f4c-39334d889b9c
69.84,Tayside Biorepository,20.93,ALLIANCE > TISSUE DIRECTORY,Bronze,20.63,60.32,74.06,69.05,Bronze,0a4f19cc-8565-410b-ac02-2751f5284a9b
81.75,Prescribing Information System (PIS),27.91,ALLIANCE > SCOTLAND,Silver,28.57,92.06,78.9,85.71,Silver,0b794715-53f3-422f-817a-92be3392c735
42.86,National Asthma and COPD Audit Programme (NACAP): Pulmonary rehabilitation - clinical audit,34.88,ALLIANCE > HQIP,Not Rated,36.51,22.22,45.66,26.19,Not Rated,0bb202c7-80e8-4532-8042-1351576e6c94
54.76,Mental Health Services Data Set - Community,39.53,NHS Digital,Not Rated,36.51,46.03,54.05,47.62,Not Rated,0c98200b-48b5-418a-b8d0-a7708abc1f39
37.3,ARIA Dataset,39.53,ALLIANCE > BARTS,Not Rated,39.68,14.29,38.57,16.67,Not Rated,0cfe60cd-038d-4c03-9a95-894c52135922
68.25,Research on use of an online learning platform on under-five pneumonia,18.6,HUBS > BREATHE,Bronze,20.63,57.14,74.03,66.67,Bronze,0d0ce21e-afc1-4d9f-bf54-e0545363a0cc
45.23,National Neonatal Audit Programme - clinical audit,30.23,ALLIANCE > HQIP,Not Rated,31.75,22.22,47.98,26.19,Not Rated,0d89c503-1c79-4e2a-baf6-02f12e68805b
71.43,IMPORT HIGH trial blood samples,20.93,ALLIANCE > TISSUE DIRECTORY,Bronze,20.63,63.49,75.25,71.43,Bronze,0df3a0a9-d261-47ff-99e5-9c7e67410712
88.09,Welsh Dispensing Dataset,20.93,ALLIANCE > SAIL,Gold,22.22,98.41,85.97,92.86,Silver,0e24f325-fdd3-4cb3-9374-8852c77cef98
69.84,HES Accident and Emergency data for CPRD Aurum,39.53,ALLIANCE > CPRD,Bronze,39.68,79.37,65.95,71.43,Not Rated,0e59698c-1532-4155-ab0e-af11b3d9e7b1
61.11,Mental Health Minimum Dataset v4 (Sensitive) Episodes,51.16,NHS Digital,Not Rated,55.56,77.78,56.57,64.29,Not Rated,0e6e6ed5-ab81-4d7f-b06a-768bf33357ca
62.7,Developing and Evaluating Interventions to Improve Asthma Care,20.93,HUBS > BREATHE,Not Rated,22.22,47.62,66.91,54.76,Bronze,0e8546e9-c841-4a99-a3f8-bb9020c6782c
58.73,National Radiotherapy Dataset (RTDS) for CPRD Aurum,46.51,ALLIANCE > CPRD,Not Rated,42.86,60.32,50.55,47.62,Not Rated,0fbd11c2-c44b-430f-b527-63cb82fcee63
61.11,Mental Health & Learning Disabilities Dataset v 1 (Non-Sensitive) Events,51.16,NHS Digital,Not Rated,55.56,77.78,56.57,64.29,Not Rated,0fc61ace-397d-4489-9e62-77f88082e775
81.75,North West London Pathology (NWL PATH),27.91,HUB > DISCOVER NOW,Silver,33.33,96.83,82.47,92.86,Silver,0fde8427-1072-4b77-9997-635157ef370a
38.89,Tayside & Fife Diabetes – Summary and a range of diabetes related datasets.,37.21,ALLIANCE > DUNDEE,Not Rated,36.51,14.29,39.73,16.67,Not Rated,0ff88499-931b-4614-9f81-facf21f28174
81.75,Cystic Fibrosis Patient Liver Enzyme,27.91,ALLIANCE > CYSTIC FIBROSIS TRUST,Silver,36.51,100.0,83.66,95.24,Silver,1048c3d9-42f6-4950-89be-c51fe7421753
45.23,National Audit of Dementia Round 4 - carer experience survey,30.23,ALLIANCE > HQIP,Not Rated,31.75,22.22,47.98,26.19,Not Rated,11571357-b9fc-45ed-ab40-3bb3d7443245
80.16,Unscheduled Care Datamart,25.58,ALLIANCE > SCOTLAND,Silver,25.4,85.71,76.5,78.57,Silver,117aa9f5-db76-48f9-9dd2-19e2d00a1b45
45.23,National Vascular Registry Audit Carotid Lower Limb Amputation clinical dataset,30.23,ALLIANCE > HQIP,Not Rated,31.75,22.22,47.98,26.19,Not Rated,12690263-f5d3-435b-9582-de1a88064e1e
45.23,National Joint Registry - Revision Hip Replacement dataset,30.23,ALLIANCE > HQIP,Not Rated,31.75,22.22,47.98,26.19,Not Rated,12c5b83c-6e4a-442e-b6c2-2f6b7165fe6b
81.75,Child Health Systems Programme - First Visit,23.26,ALLIANCE > SCOTLAND,Silver,23.81,87.3,78.84,80.95,Silver,12d23c2c-5f35-4f59-80e3-584636c7cacb
83.34,North West London COVID-19 Patient Level Situation Report (NWL COVID19 PLD SITREP),27.91,HUB > DISCOVER NOW,Silver,30.16,96.83,82.47,92.86,Silver,135ba51b-8a01-4624-b3c4-1d6f5b22b357
69.84,Obesity Research Biobank Syndicate (ORBiS),20.93,ALLIANCE > TISSUE DIRECTORY,Bronze,20.63,60.32,74.06,69.05,Bronze,13a931c1-18cf-4d60-be79-a527acb0a36d
69.84,Watch and Wait Trial,20.93,ALLIANCE > TISSUE DIRECTORY,Bronze,20.63,60.32,74.06,69.05,Bronze,14855eb1-6563-4e56-89e5-aecd51f100ad
43.65,Paediatric Intensive Care Audit Network - core dataset (referral),32.56,ALLIANCE > HQIP,Not Rated,34.92,22.22,46.81,26.19,Not Rated,148a3896-e4ed-48ef-8643-48df726041e1
87.3,Active Adult Survey,20.93,ALLIANCE > SAIL,Gold,25.4,100.0,87.16,95.24,Gold,15805559-2115-4822-b91f-635de36fb289
84.12,GENOMICS ENGLAND 100K NHSD LINKED DATA,30.23,ALLIANCE > GENOMICS ENGLAND,Silver,31.75,100.0,82.5,95.24,Silver,15a7c12f-145c-46fc-acc9-c27e83ed2c4d
69.84,INCA Trial,20.93,ALLIANCE > TISSUE DIRECTORY,Bronze,20.63,60.32,74.06,69.05,Bronze,16341d43-0e79-4afa-a84f-67db018e449f
37.3,ARIA Medonc,39.53,ALLIANCE > OUH,Not Rated,39.68,14.29,38.57,16.67,Not Rated,172242ce-a1c5-4915-9c71-686f6e7d5789
71.43,IDRIS Trial,20.93,ALLIANCE > TISSUE DIRECTORY,Bronze,20.63,63.49,75.25,71.43,Bronze,179c21cd-41e0-489b-82c4-1bec011c562f
60.31,Rural-Urban classification for CPRD GOLD,46.51,ALLIANCE > CPRD,Not Rated,42.86,63.49,51.75,50.0,Not Rated,1841e7c9-39e1-4eff-9d2f-da3dede71f86
69.05,Asthma and COPD: practices and perceptions of GPs in rural India,16.28,HUBS > BREATHE,Bronze,19.05,57.14,75.19,66.67,Bronze,184b973d-ac38-4fc5-8203-f2a244574b4f
44.45,National Audit of Psychosis - Audit on Early Intervention in Psychosis services - case note audit,32.56,ALLIANCE > HQIP,Not Rated,33.33,22.22,46.81,26.19,Not Rated,18603ae7-a056-4fd6-a3e5-d32a2440dd26
69.05,Early Pandemic Evaluation and Enhanced Surveillance of COVID-19 (EAVE II),18.6,HUBS > BREATHE,Bronze,20.63,58.73,76.42,71.43,Silver,191c1e3f-4eff-41b9-bff1-c6510f7c6c3d
42.86,National Asthma and COPD Audit Programme (NACAP): COPD secondary care clinical dataset,34.88,ALLIANCE > HQIP,Not Rated,36.51,22.22,45.66,26.19,Not Rated,1a0af437-ec80-4db7-9c76-a2418cc8c5c8
38.89,NHS Tayside and Fife Accident & Emergency Dataset (ISD/National),37.21,ALLIANCE > DUNDEE,Not Rated,36.51,14.29,39.73,16.67,Not Rated,1aa60c9f-a458-454d-802a-e4c4628f3870
61.91,Air Quality Study: An ecological analysis of asthma health outcomes in Malaysia,20.93,HUBS > BREATHE,Not Rated,22.22,46.03,65.72,52.38,Not Rated,1b80d25c-4f0f-497b-8614-4d1a8c4d1cd3
69.05,DARWIN1 Trial,25.58,ALLIANCE > TISSUE DIRECTORY,Bronze,25.4,63.49,72.93,71.43,Bronze,1bb2c353-8d91-4989-a21b-26182262b807
73.02,Linked Census and death occurrences,34.88,OTHER > Office for National Statistics,Bronze,38.1,84.13,70.66,76.19,Bronze,1bfdab55-3e6a-4b26-bff1-0105ad416cea
69.05,NICAM: Nilotinib treatment for c-KIT mutated advanced AMM,23.26,ALLIANCE > TISSUE DIRECTORY,Bronze,22.22,60.32,72.89,69.05,Bronze,1c17f45b-ba0f-4e97-a0f0-34a600844d4f
69.05,HPB Biobank,20.93,ALLIANCE > TISSUE DIRECTORY,Bronze,22.22,60.32,74.06,69.05,Bronze,1cb31e11-505b-4ff6-ae20-5c468c9ad296
69.84,National Diet and Nutrition Survey (NDNS),20.93,ALLIANCE > TISSUE DIRECTORY,Bronze,20.63,60.32,74.06,69.05,Bronze,1d2a94c4-b18d-47c4-9b48-cfab8e67f126
54.76,Mental Health Services Data Set - Service Users,39.53,NHS Digital,Not Rated,36.51,46.03,54.05,47.62,Not Rated,1d5e3b05-8ce3-4f80-ae3a-f6031ad8cf69
42.86,National Cardiac Audit Programme - National Audit of Percutaneous Coronary Interventions (PCI),34.88,ALLIANCE > HQIP,Not Rated,36.51,22.22,45.66,26.19,Not Rated,1da704e3-f5ee-4614-8880-10541637a0b7
82.54,Cystic Fibrosis Patient Demographics,30.23,ALLIANCE > CYSTIC FIBROSIS TRUST,Silver,34.92,100.0,82.5,95.24,Silver,1f55cfcc-1c5d-44e3-9d60-3bedeb033f0a
69.84,University of Southampton Faculty of Medicine Tissue Bank,20.93,ALLIANCE > TISSUE DIRECTORY,Bronze,20.63,60.32,74.06,69.05,Bronze,201602df-7432-4710-98a7-18f59e4f211e
88.89,Patient Episode Dataset for Wales,20.93,ALLIANCE > SAIL,Gold,22.22,100.0,87.16,95.24,Gold,2057a9e3-b491-4d8f-874c-9857d00116b0
69.84,RIO,25.58,ALLIANCE > TISSUE DIRECTORY,Bronze,23.81,63.49,74.12,73.81,Bronze,209f42a8-4581-49e1-a0c2-25069a37f230
69.05,TNT: Triple Negative breast cancer Trial,23.26,ALLIANCE > TISSUE DIRECTORY,Bronze,22.22,60.32,72.89,69.05,Bronze,20c2a274-843c-43fa-9b76-38ef2f8a3d64
65.08,South London and Maudsley NHS Foundation Trust (SLaM) Clinical Record Interactive Search (CRIS) platform,41.86,ALLIANCE > SLaM,Not Rated,41.27,71.43,69.55,80.95,Bronze,21cd4b8e-f4f5-44a6-83eb-b7799e98ba55
73.81,Secondary Uses Services Payment By Results,34.88,ALLIANCE > NHS DIGITAL,Bronze,33.33,80.95,69.47,73.81,Bronze,2259bbdf-86e0-4107-801b-69dcb25b45b5
37.3,Emergency Care Dataset (ECDS),39.53,ALLIANCE > BARTS,Not Rated,39.68,14.29,38.57,16.67,Not Rated,226fb3f1-4471-400a-8c39-2b66d46a39b6
76.19,The impact of ethnicity and multi-morbidity on C19 hospitalised outcomes,30.23,HUB > PIONEER,Silver,31.75,84.13,72.98,76.19,Bronze,22e14c8d-9d92-4437-b39b-f69f7b033d13
81.75,Cystic Fibrosis Patient Chronic Medication,27.91,ALLIANCE > CYSTIC FIBROSIS TRUST,Silver,36.51,100.0,83.66,95.24,Silver,22fe7168-89af-4d93-89c8-afa03cf2031a
45.23,National Joint Registry - Revision Knee Replacement dataset,30.23,ALLIANCE > HQIP,Not Rated,31.75,22.22,47.98,26.19,Not Rated,23330792-fe18-4331-a101-b246657a03ae
69.84,Human Biomaterials Resource Centre,20.93,ALLIANCE > TISSUE DIRECTORY,Bronze,20.63,60.32,74.06,69.05,Bronze,236108a2-5e2c-4acb-86e7-6ec793aef8ab
42.86,Falls and Fragility Fracture Audit Programme Fracture Liaison Service Database clinical dataset,34.88,ALLIANCE > HQIP,Not Rated,36.51,22.22,45.66,26.19,Not Rated,237e724d-03b2-478c-a92d-85a1baa6ae53
89.69,Welsh Cancer Intelligence and Surveillance Unit (WCISU),18.6,ALLIANCE > SAIL,Gold,20.63,100.0,88.32,95.24,Gold,24095736-dbea-4c37-86fe-ddf3a6933a6b
79.37,Idiopathic Pulmonary Fibrosis (IPF) Genome-wide Association Study,11.63,HUBS > BREATHE,Silver,12.7,71.43,84.66,80.95,Silver,24b82645-1854-438a-97b2-911bba469d3d
82.54,General Acute Inpatient and Day Case - Scottish Morbidity Record (SMR01),25.58,ALLIANCE > PUBLIC HEALTH SCOTLAND,Silver,25.4,90.48,78.88,83.33,Silver,2537007c-9e9e-4441-a0d1-59fa400566c5
69.05,mHealth for pneumonia prevention,16.28,HUBS > BREATHE,Bronze,19.05,57.14,75.19,66.67,Bronze,2542abf8-e50b-4962-9fa1-6dba1b7e8439
89.69,Maternity Indicators Dataset,18.6,ALLIANCE > SAIL,Gold,20.63,100.0,88.32,95.24,Gold,258c9577-76cd-45c7-a6b5-8e7eed07ce9e
61.11,Mental Health Minimum Dataset v4 (Non-Sensitive) Episodes,51.16,NHS Digital,Not Rated,55.56,77.78,56.57,64.29,Not Rated,263ad0a8-ae90-4c1d-85d6-c3d2470eb2b7
61.11,Mental Health Minimum Dataset v2.6 (Sensitive),51.16,NHS Digital,Not Rated,55.56,77.78,56.57,64.29,Not Rated,263f28a4-9835-4856-b1c3-0a0d4085f207
38.88,CDE Patient Demographics,37.21,ALLIANCE > BARTS,Not Rated,38.1,15.87,40.92,19.05,Not Rated,2684706f-1d43-4263-99b7-b54279614c76
87.3,Pathology Data from WRRS,20.93,ALLIANCE > SAIL,Gold,25.4,100.0,87.16,95.24,Gold,26da4493-a78b-4090-ba18-e6c600d2c375
84.92,North West London population data (NWL POP),25.58,HUB > DISCOVER NOW,Silver,30.16,100.0,84.83,95.24,Silver,278b91aa-7ad1-4b89-86aa-10e9e013f0cf
42.86,National Asthma and COPD Audit Programme (NACAP): secondary care workstream – children and young people asthma (clinical),34.88,ALLIANCE > HQIP,Not Rated,36.51,22.22,45.66,26.19,Not Rated,278c3fb2-6b1e-46db-a529-9fc7ddaf4461
85.72,Cystic Fibrosis Patient Annual Review Encounters,23.26,ALLIANCE > CYSTIC FIBROSIS TRUST,Silver,28.57,100.0,85.99,95.24,Silver,27910ce4-f74f-4fab-8649-19d5ec292ad8
69.05,IoN Trial,23.26,ALLIANCE > TISSUE DIRECTORY,Bronze,22.22,60.32,72.89,69.05,Bronze,2a5d2a42-803c-4c96-bcd6-a4289d2b664a
61.11,Mental Health & Learning Disabilities Dataset v 1 (Sensitive) Records,51.16,NHS Digital,Not Rated,55.56,77.78,56.57,64.29,Not Rated,2a725f9d-c4a9-4c89-aa37-b3c25cc83389
69.05,ESPAC-TPlus,23.26,ALLIANCE > TISSUE DIRECTORY,Bronze,22.22,60.32,72.89,69.05,Bronze,2aa58bb8-83d8-455a-87e6-d567ae4a379c
74.6,Admissions & Discharges,32.56,ALLIANCE > HSCNI,Bronze,31.75,80.95,70.62,73.81,Bronze,2aabcea9-d0dd-4780-b162-3c7ed3ee9888
69.05,Scottish Stillbirth and Infant Death Survey,18.6,ALLIANCE > SCOTLAND,Bronze,19.05,57.14,72.84,64.29,Bronze,2b06afa3-dfc7-424b-8b9a-9325df6cfc19
85.72,Millennium Cohort Study,23.26,ALLIANCE > SAIL,Silver,26.98,98.41,84.8,92.86,Silver,2b09ea87-5b22-4049-b7dd-de0889699115
68.25,NIHR Nottingham Digestive Diseases Collection,23.26,ALLIANCE > TISSUE DIRECTORY,Bronze,23.81,60.32,72.89,69.05,Bronze,2b198886-ccab-4276-b6b9-22c344df8304
71.43,BRAIN UK,20.93,ALLIANCE > TISSUE DIRECTORY,Bronze,20.63,63.49,75.25,71.43,Bronze,2bf53952-e77c-4746-b36f-5ccb1574f6a7
45.23,National Joint Registry - Revision Ankle Replacement dataset,30.23,ALLIANCE > HQIP,Not Rated,31.75,22.22,47.98,26.19,Not Rated,2c0e04bc-2f16-4903-90dc-c9d57ab40efb
45.23,National Diabetes Inpatient Audit Hospital Characteristics Survey dataset,30.23,ALLIANCE > HQIP,Not Rated,31.75,22.22,47.98,26.19,Not Rated,2c53d1f7-4540-4c57-8e93-8115b8abc6a9
60.31,Rural-Urban classification for CPRD Aurum,46.51,ALLIANCE > CPRD,Not Rated,42.86,63.49,51.75,50.0,Not Rated,2d23ad3c-0541-453c-8bf7-9dc42e1aba65
59.53,Quality of Life of Cancer Survivors in England: Pilot Patient Reported Outcomes Measures Survey (2011) for CPRD Aurum,48.84,ALLIANCE > CPRD,Not Rated,44.44,63.49,50.58,50.0,Not Rated,2d3302d1-b6fc-4883-8168-010da0d48638
42.86,Falls and Fragility Fracture Audit Programme National Hip Database Facilities Survey 2019,34.88,ALLIANCE > HQIP,Not Rated,36.51,22.22,45.66,26.19,Not Rated,2dbd2e38-a4bb-4f8c-b401-ebec10f0d89e
65.08,"4 Country ChrOnic: estimating respiratory disease burden in adults, South India",20.93,HUBS > BREATHE,Not Rated,22.22,52.38,69.3,59.52,Bronze,2dc79612-0e0d-4336-aaa1-6abd90d28589
71.43,NHS Greater Glasgow & Clyde Bio-Repository,20.93,ALLIANCE > TISSUE DIRECTORY,Bronze,20.63,63.49,75.25,71.43,Bronze,2e20b776-a0bc-44ed-9882-ad63855a0ec4
55.55,Mental Health Dataset (MHDS) for CPRD Aurum,51.16,ALLIANCE > CPRD,Not Rated,52.38,63.49,49.42,50.0,Not Rated,2e8cc70b-bd57-4b64-bd12-fbc07e0f240f
84.92,North West London Patient Index (NWL PI),23.26,HUB > DISCOVER NOW,Silver,26.98,96.83,84.8,92.86,Silver,2f19548c-99d7-4f48-a418-d7afb77aebec
69.84,BioDock,20.93,ALLIANCE > TISSUE DIRECTORY,Bronze,20.63,60.32,74.06,69.05,Bronze,2f57c592-c65c-4d1c-b92d-d19d2a11c02e
59.52,Generation Scotland: Scottish Family Health Study,23.26,ALLIANCE > GENERATION SCOTLAND,Not Rated,23.81,42.86,63.37,50.0,Not Rated,301233da-53f8-4cea-8f74-4d4aa8d8c42c
45.23,National Audit of Dementia Round 4 - casenote audit,30.23,ALLIANCE > HQIP,Not Rated,31.75,22.22,47.98,26.19,Not Rated,304430ff-0aff-4d36-91e5-94be251a409a
71.43,PHOTO Translational bladder cancer biorepository,20.93,ALLIANCE > TISSUE DIRECTORY,Bronze,20.63,63.49,75.25,71.43,Bronze,319a2a77-3f4d-497e-bc3e-33002f316cae
76.19,Covid-19 Second Generation Surveillance System,30.23,ALLIANCE > NHS DIGITAL,Silver,31.75,84.13,72.98,76.19,Bronze,31fd27d5-c08d-49c3-b7f1-0af71ad219aa
69.84,LBIH Biobank,20.93,ALLIANCE > TISSUE DIRECTORY,Bronze,20.63,60.32,74.06,69.05,Bronze,32b5d90f-6bad-40f8-96d7-69b11df6d5ff
72.22,Scottish Human Papillomavirus Archive,23.26,ALLIANCE > TISSUE DIRECTORY,Bronze,22.22,66.67,76.47,76.19,Silver,342bef6e-8fa2-49f0-bdbb-c95d866aa145
69.84,Human Developmental Biology Resource (HDBR),20.93,ALLIANCE > TISSUE DIRECTORY,Bronze,20.63,60.32,74.06,69.05,Bronze,355de4ca-1ce9-4ba4-8e07-2d51bb82bfbf
61.11,Mental Health Minimum Dataset v3_3.5 (Sensitive),51.16,NHS Digital,Not Rated,55.56,77.78,56.57,64.29,Not Rated,36047c5f-7d57-4d25-a114-2bcc6c11708f
69.84,NIMRAD-TRANS,20.93,ALLIANCE > TISSUE DIRECTORY,Bronze,20.63,60.32,74.06,69.05,Bronze,3784d68e-d213-43a7-bf30-8f4d34de022c
62.7,Exploring psychological issues of primary care teams in Malaysia amidst COVID-19,18.6,HUBS > BREATHE,Not Rated,20.63,46.03,66.89,52.38,Bronze,37eb2884-d7df-489f-a3ad-f02f1e510475
69.84,"Leeds Dental Institute/School of Dentistry Leeds, Skeletal Tissues Bank",20.93,ALLIANCE > TISSUE DIRECTORY,Bronze,20.63,60.32,74.06,69.05,Bronze,37fe2488-f4c3-4471-a1e0-7d4a4204f063
69.05,RAPID (Hospital Stay Level Data),34.88,ALLIANCE > NHS SCOTLAND,Bronze,42.86,80.95,69.47,73.81,Bronze,380cbddb-e64e-42b9-a364-47c550262b6a
89.69,Congenital Anomaly Register and Information Service,18.6,ALLIANCE > SAIL,Gold,20.63,100.0,88.32,95.24,Gold,38468759-3351-4722-9eeb-4c6dc9fa44ce
64.28,Bridge file: Hospital Episode Statistics to Diagnostic Imaging Dataset,46.51,NHS Digital,Not Rated,49.21,77.78,58.89,64.29,Not Rated,3935e2fd-0c30-4f56-8388-45a02e0499b4
58.73,National Radiotherapy Dataset (RTDS) for CPRD GOLD,46.51,ALLIANCE > CPRD,Not Rated,42.86,60.32,50.55,47.62,Not Rated,3943e6de-6c32-43dd-8090-16ec9ca0902f
43.65,National Cardiac Audit Programme - Cardiac Rhythm Management (CRM),32.56,ALLIANCE > HQIP,Not Rated,34.92,22.22,46.81,26.19,Not Rated,395262e7-9846-4d9d-a288-8b0ebea782b9
64.28,Business Impact of COVID-19 Survey (BICS),25.58,OTHER > Office for National Statistics,Not Rated,23.81,52.38,66.97,59.52,Bronze,39537838-164a-4aee-8859-957f0a347390
80.95,Children’s Kidney Cancers - Great Ormond Street Hospital,32.56,HUBS > DATA-CAN,Silver,34.92,96.83,80.15,92.86,Silver,395d4311-da00-49a4-b78e-5387c961d803
70.64,The Cleft Collective,23.26,ALLIANCE > TISSUE DIRECTORY,Bronze,22.22,63.49,74.09,71.43,Bronze,3983f3ec-ce63-4142-b73e-93130654710b
70.64,PHOENIX DDR-Anti-PD-L1 Trial,23.26,ALLIANCE > TISSUE DIRECTORY,Bronze,22.22,63.49,74.09,71.43,Bronze,3a0599ed-5452-4299-956c-af5a30bbef23
69.05,SWIFT-RTB,23.26,ALLIANCE > TISSUE DIRECTORY,Bronze,22.22,60.32,72.89,69.05,Bronze,3a23e7dc-d814-4772-a6f8-a814c8e0128b
45.23,Epilepsy 12 - clinical audit,30.23,ALLIANCE > HQIP,Not Rated,31.75,22.22,47.98,26.19,Not Rated,3a51b861-026d-45ed-abe6-30d9cc07b516
42.86,National Paediatric Diabetes Audit - Spotlight survey of workforce in Paediatric Diabetes Units,34.88,ALLIANCE > HQIP,Not Rated,36.51,22.22,45.66,26.19,Not Rated,3a9ab245-5fcc-49a0-ae58-12ebab9b0053
68.25,COVID-19 Detection from Chest X-Rays using Deep Learning,16.28,HUBS > BREATHE,Bronze,19.05,55.56,74.0,64.29,Bronze,3aa01779-831e-478f-b4e3-7c111d642b18
87.3,Annual District Birth Extract,20.93,ALLIANCE > SAIL,Gold,25.4,100.0,87.16,95.24,Gold,3ab70331-aa54-4f0d-aa95-ea2b95bed9d5
73.02,SICSAG Episodes (Scottish Intensive Care Audit Group),30.23,ALLIANCE > PUBLIC HEALTH SCOTLAND,Bronze,36.51,82.54,71.79,73.81,Bronze,3c9e8226-f12c-4824-9996-29a667b9609c
37.3,"Problems, Diagnosis and Procedures",39.53,ALLIANCE > BARTS,Not Rated,39.68,14.29,38.57,16.67,Not Rated,3cd53c68-7e56-4c3e-b7c2-bd7e18040ec5
38.89,Renal Register – ISD National dataset,37.21,ALLIANCE > DUNDEE,Not Rated,36.51,14.29,39.73,16.67,Not Rated,3d42b7e1-89b0-4bef-9e42-18edc328f28f
44.45,National Clinical Audit of Anxiety and Depression - spotlight audit on psychological therapies (patient experience survey),32.56,ALLIANCE > HQIP,Not Rated,33.33,22.22,46.81,26.19,Not Rated,3e89692b-7aa2-49d6-b802-82921bd7e006
84.92,"Extended Cohort for E-health, Environment and DNA (EXCEED)",27.91,HUBS > BREATHE,Silver,30.16,100.0,83.66,95.24,Silver,3ee52adc-b97e-4f7b-a251-a1c9841a380c
43.65,National Emergency Laparotomy Audit - Patient Audit Dataset,32.56,ALLIANCE > HQIP,Not Rated,34.92,22.22,46.81,26.19,Not Rated,3f299029-3126-4ce0-893c-4a759cbe90b1
89.69,Cafcass Wales,18.6,ALLIANCE > SAIL,Gold,20.63,100.0,88.32,95.24,Gold,3fceb952-0b21-40f4-bd69-fa5cd7ad7df9
38.89,Walker Study Data,37.21,ALLIANCE > DUNDEE,Not Rated,36.51,14.29,39.73,16.67,Not Rated,3fd5f728-fdb4-4ce2-86ec-f626787d455c
37.3,Endobase,39.53,ALLIANCE > OUH,Not Rated,39.68,14.29,38.57,16.67,Not Rated,40573895-497b-4d47-90e1-6aafe70b93f6
71.43,Bloodwise Childhood Leukaemia Cell Bank,20.93,ALLIANCE > TISSUE DIRECTORY,Bronze,20.63,63.49,75.25,71.43,Bronze,406e7ae7-554b-4807-b3a5-a4d81316cf9c
64.28,Mental Health and Learning Disabilities Data Set,46.51,NHS Digital,Not Rated,46.03,74.6,57.7,61.9,Not Rated,4262e057-6978-4e4c-a05d-c4f328422090
45.23,National Neonatal Audit Programme - 2 year outcomes audit,30.23,ALLIANCE > HQIP,Not Rated,31.75,22.22,47.98,26.19,Not Rated,4271bc64-b139-40b0-98de-5f2e94e2d026
65.08,HES Patient Reported Outcomes Measures (PROMs) data for CPRD Aurum,39.53,ALLIANCE > CPRD,Not Rated,41.27,71.43,61.19,61.9,Not Rated,42780b16-32e3-442e-92cd-1810bf30dab8
42.86,Falls and Fragility Fracture Audit Programme National Audit of Inpatient Falls clinical dataset,34.88,ALLIANCE > HQIP,Not Rated,36.51,22.22,45.66,26.19,Not Rated,430331ef-fa66-485b-b090-e4e83def9136
80.16,Scottish Cancer Registry (SMR06),30.23,ALLIANCE > SCOTLAND,Silver,30.16,90.48,76.55,83.33,Silver,4481aab8-9b4f-43dd-9cd4-1e427561a2a5
61.11,Mental Health Minimum Dataset v4 (Sensitive) Events,51.16,NHS Digital,Not Rated,55.56,77.78,56.57,64.29,Not Rated,46493a09-b3bb-4c0e-b944-82665ee21508
38.89,Deaths General Registrar Office – National Records Scotland,37.21,ALLIANCE > DUNDEE,Not Rated,36.51,14.29,39.73,16.67,Not Rated,464b06d6-239a-4c6d-a626-242ba7e79e05
68.25,Child Health Systems Programme - School,20.93,ALLIANCE > SCOTLAND,Bronze,20.63,57.14,71.68,64.29,Bronze,4660884b-e40a-4251-ad19-40872641fa8c
45.23,National Vascular Registry - Organisational Audit dataset,30.23,ALLIANCE > HQIP,Not Rated,31.75,22.22,47.98,26.19,Not Rated,4678a81d-dfb6-478a-a373-d5510866b3d0
42.86,National Cardiac Audit Programme - National Congenital Heart Disease Audit (NCHDA),34.88,ALLIANCE > HQIP,Not Rated,36.51,22.22,45.66,26.19,Not Rated,46e4c3ba-dae2-453d-832a-88ea603110f1
45.23,National Vascular Registry Audit - Lower Limb Bypass clinical dataset,30.23,ALLIANCE > HQIP,Not Rated,31.75,22.22,47.98,26.19,Not Rated,47bec08b-57b7-450e-9be7-af19bab99b58
66.67,Theory of Planned Behaviour Intervention: respiratory disease in South India,18.6,HUBS > BREATHE,Bronze,20.63,53.97,71.65,61.9,Bronze,47e9fa0a-d74f-43bc-ae63-0eb33f354f01
82.54,Comprehensive Patient Records for Cancer Outcomes,30.23,HUBS > DATA-CAN,Silver,34.92,100.0,82.5,95.24,Silver,49dc6bfb-37f7-4f18-92e7-1a06ab80633e
