error_percent,completeness_percent,weighted_completeness_percent,quality_score,quality_rating,publisher,weighted_error_percent,weighted_quality_score,weighted_quality_rating,title,id
18.6,92.86,96.83,87.13,Gold,HUBS > DISCOVER NOW,14.29,91.27,Gold,North West London COVID-19 Patient Level Situation Report (NWL COVID19 PLD SITREP),997a5bda-d6f2-46c7-8fe5-990ac4576ff6
32.56,26.19,22.22,46.81,Not Rated,ALLIANCE > HQIP,33.33,44.45,Not Rated,National Bowel Cancer Audit - clinical dataset,9a4ef776-6b4b-40cd-9c88-cbf1128780e9
41.86,47.62,60.32,52.88,Not Rated,ALLIANCE > CPRD,33.33,63.5,Not Rated,Cancer Patient Experience Survey (CPES) for CPRD GOLD,9a58219f-8cea-479c-bb5f-c68cae23136b
18.6,80.95,85.71,81.18,Silver,ALLIANCE > ISARIC 4C,19.05,83.33,Silver,COVID-19 Clinical Information Network (CO-CIN),9a85b69e-fd3e-4522-bc68-48024df0ea3e
39.53,47.62,46.03,54.05,Not Rated,NHS Digital,36.51,54.76,Not Rated,Mental Health Services Data Set - Currencies,9b7f7994-0b9c-4809-b67d-45ae1f04ec5c
34.88,61.9,71.43,63.51,Not Rated,ALLIANCE > CPRD,31.75,69.84,Bronze,HES Patient Reported Outcomes Measures (PROMs) data for CPRD GOLD,9bc66d1b-68a2-4d4e-a54a-cc3842ff95c7
37.21,23.81,20.63,43.3,Not Rated,ALLIANCE > HQIP,38.1,41.27,Not Rated,National Asthma and COPD Audit Programme (NACAP):COPD and adult asthma secondary care organisational dataset,9beca627-12cd-4231-8638-93cf0bdfa413
32.56,88.1,92.06,77.77,Silver,ALLIANCE > NIHR BIORESOURCE,28.57,81.75,Silver,Sample holding,9bfcf24b-5b13-4997-9062-6c58583e69cd
30.23,71.43,61.9,70.6,Bronze,ALLIANCE > ALSPAC,28.57,66.67,Bronze,Avon Longitudinal Study of Parents and Children,9c07be99-54a1-4a23-8de2-492e8dfea55a
34.88,26.19,22.22,45.66,Not Rated,ALLIANCE > HQIP,36.51,42.86,Not Rated,Falls and Fragility Fracture Audit Programme National Hip Database clinical dataset,9c0f13ca-5831-4d9b-860a-7d856be7a9f1
23.26,69.05,60.32,72.89,Bronze,ALLIANCE > TISSUE DIRECTORY,23.81,68.25,Bronze,Tissue Access for Patient Benefit (TAPb),9cb10184-7459-4ca5-ac30-d2364e70821d
32.56,26.19,22.22,46.81,Not Rated,ALLIANCE > NIHR BIORESOURCE,34.92,43.65,Not Rated,Full Blood Counts,9ccfde56-dd13-4606-a6c1-1e797d3b8d82
41.86,40.48,50.79,49.31,Not Rated,ALLIANCE > PUBLIC HEALTH SCOTLAND,42.86,53.97,Not Rated,SICSAG Daily (Scottish Intensive Care Audit Group),9e3c804f-ecf8-425d-a0c3-6f9fa221bda7
20.93,69.05,60.32,74.06,Bronze,ALLIANCE > TISSUE DIRECTORY,20.63,69.84,Bronze,POUT-T,9e8982cb-6e2b-4c6e-b9d5-80a3794eb1dc
25.58,59.52,52.38,66.97,Bronze,OTHER > Office for National Statistics,23.81,64.28,Not Rated,Death registration data - Provisional Monthly Extracts,9f34263d-ea74-4ddf-84df-b8dedd4baf6d
18.6,69.05,60.32,75.22,Bronze,ALLIANCE > TISSUE DIRECTORY,19.05,70.64,Bronze,MDSBio,9f45db59-b3c9-4c33-85bf-25c1b5242903
37.21,11.9,9.52,37.34,Not Rated,ALLIANCE > NHS SCOTLAND,38.1,35.71,Not Rated,NHS Scotland General Practice (GP) Contact Data - Subset,a021f150-41e6-48c3-807c-a0cefa4cb2c2
32.56,26.19,22.22,46.81,Not Rated,ALLIANCE > HQIP,34.92,43.65,Not Rated,National Early Inflammatory Arthritis Audit - patient survey,a05443cd-e292-4b5f-b1f1-95718e300d46
46.51,50.0,61.9,51.75,Not Rated,ALLIANCE > CPRD,39.68,61.11,Not Rated,Cancer registration data for CPRD GOLD,a0dad23c-c02d-4347-92ef-0019fa59eb3e
46.51,92.86,98.41,73.17,Bronze,NIHR Health Informatics Collaborative Renal Transplantation Theme,49.21,74.6,Bronze,HIC Transplantation,a0e0c0c2-072a-47ac-9252-e27b37ac024f
46.51,64.29,77.78,58.89,Not Rated,NHS Digital,46.03,65.88,Not Rated,Mental Health Minimum Dataset v4.1 (Non-Sensitive) Events,a1a67182-e81b-4144-ac51-92a86f277eb2
20.93,69.05,60.32,74.06,Bronze,ALLIANCE > TISSUE DIRECTORY,20.63,69.84,Bronze,Cam-UroOnc Biorepository,a1f9315e-8561-4e7b-b1a7-1276bdeca14d
20.93,69.05,60.32,74.06,Bronze,ALLIANCE > TISSUE DIRECTORY,20.63,69.84,Bronze,ICON9 Trial,a2d94442-91c1-4626-b28f-700eb436a4c1
27.91,76.19,84.13,74.14,Bronze,ALLIANCE > SCOTLAND,31.75,76.19,Silver,ECOSS (-/+VE tested patients only),a3b9cfd3-abd1-4d18-99cc-360cd9d543c2
39.53,16.67,14.29,38.57,Not Rated,ALLIANCE > BARTS,39.68,37.3,Not Rated,Freetext Dataset,a429e699-4650-4feb-9392-f24aa3a3b7b6
25.58,76.19,66.67,75.31,Bronze,ALLIANCE > TISSUE DIRECTORY,23.81,71.43,Bronze,Sheffield Brain Tissue Bank (SBTB),a49a1145-4334-4c2a-81cb-90155e8f05c6
23.26,69.05,60.32,72.89,Bronze,ALLIANCE > TISSUE DIRECTORY,22.22,69.05,Bronze,plasmaMATCH,a617a37d-1813-49ad-8282-38169981a095
39.53,16.67,14.29,38.57,Not Rated,ALLIANCE > BARTS,39.68,37.3,Not Rated,Community Services Dataset,a675ac5e-ecc2-4899-9c3c-65c2f36432c5
23.26,69.05,60.32,72.89,Bronze,ALLIANCE > TISSUE DIRECTORY,22.22,69.05,Bronze,UK primary Sjogren's syndrome Registry,a6fb087d-1a90-4db0-9fcf-323c5b3cce51
23.26,71.43,63.49,74.09,Bronze,ALLIANCE > TISSUE DIRECTORY,22.22,70.64,Bronze,Central England Haemato-oncology and oncology Research Biobank (CEHRB),a7209348-c011-44d0-9c4f-35a2014c2542
39.53,16.67,14.29,38.57,Not Rated,ALLIANCE > OUH,39.68,37.3,Not Rated,LIMS,a74f72ad-bf70-42e4-8933-069c7b53c7f9
48.84,50.0,63.49,50.58,Not Rated,ALLIANCE > CPRD,44.44,59.53,Not Rated,Quality of Life of Colorectal Cancer Survivors in England: Patient Reported Outcome Measures Survey for CPRD Aurum,a772b8dd-cb93-4f27-a349-329992e0b212
34.88,26.19,22.22,45.66,Not Rated,ALLIANCE > HQIP,36.51,42.86,Not Rated,National Asthma and COPD Audit Programme (NACAP): primary care workstream resources,a895be78-f41c-40b8-b2fa-678a071a6427
46.51,64.29,77.78,58.89,Not Rated,NHS Digital,46.03,65.88,Not Rated,Mental Health Minimum Dataset v3_3.5 (Non-Sensitive),aa019da2-0f2f-493c-95e8-7263ee735f46
32.56,69.05,77.78,68.25,Bronze,ALLIANCE > CPRD,28.57,74.61,Bronze,HES Diagnostic Imaging Dataset for CPRD GOLD,aa8c53e8-f91f-41f7-9522-7e2462a9a84b
25.58,80.95,87.3,77.69,Silver,HUB > NHS DIGITRIALS,22.22,82.54,Silver,National Diabetes Audit,aafe3a2f-c0f3-44f2-b50e-d1120d5f2e93
41.86,61.9,74.6,60.02,Not Rated,NHS Digital,36.51,69.05,Bronze,Mental Health Minimum Data Set,acafb160-b18a-436e-90f1-dc4530a90267
20.93,69.05,60.32,74.06,Bronze,ALLIANCE > TISSUE DIRECTORY,20.63,69.84,Bronze,REQUITE,ace79a9e-1552-4287-9f6e-9d01f628252b
20.93,71.43,63.49,75.25,Bronze,ALLIANCE > TISSUE DIRECTORY,20.63,71.43,Bronze,Cardiff University Biobank,ad5c7693-983e-4f32-a979-9ab550f2084a
23.26,50.0,41.27,63.37,Not Rated,HUBS > BREATHE,25.4,57.94,Not Rated,Optimum Patient Care Research Database,ae4b8371-d037-46e8-bdcd-bf3de08ef38e
20.93,69.05,60.32,74.06,Bronze,ALLIANCE > TISSUE DIRECTORY,20.63,69.84,Bronze,Cambridge Blood and Stem Cell Biobank,ae4f0589-8679-48a1-ad04-2324a5001869
30.23,26.19,22.22,47.98,Not Rated,ALLIANCE > HQIP,31.75,45.23,Not Rated,National Audit of Care at the End of Life - Quality Survey,aeb2f1ea-c914-4b30-94c8-9fd3eb51b288
23.26,95.24,100.0,85.99,Silver,ALLIANCE > CYSTIC FIBROSIS TRUST,26.98,86.51,Gold,Cystic Fibrosis Patient NTM culture,af148400-1ec6-436d-910e-45350a54c390
18.6,64.29,55.56,72.84,Bronze,HUBS > BREATHE,20.63,67.47,Bronze,Community perception on public health measures for COVID-19 prevention/control,af238430-c257-4d60-9ff0-1de6b825f09e
16.28,92.86,96.83,88.29,Gold,HUBS > DISCOVER NOW,12.7,92.06,Gold,North West London Coordinate My Care (NWL CMC),af660e81-bb96-4e85-99a8-b85147c6ba79
20.93,71.43,63.49,75.25,Bronze,ALLIANCE > TISSUE DIRECTORY,20.63,71.43,Bronze,RAPPER,b0886a0c-7ddc-4c2b-a499-afd7262fbe56
25.58,95.24,100.0,84.83,Silver,ALLIANCE > GENOMICS ENGLAND,22.22,88.89,Gold,GENOMICS ENGLAND 100K RARE DISEASE & COMMON,b0a8085e-8cf0-45ee-b4a6-12a4a545ca70
37.21,16.67,14.29,39.73,Not Rated,ALLIANCE > DUNDEE,36.51,38.89,Not Rated,Patient SIMD Postcode,b2124786-9658-40cc-b5a3-6624885ce490
18.6,92.86,96.83,87.13,Gold,HUBS > DISCOVER NOW,15.87,90.48,Gold,North West London Patient Index (NWL PI),b232b32f-07d4-4fce-85a0-3834efd8757a
18.6,92.86,96.83,87.13,Gold,HUBS > DISCOVER NOW,14.29,91.27,Gold,North West London Admitted Patient Care Data (NWL APC),b339ea90-c3dd-44d8-a968-88eba9e3edb3
18.6,71.43,63.49,76.42,Silver,ALLIANCE > TISSUE DIRECTORY,19.05,72.22,Bronze,York Tissue Bank,b36202ad-7652-460c-8389-baa1a1c1ac46
23.26,69.05,60.32,72.89,Bronze,ALLIANCE > TISSUE DIRECTORY,22.22,69.05,Bronze,HCV Research UK,b3a10154-a409-491a-92fb-e7fac47ccd91
41.86,95.24,100.0,76.69,Silver,NIHR Health Informatics Collaborative Critical Care Theme,42.86,78.57,Silver,HIC ICU 8.3.2,b40777a2-468b-4b45-8b7d-2f62f912e950
39.53,16.67,14.29,38.57,Not Rated,ALLIANCE > BARTS,39.68,37.3,Not Rated,CDE Surginet Documentation,b41bb360-f2ed-49f0-a45b-b2fb05321975
44.19,47.62,60.32,51.72,Not Rated,ALLIANCE > CPRD,38.1,61.11,Not Rated,Systemic Anti-Cancer Treatment (SACT) data for CPRD Aurum,b4f6a5c2-e652-4972-9d06-510e9a469dfe
46.51,61.9,74.6,57.7,Not Rated,NHS Digital,46.03,64.28,Not Rated,Mental Health Minimum Dataset v4.1 (Non-Sensitive) Episodes,b53f716d-a5c3-4ad8-a2aa-cae09c12ac18
20.93,69.05,60.32,74.06,Bronze,ALLIANCE > TISSUE DIRECTORY,20.63,69.84,Bronze,MRC Brain Banks Network,b717d41e-9202-40ed-be1a-882ec0c47761
27.91,69.05,61.9,70.57,Bronze,ALLIANCE > TISSUE DIRECTORY,26.98,67.46,Bronze,Tissue Solutions Ltd,b730442a-72f3-4b0d-8ad3-4bdba046df7a
27.91,92.86,96.83,82.47,Silver,HUBS > DATA-CAN,28.57,84.13,Silver,Yorkshire Specialist Register of Cancer in Children and Young People,b765d514-1642-4762-a521-73463c977094
23.26,71.43,63.49,74.09,Bronze,ALLIANCE > TISSUE DIRECTORY,22.22,70.64,Bronze,TRICON8,b796b821-97cf-4aa1-bbc7-53e3c1fbc33f
25.58,54.76,50.79,64.59,Not Rated,HUB > PIONEER,25.4,62.69,Not Rated,PIONEER - COVID ACUITY,b7d5bae7-f047-454c-91c3-81fa5e5543eb
37.21,16.67,14.29,39.73,Not Rated,ALLIANCE > DUNDEE,36.51,38.89,Not Rated,Tayside Radiology,b8107ec3-ba35-45ee-8231-cb610fe2ce48
37.21,16.67,14.29,39.73,Not Rated,ALLIANCE > DUNDEE,36.51,38.89,Not Rated,NHS Tayside and Fife Haematology (Lab Data Restructured),b9a2fe09-60b3-48a4-b252-9ed04a7dcc66
46.51,64.29,77.78,58.89,Not Rated,NHS Digital,46.03,65.88,Not Rated,Mental Health Minimum Dataset v4 (Non-Sensitive) Events,ba071b0b-5ef4-457b-b194-3a69c2c71a06
18.6,61.9,53.97,71.65,Bronze,HUBS > BREATHE,20.63,66.67,Bronze,Assessment of ASHA’s workload and its determinants,bab944af-e345-4893-8640-a88aaff97c72
16.28,92.86,96.83,88.29,Gold,HUBS > DISCOVER NOW,12.7,92.06,Gold,North West London Primary Care Events Data (NWL PCE),bc2d2a17-0f36-4cb0-85d3-b54e64460d75
37.21,35.71,49.21,49.25,Not Rated,ALLIANCE > NHS DIGITAL,34.92,57.14,Not Rated,Cancer Registration Data,bc30732b-32cb-4f66-8794-e6e6691c79e7
41.86,50.0,63.49,54.07,Not Rated,ALLIANCE > CPRD,33.33,65.08,Not Rated,Patient postcode linked deprivation measures for CPRD GOLD,bc6ae5bc-7175-49e2-b093-337dde427736
20.93,69.05,60.32,74.06,Bronze,ALLIANCE > TISSUE DIRECTORY,20.63,69.84,Bronze,Wales Cancer Bank,bcfdc597-1bf0-41c2-8b68-779f9a115f83
46.51,64.29,77.78,58.89,Not Rated,NHS Digital,46.03,65.88,Not Rated,Mental Health & Learning Disabilities Dataset v 1 (Sensitive) Events,bdc17b2c-8b0f-4959-ab9b-e2de32d8a5f9
44.19,54.76,69.84,55.28,Not Rated,ALLIANCE > CPRD,38.1,65.87,Not Rated,Mother-Baby Link for CPRD GOLD,bdcbbb2b-df99-4ae7-b36e-f266cfe10ed3
30.23,26.19,22.22,47.98,Not Rated,ALLIANCE > HQIP,31.75,45.23,Not Rated,National Joint Registry - Revision Shoulder Replacement dataset,bddcc89d-028f-48a5-b568-7dccd574563b
16.28,69.05,58.73,76.38,Silver,HUBS > BREATHE,19.05,69.84,Bronze,4 LMIC Asian Country ChrOnic: estimating respiratory disease burden in adults,be9bf427-d96d-4b1a-b1d1-83bdc3e8790b
41.86,16.67,14.29,37.41,Not Rated,ALLIANCE > OUH,41.27,36.51,Not Rated,TheatreEvents,bf83ada4-b72e-4789-b177-12a53aa763ea
25.58,80.95,87.3,77.69,Silver,ALLIANCE > SCOTLAND,20.63,83.34,Silver,Mental Health Inpatient and Day Case - Scottish Morbidity Record (SMR04),bfc6e7c5-a81b-4fe2-95b5-d108a48d7d67
11.63,92.86,98.41,90.62,Gold,ALLIANCE > SAIL,7.94,95.23,Gold,Daily Situation Report Data,c0da6801-6907-4c06-8fba-d21943c3a931
25.58,71.43,63.49,72.93,Bronze,ALLIANCE > TISSUE DIRECTORY,25.4,69.05,Bronze,UCL Infection DNA Bank,c10d6c3a-e405-4ee9-828f-02443c210879
30.23,28.57,23.81,49.17,Not Rated,HUBS > BREATHE,33.33,45.24,Not Rated,Vitamin D supplementation meta-analyses,c16605d7-6e6e-4461-bfab-107660e31427
18.6,69.05,60.32,75.22,Bronze,ALLIANCE > TISSUE DIRECTORY,19.05,70.64,Bronze,STAMPEDE,c182a3b6-8eea-43ef-be18-6cd444f150dc
16.28,92.86,96.83,88.29,Gold,HUBS > DISCOVER NOW,14.29,91.27,Gold,North West London Primary Care Prescriptions Data (NWL PCP),c1f947c3-4956-4e0b-93ef-23ce9abda000
37.21,16.67,14.29,39.73,Not Rated,ALLIANCE > DUNDEE,36.51,38.89,Not Rated,Fife Radiology,c22d8356-d51b-4d34-aadf-ed356d15fe46
18.6,66.67,57.14,74.03,Bronze,HUBS > BREATHE,20.63,68.25,Bronze,Assessing the eDPSEEA model in seasonal pollen induced asthma in Islamabad,c2548017-7913-40e1-bf98-aaa2e907b0ea
37.21,16.67,14.29,39.73,Not Rated,ALLIANCE > DUNDEE,36.51,38.89,Not Rated,Tayside Bowel Screening Dataset,c275f19e-2373-43dc-8e83-3318aaf8bfa4
18.6,73.81,65.08,77.61,Silver,ALLIANCE > TISSUE DIRECTORY,19.05,73.02,Bronze,Arden Tissue Bank,c29c3fbe-700e-4f85-8943-5557c30c1dfa
30.23,78.57,85.71,74.17,Bronze,HUB > NHS DIGITRIALS,28.57,78.57,Silver,Diagnostic Imaging Dataset,c2f15f59-8e0d-4e90-9277-342497a6d961
32.56,28.57,23.81,48.0,Not Rated,ALLIANCE > LEICESTER,33.33,45.24,Not Rated,Genvasc Primary Care Data,c324246a-22d9-45d8-9a7a-a513078be2d1
32.56,26.19,22.22,46.81,Not Rated,ALLIANCE > HQIP,34.92,43.65,Not Rated,Sentinel Stroke National Audit Programme Acute Organisational survey dataset,c3d84dfa-fe3a-4b86-a0f5-efbe45aa93ad
13.95,78.57,69.84,82.31,Silver,HUBS > BREATHE,15.87,76.98,Silver,UK BiLEVE Consortium Dataset,c43363e5-a2cd-4990-a425-733dfe559a4f
13.95,95.24,100.0,90.64,Gold,ALLIANCE > SAIL,11.11,94.44,Gold,Cafcass Wales,c494f4ec-77cb-43d0-9038-9885311abb5a
32.56,69.05,77.78,68.25,Bronze,ALLIANCE > CPRD,28.57,74.61,Bronze,HES Accident and Emergency data for CPRD GOLD,c55b92d8-889d-435c-b0cb-2d9f7b432839
34.88,69.05,77.78,67.09,Bronze,ALLIANCE > CPRD,30.16,73.81,Bronze,Death Registration data for CPRD Aurum,c577669a-a84f-493e-8164-3fe02f618561
32.56,26.19,22.22,46.81,Not Rated,ALLIANCE > HQIP,33.33,44.45,Not Rated,National Audit of Psychosis - Audit on Early Intervention in Psychosis services - contextual data,c5994fae-9c4a-47eb-ba42-85bd76e92879
41.86,50.0,63.49,54.07,Not Rated,ALLIANCE > CPRD,33.33,65.08,Not Rated,Practice postcode linked deprivation measures for CPRD GOLD,c6117afd-bc4d-404b-8d58-9d87db936b4c
23.26,69.05,60.32,72.89,Bronze,ALLIANCE > TISSUE DIRECTORY,23.81,68.25,Bronze,Barts CTU,c6d6bbd3-74ed-46af-841d-ac5e05f4da41
16.28,95.24,100.0,89.48,Gold,OTHER > COG-UK,12.7,93.65,Gold,COG-UK Viral Genome Sequences,c6dc78fa-1543-4fbf-87d8-a3f48e7de813
46.51,64.29,77.78,58.89,Not Rated,NHS Digital,46.03,65.88,Not Rated,Mental Health & Learning Disabilities Dataset v 1 (Non-Sensitive) Episodes,c713773c-e961-400e-b44a-947002deb073
20.93,95.24,100.0,87.16,Gold,ALLIANCE > SAIL,23.81,88.09,Gold,Annual District Death Daily,c7c7d692-99a2-4ef4-b295-35c3e6e243a1
16.28,95.24,100.0,89.48,Gold,ALLIANCE > SAIL,15.87,92.06,Gold,COVID-19 Consolidated Deaths,c809126e-315b-4bcc-8fa3-741317bf9a4e
23.26,73.81,63.49,75.28,Bronze,ALLIANCE > TISSUE DIRECTORY,22.22,70.64,Bronze,RATHL Trial,c83d2206-3778-400b-9b26-27c7588af930
37.21,16.67,14.29,39.73,Not Rated,ALLIANCE > DUNDEE,36.51,38.89,Not Rated,NHS Tayside and Fife Virology,c8ed8784-91ce-4823-8e80-fa3a4b732e11
46.51,64.29,77.78,58.89,Not Rated,NHS Digital,46.03,65.88,Not Rated,Mental Health Minimum Dataset v4.1 (Non-Sensitive) Records,c97b8058-a6a4-4c8d-92e1-6e9f4cddd301
30.23,26.19,22.22,47.98,Not Rated,ALLIANCE > HQIP,31.75,45.23,Not Rated,National Audit of Care at the End of Life - case note review,cabb1db1-ee3e-42ce-a40b-468282e2011d
20.93,78.57,85.71,78.82,Silver,HUB > NHS DIGITRIALS,15.87,84.92,Silver,Personal Demographic Service,caf619c9-3e9c-4873-a7ba-c0df8f4a62c2
32.56,26.19,22.22,46.81,Not Rated,ALLIANCE > HQIP,34.92,43.65,Not Rated,National Early Inflammatory Arthritis Audit - organisational survey dataset,cbda5643-96b7-4914-b990-a872e693ff29
46.51,64.29,77.78,58.89,Not Rated,NHS Digital,46.03,65.88,Not Rated,Mental Health Minimum Dataset v4.1 (Sensitive) Records,cc383a3f-1c47-4b7d-99cf-be8ee0afe401
34.88,71.43,79.37,68.28,Bronze,ALLIANCE > CPRD,30.16,74.61,Bronze,HES Admitted Patient Care data for CPRD Aurum,cc3e20da-aca5-471d-a4bb-38e13f350f10
27.91,42.86,38.1,57.48,Not Rated,ALLIANCE > NHS DIGITAL,26.98,55.56,Not Rated,Improving Access to Psychological Therapies Data Set,cef00323-8756-4ea5-99e4-f12dcb2c6297
32.56,26.19,22.22,46.81,Not Rated,ALLIANCE > HQIP,33.33,44.45,Not Rated,National Clinical Audit of Anxiety and Depression - spotlight audit on psychological therapies (clinical),cf3f4336-e52d-4b82-8cc5-647dedaaee57
48.84,50.0,63.49,50.58,Not Rated,ALLIANCE > CPRD,44.44,59.53,Not Rated,Quality of Life of Colorectal Cancer Survivors in England: Patient Reported Outcome Measures Survey for CPRD GOLD,cf81a42f-2611-4410-89e9-7e3770d03a15
23.26,95.24,100.0,85.99,Silver,ALLIANCE > CYSTIC FIBROSIS TRUST,26.98,86.51,Gold,Cystic Fibrosis Patient Microbiology Cultures,d0468470-a88f-4692-a19d-c9ac0b9868f3
11.63,95.24,100.0,91.81,Gold,ALLIANCE > SAIL,9.52,95.24,Gold,Welsh Cancer Intelligence and Surveillance Unit (WCISU),d2667c43-adfd-4a61-b090-38d39e35a392
20.93,69.05,60.32,74.06,Bronze,ALLIANCE > TISSUE DIRECTORY,20.63,69.84,Bronze,Cancer Group CTR Cardiff trials,d272b783-8db3-4068-8d0f-05728f786d6d
51.16,33.33,46.03,41.09,Not Rated,NHS Digital,49.21,48.41,Not Rated,Patient Reported Outcome Measures,d2af6a29-291b-4444-a17c-40f4208f1e1b
20.93,95.24,100.0,87.16,Gold,ALLIANCE > SAIL,22.22,88.89,Gold,Education - Wales,d2da2750-7482-4ce9-ae5c-2ab393408a67
32.56,26.19,22.22,46.81,Not Rated,ALLIANCE > HQIP,34.92,43.65,Not Rated,Sentinel Stroke National Audit Programme Clinical Dataset,d3673b75-ec8f-4c2e-8c9b-6ef1d951f978
20.93,71.43,63.49,75.25,Bronze,ALLIANCE > TISSUE DIRECTORY,20.63,71.43,Bronze,MFT Biobank,d3a3935f-b28e-4e74-9b15-9432d611f26c
25.58,76.19,68.25,75.31,Bronze,HUB > PIONEER,25.4,71.42,Bronze,PIONEER - COVID,d3d1cdf1-3a36-49d1-ba73-b02ebeceab9b
20.93,59.52,52.38,69.3,Bronze,HUBS > BREATHE,22.22,65.08,Not Rated,Strategy introducing Pulmonary Rehabilitation for COPD management in rural India,d3e859ba-cfb0-4eda-a14c-34b08d113cd9
39.53,16.67,14.29,38.57,Not Rated,ALLIANCE > OUH,39.68,37.3,Not Rated,JANUS,d3fd4dac-2d15-401c-8185-905ee108d9ce
20.93,71.43,63.49,75.25,Bronze,ALLIANCE > TISSUE DIRECTORY,20.63,71.43,Bronze,UK ME/CFS Biobank,d51de39c-153a-462b-8de5-cd1424908e0c
18.6,66.67,57.14,74.03,Bronze,HUBS > BREATHE,20.63,68.25,Bronze,Exploration of Pneumonia Related Policy Formation and Implementation in Pakistan,d5446d68-2fb9-4f0f-962e-7b7ed484d534
32.56,26.19,22.22,46.81,Not Rated,HUBS > PIONEER,34.92,43.65,Not Rated,Birmingham Out of Hours Research Database,d546521a-79be-4a53-83bd-ff008bda6171
39.53,16.67,14.29,38.57,Not Rated,ALLIANCE > OUH,39.68,37.3,Not Rated,OUH Patient Master Index,d57a096a-4fa3-4529-b508-0b9df0f1893c
20.93,71.43,63.49,75.25,Bronze,ALLIANCE > TISSUE DIRECTORY,20.63,71.43,Bronze,NHS Grampian Biorepository,d5ab658e-b474-4e22-95f8-92607c40792d
6.98,95.24,100.0,94.13,Gold,OTHER > HEALTH DATA RESEARCH UK,9.52,95.24,Gold,HDR UK Papers & Preprints,d5faf9c6-6c34-46d7-93c4-7706a5436ed9
34.88,73.81,80.95,69.47,Bronze,HUB > NHS DIGITRIALS,33.33,73.81,Bronze,Mental Health Services Data Set,d612e29a-c26a-4512-99d4-548514b60c76
30.23,88.1,92.06,78.94,Silver,ALLIANCE > NIHR BIORESOURCE,23.81,84.12,Silver,Health and Lifestyle Questionnaire,d7ec9584-cba3-46f9-9ef4-b1cb9eef2e7c
20.93,83.33,90.48,81.2,Silver,ALLIANCE > SCOTLAND,15.87,87.31,Gold,Outpatient Appointments and Attendances - Scottish Morbidity Record (SMR00),d8043751-28d6-4cfe-b860-757e592ab3cb
41.86,33.33,31.75,45.73,Not Rated,ALLIANCE > CPRD,38.1,46.83,Not Rated,Cancer Patient Experience Survey (CPES) for CPRD Aurum,d90830f4-5aaa-4075-8c8d-839627224d16
16.28,95.24,100.0,89.48,Gold,ALLIANCE > SAIL,12.7,93.65,Gold,Patient Episode Dataset for Wales,d99dd234-0fed-4731-99fe-82a567187854
30.23,26.19,22.22,47.98,Not Rated,ALLIANCE > HQIP,31.75,45.23,Not Rated,National Vascular Registry -  Abdominal Aortic Aneurysm Repair clinical dataset,da4d3e21-3d81-49e9-ada0-6175e2341190
46.51,64.29,77.78,58.89,Not Rated,NHS Digital,46.03,65.88,Not Rated,Mental Health Minimum Dataset v4.1 (Sensitive) Events,db113fcd-69a0-4357-9c6d-250085deb3f5
18.6,69.05,60.32,75.22,Bronze,ALLIANCE > TISSUE DIRECTORY,19.05,70.64,Bronze,interNational Anaplastic Thyroid Cancer Tissue Bank (iNATT),dd7e56e7-2683-4b88-bed2-3a27ef3e4c9e
30.23,26.19,22.22,47.98,Not Rated,ALLIANCE > HQIP,31.75,45.23,Not Rated,National Vascular Registry Audit Carotid Endarterectomy Clinical Dataset,ddc965e7-6f52-4eed-bed5-657e3e7bbeac
34.88,21.43,17.46,43.28,Not Rated,ALLIANCE > NIHR BIORESOURCE,36.51,40.48,Not Rated,NHS Digital data,de1179eb-89fe-45a3-9e3c-e54a2a36ebf0
32.56,26.19,22.22,46.81,Not Rated,ALLIANCE > HQIP,33.33,44.45,Not Rated,National Bowel Cancer Audit -  Organisational Survey dataset,de19b3ea-2600-4472-85e8-628e7beff76e
9.3,80.95,71.43,85.83,Silver,HUBS > BREATHE,9.52,80.96,Silver,UK Lung Volume Reduction Surgery,def6669b-0fac-485c-84b2-2ea83ec31123
20.93,64.29,55.56,71.68,Bronze,HUBS > BREATHE,23.81,65.88,Not Rated,Klang Asthma Cohort,df63e893-f688-4bb4-956c-cc4354bb4001
39.53,16.67,14.29,38.57,Not Rated,ALLIANCE > OUH,39.68,37.3,Not Rated,Admitted Patient Care Dataset,dfb21b3b-7fd9-40c4-892e-810edd6dfc25
34.88,78.57,85.71,71.84,Bronze,ALLIANCE > NHS DIGITAL,34.92,75.39,Bronze,Civil Registration - Deaths,e09ddabc-b0b9-4f9d-af32-97293e0e6cb7
25.58,95.24,100.0,84.83,Silver,ALLIANCE > GENOMICS ENGLAND,22.22,88.89,Gold,GENOMICS ENGLAND 100K PHE LINKED DATA,e0c871f9-b63c-43a5-9fd6-e5731dae2343
11.63,95.24,100.0,91.81,Gold,ALLIANCE > SAIL,9.52,95.24,Gold,Brecon dataset,e0ed59e2-8fb5-44d4-b694-f31d46884954
30.23,26.19,22.22,47.98,Not Rated,ALLIANCE > HQIP,31.75,45.23,Not Rated,National Oesophago-Gastric Cancer Audit - clinical dataset,e10660af-b420-4e25-8fc9-ea451da1dcfb
30.23,26.19,22.22,47.98,Not Rated,ALLIANCE > HQIP,31.75,45.23,Not Rated,National Joint Registry - Primary Ankle Replacement dataset,e38c8d6c-8655-4432-b654-23f89c0bb495
23.26,95.24,100.0,85.99,Silver,ALLIANCE > CYSTIC FIBROSIS TRUST,26.98,86.51,Gold,Cystic Fibrosis Patient Tendon Rupture,e432737f-43c0-43c1-aef5-71cb204d770c
30.23,28.57,23.81,49.17,Not Rated,HUBS > BREATHE,33.33,45.24,Not Rated,Unified Cohorts Research Network,e516a359-74a8-4932-b4df-f2cf75eef89d
23.26,85.71,92.06,81.22,Silver,ALLIANCE > PUBLIC HEALTH SCOTLAND,26.98,82.54,Silver,National Records of Scotland (NRS) - Deaths Data,e61fce14-617d-4f7b-80aa-468d94c6d897
25.58,95.24,100.0,84.83,Silver,ALLIANCE > CYSTIC FIBROSIS TRUST,26.98,86.51,Gold,Cystic Fibrosis Patient Sweat Tests,e66b726f-8e58-4411-be32-1d00ba1df13f
20.93,69.05,60.32,74.06,Bronze,ALLIANCE > TISSUE DIRECTORY,20.63,69.84,Bronze,Biobank for patients with retinal degenerations & dystrophies,e678366e-bb53-4dbb-a228-05114e0b6eb3
30.23,73.81,80.95,71.79,Bronze,ALLIANCE > NHS DIGITAL,23.81,78.57,Silver,Secondary Uses Services Payment By Results,e72825e0-d982-49cd-b361-e15cf63c6c33
27.91,73.81,84.13,72.95,Bronze,ALLIANCE > SAIL,25.4,79.36,Silver,Lifelong Learning Wales Record (LLWR),e7c99216-2d93-4cc5-96e8-36002aac80b1
20.93,92.86,96.83,85.97,Silver,HUBS > DISCOVER NOW,20.63,88.1,Gold,North West London Community Data (NWL COM),e85e5c8c-b6be-4e8b-8a0b-13b785b457a2
20.93,69.05,60.32,74.06,Bronze,ALLIANCE > TISSUE DIRECTORY,20.63,69.84,Bronze,University of Liverpool - GCP Laboratory Facility,e8f23004-f1f7-4a36-859f-25af6ca6433b
37.21,16.67,14.29,39.73,Not Rated,ALLIANCE > DUNDEE,36.51,38.89,Not Rated,"NHS Tayside, A&E Drugs given during an A&E visit",e8f5b1b5-2c08-439a-b337-70b454aa40f3
18.6,61.9,53.97,71.65,Bronze,ALLIANCE > SCOTLAND,19.05,67.46,Bronze,Scottish Immunisation Recall System (SIRS),e9d504fc-4b61-4419-a400-ffda998fc377
25.58,76.19,66.67,75.31,Bronze,ALLIANCE > TISSUE DIRECTORY,23.81,71.43,Bronze,Research Donors Ltd,ea07f115-9f70-4c21-a373-247a1ca906f0
39.53,16.67,14.29,38.57,Not Rated,ALLIANCE > OUH,39.68,37.3,Not Rated,Sunquest,eaca9ed1-30b6-4157-8894-8e53efc84849
18.6,71.43,63.49,76.42,Silver,ALLIANCE > TISSUE DIRECTORY,19.05,72.22,Bronze,Tommy's National Reproductive Health Biobank,eb19fcd9-2e9e-4e27-aa79-ad235952b1ac
20.93,88.1,93.65,83.58,Silver,ALLIANCE > SAIL,20.63,86.51,Gold,Higher Education Statistics Agency (HESA) Student Data,ec8e4933-2118-4366-a61a-090748e49be7
23.26,95.24,100.0,85.99,Silver,ALLIANCE > GENOMICS ENGLAND,17.46,91.27,Gold,GENOMICS ENGLAND 100K QUICK VIEW,ecbe7275-82b5-43cd-9401-fd7ef4b55341
20.93,59.52,52.38,69.3,Bronze,HUBS > BREATHE,22.22,65.08,Not Rated,"Introducing pulse oximetry in IMNCI, primary health facilities in Pune India",ecc4daf2-e58a-4ebc-9608-4bc741231fb9
37.21,16.67,14.29,39.73,Not Rated,ALLIANCE > DUNDEE,36.51,38.89,Not Rated,Fife Microbiology: Isolations,edaf29f4-9857-4bb0-97b9-ae88b70a2a3c
20.93,78.57,68.25,78.82,Silver,HUBS > BREATHE,20.63,73.81,Bronze,Its Not JUST Idiopathic pulmonary fibrosis Study (INJUSTIS),edc8f0c6-64f8-4f6d-a1dd-41e05033d54e
20.93,71.43,63.49,75.25,Bronze,ALLIANCE > TISSUE DIRECTORY,20.63,71.43,Bronze,QTL Programme at MRC HGU,ee5f4405-6930-4a7b-ba00-85a8e8c8a8b9
16.28,95.24,100.0,89.48,Gold,ALLIANCE > SAIL,14.29,92.86,Gold,National Survey for Wales,ee78ce42-7f1f-4c97-80cc-ea6ad628e5da
20.93,71.43,63.49,75.25,Bronze,ALLIANCE > TISSUE DIRECTORY,20.63,71.43,Bronze,Manchester Cancer Research Centre (MCRC) Biobank,eea147a4-4576-4f86-8ad1-c762137335fd
13.95,95.24,100.0,90.64,Gold,ALLIANCE > SAIL,12.7,93.65,Gold,Emergency Department Dataset Daily,eebb647a-63eb-4e62-b052-26cb2eb4799d
27.91,83.33,90.48,77.71,Silver,ALLIANCE > CPRD,22.22,84.13,Silver,CPRD Aurum,ef42201e-deb1-4675-896a-8a0162fe52a8
32.56,26.19,22.22,46.81,Not Rated,ALLIANCE > HQIP,34.92,43.65,Not Rated,National Cardiac Audit Programme - National Heart Failure Audit,efbb3bf4-834b-417e-b002-03fc41715e58
