completeness_percent,quality_rating,weighted_completeness_percent,quality_score,weighted_quality_score,id,error_percent,title,weighted_quality_rating,weighted_error_percent,publisher
50.0,Not Rated,41.27,63.37,57.94,ae4b8371-d037-46e8-bdcd-bf3de08ef38e,23.26,Optimum Patient Care Research Database,Not Rated,25.4,HUBS > BREATHE
69.05,Bronze,60.32,74.06,69.84,ae4f0589-8679-48a1-ad04-2324a5001869,20.93,Cambridge Blood and Stem Cell Biobank,Bronze,20.63,ALLIANCE > TISSUE DIRECTORY
26.19,Not Rated,22.22,47.98,45.23,aeb2f1ea-c914-4b30-94c8-9fd3eb51b288,30.23,National Audit of Care at the End of Life - Quality Survey,Not Rated,31.75,ALLIANCE > HQIP
95.24,Silver,100.0,85.99,86.51,af148400-1ec6-436d-910e-45350a54c390,23.26,Cystic Fibrosis Patient NTM culture,Gold,26.98,ALLIANCE > CYSTIC FIBROSIS
64.29,Bronze,55.56,72.84,67.47,af238430-c257-4d60-9ff0-1de6b825f09e,18.6,Community perception on public health measures for COVID-19 prevention/control,Bronze,20.63,HUBS > BREATHE
92.86,Gold,96.83,88.29,92.06,af660e81-bb96-4e85-99a8-b85147c6ba79,16.28,North West London Coordinate My Care (NWL CMC),Gold,12.7,HUBS > DISCOVER NOW
71.43,Bronze,63.49,75.25,71.43,b0886a0c-7ddc-4c2b-a499-afd7262fbe56,20.93,RAPPER,Bronze,20.63,ALLIANCE > TISSUE DIRECTORY
95.24,Silver,100.0,84.83,88.89,b0a8085e-8cf0-45ee-b4a6-12a4a545ca70,25.58,GENOMICS ENGLAND 100K RARE DISEASE & COMMON,Gold,22.22,ALLIANCE > GENOMICS ENGLAND
16.67,Not Rated,14.29,39.73,38.89,b2124786-9658-40cc-b5a3-6624885ce490,37.21,Patient SIMD Postcode,Not Rated,36.51,ALLIANCE > DUNDEE
92.86,Gold,96.83,87.13,90.48,b232b32f-07d4-4fce-85a0-3834efd8757a,18.6,North West London Patient Index (NWL PI),Gold,15.87,HUBS > DISCOVER NOW
92.86,Gold,96.83,88.29,93.66,b339ea90-c3dd-44d8-a968-88eba9e3edb3,16.28,North West London Admitted Patient Care Data (NWL APC),Gold,9.52,HUBS > DISCOVER NOW
71.43,Silver,63.49,76.42,72.22,b36202ad-7652-460c-8389-baa1a1c1ac46,18.6,York Tissue Bank,Bronze,19.05,ALLIANCE > TISSUE DIRECTORY
69.05,Bronze,60.32,72.89,69.05,b3a10154-a409-491a-92fb-e7fac47ccd91,23.26,HCV Research UK,Bronze,22.22,ALLIANCE > TISSUE DIRECTORY
95.24,Silver,100.0,76.69,78.57,b40777a2-468b-4b45-8b7d-2f62f912e950,41.86,HIC ICU 8.3.2,Silver,42.86,NIHR Health Informatics Collaborative Critical Care Theme
16.67,Not Rated,14.29,38.57,37.3,b41bb360-f2ed-49f0-a45b-b2fb05321975,39.53,CDE Surginet Documentation,Not Rated,39.68,ALLIANCE > BARTS
47.62,Not Rated,60.32,51.72,61.11,b4f6a5c2-e652-4972-9d06-510e9a469dfe,44.19,Systemic Anti-Cancer Treatment (SACT) data for CPRD Aurum,Not Rated,38.1,ALLIANCE > CPRD
61.9,Not Rated,74.6,57.7,64.28,b53f716d-a5c3-4ad8-a2aa-cae09c12ac18,46.51,Mental Health Minimum Dataset v4.1 (Non-Sensitive) Episodes,Not Rated,46.03,NHS Digital
69.05,Bronze,60.32,74.06,69.84,b717d41e-9202-40ed-be1a-882ec0c47761,20.93,MRC Brain Banks Network,Bronze,20.63,ALLIANCE > TISSUE DIRECTORY
69.05,Bronze,61.9,70.57,67.46,b730442a-72f3-4b0d-8ad3-4bdba046df7a,27.91,Tissue Solutions Ltd,Bronze,26.98,ALLIANCE > TISSUE DIRECTORY
71.43,Bronze,63.49,74.09,70.64,b796b821-97cf-4aa1-bbc7-53e3c1fbc33f,23.26,TRICON8,Bronze,22.22,ALLIANCE > TISSUE DIRECTORY
16.67,Not Rated,14.29,39.73,38.89,b8107ec3-ba35-45ee-8231-cb610fe2ce48,37.21,Tayside Radiology,Not Rated,36.51,ALLIANCE > DUNDEE
16.67,Not Rated,14.29,39.73,38.89,b9a2fe09-60b3-48a4-b252-9ed04a7dcc66,37.21,NHS Tayside and Fife Haematology (Lab Data Restructured),Not Rated,36.51,ALLIANCE > DUNDEE
64.29,Not Rated,77.78,58.89,65.88,ba071b0b-5ef4-457b-b194-3a69c2c71a06,46.51,Mental Health Minimum Dataset v4 (Non-Sensitive) Events,Not Rated,46.03,NHS Digital
61.9,Bronze,53.97,71.65,66.67,bab944af-e345-4893-8640-a88aaff97c72,18.6,Assessment of ASHA’s workload and its determinants,Bronze,20.63,HUBS > BREATHE
92.86,Gold,96.83,88.29,92.06,bc2d2a17-0f36-4cb0-85d3-b54e64460d75,16.28,North West London Primary Care Events Data (NWL PCE),Gold,12.7,HUBS > DISCOVER NOW
50.0,Not Rated,63.49,54.07,65.08,bc6ae5bc-7175-49e2-b093-337dde427736,41.86,Patient postcode linked deprivation measures for CPRD GOLD,Not Rated,33.33,ALLIANCE > CPRD
69.05,Bronze,60.32,74.06,69.84,bcfdc597-1bf0-41c2-8b68-779f9a115f83,20.93,Wales Cancer Bank,Bronze,20.63,ALLIANCE > TISSUE DIRECTORY
64.29,Not Rated,77.78,58.89,65.88,bdc17b2c-8b0f-4959-ab9b-e2de32d8a5f9,46.51,Mental Health & Learning Disabilities Dataset v 1 (Sensitive) Events,Not Rated,46.03,NHS Digital
54.76,Not Rated,69.84,55.28,65.87,bdcbbb2b-df99-4ae7-b36e-f266cfe10ed3,44.19,Mother-Baby Link for CPRD GOLD,Not Rated,38.1,ALLIANCE > CPRD
26.19,Not Rated,22.22,47.98,45.23,bddcc89d-028f-48a5-b568-7dccd574563b,30.23,National Joint Registry - Revision Shoulder Replacement dataset,Not Rated,31.75,ALLIANCE > HQIP
69.05,Bronze,77.78,72.89,80.16,be170751-3ab2-4cb6-a59f-d5d5867e0bfd,23.26,Unscheduled Care Datamart,Silver,17.46,ALLIANCE > SCOTLAND
69.05,Silver,58.73,76.38,69.84,be9bf427-d96d-4b1a-b1d1-83bdc3e8790b,16.28,4 LMIC Asian Country ChrOnic: estimating respiratory disease burden in adults,Bronze,19.05,HUBS > BREATHE
16.67,Not Rated,14.29,37.41,36.51,bf83ada4-b72e-4789-b177-12a53aa763ea,41.86,TheatreEvents,Not Rated,41.27,Oxford University Hospitals NHS Foundation Trust
71.43,Bronze,63.49,72.93,69.05,c10d6c3a-e405-4ee9-828f-02443c210879,25.58,UCL Infection DNA Bank,Bronze,25.4,ALLIANCE > TISSUE DIRECTORY
28.57,Not Rated,23.81,49.17,45.24,c16605d7-6e6e-4461-bfab-107660e31427,30.23,Vitamin D supplementation meta-analyses,Not Rated,33.33,HUBS > BREATHE
69.05,Bronze,60.32,75.22,70.64,c182a3b6-8eea-43ef-be18-6cd444f150dc,18.6,STAMPEDE,Bronze,19.05,ALLIANCE > TISSUE DIRECTORY
92.86,Gold,96.83,88.29,91.27,c1f947c3-4956-4e0b-93ef-23ce9abda000,16.28,North West London Primary Care Prescriptions Data (NWL PCP),Gold,14.29,HUBS > DISCOVER NOW
16.67,Not Rated,14.29,39.73,38.89,c22d8356-d51b-4d34-aadf-ed356d15fe46,37.21,Fife Radiology,Not Rated,36.51,ALLIANCE > DUNDEE
66.67,Bronze,76.19,69.38,75.39,c23c588f-7ab6-4c19-af4d-fe1e4d181102,27.91,National Diabetes Audit,Bronze,25.4,HUBS > NHS DIGITRIALS
66.67,Bronze,57.14,74.03,68.25,c2548017-7913-40e1-bf98-aaa2e907b0ea,18.6,Assessing the eDPSEEA model in seasonal pollen induced asthma in Islamabad,Bronze,20.63,HUBS > BREATHE
16.67,Not Rated,14.29,39.73,38.89,c275f19e-2373-43dc-8e83-3318aaf8bfa4,37.21,Tayside Bowel Screening Dataset,Not Rated,36.51,ALLIANCE > DUNDEE
73.81,Silver,65.08,77.61,73.02,c29c3fbe-700e-4f85-8943-5557c30c1dfa,18.6,Arden Tissue Bank,Bronze,19.05,ALLIANCE > TISSUE DIRECTORY
28.57,Not Rated,23.81,48.0,45.24,c324246a-22d9-45d8-9a7a-a513078be2d1,32.56,Genvasc Primary Care Data,Not Rated,33.33,ALLIANCE > LEICESTER
26.19,Not Rated,22.22,46.81,43.65,c3d84dfa-fe3a-4b86-a0f5-efbe45aa93ad,32.56,Sentinel Stroke National Audit Programme Acute Organisational survey dataset,Not Rated,34.92,ALLIANCE > HQIP
95.24,Gold,100.0,94.13,98.41,c42ceb2a-c9c2-491d-9f34-3da55413225f,6.98,COVID-19 Symptom Tracker Dataset,Gold,3.17,ALLIANCE > SAIL
78.57,Silver,69.84,82.31,76.98,c43363e5-a2cd-4990-a425-733dfe559a4f,13.95,UK BiLEVE Consortium Dataset,Silver,15.87,HUBS > BREATHE
69.05,Bronze,77.78,68.25,74.61,c55b92d8-889d-435c-b0cb-2d9f7b432839,32.56,HES Accident and Emergency data for CPRD GOLD,Bronze,28.57,ALLIANCE > CPRD
69.05,Bronze,77.78,67.09,73.81,c577669a-a84f-493e-8164-3fe02f618561,34.88,Death Registration data for CPRD Aurum,Bronze,30.16,ALLIANCE > CPRD
26.19,Not Rated,22.22,46.81,44.45,c5994fae-9c4a-47eb-ba42-85bd76e92879,32.56,National Audit of Psychosis - Audit on Early Intervention in Psychosis services - contextual data,Not Rated,33.33,ALLIANCE > HQIP
50.0,Not Rated,63.49,54.07,65.08,c6117afd-bc4d-404b-8d58-9d87db936b4c,41.86,Practice postcode linked deprivation measures for CPRD GOLD,Not Rated,33.33,ALLIANCE > CPRD
69.05,Bronze,60.32,72.89,68.25,c6d6bbd3-74ed-46af-841d-ac5e05f4da41,23.26,Barts CTU,Bronze,23.81,ALLIANCE > TISSUE DIRECTORY
95.24,Gold,100.0,89.48,93.65,c6dc78fa-1543-4fbf-87d8-a3f48e7de813,16.28,COG-UK Viral Genome Sequences,Gold,12.7,OTHER > COG-UK
64.29,Not Rated,77.78,58.89,65.88,c713773c-e961-400e-b44a-947002deb073,46.51,Mental Health & Learning Disabilities Dataset v 1 (Non-Sensitive) Episodes,Not Rated,46.03,NHS Digital
66.67,Bronze,76.19,69.38,75.39,c720c89a-b2c6-4cd6-b606-df34ff22b1c8,27.91,Hospital Episode Statistics Outpatients,Bronze,25.4,HUBS > NHS DIGITRIALS
73.81,Bronze,63.49,75.28,70.64,c83d2206-3778-400b-9b26-27c7588af930,23.26,RATHL Trial,Bronze,22.22,ALLIANCE > TISSUE DIRECTORY
16.67,Not Rated,14.29,39.73,38.89,c8ed8784-91ce-4823-8e80-fa3a4b732e11,37.21,NHS Tayside and Fife Virology,Not Rated,36.51,ALLIANCE > DUNDEE
64.29,Not Rated,77.78,58.89,65.88,c97b8058-a6a4-4c8d-92e1-6e9f4cddd301,46.51,Mental Health Minimum Dataset v4.1 (Non-Sensitive) Records,Not Rated,46.03,NHS Digital
26.19,Not Rated,22.22,47.98,45.23,cabb1db1-ee3e-42ce-a40b-468282e2011d,30.23,National Audit of Care at the End of Life - case note review,Not Rated,31.75,ALLIANCE > HQIP
26.19,Not Rated,22.22,46.81,43.65,cbda5643-96b7-4914-b990-a872e693ff29,32.56,National Early Inflammatory Arthritis Audit - organisational survey dataset,Not Rated,34.92,ALLIANCE > HQIP
64.29,Not Rated,77.78,58.89,65.88,cc383a3f-1c47-4b7d-99cf-be8ee0afe401,46.51,Mental Health Minimum Dataset v4.1 (Sensitive) Records,Not Rated,46.03,NHS Digital
71.43,Bronze,79.37,68.28,74.61,cc3e20da-aca5-471d-a4bb-38e13f350f10,34.88,HES Admitted Patient Care data for CPRD Aurum,Bronze,30.16,ALLIANCE > CPRD
57.14,Bronze,50.79,68.1,65.08,cd051ddc-b383-4583-aeca-b2e1fe5b17e3,20.93,National Records of Scotland (NRS) - Births Data,Not Rated,20.63,ALLIANCE > SCOTLAND
73.81,Bronze,65.08,75.28,71.43,cd0cc1de-f0bc-4247-9e67-47e162e2cc6b,23.26,National Cancer Registration Dataset 2018,Bronze,22.22,ALLIANCE > PUBLIC HEALTH ENGLAND
69.05,Bronze,77.78,74.06,80.95,ce9025c9-cf30-420b-8edb-f6ca438b099f,20.93,Child Health Systems Programme - 4-5 year review,Silver,15.87,ALLIANCE > SCOTLAND
69.05,Bronze,77.78,72.89,80.16,ceca959a-11b1-4da3-8289-3cf22c9fc541,23.26,Child Health Systems Programme - 27-30Months Review,Silver,17.46,ALLIANCE > SCOTLAND
26.19,Not Rated,22.22,46.81,44.45,cf3f4336-e52d-4b82-8cc5-647dedaaee57,32.56,National Clinical Audit of Anxiety and Depression - spotlight audit on psychological therapies (clinical),Not Rated,33.33,ALLIANCE > HQIP
50.0,Not Rated,63.49,51.75,61.91,cf81a42f-2611-4410-89e9-7e3770d03a15,46.51,Quality of Life of Colorectal Cancer Survivors in England: Patient Reported Outcome Measures Survey for CPRD GOLD,Not Rated,39.68,ALLIANCE > CPRD
95.24,Silver,100.0,85.99,86.51,d0468470-a88f-4692-a19d-c9ac0b9868f3,23.26,Cystic Fibrosis Patient Microbiology Cultures,Gold,26.98,ALLIANCE > CYSTIC FIBROSIS
69.05,Bronze,60.32,74.06,69.84,d272b783-8db3-4068-8d0f-05728f786d6d,20.93,Cancer Group CTR Cardiff trials,Bronze,20.63,ALLIANCE > TISSUE DIRECTORY
33.33,Not Rated,46.03,41.09,48.41,d2af6a29-291b-4444-a17c-40f4208f1e1b,51.16,Patient Reported Outcome Measures,Not Rated,49.21,NHS Digital
26.19,Not Rated,22.22,46.81,43.65,d3673b75-ec8f-4c2e-8c9b-6ef1d951f978,32.56,Sentinel Stroke National Audit Programme Clinical Dataset,Not Rated,34.92,ALLIANCE > HQIP
71.43,Bronze,63.49,75.25,71.43,d3a3935f-b28e-4e74-9b15-9432d611f26c,20.93,MFT Biobank,Bronze,20.63,ALLIANCE > TISSUE DIRECTORY
59.52,Bronze,52.38,69.3,65.08,d3e859ba-cfb0-4eda-a14c-34b08d113cd9,20.93,Strategy introducing Pulmonary Rehabilitation for COPD management in rural India,Not Rated,22.22,HUBS > BREATHE
16.67,Not Rated,14.29,38.57,37.3,d3fd4dac-2d15-401c-8185-905ee108d9ce,39.53,JANUS,Not Rated,39.68,Oxford University Hospitals NHS Foundation Trust
71.43,Bronze,63.49,75.25,71.43,d51de39c-153a-462b-8de5-cd1424908e0c,20.93,UK ME/CFS Biobank,Bronze,20.63,ALLIANCE > TISSUE DIRECTORY
66.67,Bronze,57.14,74.03,68.25,d5446d68-2fb9-4f0f-962e-7b7ed484d534,18.6,Exploration of Pneumonia Related Policy Formation and Implementation in Pakistan,Bronze,20.63,HUBS > BREATHE
26.19,Not Rated,22.22,46.81,43.65,d546521a-79be-4a53-83bd-ff008bda6171,32.56,Birmingham Out of Hours Research Database,Not Rated,34.92,HUBS > PIONEER
16.67,Not Rated,14.29,38.57,37.3,d57a096a-4fa3-4529-b508-0b9df0f1893c,39.53,OUH Patient Master Index,Not Rated,39.68,Oxford University Hospitals NHS Foundation Trust
71.43,Bronze,63.49,75.25,71.43,d5ab658e-b474-4e22-95f8-92607c40792d,20.93,NHS Grampian Biorepository,Bronze,20.63,ALLIANCE > TISSUE DIRECTORY
88.1,Silver,92.06,78.94,84.12,d7ec9584-cba3-46f9-9ef4-b1cb9eef2e7c,30.23,Health and Lifestyle Questionnaire,Silver,23.81,ALLIANCE > NIHR BIORESOURCE
66.67,Bronze,74.6,67.06,71.42,d83cc514-3e36-41a8-b9bc-c288265e66cf,32.56,Civil Registration - Deaths,Bronze,31.75,HUBS > NHS DIGITRIALS
33.33,Not Rated,31.75,45.73,46.83,d90830f4-5aaa-4075-8c8d-839627224d16,41.86,Cancer Patient Experience Survey (CPES) for CPRD Aurum,Not Rated,38.1,ALLIANCE > CPRD
61.9,Bronze,53.97,69.32,65.88,d936d21f-6b78-470c-b623-6d1213f2a041,23.26,Outpatient Appointments and Attendances - Scottish Morbidity Record (SMR00),Not Rated,22.22,ALLIANCE > SCOTLAND
26.19,Not Rated,22.22,47.98,45.23,da4d3e21-3d81-49e9-ada0-6175e2341190,30.23,National Vascular Registry -  Abdominal Aortic Aneurysm Repair clinical dataset,Not Rated,31.75,ALLIANCE > HQIP
64.29,Not Rated,77.78,58.89,65.88,db113fcd-69a0-4357-9c6d-250085deb3f5,46.51,Mental Health Minimum Dataset v4.1 (Sensitive) Events,Not Rated,46.03,NHS Digital
69.05,Bronze,60.32,75.22,70.64,dd7e56e7-2683-4b88-bed2-3a27ef3e4c9e,18.6,interNational Anaplastic Thyroid Cancer Tissue Bank (iNATT),Bronze,19.05,ALLIANCE > TISSUE DIRECTORY
26.19,Not Rated,22.22,47.98,45.23,ddc965e7-6f52-4eed-bed5-657e3e7bbeac,30.23,National Vascular Registry Audit Carotid Endarterectomy Clinical Dataset,Not Rated,31.75,ALLIANCE > HQIP
21.43,Not Rated,17.46,43.28,40.48,de1179eb-89fe-45a3-9e3c-e54a2a36ebf0,34.88,NHS Digital data,Not Rated,36.51,ALLIANCE > NIHR BIORESOURCE
26.19,Not Rated,22.22,46.81,44.45,de19b3ea-2600-4472-85e8-628e7beff76e,32.56,National Bowel Cancer Audit -  Organisational Survey dataset,Not Rated,33.33,ALLIANCE > HQIP
80.95,Silver,71.43,85.83,80.96,def6669b-0fac-485c-84b2-2ea83ec31123,9.3,UK Lung Volume Reduction Surgery,Silver,9.52,HUBS > BREATHE
57.14,Bronze,50.79,66.94,64.28,df63bdd2-712d-478e-8aae-36d01158a440,23.26,National Records of Scotland (NRS) - Deaths Data,Not Rated,22.22,ALLIANCE > SCOTLAND
64.29,Bronze,55.56,71.68,65.88,df63e893-f688-4bb4-956c-cc4354bb4001,20.93,Klang Asthma Cohort,Not Rated,23.81,HUBS > BREATHE
16.67,Not Rated,14.29,38.57,37.3,dfb21b3b-7fd9-40c4-892e-810edd6dfc25,39.53,Admitted Patient Care Dataset,Not Rated,39.68,Oxford University Hospitals NHS Foundation Trust
95.24,Silver,100.0,84.83,88.89,e0c871f9-b63c-43a5-9fd6-e5731dae2343,25.58,GENOMICS ENGLAND 100K PHE LINKED DATA,Gold,22.22,ALLIANCE > GENOMICS ENGLAND
95.24,Gold,100.0,91.81,95.24,e0ed59e2-8fb5-44d4-b694-f31d46884954,11.63,Brecon dataset,Gold,9.52,ALLIANCE > SAIL
26.19,Not Rated,22.22,47.98,45.23,e10660af-b420-4e25-8fc9-ea451da1dcfb,30.23,National Oesophago-Gastric Cancer Audit - clinical dataset,Not Rated,31.75,ALLIANCE > HQIP
26.19,Not Rated,22.22,47.98,45.23,e38c8d6c-8655-4432-b654-23f89c0bb495,30.23,National Joint Registry - Primary Ankle Replacement dataset,Not Rated,31.75,ALLIANCE > HQIP
95.24,Silver,100.0,85.99,86.51,e432737f-43c0-43c1-aef5-71cb204d770c,23.26,Cystic Fibrosis Patient Tendon Rupture,Gold,26.98,ALLIANCE > CYSTIC FIBROSIS
28.57,Not Rated,23.81,49.17,45.24,e516a359-74a8-4932-b4df-f2cf75eef89d,30.23,Unified Cohorts Research Network,Not Rated,33.33,HUBS > BREATHE
95.24,Silver,100.0,84.83,86.51,e66b726f-8e58-4411-be32-1d00ba1df13f,25.58,Cystic Fibrosis Patient Sweat Tests,Gold,26.98,ALLIANCE > CYSTIC FIBROSIS
69.05,Bronze,60.32,74.06,69.84,e678366e-bb53-4dbb-a228-05114e0b6eb3,20.93,Biobank for patients with retinal degenerations & dystrophies,Bronze,20.63,ALLIANCE > TISSUE DIRECTORY
92.86,Silver,96.83,85.97,88.1,e85e5c8c-b6be-4e8b-8a0b-13b785b457a2,20.93,North West London Community Data (NWL COM),Gold,20.63,HUBS > DISCOVER NOW
69.05,Bronze,60.32,74.06,69.84,e8f23004-f1f7-4a36-859f-25af6ca6433b,20.93,University of Liverpool - GCP Laboratory Facility,Bronze,20.63,ALLIANCE > TISSUE DIRECTORY
16.67,Not Rated,14.29,39.73,38.89,e8f5b1b5-2c08-439a-b337-70b454aa40f3,37.21,"NHS Tayside, A&E Drugs given during an A&E visit",Not Rated,36.51,ALLIANCE > DUNDEE
76.19,Bronze,66.67,75.31,71.43,ea07f115-9f70-4c21-a373-247a1ca906f0,25.58,Research Donors Ltd,Bronze,23.81,ALLIANCE > TISSUE DIRECTORY
16.67,Not Rated,14.29,38.57,37.3,eaca9ed1-30b6-4157-8894-8e53efc84849,39.53,Sunquest,Not Rated,39.68,Oxford University Hospitals NHS Foundation Trust
71.43,Silver,63.49,76.42,72.22,eb19fcd9-2e9e-4e27-aa79-ad235952b1ac,18.6,Tommy's National Reproductive Health Biobank,Bronze,19.05,ALLIANCE > TISSUE DIRECTORY
95.24,Silver,100.0,85.99,91.27,ecbe7275-82b5-43cd-9401-fd7ef4b55341,23.26,GENOMICS ENGLAND 100K QUICK VIEW,Gold,17.46,ALLIANCE > GENOMICS ENGLAND
59.52,Bronze,52.38,69.3,65.08,ecc4daf2-e58a-4ebc-9608-4bc741231fb9,20.93,"Introducing pulse oximetry in IMNCI, primary health facilities in Pune India",Not Rated,22.22,HUBS > BREATHE
16.67,Not Rated,14.29,39.73,38.89,edaf29f4-9857-4bb0-97b9-ae88b70a2a3c,37.21,Fife Microbiology: Isolations,Not Rated,36.51,ALLIANCE > DUNDEE
78.57,Silver,68.25,78.82,73.81,edc8f0c6-64f8-4f6d-a1dd-41e05033d54e,20.93,Its Not JUST Idiopathic pulmonary fibrosis Study (INJUSTIS),Bronze,20.63,HUBS > BREATHE
71.43,Bronze,63.49,75.25,71.43,ee5f4405-6930-4a7b-ba00-85a8e8c8a8b9,20.93,QTL Programme at MRC HGU,Bronze,20.63,ALLIANCE > TISSUE DIRECTORY
95.24,Gold,100.0,90.64,95.24,ee78ce42-7f1f-4c97-80cc-ea6ad628e5da,13.95,National Survey for Wales,Gold,9.52,ALLIANCE > SAIL
71.43,Bronze,63.49,75.25,71.43,eea147a4-4576-4f86-8ad1-c762137335fd,20.93,Manchester Cancer Research Centre (MCRC) Biobank,Bronze,20.63,ALLIANCE > TISSUE DIRECTORY
95.24,Gold,100.0,90.64,93.65,eebb647a-63eb-4e62-b052-26cb2eb4799d,13.95,Emergency Department Dataset Daily,Gold,12.7,ALLIANCE > SAIL
83.33,Silver,90.48,77.71,84.13,ef42201e-deb1-4675-896a-8a0162fe52a8,27.91,CPRD Aurum,Silver,22.22,ALLIANCE > CPRD
26.19,Not Rated,22.22,46.81,43.65,efbb3bf4-834b-417e-b002-03fc41715e58,32.56,National Cardiac Audit Programme - National Heart Failure Audit,Not Rated,34.92,ALLIANCE > HQIP
92.86,Gold,98.41,89.45,92.85,efc2bb06-d502-4424-ac92-72834459fbaa,13.95,COVID-19 Consolidated Deaths,Gold,12.7,ALLIANCE > SAIL
26.19,Not Rated,22.22,45.66,42.86,f075ceb7-5bed-4e6b-8e83-211aee945356,34.88,Society for Acute Medicine Benchmarking Audit,Not Rated,36.51,HUBS > PIONEER
23.81,Not Rated,20.63,44.47,42.06,f1a85970-bddc-499b-92e9-783706c60995,34.88,SNP imputation data,Not Rated,36.51,ALLIANCE > NIHR BIORESOURCE
69.05,Bronze,60.32,72.89,69.05,f1a93b8f-6332-43a2-b2da-c86f68f7d24a,23.26,Manchester Eye Tissue Repository,Bronze,22.22,ALLIANCE > TISSUE DIRECTORY
88.1,Silver,92.06,76.61,79.37,f1d3b068-7dd0-4a28-bd64-3519dd104eb6,34.88,Case report form,Silver,33.33,ALLIANCE > NIHR BIORESOURCE
61.9,Not Rated,57.14,63.51,62.7,f202a9da-f036-4e8c-a069-a20ff6c8a9e1,34.88,PIONEER - Genomics Patients and related data,Not Rated,31.75,HUBS > PIONEER
50.0,Not Rated,63.49,54.07,65.08,f3a53f7a-ea93-4b9e-bccd-afe762259044,41.86,Practice postcode linked deprivation measures for CPRD Aurum,Not Rated,33.33,ALLIANCE > CPRD
26.19,Not Rated,22.22,47.98,45.23,f3ade619-292e-4631-916a-9cd9d7938e48,30.23,The Leicester City and County Chronic Kidney Disease Cohort,Not Rated,31.75,ALLIANCE > LEICESTER
69.05,Bronze,60.32,72.89,69.05,f42b9fa6-adad-4637-943e-6fa7508559a3,23.26,Bristol Biobank,Bronze,22.22,ALLIANCE > TISSUE DIRECTORY
71.43,Bronze,63.49,72.93,69.05,f4915e4b-639c-45ae-9b0f-afab547e1104,25.58,National Joint Registry - Primary Knee Replacement dataset,Bronze,25.4,ALLIANCE > HQIP
69.05,Bronze,60.32,74.06,69.84,f5b57b56-a4ed-46d4-825f-d181e8db809d,20.93,Leeds NIHR Biomarker Research Tissue Bank,Bronze,20.63,ALLIANCE > TISSUE DIRECTORY
69.05,Bronze,60.32,72.89,69.05,f5ed34fa-154a-4613-a253-277547cfd8ca,23.26,Oxford Musculoskeletal Biobank,Bronze,22.22,ALLIANCE > TISSUE DIRECTORY
69.05,Bronze,60.32,72.89,69.05,f621fcc9-e9ab-4da4-bd34-e4530d11b59d,23.26,NIHR Exeter Clinical Research Facility,Bronze,22.22,ALLIANCE > TISSUE DIRECTORY
26.19,Not Rated,22.22,47.98,45.23,f69d1b15-a0b4-461a-8aff-dba56da0791f,30.23,National Diabetes Inpatient Audit - Harms clinical dataset,Not Rated,31.75,ALLIANCE > HQIP
69.05,Bronze,60.32,74.06,69.84,f72798fb-d168-4c3c-abce-f8300cbcb8b3,20.93,Generation Scotland,Bronze,20.63,ALLIANCE > TISSUE DIRECTORY
59.52,Bronze,52.38,66.97,64.28,f79d91c1-981e-4389-8626-b2cef391cf90,25.58,Scottish Cancer Registry (SMR06),Not Rated,23.81,ALLIANCE > SCOTLAND
83.33,Silver,88.89,76.55,80.95,f7c563c0-9625-47be-a070-c121fe734f3c,30.23,SNP chip data,Silver,26.98,ALLIANCE > NIHR BIORESOURCE
26.19,Not Rated,22.22,47.98,45.23,f806fe65-79aa-4843-bc56-a08bf14ffcec,30.23,National Maternity and Perinatal Audit clinical audit,Not Rated,31.75,ALLIANCE > HQIP
26.19,Not Rated,22.22,46.81,44.45,f82b8ca5-5a52-4502-bf78-cfbb718cbe2f,32.56,"Maternal, Newborn and Infant Clinical Outcome Review Programme - perinatal surveillance dataset",Not Rated,33.33,ALLIANCE > HQIP
90.48,Gold,95.24,88.27,91.27,f89af2f4-e3cd-4eaa-835d-94aa347d8a92,13.95,National Neonatal Research Database,Gold,12.7,ALLIANCE > IMPERIAL COLLEGE LONDON
16.67,Not Rated,14.29,38.57,37.3,f8bab14a-bc9b-4dd1-a6c6-c57588605849,39.53,Maternity Services Dataset,Not Rated,39.68,ALLIANCE > BARTS
69.05,Bronze,60.32,74.06,69.84,f8f6e9ea-65c0-48a6-9beb-6de80bbbefda,20.93,Multiple Sclerosis and Parkinson's Tissue Bank,Bronze,20.63,ALLIANCE > TISSUE DIRECTORY
76.19,Bronze,66.67,75.31,70.63,f908efd6-c6ac-448b-89b9-222c50aec7c8,25.58,SpiroMeta Consortium Dataset,Bronze,25.4,HUBS > BREATHE
71.43,Silver,63.49,76.42,72.22,f9a712ae-9d41-41a6-b2ca-3127441b03ac,18.6,UCL / UCLH Biobank for Studying Health and Disease,Bronze,19.05,ALLIANCE > TISSUE DIRECTORY
71.43,Bronze,63.49,72.93,69.84,f9f3af0d-ca1c-4e8f-b5e8-20962e1e7b4e,25.58,"St Thomas' Hospitals Plasma, serum & DNA Bio bank from patients with antiphospholipid antibodies",Bronze,23.81,ALLIANCE > TISSUE DIRECTORY
26.19,Not Rated,22.22,46.81,43.65,faf7ec31-999a-4d87-9d6d-8837ff2fa486,32.56,National Cardiac Audit Programme - National Adult Cardiac Surgery Audit (NACSA),Not Rated,34.92,ALLIANCE > HQIP
16.67,Not Rated,14.29,38.57,37.3,fc7b44f0-eb69-4257-8c07-7516c1210c46,39.53,CellPath,Not Rated,39.68,Oxford University Hospitals NHS Foundation Trust
71.43,Bronze,63.49,75.25,71.43,fcee6c99-a4bd-44b8-a28e-dc63337ce216,20.93,eLIXIR - Early Life Data Cross-Linkage in Research,Bronze,20.63,ALLIANCE > TISSUE DIRECTORY
95.24,Gold,100.0,91.81,95.24,fe3c7527-e802-4a51-9aa2-19e7d4d22783,11.63,National Exercise Referral Scheme,Gold,9.52,ALLIANCE > SAIL
26.19,Not Rated,22.22,47.98,45.23,fe4662ad-9080-4bd8-8de4-51195d275d5b,30.23,National Joint Registry - Primary Shoulder Replacement dataset,Not Rated,31.75,ALLIANCE > HQIP
26.19,Not Rated,22.22,45.66,42.86,fe872375-2401-4de1-9650-d4139cf5793a,34.88,National Paediatric Diabetes Audit - Parent and Patient Recorded Experience measures,Not Rated,36.51,ALLIANCE > HQIP
92.86,Gold,98.41,89.45,94.44,fea0b4be-4097-4c2e-86f2-03dc1ee2877b,13.95,Welsh Dispensing Dataset,Gold,9.52,ALLIANCE > SAIL
64.29,Not Rated,77.78,58.89,65.88,ff2c6982-00f3-4483-9fc2-19b3a7211d8d,46.51,Mental Health Minimum Dataset v4 (Non-Sensitive) Records,Not Rated,46.03,NHS Digital
64.29,Bronze,55.56,72.84,67.47,ffc34689-1a81-4f56-9c3f-e62b76d8445b,18.6,Teleconsultation in remote rural India: management of COPD and Asthma,Bronze,20.63,HUBS > BREATHE
