quality_rating,publisher,weighted_quality_score,quality_score,title,error_percent,weighted_quality_rating,completeness_percent,weighted_error_percent,weighted_completeness_percent,id
Not Rated,ALLIANCE > HQIP,42.86,45.66,National Paediatric Diabetes Audit - Parent and Patient Recorded Experience measures,34.88,Not Rated,26.19,36.51,22.22,fe872375-2401-4de1-9650-d4139cf5793a
Gold,ALLIANCE > SAIL,94.44,89.45,Welsh Dispensing Dataset,13.95,Gold,92.86,9.52,98.41,fea0b4be-4097-4c2e-86f2-03dc1ee2877b
Bronze,ALLIANCE > SCOTLAND,69.05,72.89,National Records of Scotland (NRS) - Deaths Data,23.26,Bronze,69.05,23.81,61.9,ff0500de-acdf-4db6-b12f-263324696d47
Not Rated,NHS Digital,65.88,58.89,Mental Health Minimum Dataset v4 (Non-Sensitive) Records,46.51,Not Rated,64.29,46.03,77.78,ff2c6982-00f3-4483-9fc2-19b3a7211d8d
Bronze,HUBS > BREATHE,67.47,72.84,Teleconsultation in remote rural India: management of COPD and Asthma,18.6,Bronze,64.29,20.63,55.56,ffc34689-1a81-4f56-9c3f-e62b76d8445b
