error_percent,weighted_error_percent,weighted_quality_score,completeness_percent,title,weighted_quality_rating,publisher,quality_rating,weighted_completeness_percent,id,quality_score
18.6,19.05,70.64,69.05,MDSBio,Bronze,ALLIANCE > TISSUE DIRECTORY,Bronze,60.32,9f45db59-b3c9-4c33-85bf-25c1b5242903,75.22
32.56,34.92,43.65,26.19,National Early Inflammatory Arthritis Audit - patient survey,Not Rated,ALLIANCE > HQIP,Not Rated,22.22,a05443cd-e292-4b5f-b1f1-95718e300d46,46.81
46.51,39.68,61.11,50.0,Cancer registration data for CPRD GOLD,Not Rated,ALLIANCE > CPRD,Not Rated,61.9,a0dad23c-c02d-4347-92ef-0019fa59eb3e,51.75
46.51,49.21,74.6,92.86,HIC Transplantation,Bronze,NIHR Health Informatics Collaborative Renal Transplantation Theme,Bronze,98.41,a0e0c0c2-072a-47ac-9252-e27b37ac024f,73.17
27.91,25.4,75.39,66.67,Hospital Episode Statistics Accident and Emergency,Bronze,HUBS > NHS DIGITRIALS,Bronze,76.19,a104ba06-be82-4f2d-b177-f13948643f84,69.38
46.51,46.03,65.88,64.29,Mental Health Minimum Dataset v4.1 (Non-Sensitive) Events,Not Rated,NHS Digital,Not Rated,77.78,a1a67182-e81b-4144-ac51-92a86f277eb2,58.89
20.93,20.63,69.84,69.05,Cam-UroOnc Biorepository,Bronze,ALLIANCE > TISSUE DIRECTORY,Bronze,60.32,a1f9315e-8561-4e7b-b1a7-1276bdeca14d,74.06
20.93,20.63,69.84,69.05,ICON9 Trial,Bronze,ALLIANCE > TISSUE DIRECTORY,Bronze,60.32,a2d94442-91c1-4626-b28f-700eb436a4c1,74.06
39.53,39.68,37.3,16.67,Freetext Dataset,Not Rated,ALLIANCE > BARTS,Not Rated,14.29,a429e699-4650-4feb-9392-f24aa3a3b7b6,38.57
25.58,23.81,71.43,76.19,Sheffield Brain Tissue Bank (SBTB),Bronze,ALLIANCE > TISSUE DIRECTORY,Bronze,66.67,a49a1145-4334-4c2a-81cb-90155e8f05c6,75.31
23.26,22.22,69.05,69.05,plasmaMATCH,Bronze,ALLIANCE > TISSUE DIRECTORY,Bronze,60.32,a617a37d-1813-49ad-8282-38169981a095,72.89
39.53,39.68,37.3,16.67,Community Services Dataset,Not Rated,ALLIANCE > BARTS,Not Rated,14.29,a675ac5e-ecc2-4899-9c3c-65c2f36432c5,38.57
23.26,22.22,69.05,69.05,UK primary Sjogren's syndrome Registry,Bronze,ALLIANCE > TISSUE DIRECTORY,Bronze,60.32,a6fb087d-1a90-4db0-9fcf-323c5b3cce51,72.89
23.26,22.22,70.64,71.43,Central England Haemato-oncology and oncology Research Biobank (CEHRB),Bronze,ALLIANCE > TISSUE DIRECTORY,Bronze,63.49,a7209348-c011-44d0-9c4f-35a2014c2542,74.09
39.53,39.68,37.3,16.67,LIMS,Not Rated,Oxford University Hospitals NHS Foundation Trust,Not Rated,14.29,a74f72ad-bf70-42e4-8933-069c7b53c7f9,38.57
48.84,44.44,59.53,50.0,Quality of Life of Colorectal Cancer Survivors in England: Patient Reported Outcome Measures Survey for CPRD Aurum,Not Rated,ALLIANCE > CPRD,Not Rated,63.49,a772b8dd-cb93-4f27-a349-329992e0b212,50.58
34.88,36.51,42.86,26.19,National Asthma and COPD Audit Programme (NACAP): primary care workstream resources,Not Rated,ALLIANCE > HQIP,Not Rated,22.22,a895be78-f41c-40b8-b2fa-678a071a6427,45.66
46.51,46.03,65.88,64.29,Mental Health Minimum Dataset v3_3.5 (Non-Sensitive),Not Rated,NHS Digital,Not Rated,77.78,aa019da2-0f2f-493c-95e8-7263ee735f46,58.89
32.56,28.57,74.61,69.05,HES Diagnostic Imaging Dataset for CPRD GOLD,Bronze,ALLIANCE > CPRD,Bronze,77.78,aa8c53e8-f91f-41f7-9522-7e2462a9a84b,68.25
41.86,36.51,69.05,61.9,Mental Health Minimum Data Set,Bronze,NHS Digital,Not Rated,74.6,acafb160-b18a-436e-90f1-dc4530a90267,60.02
20.93,20.63,69.84,69.05,REQUITE,Bronze,ALLIANCE > TISSUE DIRECTORY,Bronze,60.32,ace79a9e-1552-4287-9f6e-9d01f628252b,74.06
20.93,20.63,71.43,71.43,Cardiff University Biobank,Bronze,ALLIANCE > TISSUE DIRECTORY,Bronze,63.49,ad5c7693-983e-4f32-a979-9ab550f2084a,75.25
23.26,25.4,57.94,50.0,Optimum Patient Care Research Database,Not Rated,HUBS > BREATHE,Not Rated,41.27,ae4b8371-d037-46e8-bdcd-bf3de08ef38e,63.37
20.93,20.63,69.84,69.05,Cambridge Blood and Stem Cell Biobank,Bronze,ALLIANCE > TISSUE DIRECTORY,Bronze,60.32,ae4f0589-8679-48a1-ad04-2324a5001869,74.06
30.23,31.75,45.23,26.19,National Audit of Care at the End of Life - Quality Survey,Not Rated,ALLIANCE > HQIP,Not Rated,22.22,aeb2f1ea-c914-4b30-94c8-9fd3eb51b288,47.98
23.26,26.98,86.51,95.24,Cystic Fibrosis Patient NTM culture,Gold,ALLIANCE > CYSTIC FIBROSIS,Silver,100.0,af148400-1ec6-436d-910e-45350a54c390,85.99
18.6,20.63,67.47,64.29,Community perception on public health measures for COVID-19 prevention/control,Bronze,HUBS > BREATHE,Bronze,55.56,af238430-c257-4d60-9ff0-1de6b825f09e,72.84
16.28,12.7,92.06,92.86,North West London Coordinate My Care (NWL CMC),Gold,HUBS > DISCOVER NOW,Gold,96.83,af660e81-bb96-4e85-99a8-b85147c6ba79,88.29
20.93,20.63,71.43,71.43,RAPPER,Bronze,ALLIANCE > TISSUE DIRECTORY,Bronze,63.49,b0886a0c-7ddc-4c2b-a499-afd7262fbe56,75.25
25.58,22.22,88.89,95.24,GENOMICS ENGLAND 100K RARE DISEASE & COMMON,Gold,ALLIANCE > GENOMICS ENGLAND,Silver,100.0,b0a8085e-8cf0-45ee-b4a6-12a4a545ca70,84.83
37.21,36.51,38.89,16.67,Patient SIMD Postcode,Not Rated,ALLIANCE > DUNDEE,Not Rated,14.29,b2124786-9658-40cc-b5a3-6624885ce490,39.73
18.6,15.87,90.48,92.86,North West London Patient Index (NWL PI),Gold,HUBS > DISCOVER NOW,Gold,96.83,b232b32f-07d4-4fce-85a0-3834efd8757a,87.13
18.6,14.29,91.27,92.86,North West London Admitted Patient Care Data (NWL APC),Gold,HUBS > DISCOVER NOW,Gold,96.83,b339ea90-c3dd-44d8-a968-88eba9e3edb3,87.13
18.6,19.05,72.22,71.43,York Tissue Bank,Bronze,ALLIANCE > TISSUE DIRECTORY,Silver,63.49,b36202ad-7652-460c-8389-baa1a1c1ac46,76.42
23.26,22.22,69.05,69.05,HCV Research UK,Bronze,ALLIANCE > TISSUE DIRECTORY,Bronze,60.32,b3a10154-a409-491a-92fb-e7fac47ccd91,72.89
41.86,42.86,78.57,95.24,HIC ICU 8.3.2,Silver,NIHR Health Informatics Collaborative Critical Care Theme,Silver,100.0,b40777a2-468b-4b45-8b7d-2f62f912e950,76.69
39.53,39.68,37.3,16.67,CDE Surginet Documentation,Not Rated,ALLIANCE > BARTS,Not Rated,14.29,b41bb360-f2ed-49f0-a45b-b2fb05321975,38.57
44.19,38.1,61.11,47.62,Systemic Anti-Cancer Treatment (SACT) data for CPRD Aurum,Not Rated,ALLIANCE > CPRD,Not Rated,60.32,b4f6a5c2-e652-4972-9d06-510e9a469dfe,51.72
46.51,46.03,64.28,61.9,Mental Health Minimum Dataset v4.1 (Non-Sensitive) Episodes,Not Rated,NHS Digital,Not Rated,74.6,b53f716d-a5c3-4ad8-a2aa-cae09c12ac18,57.7
20.93,20.63,69.84,69.05,MRC Brain Banks Network,Bronze,ALLIANCE > TISSUE DIRECTORY,Bronze,60.32,b717d41e-9202-40ed-be1a-882ec0c47761,74.06
27.91,26.98,67.46,69.05,Tissue Solutions Ltd,Bronze,ALLIANCE > TISSUE DIRECTORY,Bronze,61.9,b730442a-72f3-4b0d-8ad3-4bdba046df7a,70.57
27.91,28.57,84.13,92.86,Yorkshire Specialist Register of Cancer in Children and Young People,Silver,HUBS > DATA-CAN,Silver,96.83,b765d514-1642-4762-a521-73463c977094,82.47
23.26,22.22,70.64,71.43,TRICON8,Bronze,ALLIANCE > TISSUE DIRECTORY,Bronze,63.49,b796b821-97cf-4aa1-bbc7-53e3c1fbc33f,74.09
37.21,36.51,38.89,16.67,Tayside Radiology,Not Rated,ALLIANCE > DUNDEE,Not Rated,14.29,b8107ec3-ba35-45ee-8231-cb610fe2ce48,39.73
37.21,36.51,38.89,16.67,NHS Tayside and Fife Haematology (Lab Data Restructured),Not Rated,ALLIANCE > DUNDEE,Not Rated,14.29,b9a2fe09-60b3-48a4-b252-9ed04a7dcc66,39.73
46.51,46.03,65.88,64.29,Mental Health Minimum Dataset v4 (Non-Sensitive) Events,Not Rated,NHS Digital,Not Rated,77.78,ba071b0b-5ef4-457b-b194-3a69c2c71a06,58.89
18.6,20.63,66.67,61.9,Assessment of ASHA’s workload and its determinants,Bronze,HUBS > BREATHE,Bronze,53.97,bab944af-e345-4893-8640-a88aaff97c72,71.65
16.28,12.7,92.06,92.86,North West London Primary Care Events Data (NWL PCE),Gold,HUBS > DISCOVER NOW,Gold,96.83,bc2d2a17-0f36-4cb0-85d3-b54e64460d75,88.29
41.86,33.33,65.08,50.0,Patient postcode linked deprivation measures for CPRD GOLD,Not Rated,ALLIANCE > CPRD,Not Rated,63.49,bc6ae5bc-7175-49e2-b093-337dde427736,54.07
20.93,20.63,69.84,69.05,Wales Cancer Bank,Bronze,ALLIANCE > TISSUE DIRECTORY,Bronze,60.32,bcfdc597-1bf0-41c2-8b68-779f9a115f83,74.06
46.51,46.03,65.88,64.29,Mental Health & Learning Disabilities Dataset v 1 (Sensitive) Events,Not Rated,NHS Digital,Not Rated,77.78,bdc17b2c-8b0f-4959-ab9b-e2de32d8a5f9,58.89
44.19,38.1,65.87,54.76,Mother-Baby Link for CPRD GOLD,Not Rated,ALLIANCE > CPRD,Not Rated,69.84,bdcbbb2b-df99-4ae7-b36e-f266cfe10ed3,55.28
30.23,31.75,45.23,26.19,National Joint Registry - Revision Shoulder Replacement dataset,Not Rated,ALLIANCE > HQIP,Not Rated,22.22,bddcc89d-028f-48a5-b568-7dccd574563b,47.98
16.28,19.05,69.84,69.05,4 LMIC Asian Country ChrOnic: estimating respiratory disease burden in adults,Bronze,HUBS > BREATHE,Silver,58.73,be9bf427-d96d-4b1a-b1d1-83bdc3e8790b,76.38
41.86,41.27,36.51,16.67,TheatreEvents,Not Rated,Oxford University Hospitals NHS Foundation Trust,Not Rated,14.29,bf83ada4-b72e-4789-b177-12a53aa763ea,37.41
25.58,20.63,83.34,80.95,Mental Health Inpatient and Day Case - Scottish Morbidity Record (SMR04),Silver,ALLIANCE > SCOTLAND,Silver,87.3,bfc6e7c5-a81b-4fe2-95b5-d108a48d7d67,77.69
11.63,7.94,95.23,92.86,Daily Situation Report Data,Gold,ALLIANCE > SAIL,Gold,98.41,c0da6801-6907-4c06-8fba-d21943c3a931,90.62
25.58,25.4,69.05,71.43,UCL Infection DNA Bank,Bronze,ALLIANCE > TISSUE DIRECTORY,Bronze,63.49,c10d6c3a-e405-4ee9-828f-02443c210879,72.93
30.23,33.33,45.24,28.57,Vitamin D supplementation meta-analyses,Not Rated,HUBS > BREATHE,Not Rated,23.81,c16605d7-6e6e-4461-bfab-107660e31427,49.17
18.6,19.05,70.64,69.05,STAMPEDE,Bronze,ALLIANCE > TISSUE DIRECTORY,Bronze,60.32,c182a3b6-8eea-43ef-be18-6cd444f150dc,75.22
16.28,14.29,91.27,92.86,North West London Primary Care Prescriptions Data (NWL PCP),Gold,HUBS > DISCOVER NOW,Gold,96.83,c1f947c3-4956-4e0b-93ef-23ce9abda000,88.29
37.21,36.51,38.89,16.67,Fife Radiology,Not Rated,ALLIANCE > DUNDEE,Not Rated,14.29,c22d8356-d51b-4d34-aadf-ed356d15fe46,39.73
18.6,20.63,68.25,66.67,Assessing the eDPSEEA model in seasonal pollen induced asthma in Islamabad,Bronze,HUBS > BREATHE,Bronze,57.14,c2548017-7913-40e1-bf98-aaa2e907b0ea,74.03
37.21,36.51,38.89,16.67,Tayside Bowel Screening Dataset,Not Rated,ALLIANCE > DUNDEE,Not Rated,14.29,c275f19e-2373-43dc-8e83-3318aaf8bfa4,39.73
18.6,19.05,73.02,73.81,Arden Tissue Bank,Bronze,ALLIANCE > TISSUE DIRECTORY,Silver,65.08,c29c3fbe-700e-4f85-8943-5557c30c1dfa,77.61
32.56,33.33,45.24,28.57,Genvasc Primary Care Data,Not Rated,ALLIANCE > LEICESTER,Not Rated,23.81,c324246a-22d9-45d8-9a7a-a513078be2d1,48.0
32.56,34.92,43.65,26.19,Sentinel Stroke National Audit Programme Acute Organisational survey dataset,Not Rated,ALLIANCE > HQIP,Not Rated,22.22,c3d84dfa-fe3a-4b86-a0f5-efbe45aa93ad,46.81
6.98,3.17,98.41,95.24,COVID-19 Symptom Tracker Dataset,Gold,ALLIANCE > SAIL,Gold,100.0,c42ceb2a-c9c2-491d-9f34-3da55413225f,94.13
13.95,15.87,76.98,78.57,UK BiLEVE Consortium Dataset,Silver,HUBS > BREATHE,Silver,69.84,c43363e5-a2cd-4990-a425-733dfe559a4f,82.31
32.56,28.57,74.61,69.05,HES Accident and Emergency data for CPRD GOLD,Bronze,ALLIANCE > CPRD,Bronze,77.78,c55b92d8-889d-435c-b0cb-2d9f7b432839,68.25
34.88,30.16,73.81,69.05,Death Registration data for CPRD Aurum,Bronze,ALLIANCE > CPRD,Bronze,77.78,c577669a-a84f-493e-8164-3fe02f618561,67.09
32.56,33.33,44.45,26.19,National Audit of Psychosis - Audit on Early Intervention in Psychosis services - contextual data,Not Rated,ALLIANCE > HQIP,Not Rated,22.22,c5994fae-9c4a-47eb-ba42-85bd76e92879,46.81
41.86,33.33,65.08,50.0,Practice postcode linked deprivation measures for CPRD GOLD,Not Rated,ALLIANCE > CPRD,Not Rated,63.49,c6117afd-bc4d-404b-8d58-9d87db936b4c,54.07
23.26,23.81,68.25,69.05,Barts CTU,Bronze,ALLIANCE > TISSUE DIRECTORY,Bronze,60.32,c6d6bbd3-74ed-46af-841d-ac5e05f4da41,72.89
16.28,12.7,93.65,95.24,COG-UK Viral Genome Sequences,Gold,OTHER > COG-UK,Gold,100.0,c6dc78fa-1543-4fbf-87d8-a3f48e7de813,89.48
46.51,46.03,65.88,64.29,Mental Health & Learning Disabilities Dataset v 1 (Non-Sensitive) Episodes,Not Rated,NHS Digital,Not Rated,77.78,c713773c-e961-400e-b44a-947002deb073,58.89
27.91,25.4,75.39,66.67,Hospital Episode Statistics Outpatients,Bronze,HUBS > NHS DIGITRIALS,Bronze,76.19,c720c89a-b2c6-4cd6-b606-df34ff22b1c8,69.38
23.26,22.22,70.64,73.81,RATHL Trial,Bronze,ALLIANCE > TISSUE DIRECTORY,Bronze,63.49,c83d2206-3778-400b-9b26-27c7588af930,75.28
16.28,15.87,92.06,95.24,COVID-19 Shielded People list,Gold,ALLIANCE > SAIL,Gold,100.0,c84321f3-caf3-4b40-a41a-5ccebe5bb1aa,89.48
37.21,36.51,38.89,16.67,NHS Tayside and Fife Virology,Not Rated,ALLIANCE > DUNDEE,Not Rated,14.29,c8ed8784-91ce-4823-8e80-fa3a4b732e11,39.73
46.51,46.03,65.88,64.29,Mental Health Minimum Dataset v4.1 (Non-Sensitive) Records,Not Rated,NHS Digital,Not Rated,77.78,c97b8058-a6a4-4c8d-92e1-6e9f4cddd301,58.89
30.23,31.75,45.23,26.19,National Audit of Care at the End of Life - case note review,Not Rated,ALLIANCE > HQIP,Not Rated,22.22,cabb1db1-ee3e-42ce-a40b-468282e2011d,47.98
32.56,34.92,43.65,26.19,National Early Inflammatory Arthritis Audit - organisational survey dataset,Not Rated,ALLIANCE > HQIP,Not Rated,22.22,cbda5643-96b7-4914-b990-a872e693ff29,46.81
46.51,46.03,65.88,64.29,Mental Health Minimum Dataset v4.1 (Sensitive) Records,Not Rated,NHS Digital,Not Rated,77.78,cc383a3f-1c47-4b7d-99cf-be8ee0afe401,58.89
34.88,30.16,74.61,71.43,HES Admitted Patient Care data for CPRD Aurum,Bronze,ALLIANCE > CPRD,Bronze,79.37,cc3e20da-aca5-471d-a4bb-38e13f350f10,68.28
32.56,33.33,44.45,26.19,National Clinical Audit of Anxiety and Depression - spotlight audit on psychological therapies (clinical),Not Rated,ALLIANCE > HQIP,Not Rated,22.22,cf3f4336-e52d-4b82-8cc5-647dedaaee57,46.81
48.84,44.44,59.53,50.0,Quality of Life of Colorectal Cancer Survivors in England: Patient Reported Outcome Measures Survey for CPRD GOLD,Not Rated,ALLIANCE > CPRD,Not Rated,63.49,cf81a42f-2611-4410-89e9-7e3770d03a15,50.58
23.26,26.98,86.51,95.24,Cystic Fibrosis Patient Microbiology Cultures,Gold,ALLIANCE > CYSTIC FIBROSIS,Silver,100.0,d0468470-a88f-4692-a19d-c9ac0b9868f3,85.99
11.63,9.52,95.24,95.24,Welsh Cancer Intelligence and Surveillance Unit (WCISU),Gold,ALLIANCE > SAIL,Gold,100.0,d2667c43-adfd-4a61-b090-38d39e35a392,91.81
20.93,20.63,69.84,69.05,Cancer Group CTR Cardiff trials,Bronze,ALLIANCE > TISSUE DIRECTORY,Bronze,60.32,d272b783-8db3-4068-8d0f-05728f786d6d,74.06
51.16,49.21,48.41,33.33,Patient Reported Outcome Measures,Not Rated,NHS Digital,Not Rated,46.03,d2af6a29-291b-4444-a17c-40f4208f1e1b,41.09
32.56,34.92,43.65,26.19,Sentinel Stroke National Audit Programme Clinical Dataset,Not Rated,ALLIANCE > HQIP,Not Rated,22.22,d3673b75-ec8f-4c2e-8c9b-6ef1d951f978,46.81
20.93,20.63,71.43,71.43,MFT Biobank,Bronze,ALLIANCE > TISSUE DIRECTORY,Bronze,63.49,d3a3935f-b28e-4e74-9b15-9432d611f26c,75.25
20.93,22.22,65.08,59.52,Strategy introducing Pulmonary Rehabilitation for COPD management in rural India,Not Rated,HUBS > BREATHE,Bronze,52.38,d3e859ba-cfb0-4eda-a14c-34b08d113cd9,69.3
39.53,39.68,37.3,16.67,JANUS,Not Rated,Oxford University Hospitals NHS Foundation Trust,Not Rated,14.29,d3fd4dac-2d15-401c-8185-905ee108d9ce,38.57
20.93,20.63,71.43,71.43,UK ME/CFS Biobank,Bronze,ALLIANCE > TISSUE DIRECTORY,Bronze,63.49,d51de39c-153a-462b-8de5-cd1424908e0c,75.25
18.6,20.63,68.25,66.67,Exploration of Pneumonia Related Policy Formation and Implementation in Pakistan,Bronze,HUBS > BREATHE,Bronze,57.14,d5446d68-2fb9-4f0f-962e-7b7ed484d534,74.03
32.56,34.92,43.65,26.19,Birmingham Out of Hours Research Database,Not Rated,HUBS > PIONEER,Not Rated,22.22,d546521a-79be-4a53-83bd-ff008bda6171,46.81
39.53,39.68,37.3,16.67,OUH Patient Master Index,Not Rated,Oxford University Hospitals NHS Foundation Trust,Not Rated,14.29,d57a096a-4fa3-4529-b508-0b9df0f1893c,38.57
20.93,20.63,71.43,71.43,NHS Grampian Biorepository,Bronze,ALLIANCE > TISSUE DIRECTORY,Bronze,63.49,d5ab658e-b474-4e22-95f8-92607c40792d,75.25
30.23,23.81,84.12,88.1,Health and Lifestyle Questionnaire,Silver,ALLIANCE > NIHR BIORESOURCE,Silver,92.06,d7ec9584-cba3-46f9-9ef4-b1cb9eef2e7c,78.94
41.86,38.1,46.83,33.33,Cancer Patient Experience Survey (CPES) for CPRD Aurum,Not Rated,ALLIANCE > CPRD,Not Rated,31.75,d90830f4-5aaa-4075-8c8d-839627224d16,45.73
30.23,31.75,45.23,26.19,National Vascular Registry -  Abdominal Aortic Aneurysm Repair clinical dataset,Not Rated,ALLIANCE > HQIP,Not Rated,22.22,da4d3e21-3d81-49e9-ada0-6175e2341190,47.98
46.51,46.03,65.88,64.29,Mental Health Minimum Dataset v4.1 (Sensitive) Events,Not Rated,NHS Digital,Not Rated,77.78,db113fcd-69a0-4357-9c6d-250085deb3f5,58.89
18.6,19.05,70.64,69.05,interNational Anaplastic Thyroid Cancer Tissue Bank (iNATT),Bronze,ALLIANCE > TISSUE DIRECTORY,Bronze,60.32,dd7e56e7-2683-4b88-bed2-3a27ef3e4c9e,75.22
30.23,31.75,45.23,26.19,National Vascular Registry Audit Carotid Endarterectomy Clinical Dataset,Not Rated,ALLIANCE > HQIP,Not Rated,22.22,ddc965e7-6f52-4eed-bed5-657e3e7bbeac,47.98
34.88,36.51,40.48,21.43,NHS Digital data,Not Rated,ALLIANCE > NIHR BIORESOURCE,Not Rated,17.46,de1179eb-89fe-45a3-9e3c-e54a2a36ebf0,43.28
32.56,33.33,44.45,26.19,National Bowel Cancer Audit -  Organisational Survey dataset,Not Rated,ALLIANCE > HQIP,Not Rated,22.22,de19b3ea-2600-4472-85e8-628e7beff76e,46.81
9.3,9.52,80.96,80.95,UK Lung Volume Reduction Surgery,Silver,HUBS > BREATHE,Silver,71.43,def6669b-0fac-485c-84b2-2ea83ec31123,85.83
20.93,23.81,65.88,64.29,Klang Asthma Cohort,Not Rated,HUBS > BREATHE,Bronze,55.56,df63e893-f688-4bb4-956c-cc4354bb4001,71.68
39.53,39.68,37.3,16.67,Admitted Patient Care Dataset,Not Rated,Oxford University Hospitals NHS Foundation Trust,Not Rated,14.29,dfb21b3b-7fd9-40c4-892e-810edd6dfc25,38.57
25.58,22.22,88.89,95.24,GENOMICS ENGLAND 100K PHE LINKED DATA,Gold,ALLIANCE > GENOMICS ENGLAND,Silver,100.0,e0c871f9-b63c-43a5-9fd6-e5731dae2343,84.83
11.63,9.52,95.24,95.24,Brecon dataset,Gold,ALLIANCE > SAIL,Gold,100.0,e0ed59e2-8fb5-44d4-b694-f31d46884954,91.81
30.23,31.75,45.23,26.19,National Oesophago-Gastric Cancer Audit - clinical dataset,Not Rated,ALLIANCE > HQIP,Not Rated,22.22,e10660af-b420-4e25-8fc9-ea451da1dcfb,47.98
30.23,31.75,45.23,26.19,National Joint Registry - Primary Ankle Replacement dataset,Not Rated,ALLIANCE > HQIP,Not Rated,22.22,e38c8d6c-8655-4432-b654-23f89c0bb495,47.98
23.26,26.98,86.51,95.24,Cystic Fibrosis Patient Tendon Rupture,Gold,ALLIANCE > CYSTIC FIBROSIS,Silver,100.0,e432737f-43c0-43c1-aef5-71cb204d770c,85.99
30.23,33.33,45.24,28.57,Unified Cohorts Research Network,Not Rated,HUBS > BREATHE,Not Rated,23.81,e516a359-74a8-4932-b4df-f2cf75eef89d,49.17
25.58,26.98,86.51,95.24,Cystic Fibrosis Patient Sweat Tests,Gold,ALLIANCE > CYSTIC FIBROSIS,Silver,100.0,e66b726f-8e58-4411-be32-1d00ba1df13f,84.83
20.93,20.63,69.84,69.05,Biobank for patients with retinal degenerations & dystrophies,Bronze,ALLIANCE > TISSUE DIRECTORY,Bronze,60.32,e678366e-bb53-4dbb-a228-05114e0b6eb3,74.06
20.93,20.63,88.1,92.86,North West London Community Data (NWL COM),Gold,HUBS > DISCOVER NOW,Silver,96.83,e85e5c8c-b6be-4e8b-8a0b-13b785b457a2,85.97
20.93,20.63,69.84,69.05,University of Liverpool - GCP Laboratory Facility,Bronze,ALLIANCE > TISSUE DIRECTORY,Bronze,60.32,e8f23004-f1f7-4a36-859f-25af6ca6433b,74.06
37.21,36.51,38.89,16.67,"NHS Tayside, A&E Drugs given during an A&E visit",Not Rated,ALLIANCE > DUNDEE,Not Rated,14.29,e8f5b1b5-2c08-439a-b337-70b454aa40f3,39.73
18.6,19.05,67.46,61.9,Scottish Immunisation Recall System (SIRS),Bronze,ALLIANCE > SCOTLAND,Bronze,53.97,e9d504fc-4b61-4419-a400-ffda998fc377,71.65
25.58,23.81,71.43,76.19,Research Donors Ltd,Bronze,ALLIANCE > TISSUE DIRECTORY,Bronze,66.67,ea07f115-9f70-4c21-a373-247a1ca906f0,75.31
39.53,39.68,37.3,16.67,Sunquest,Not Rated,Oxford University Hospitals NHS Foundation Trust,Not Rated,14.29,eaca9ed1-30b6-4157-8894-8e53efc84849,38.57
18.6,19.05,72.22,71.43,Tommy's National Reproductive Health Biobank,Bronze,ALLIANCE > TISSUE DIRECTORY,Silver,63.49,eb19fcd9-2e9e-4e27-aa79-ad235952b1ac,76.42
20.93,20.63,86.51,88.1,Higher Education Statistics Agency (HESA) Student Data,Gold,ALLIANCE > SAIL,Silver,93.65,ec8e4933-2118-4366-a61a-090748e49be7,83.58
23.26,17.46,91.27,95.24,GENOMICS ENGLAND 100K QUICK VIEW,Gold,ALLIANCE > GENOMICS ENGLAND,Silver,100.0,ecbe7275-82b5-43cd-9401-fd7ef4b55341,85.99
20.93,22.22,65.08,59.52,"Introducing pulse oximetry in IMNCI, primary health facilities in Pune India",Not Rated,HUBS > BREATHE,Bronze,52.38,ecc4daf2-e58a-4ebc-9608-4bc741231fb9,69.3
37.21,36.51,38.89,16.67,Fife Microbiology: Isolations,Not Rated,ALLIANCE > DUNDEE,Not Rated,14.29,edaf29f4-9857-4bb0-97b9-ae88b70a2a3c,39.73
20.93,20.63,73.81,78.57,Its Not JUST Idiopathic pulmonary fibrosis Study (INJUSTIS),Bronze,HUBS > BREATHE,Silver,68.25,edc8f0c6-64f8-4f6d-a1dd-41e05033d54e,78.82
20.93,20.63,71.43,71.43,QTL Programme at MRC HGU,Bronze,ALLIANCE > TISSUE DIRECTORY,Bronze,63.49,ee5f4405-6930-4a7b-ba00-85a8e8c8a8b9,75.25
16.28,14.29,92.86,95.24,National Survey for Wales,Gold,ALLIANCE > SAIL,Gold,100.0,ee78ce42-7f1f-4c97-80cc-ea6ad628e5da,89.48
20.93,20.63,71.43,71.43,Manchester Cancer Research Centre (MCRC) Biobank,Bronze,ALLIANCE > TISSUE DIRECTORY,Bronze,63.49,eea147a4-4576-4f86-8ad1-c762137335fd,75.25
13.95,12.7,93.65,95.24,Emergency Department Dataset Daily,Gold,ALLIANCE > SAIL,Gold,100.0,eebb647a-63eb-4e62-b052-26cb2eb4799d,90.64
27.91,22.22,84.13,83.33,CPRD Aurum,Silver,ALLIANCE > CPRD,Silver,90.48,ef42201e-deb1-4675-896a-8a0162fe52a8,77.71
32.56,34.92,43.65,26.19,National Cardiac Audit Programme - National Heart Failure Audit,Not Rated,ALLIANCE > HQIP,Not Rated,22.22,efbb3bf4-834b-417e-b002-03fc41715e58,46.81
13.95,12.7,92.85,92.86,COVID-19 Consolidated Deaths,Gold,ALLIANCE > SAIL,Gold,98.41,efc2bb06-d502-4424-ac92-72834459fbaa,89.45
18.6,20.63,64.29,57.14,The Malaysian Asthma Hajj Study,Not Rated,HUBS > BREATHE,Bronze,49.21,eff41dbc-0ce4-4bfe-b51f-7b2753750332,69.27
34.88,36.51,42.86,26.19,Society for Acute Medicine Benchmarking Audit,Not Rated,HUBS > PIONEER,Not Rated,22.22,f075ceb7-5bed-4e6b-8e83-211aee945356,45.66
34.88,36.51,42.06,23.81,SNP imputation data,Not Rated,ALLIANCE > NIHR BIORESOURCE,Not Rated,20.63,f1a85970-bddc-499b-92e9-783706c60995,44.47
23.26,22.22,69.05,69.05,Manchester Eye Tissue Repository,Bronze,ALLIANCE > TISSUE DIRECTORY,Bronze,60.32,f1a93b8f-6332-43a2-b2da-c86f68f7d24a,72.89
34.88,33.33,79.37,88.1,Case report form,Silver,ALLIANCE > NIHR BIORESOURCE,Silver,92.06,f1d3b068-7dd0-4a28-bd64-3519dd104eb6,76.61
34.88,31.75,62.7,61.9,PIONEER - Genomics Patients and related data,Not Rated,HUBS > PIONEER,Not Rated,57.14,f202a9da-f036-4e8c-a069-a20ff6c8a9e1,63.51
41.86,33.33,65.08,50.0,Practice postcode linked deprivation measures for CPRD Aurum,Not Rated,ALLIANCE > CPRD,Not Rated,63.49,f3a53f7a-ea93-4b9e-bccd-afe762259044,54.07
30.23,31.75,45.23,26.19,The Leicester City and County Chronic Kidney Disease Cohort,Not Rated,ALLIANCE > LEICESTER,Not Rated,22.22,f3ade619-292e-4631-916a-9cd9d7938e48,47.98
23.26,22.22,69.05,69.05,Bristol Biobank,Bronze,ALLIANCE > TISSUE DIRECTORY,Bronze,60.32,f42b9fa6-adad-4637-943e-6fa7508559a3,72.89
25.58,25.4,69.05,71.43,National Joint Registry - Primary Knee Replacement dataset,Bronze,ALLIANCE > HQIP,Bronze,63.49,f4915e4b-639c-45ae-9b0f-afab547e1104,72.93
20.93,20.63,69.84,69.05,Leeds NIHR Biomarker Research Tissue Bank,Bronze,ALLIANCE > TISSUE DIRECTORY,Bronze,60.32,f5b57b56-a4ed-46d4-825f-d181e8db809d,74.06
23.26,22.22,69.05,69.05,Oxford Musculoskeletal Biobank,Bronze,ALLIANCE > TISSUE DIRECTORY,Bronze,60.32,f5ed34fa-154a-4613-a253-277547cfd8ca,72.89
23.26,22.22,69.05,69.05,NIHR Exeter Clinical Research Facility,Bronze,ALLIANCE > TISSUE DIRECTORY,Bronze,60.32,f621fcc9-e9ab-4da4-bd34-e4530d11b59d,72.89
30.23,31.75,45.23,26.19,National Diabetes Inpatient Audit - Harms clinical dataset,Not Rated,ALLIANCE > HQIP,Not Rated,22.22,f69d1b15-a0b4-461a-8aff-dba56da0791f,47.98
32.56,31.75,78.57,83.33,SNP chip data,Silver,ALLIANCE > NIHR BIORESOURCE,Bronze,88.89,f7c563c0-9625-47be-a070-c121fe734f3c,75.38
30.23,31.75,45.23,26.19,National Maternity and Perinatal Audit clinical audit,Not Rated,ALLIANCE > HQIP,Not Rated,22.22,f806fe65-79aa-4843-bc56-a08bf14ffcec,47.98
32.56,33.33,44.45,26.19,"Maternal, Newborn and Infant Clinical Outcome Review Programme - perinatal surveillance dataset",Not Rated,ALLIANCE > HQIP,Not Rated,22.22,f82b8ca5-5a52-4502-bf78-cfbb718cbe2f,46.81
13.95,12.7,91.27,90.48,National Neonatal Research Database,Gold,ALLIANCE > IMPERIAL COLLEGE LONDON,Gold,95.24,f89af2f4-e3cd-4eaa-835d-94aa347d8a92,88.27
39.53,39.68,37.3,16.67,Maternity Services Dataset,Not Rated,ALLIANCE > BARTS,Not Rated,14.29,f8bab14a-bc9b-4dd1-a6c6-c57588605849,38.57
20.93,20.63,69.84,69.05,Multiple Sclerosis and Parkinson's Tissue Bank,Bronze,ALLIANCE > TISSUE DIRECTORY,Bronze,60.32,f8f6e9ea-65c0-48a6-9beb-6de80bbbefda,74.06
18.6,19.05,72.22,71.43,UCL / UCLH Biobank for Studying Health and Disease,Bronze,ALLIANCE > TISSUE DIRECTORY,Silver,63.49,f9a712ae-9d41-41a6-b2ca-3127441b03ac,76.42
25.58,23.81,69.84,71.43,"St Thomas' Hospitals Plasma, serum & DNA Bio bank from patients with antiphospholipid antibodies",Bronze,ALLIANCE > TISSUE DIRECTORY,Bronze,63.49,f9f3af0d-ca1c-4e8f-b5e8-20962e1e7b4e,72.93
32.56,34.92,43.65,26.19,National Cardiac Audit Programme - National Adult Cardiac Surgery Audit (NACSA),Not Rated,ALLIANCE > HQIP,Not Rated,22.22,faf7ec31-999a-4d87-9d6d-8837ff2fa486,46.81
25.58,20.63,84.93,83.33,Outpatient Appointments and Attendances - Scottish Morbidity Record (SMR00),Silver,ALLIANCE > SCOTLAND,Silver,90.48,fb0e3d82-dcdb-4854-bdf5-99f03514a083,78.88
39.53,39.68,37.3,16.67,CellPath,Not Rated,Oxford University Hospitals NHS Foundation Trust,Not Rated,14.29,fc7b44f0-eb69-4257-8c07-7516c1210c46,38.57
20.93,20.63,71.43,71.43,eLIXIR - Early Life Data Cross-Linkage in Research,Bronze,ALLIANCE > TISSUE DIRECTORY,Bronze,63.49,fcee6c99-a4bd-44b8-a28e-dc63337ce216,75.25
11.63,9.52,95.24,95.24,National Exercise Referral Scheme,Gold,ALLIANCE > SAIL,Gold,100.0,fe3c7527-e802-4a51-9aa2-19e7d4d22783,91.81
30.23,31.75,45.23,26.19,National Joint Registry - Primary Shoulder Replacement dataset,Not Rated,ALLIANCE > HQIP,Not Rated,22.22,fe4662ad-9080-4bd8-8de4-51195d275d5b,47.98
