id,quality_rating,publisher,weighted_error_percent,error_percent,weighted_quality_score,weighted_quality_rating,completeness_percent,weighted_completeness_percent,quality_score,title
edaf29f4-9857-4bb0-97b9-ae88b70a2a3c,Not Rated,ALLIANCE > DUNDEE,36.51,37.21,38.89,Not Rated,16.67,14.29,39.73,Fife Microbiology: Isolations
edc8f0c6-64f8-4f6d-a1dd-41e05033d54e,Silver,HUBS > BREATHE,20.63,20.93,73.81,Bronze,78.57,68.25,78.82,Its Not JUST Idiopathic pulmonary fibrosis Study (INJUSTIS)
ee5f4405-6930-4a7b-ba00-85a8e8c8a8b9,Bronze,ALLIANCE > TISSUE DIRECTORY,20.63,20.93,71.43,Bronze,71.43,63.49,75.25,QTL Programme at MRC HGU
ee78ce42-7f1f-4c97-80cc-ea6ad628e5da,Gold,ALLIANCE > SAIL,14.29,16.28,92.86,Gold,95.24,100.0,89.48,National Survey for Wales
eea147a4-4576-4f86-8ad1-c762137335fd,Bronze,ALLIANCE > TISSUE DIRECTORY,20.63,20.93,71.43,Bronze,71.43,63.49,75.25,Manchester Cancer Research Centre (MCRC) Biobank
ef42201e-deb1-4675-896a-8a0162fe52a8,Silver,ALLIANCE > CPRD,22.22,27.91,84.13,Silver,83.33,90.48,77.71,CPRD Aurum
efbb3bf4-834b-417e-b002-03fc41715e58,Not Rated,ALLIANCE > HQIP,34.92,32.56,43.65,Not Rated,26.19,22.22,46.81,National Cardiac Audit Programme - National Heart Failure Audit
eff41dbc-0ce4-4bfe-b51f-7b2753750332,Bronze,HUBS > BREATHE,20.63,18.6,64.29,Not Rated,57.14,49.21,69.27,The Malaysian Asthma Hajj Study
f0392b68-5075-4557-adaa-2fb24b5dec4d,Bronze,HUB > NHS DIGITRIALS,23.81,27.91,80.95,Silver,78.57,85.71,75.33,Hospital Episode Statistics Critical Care
f075ceb7-5bed-4e6b-8e83-211aee945356,Not Rated,HUBS > PIONEER,36.51,34.88,42.86,Not Rated,26.19,22.22,45.66,Society for Acute Medicine Benchmarking Audit
f1a85970-bddc-499b-92e9-783706c60995,Not Rated,ALLIANCE > NIHR BIORESOURCE,36.51,34.88,42.06,Not Rated,23.81,20.63,44.47,SNP imputation data
f1a93b8f-6332-43a2-b2da-c86f68f7d24a,Bronze,ALLIANCE > TISSUE DIRECTORY,22.22,23.26,69.05,Bronze,69.05,60.32,72.89,Manchester Eye Tissue Repository
f1d3b068-7dd0-4a28-bd64-3519dd104eb6,Silver,ALLIANCE > NIHR BIORESOURCE,33.33,34.88,79.37,Silver,88.1,92.06,76.61,Case report form
f202a9da-f036-4e8c-a069-a20ff6c8a9e1,Not Rated,HUBS > PIONEER,31.75,34.88,62.7,Not Rated,61.9,57.14,63.51,PIONEER - Genomics Patients and related data
f3a53f7a-ea93-4b9e-bccd-afe762259044,Not Rated,ALLIANCE > CPRD,33.33,41.86,65.08,Not Rated,50.0,63.49,54.07,Practice postcode linked deprivation measures for CPRD Aurum
f3ade619-292e-4631-916a-9cd9d7938e48,Not Rated,ALLIANCE > LEICESTER,31.75,30.23,45.23,Not Rated,26.19,22.22,47.98,The Leicester City and County Chronic Kidney Disease Cohort
f3b4817a-7924-460c-a1c5-0b24acd81a7d,Bronze,ALLIANCE > NHS DIGITAL,20.63,23.26,77.78,Silver,69.05,76.19,72.89,Pillar 2 - Covid-19 UK Non-hospital Antigen Testing Results
f42b9fa6-adad-4637-943e-6fa7508559a3,Bronze,ALLIANCE > TISSUE DIRECTORY,22.22,23.26,69.05,Bronze,69.05,60.32,72.89,Bristol Biobank
f4915e4b-639c-45ae-9b0f-afab547e1104,Bronze,ALLIANCE > HQIP,25.4,25.58,69.05,Bronze,71.43,63.49,72.93,National Joint Registry - Primary Knee Replacement dataset
f5b57b56-a4ed-46d4-825f-d181e8db809d,Bronze,ALLIANCE > TISSUE DIRECTORY,20.63,20.93,69.84,Bronze,69.05,60.32,74.06,Leeds NIHR Biomarker Research Tissue Bank
f5ed34fa-154a-4613-a253-277547cfd8ca,Bronze,ALLIANCE > TISSUE DIRECTORY,22.22,23.26,69.05,Bronze,69.05,60.32,72.89,Oxford Musculoskeletal Biobank
f621fcc9-e9ab-4da4-bd34-e4530d11b59d,Bronze,ALLIANCE > TISSUE DIRECTORY,22.22,23.26,69.05,Bronze,69.05,60.32,72.89,NIHR Exeter Clinical Research Facility
f69d1b15-a0b4-461a-8aff-dba56da0791f,Not Rated,ALLIANCE > HQIP,31.75,30.23,45.23,Not Rated,26.19,22.22,47.98,National Diabetes Inpatient Audit - Harms clinical dataset
f6aa8836-b437-40b6-bd1e-ae20010048dd,Gold,ALLIANCE > SAIL,15.87,16.28,92.06,Gold,95.24,100.0,89.48,Substance Misuse Dataset
f73627e3-bd7c-4be2-81b4-3baf846ab787,Bronze,HUB > BREATHE,26.98,25.58,65.08,Not Rated,66.67,57.14,70.55,Developing and evaluating interventions to improve asthma care: HEAL ASTHMA
f7c563c0-9625-47be-a070-c121fe734f3c,Bronze,ALLIANCE > NIHR BIORESOURCE,31.75,32.56,78.57,Silver,83.33,88.89,75.38,SNP chip data
f806fe65-79aa-4843-bc56-a08bf14ffcec,Not Rated,ALLIANCE > HQIP,31.75,30.23,45.23,Not Rated,26.19,22.22,47.98,National Maternity and Perinatal Audit clinical audit
f82b8ca5-5a52-4502-bf78-cfbb718cbe2f,Not Rated,ALLIANCE > HQIP,33.33,32.56,44.45,Not Rated,26.19,22.22,46.81,"Maternal, Newborn and Infant Clinical Outcome Review Programme - perinatal surveillance dataset"
f89af2f4-e3cd-4eaa-835d-94aa347d8a92,Gold,ALLIANCE > IMPERIAL COLLEGE LONDON,12.7,13.95,91.27,Gold,90.48,95.24,88.27,National Neonatal Research Database
f8bab14a-bc9b-4dd1-a6c6-c57588605849,Not Rated,ALLIANCE > BARTS,39.68,39.53,37.3,Not Rated,16.67,14.29,38.57,Maternity Services Dataset
f8f6e9ea-65c0-48a6-9beb-6de80bbbefda,Bronze,ALLIANCE > TISSUE DIRECTORY,20.63,20.93,69.84,Bronze,69.05,60.32,74.06,Multiple Sclerosis and Parkinson's Tissue Bank
f9a712ae-9d41-41a6-b2ca-3127441b03ac,Silver,ALLIANCE > TISSUE DIRECTORY,19.05,18.6,72.22,Bronze,71.43,63.49,76.42,UCL / UCLH Biobank for Studying Health and Disease
f9f3af0d-ca1c-4e8f-b5e8-20962e1e7b4e,Bronze,ALLIANCE > TISSUE DIRECTORY,23.81,25.58,69.84,Bronze,71.43,63.49,72.93,"St Thomas' Hospitals Plasma, serum & DNA Bio bank from patients with antiphospholipid antibodies"
faf7ec31-999a-4d87-9d6d-8837ff2fa486,Not Rated,ALLIANCE > HQIP,34.92,32.56,43.65,Not Rated,26.19,22.22,46.81,National Cardiac Audit Programme - National Adult Cardiac Surgery Audit (NACSA)
fb4a069b-fd74-47b2-bbb1-9cde6b590d66,Gold,ALLIANCE > SAIL,11.11,13.95,94.44,Gold,95.24,100.0,90.64,Breast Test Wales
fc7b44f0-eb69-4257-8c07-7516c1210c46,Not Rated,ALLIANCE > OUH,39.68,39.53,37.3,Not Rated,16.67,14.29,38.57,CellPath
fcee6c99-a4bd-44b8-a28e-dc63337ce216,Bronze,ALLIANCE > TISSUE DIRECTORY,20.63,20.93,71.43,Bronze,71.43,63.49,75.25,eLIXIR - Early Life Data Cross-Linkage in Research
fe3c7527-e802-4a51-9aa2-19e7d4d22783,Gold,ALLIANCE > SAIL,9.52,11.63,95.24,Gold,95.24,100.0,91.81,National Exercise Referral Scheme
fe4662ad-9080-4bd8-8de4-51195d275d5b,Not Rated,ALLIANCE > HQIP,31.75,30.23,45.23,Not Rated,26.19,22.22,47.98,National Joint Registry - Primary Shoulder Replacement dataset
fe872375-2401-4de1-9650-d4139cf5793a,Not Rated,ALLIANCE > HQIP,36.51,34.88,42.86,Not Rated,26.19,22.22,45.66,National Paediatric Diabetes Audit - Parent and Patient Recorded Experience measures
ff2c6982-00f3-4483-9fc2-19b3a7211d8d,Not Rated,NHS Digital,46.03,46.51,65.88,Not Rated,64.29,77.78,58.89,Mental Health Minimum Dataset v4 (Non-Sensitive) Records
ff88d11a-d29b-4d94-92f2-2bbf7dd7d03a,Gold,ALLIANCE > SAIL,7.94,11.63,96.03,Gold,95.24,100.0,91.81,COVID-19 Symptom Tracker Dataset
ffc34689-1a81-4f56-9c3f-e62b76d8445b,Bronze,HUBS > BREATHE,20.63,18.6,67.47,Bronze,64.29,55.56,72.84,Teleconsultation in remote rural India: management of COPD and Asthma
