F: Technical Metadata Missing Count,C: Coverage & Detail Missing Count,B: Business Missing Count,E: Attribution Total Attributes,C: Coverage & Detail Total Attributes,B: Business Total Attributes,title,total_attributes,id,missing_attributes,pid,A: Summary Total Attributes,F: Technical Metadata Total Attributes,A: Summary Missing Count,D: Format & Structure Missing Count,publisher,E: Attribution Missing Count,D: Format & Structure Total Attributes
7,8,8,3,10,9,Metabolite data,42,004d1932-f06e-49d2-b87a-e5e4140ffbb3,29,92c80a25-fd93-40a6-b98f-4112ed0c233b,7,7,0,4,ALLIANCE > NIHR BIORESOURCE,3,5
7,8,8,3,10,9,National Joint Registry - Primary Elbow Replacement dataset,42,0092dc60-a0af-4d45-801c-b888210d6609,29,b06415af-9151-4ccc-83a1-ab859943fb2b,7,7,0,4,ALLIANCE > HQIP,3,5
7,3,5,3,10,9,Estimating Chronic Respiratory Disease burden in adults in Asian LMICs,42,0150353c-d33d-4af0-b177-8ef0adf867f4,18,56130df6-1880-4600-a7a4-afa9a4bcc895,7,7,0,2,HUB > BREATHE,2,5
7,8,8,3,10,9,Paediatric Intensive Care Audit Network - core dataset (admission),42,0217114b-6847-4aae-9d76-4d52acea2bcc,29,4ca76471-6970-4ad4-87c7-fae77a98cbf5,7,7,0,4,ALLIANCE > HQIP,3,5
6,4,2,3,10,9,COVID antigen  testing - Pillar 2,42,022cedb4-650d-4566-be41-8d7ed07a5112,18,c8f2ee14-2831-445d-a207-2f7f932f4735,7,7,1,3,ALLIANCE > HEALTH AND SOCIAL CARE NORTHERN IRELAND,2,5
6,3,3,3,10,9,HES Diagnostic Imaging Dataset for CPRD Aurum,42,0266f904-b168-488a-a9e7-d318443584ef,17,617f9f54-3fb6-40c3-b391-fe51d1fc7c49,7,7,0,3,ALLIANCE > CPRD,2,5
6,1,2,3,10,9,Unscheduled Care Datamart,42,02dceba1-65c7-49e8-a3e2-05e71c1a3033,12,a265af2e-40fc-4759-af61-eab293cdad5a,7,7,0,1,ALLIANCE > PUBLIC HEALTH SCOTLAND,2,5
6,0,0,3,10,9,Annual District Death Extract,42,03db4df3-f482-4bdd-a335-546ffffbeaab,6,15cf4241-abad-4dcc-95b0-8cd7c02be999,7,7,0,0,ALLIANCE > SAIL,0,5
7,10,9,3,10,9,SOLUS,42,0477b06f-cbed-4949-982e-ce248a47ed1a,33,e653b264-3e44-4ed1-a376-86df45db7f72,7,7,0,5,ALLIANCE > OXFORD UNIVERSITY HOSPITALS NHS TRUST,3,5
7,8,8,3,10,9,National Cardiac Audit Programme - Myocardial Ischaemia National Audit Project (MINAP),42,04b1648d-eeb7-4072-8dd2-806c3ae4e20d,29,3558f8a1-6d52-4b59-b513-51c068095bc2,7,7,0,4,ALLIANCE > HQIP,3,5
7,10,9,3,10,9,Sectra PACS,42,04f4604e-6d0b-4100-977b-59c3b69b0cfc,33,10bf4c08-6702-44fe-8faa-1280dea6b0c9,7,7,0,5,ALLIANCE > BARTS HEALTH NHS TRUST,3,5
7,2,1,3,10,9,Infectious Diseases BioBank at King's College London,42,0534b41b-9877-4e30-b3ce-e604b29d4990,11,47b544f4-301c-43e0-b347-fc623ea1a8b3,7,7,0,2,ALLIANCE > TISSUE DIRECTORY,0,5
6,0,0,3,10,9,Bowel Screening Wales,42,05716e41-9842-4c07-8ddd-af9f9231e056,6,9f29d47e-4e9a-41b8-b7bc-5ef3570294ef,7,7,0,0,ALLIANCE > SAIL,0,5
7,8,8,3,10,9,The Primary-Secondary Care Partnership to Improve Outcomes in Chronic Kidney Disease,42,05ade19c-75f5-4623-ade6-99fb21c2d4e3,29,d472a895-8587-4503-956e-3bd66d990979,7,7,0,4,ALLIANCE > UNIVERSITY HOSPITALS OF LEICESTER NHS TRUST,3,5
6,3,7,3,10,9,PANTHER study,42,0600a271-4a24-414f-a2d0-4b12e5c47d72,22,596077a9-298b-44cc-aa7a-81f04cf5dcb3,7,7,2,1,ALLIANCE > University of Nottingham,3,5
7,2,5,3,10,9,CuT-AsthMa: Culturally tailored school-based intervention for asthma in Malaysia,42,0692d86c-1f24-43a4-9508-005d00bd7259,17,009bcb87-05f3-46e6-8866-7e4df698cb19,7,7,0,2,HUB > BREATHE,2,5
7,10,9,3,10,9,Millennium Clinical Events,42,0711cc7e-80d5-4781-a1ab-2637ea176ceb,33,5f45bcd1-970b-44ba-8ae2-0fb49b85ffa9,7,7,0,5,ALLIANCE > OXFORD UNIVERSITY HOSPITALS NHS TRUST,3,5
6,1,0,3,10,9,North West London Mental Health Data (NWL MH),42,07169a48-2e59-4ef6-ad77-f272d60b5a83,7,2d3ec99a-a087-4355-8539-5a22cef58910,7,7,0,0,HUB > DISCOVER NOW,0,5
7,10,9,3,10,9,Returned datasets,42,07abf678-a2c0-4d8b-8d25-8b9f180f9ff2,33,145f008a-e4ff-4b87-bd16-98016b928f46,7,7,0,5,ALLIANCE > NIHR BIORESOURCE,3,5
7,6,5,3,10,9,Exome sequencing,42,07b82dd5-adc3-42c5-8a60-914042b5bc40,26,2ddf0659-f05a-4f1c-b558-63a96e5b49f7,7,7,2,4,UK Biobank,3,5
6,2,3,3,10,9,The impact of COVID on hospitalised patients with COPD; a dataset in OMOP,42,07e3ac82-a38d-45f3-9933-07439f6a761d,14,,7,7,1,1,HUB > PIONEER,1,5
6,2,1,3,10,9,Careers Wales dataset,42,08846261-45f0-4bcf-9801-fe785dcef1c9,12,e4004e0e-6adb-4b11-82c2-af0caf61d751,7,7,1,1,ALLIANCE > SAIL,1,5
7,9,8,3,10,9,Walker Study Data,42,08a29778-afac-4ae0-86fc-5ca544d53874,31,245bffa9-07c3-40b6-916b-161062cdf674,7,7,0,5,HEALTH INFORMATICS CENTRE - UNIVERSITY OF DUNDEE,3,5
7,7,8,3,10,9,Labour Force Survey (Household),42,08fd6103-be40-4380-9399-aecaeb216d33,28,0b630200-1e7c-4b19-ad53-bcc8863f7ade,7,7,2,2,NCS > OFFICE FOR NATIONAL STATISTICS,3,5
7,8,8,3,10,9,Paediatric Intensive Care Audit Network - customised data collection,42,09586db0-4da4-47f8-9434-13cbd2da2bb9,29,6c78af2c-3898-435e-b1f4-e6a44682dc71,7,7,0,4,ALLIANCE > HQIP,3,5
7,2,3,3,10,9,Development of spirometry predictive values for Indian population,42,0985f58b-87e0-42d2-9ee7-efd618abcd51,12,59521b01-6adb-4dd3-8b40-dbeb51171e4f,7,7,0,0,HUB > BREATHE,1,5
7,2,3,3,10,9,Reasons for delay in seeking care for pneumonia in children under five,42,09e8e407-82b4-4ed4-b296-53810472cbe9,11,46f50b9b-b8e2-4ff1-a1b3-779174c3d032,7,7,0,0,HUB > BREATHE,0,5
7,8,8,3,10,9,Paediatric Intensive Care Audit Network - core dataset (transport),42,0a418d30-c13c-404a-9f4c-39334d889b9c,29,45310176-6331-4bdd-bc53-d9194e212a35,7,7,0,4,ALLIANCE > HQIP,3,5
7,2,1,3,10,9,Tayside Biorepository,42,0a4f19cc-8565-410b-ac02-2751f5284a9b,11,6ac9b356-00f1-49da-825a-6eb04d18e49d,7,7,0,2,ALLIANCE > TISSUE DIRECTORY,0,5
7,8,8,3,10,9,National Asthma and COPD Audit Programme (NACAP): Pulmonary rehabilitation - clinical audit,42,0bb202c7-80e8-4532-8042-1351576e6c94,29,3afbb83d-d47b-43b3-a202-0d3081e5d294,7,7,0,4,ALLIANCE > HQIP,3,5
7,9,8,3,10,9,Fife Microbiology: Isolations,42,0c74238f-58b4-42d4-a97a-94737d75a897,31,79086e92-cbbf-4615-b642-bc65d8a3bc6d,7,7,0,5,HEALTH INFORMATICS CENTRE - UNIVERSITY OF DUNDEE,3,5
7,5,1,3,10,9,Mental Health Services Data Set - Community,42,0c98200b-48b5-418a-b8d0-a7708abc1f39,20,f3bb6a68-2c32-40a7-9a79-61a718068893,7,7,0,5,ALLIANCE > NHS DIGITAL,3,5
6,1,1,3,10,9,Prescribing Information System (PIS),42,0cb92a4a-cc82-4c33-98f7-06ba93818c50,9,22e3943e-edb5-44a1-9e4e-22b0f7a31767,7,7,0,1,ALLIANCE > PUBLIC HEALTH SCOTLAND,0,5
7,10,9,3,10,9,ARIA Dataset,42,0cfe60cd-038d-4c03-9a95-894c52135922,33,621dd611-adcf-4434-b538-eecdbe5f72cf,7,7,0,5,ALLIANCE > BARTS HEALTH NHS TRUST,3,5
7,2,3,3,10,9,Research on use of an online learning platform on under-five pneumonia,42,0d0ce21e-afc1-4d9f-bf54-e0545363a0cc,12,a3d85fd2-9df3-4f6e-9035-0830a3488ddb,7,7,0,1,HUB > BREATHE,0,5
6,3,2,3,10,9,Mental Health Services Data Set,42,0d5bb5b4-ad38-4313-8b19-cd37491c0b41,15,fa2ec63d-f76d-4555-8fc1-f4bd66e3c60d,7,7,1,1,ALLIANCE > NHS DIGITAL,2,5
7,8,8,3,10,9,National Neonatal Audit Programme - clinical audit,42,0d89c503-1c79-4e2a-baf6-02f12e68805b,29,382e897a-77cf-46ca-8d44-d79449ab61df,7,7,0,4,ALLIANCE > HQIP,3,5
6,3,3,3,10,9,Real Time Data Network (RTDN),42,0ddcb454-2372-4180-9ba0-a7e1896d4fe2,15,,7,7,1,1,HUB > DATA-CAN,1,5
7,2,0,3,10,9,IMPORT HIGH trial blood samples,42,0df3a0a9-d261-47ff-99e5-9c7e67410712,10,edafebac-9479-4d2c-b44e-349091d5b35b,7,7,0,2,ALLIANCE > TISSUE DIRECTORY,0,5
6,3,3,3,10,9,HES Accident and Emergency data for CPRD Aurum,42,0e59698c-1532-4155-ab0e-af11b3d9e7b1,16,c43501ec-08b4-4d33-a7dd-d19fca821925,7,7,0,2,ALLIANCE > CPRD,2,5
6,4,1,3,10,9,Mental Health Minimum Dataset v4 (Sensitive) Episodes,42,0e6e6ed5-ab81-4d7f-b06a-768bf33357ca,19,29c61f09-c4a1-425f-9bbc-888c23d99516,7,7,0,5,ALLIANCE > NHS DIGITAL,3,5
7,9,8,3,10,9,Tayside Bowel Screening Dataset,42,0e80170d-de4f-4349-a879-c54a70262736,31,00201dde-1faf-41d3-b282-5c24c0ca3697,7,7,0,5,HEALTH INFORMATICS CENTRE - UNIVERSITY OF DUNDEE,3,5
7,2,5,3,10,9,Developing and Evaluating Interventions to Improve Asthma Care,42,0e8546e9-c841-4a99-a3f8-bb9020c6782c,17,d57d7956-d13e-49c4-bb31-889b8e560596,7,7,0,2,HUB > BREATHE,2,5
6,8,4,3,10,9,National Radiotherapy Dataset (RTDS) for CPRD Aurum,42,0fbd11c2-c44b-430f-b527-63cb82fcee63,26,9c535c8d-ebac-4212-b602-fc2489df2c92,7,7,0,5,ALLIANCE > CPRD,3,5
6,4,1,3,10,9,Mental Health & Learning Disabilities Dataset v 1 (Non-Sensitive) Events,42,0fc61ace-397d-4489-9e62-77f88082e775,19,9c8bd383-b117-4167-a25c-9e15fa5ec1c6,7,7,0,5,ALLIANCE > NHS DIGITAL,3,5
6,1,0,3,10,9,North West London Pathology (NWL PATH),42,0fde8427-1072-4b77-9997-635157ef370a,7,2c5f3ef6-53f8-42e6-a077-8718261df026,7,7,0,0,HUB > DISCOVER NOW,0,5
6,0,0,3,10,9,Cystic Fibrosis Patient Liver Enzyme,42,1048c3d9-42f6-4950-89be-c51fe7421753,6,f72e80fc-dcd3-4457-ae91-dd14449002dd,7,7,0,0,ALLIANCE > CYSTIC FIBROSIS TRUST,0,5
7,8,8,3,10,9,National Audit of Dementia Round 4 - carer experience survey,42,11571357-b9fc-45ed-ab40-3bb3d7443245,29,3b5907da-256d-49a3-b24b-00893afe8bdd,7,7,0,4,ALLIANCE > HQIP,3,5
7,8,8,3,10,9,National Vascular Registry Audit Carotid Lower Limb Amputation clinical dataset,42,12690263-f5d3-435b-9582-de1a88064e1e,29,03e77b9d-57b8-44d5-8d64-9b1325958b22,7,7,0,4,ALLIANCE > HQIP,3,5
7,8,8,3,10,9,National Joint Registry - Revision Hip Replacement dataset,42,12c5b83c-6e4a-442e-b6c2-2f6b7165fe6b,29,4b8286e2-c4e4-4db4-8fd9-5f1c8b4e56de,7,7,0,4,ALLIANCE > HQIP,3,5
6,1,2,3,10,9,Child Health Systems Programme - First Visit,42,12d23c2c-5f35-4f59-80e3-584636c7cacb,12,dec04153-f595-41ce-9d7e-5ef0c3fe8289,7,7,0,2,ALLIANCE > PUBLIC HEALTH SCOTLAND,1,5
6,1,0,3,10,9,North West London COVID-19 Patient Level Situation Report (NWL COVID19 PLD SITREP),42,135ba51b-8a01-4624-b3c4-1d6f5b22b357,7,1d7a0222-d5ae-41f7-afe9-8d3bd564b00e,7,7,0,0,HUB > DISCOVER NOW,0,5
7,2,1,3,10,9,Obesity Research Biobank Syndicate (ORBiS),42,13a931c1-18cf-4d60-be79-a527acb0a36d,11,264a1987-a8cb-4a83-81e0-70b4c3893b7d,7,7,0,2,ALLIANCE > TISSUE DIRECTORY,0,5
7,2,1,3,10,9,Watch and Wait Trial,42,14855eb1-6563-4e56-89e5-aecd51f100ad,11,e46dccbf-484d-45d2-a42a-4d308b87c113,7,7,0,2,ALLIANCE > TISSUE DIRECTORY,0,5
7,8,8,3,10,9,Paediatric Intensive Care Audit Network - core dataset (referral),42,148a3896-e4ed-48ef-8643-48df726041e1,29,79ae4881-6223-471a-a278-6b2d3b84f971,7,7,0,4,ALLIANCE > HQIP,3,5
6,3,1,3,10,9,MSDS (Maternity Services Data Set),42,15123705-7d80-4803-a3b4-d145bf2902c5,12,11d3cf0f-ae5d-42f4-a756-b98c3eff46bc,7,7,0,1,ALLIANCE > NHS DIGITAL,1,5
6,0,0,3,10,9,Active Adult Survey,42,15805559-2115-4822-b91f-635de36fb289,6,1eb67fd5-33f6-49dd-a43d-854fff9f25f5,7,7,0,0,ALLIANCE > SAIL,0,5
6,0,0,3,10,9,GENOMICS ENGLAND 100K QUICK VIEW,42,15efea36-d022-495c-a5b6-90f51631a643,6,4cc5ed33-3190-4f80-953b-cabd5a2b1c7c,7,7,0,0,GENOMICS ENGLAND,0,5
7,2,1,3,10,9,INCA Trial,42,16341d43-0e79-4afa-a84f-67db018e449f,11,edd55990-a616-4a9c-a4a2-38af136a349b,7,7,0,2,ALLIANCE > TISSUE DIRECTORY,0,5
6,3,1,3,10,9,NHS 111 Dataset,42,16e343ce-61f5-4f04-9fae-4fa6c9babf61,13,3d6b69dc-cb3c-4b9a-bdea-a798e7d5b5cf,7,7,1,1,ALLIANCE > SAIL,1,5
7,10,9,3,10,9,ARIA Medonc,42,172242ce-a1c5-4915-9c71-686f6e7d5789,33,88eb839c-bc51-45f0-b15e-ea89bba9ffca,7,7,0,5,ALLIANCE > OXFORD UNIVERSITY HOSPITALS NHS TRUST,3,5
6,2,2,3,10,9,UHB 2019 Summer Society of Acute Medicine Benchmarking Audit,42,1785cc1a-ace0-4980-8352-5977b2b72969,12,,7,7,1,1,HUB > PIONEER,0,5
7,2,0,3,10,9,IDRIS Trial,42,179c21cd-41e0-489b-82c4-1bec011c562f,10,8437b207-c925-4dd1-9478-5af329cd736e,7,7,0,2,ALLIANCE > TISSUE DIRECTORY,0,5
6,3,1,3,10,9,Personal Demographic Service,42,18028eac-b157-4264-9b86-9928c8e1709a,13,f8be6d46-61de-4ed3-b127-76cdf92209d0,7,7,0,1,ALLIANCE > NHS DIGITAL,2,5
6,8,3,3,10,9,Rural-Urban classification for CPRD GOLD,42,1841e7c9-39e1-4eff-9d2f-da3dede71f86,25,a7d8c6a8-0825-4e73-8f29-3d76194d7114,7,7,0,5,ALLIANCE > CPRD,3,5
7,1,3,3,10,9,Asthma and COPD: practices and perceptions of GPs in rural India,42,184b973d-ac38-4fc5-8203-f2a244574b4f,12,c15bc3ad-c053-496b-863f-1d54075d5bd4,7,7,0,0,HUB > BREATHE,2,5
7,8,8,3,10,9,National Audit of Psychosis - Audit on Early Intervention in Psychosis services - case note audit,42,18603ae7-a056-4fd6-a3e5-d32a2440dd26,29,24b88d1a-4363-4619-870e-9ba9fc5d09e1,7,7,0,4,ALLIANCE > HQIP,3,5
6,0,0,3,10,9,GENOMICS ENGLAND 100K BIOINFORMATICS DATA,42,1900af1a-bd21-4157-ac48-203eec682073,6,98999c67-0133-4f11-be95-b84ee5727c84,7,7,0,0,ALLIANCE > GENOMICS ENGLAND,0,5
7,2,2,3,10,9,Early Pandemic Evaluation and Enhanced Surveillance of COVID-19 (EAVE II),42,191c1e3f-4eff-41b9-bff1-c6510f7c6c3d,10,25bc9862-5b6c-4dda-80b2-46642d9e518a,7,7,0,0,HUB > BREATHE,0,5
6,2,2,3,10,9,UHB 2020 Winter Society of Acute Medicine Benchmarking Audit,42,19f9399a-2794-47af-aca1-357014a1ee31,12,5bf9bf39-3cd7-4a54-994b-9914405f945e,7,7,1,1,HUB > PIONEER,0,5
7,8,8,3,10,9,National Asthma and COPD Audit Programme (NACAP): COPD secondary care clinical dataset,42,1a0af437-ec80-4db7-9c76-a2418cc8c5c8,29,85b4dc84-88f4-4740-80fa-fa1eb04a0ae6,7,7,0,4,ALLIANCE > HQIP,3,5
7,3,5,3,10,9,Air Quality Study: An ecological analysis of asthma health outcomes in Malaysia,42,1b80d25c-4f0f-497b-8614-4d1a8c4d1cd3,18,95f385b1-4f5c-4a88-8e79-9613acc66938,7,7,0,2,HUB > BREATHE,2,5
7,2,0,3,10,9,DARWIN1 Trial,42,1bb2c353-8d91-4989-a21b-26182262b807,10,7f9672fa-dad5-479d-a929-52719e8cc2fa,7,7,0,2,ALLIANCE > TISSUE DIRECTORY,0,5
6,2,2,3,10,9,Linked Census and death occurrences,42,1bfdab55-3e6a-4b26-bff1-0105ad416cea,14,54095c0e-6faa-4de4-ac26-e2c7ef3cba5c,7,7,0,1,NCS > OFFICE FOR NATIONAL STATISTICS,3,5
7,2,1,3,10,9,NICAM: Nilotinib treatment for c-KIT mutated advanced AMM,42,1c17f45b-ba0f-4e97-a0f0-34a600844d4f,11,ba0edcaf-854d-4907-851a-280b56128b3b,7,7,0,2,ALLIANCE > TISSUE DIRECTORY,0,5
6,4,2,3,10,9,COVID-19 Test Trace and Protect [CTTP],42,1c1ada6a-d6e4-4415-a291-81f21acf8f81,14,c0fc84af-aeab-4c7e-aa0b-8264baff55d9,7,7,1,1,ALLIANCE > SAIL,0,5
7,2,1,3,10,9,HPB Biobank,42,1cb31e11-505b-4ff6-ae20-5c468c9ad296,11,ebe6c9dd-fb95-4301-a929-c21b8077753a,7,7,0,2,ALLIANCE > TISSUE DIRECTORY,0,5
7,2,1,3,10,9,National Diet and Nutrition Survey (NDNS),42,1d2a94c4-b18d-47c4-9b48-cfab8e67f126,11,f86400cb-7cab-4e34-aab6-57138b6a96c2,7,7,0,2,ALLIANCE > TISSUE DIRECTORY,0,5
7,5,1,3,10,9,Mental Health Services Data Set - Service Users,42,1d5e3b05-8ce3-4f80-ae3a-f6031ad8cf69,20,f48ad0a1-f90c-4a81-8c04-b23f2d8baf7a,7,7,0,5,ALLIANCE > NHS DIGITAL,3,5
7,8,8,3,10,9,National Cardiac Audit Programme - National Audit of Percutaneous Coronary Interventions (PCI),42,1da704e3-f5ee-4614-8880-10541637a0b7,29,ac7016ce-f7a9-4c71-bebb-6af6efa27844,7,7,0,4,ALLIANCE > HQIP,3,5
7,9,8,3,10,9,Patient SIMD Postcode,42,1db7ce43-0dc3-4fa9-8bc8-14db16aba508,31,798567eb-d790-466e-880b-75a1e94ffdf2,7,7,0,5,HEALTH INFORMATICS CENTRE - UNIVERSITY OF DUNDEE,3,5
6,0,0,3,10,9,Cystic Fibrosis Patient Demographics,42,1f55cfcc-1c5d-44e3-9d60-3bedeb033f0a,6,19bc55c2-13d7-4488-a52c-35287483ea4e,7,7,0,0,ALLIANCE > CYSTIC FIBROSIS TRUST,0,5
7,2,1,3,10,9,University of Southampton Faculty of Medicine Tissue Bank,42,201602df-7432-4710-98a7-18f59e4f211e,11,786563e9-5377-4d18-8d32-65ff14d53987,7,7,0,2,ALLIANCE > TISSUE DIRECTORY,0,5
6,0,0,3,10,9,Patient Episode Dataset for Wales,42,2057a9e3-b491-4d8f-874c-9857d00116b0,6,4c33a5d2-164c-41d7-9797-dc2b008cc852,7,7,0,0,ALLIANCE > SAIL,0,5
7,2,1,3,10,9,RIO,42,209f42a8-4581-49e1-a0c2-25069a37f230,9,18bc81e3-7d99-4152-bd7a-3c90ee7e489d,7,7,0,0,ALLIANCE > TISSUE DIRECTORY,0,5
7,2,1,3,10,9,TNT: Triple Negative breast cancer Trial,42,20c2a274-843c-43fa-9b76-38ef2f8a3d64,11,5f4c825d-d6c3-453e-9667-8cdf2329b6e1,7,7,0,2,ALLIANCE > TISSUE DIRECTORY,0,5
7,0,0,3,10,9,South London and Maudsley NHS Foundation Trust (SLaM) Clinical Record Interactive Search (CRIS) platform,42,21cd4b8e-f4f5-44a6-83eb-b7799e98ba55,6,a25a9892-9141-4e78-8415-945ba73da11e,7,7,0,0,ALLIANCE > SLaM,0,5
6,1,1,3,10,9,Scotland Accident and Emergency,42,22173c55-25db-4616-97d8-04fdb6899387,11,05e6752e-3a0b-4809-aa14-207b4761ef60,7,7,0,1,ALLIANCE > PUBLIC HEALTH SCOTLAND,2,5
7,10,9,3,10,9,Emergency Care Dataset (ECDS),42,226fb3f1-4471-400a-8c39-2b66d46a39b6,33,1559ab92-30bb-4cc2-821b-5e1bc521e5a4,7,7,0,5,ALLIANCE > BARTS HEALTH NHS TRUST,3,5
6,2,3,3,10,9,The impact of ethnicity and multi-morbidity on C19 hospitalised outcomes,42,22e14c8d-9d92-4437-b39b-f69f7b033d13,14,cfa1ef13-8ae0-4827-8a0f-9d2df5244725,7,7,1,1,HUB > PIONEER,1,5
6,0,0,3,10,9,Cystic Fibrosis Patient Chronic Medication,42,22fe7168-89af-4d93-89c8-afa03cf2031a,6,0ad31772-0893-4cf7-bab0-683e80302201,7,7,0,0,ALLIANCE > CYSTIC FIBROSIS TRUST,0,5
7,8,8,3,10,9,National Joint Registry - Revision Knee Replacement dataset,42,23330792-fe18-4331-a101-b246657a03ae,29,6664317b-39b9-4133-b6c7-ec4bddf78c76,7,7,0,4,ALLIANCE > HQIP,3,5
7,2,1,3,10,9,Human Biomaterials Resource Centre,42,236108a2-5e2c-4acb-86e7-6ec793aef8ab,11,2f085ac6-d33d-4b9b-8a99-624cc51c3f17,7,7,0,2,ALLIANCE > TISSUE DIRECTORY,0,5
7,8,8,3,10,9,Falls and Fragility Fracture Audit Programme Fracture Liaison Service Database clinical dataset,42,237e724d-03b2-478c-a92d-85a1baa6ae53,29,d94a604c-5733-4f07-93bb-e77b6ea2313f,7,7,0,4,ALLIANCE > HQIP,3,5
6,0,0,3,10,9,GENOMICS ENGLAND 100K RARE DISEASE & COMMON,42,239e8253-a997-4676-8940-16b74a004365,6,3f2b37f1-e8f7-42e5-83c4-fc9e1c58725d,7,7,0,0,GENOMICS ENGLAND,0,5
6,0,0,3,10,9,Welsh Cancer Intelligence and Surveillance Unit (WCISU),42,24095736-dbea-4c37-86fe-ddf3a6933a6b,6,368ad790-3ad8-4f93-9a7c-0bfb64dc6015,7,7,0,0,ALLIANCE > SAIL,0,5
7,0,0,3,10,9,Idiopathic Pulmonary Fibrosis (IPF) Genome-wide Association Study,42,24b82645-1854-438a-97b2-911bba469d3d,6,b850e56c-5c5b-413e-b829-743772053978,7,7,0,0,HUB > BREATHE,0,5
6,1,1,3,10,9,General Acute Inpatient and Day Case - Scottish Morbidity Record (SMR01),42,2537007c-9e9e-4441-a0d1-59fa400566c5,11,98cda353-0011-45b2-80ca-4ed24cd084bf,7,7,0,1,ALLIANCE > PUBLIC HEALTH SCOTLAND,2,5
7,2,3,3,10,9,mHealth for pneumonia prevention,42,2542abf8-e50b-4962-9fa1-6dba1b7e8439,12,fc66381e-cc46-4bca-85fc-fc2ee09cc5dd,7,7,0,1,HUB > BREATHE,0,5
6,0,0,3,10,9,Maternity Indicators Dataset,42,258c9577-76cd-45c7-a6b5-8e7eed07ce9e,6,a0c27454-8cbe-418f-bdae-a85d5e92e9d4,7,7,0,0,ALLIANCE > SAIL,0,5
6,4,1,3,10,9,Mental Health Minimum Dataset v4 (Non-Sensitive) Episodes,42,263ad0a8-ae90-4c1d-85d6-c3d2470eb2b7,19,2964d1b0-2630-468a-82c1-00f5ac901b3d,7,7,0,5,ALLIANCE > NHS DIGITAL,3,5
6,4,1,3,10,9,Mental Health Minimum Dataset v2.6 (Sensitive),42,263f28a4-9835-4856-b1c3-0a0d4085f207,19,dc37fcd6-1e68-46e5-b73d-4896e069746a,7,7,0,5,ALLIANCE > NHS DIGITAL,3,5
7,9,9,3,10,9,CDE Patient Demographics,42,2684706f-1d43-4263-99b7-b54279614c76,32,209d7fae-0521-4d07-8a4d-e0843a46a107,7,7,0,5,ALLIANCE > BARTS HEALTH NHS TRUST,3,5
6,0,0,3,10,9,Pathology Data from WRRS,42,26da4493-a78b-4090-ba18-e6c600d2c375,6,48ef8f54-9606-4e6f-9256-3cc07ffd10b8,7,7,0,0,ALLIANCE > SAIL,0,5
6,0,0,3,10,9,North West London population data (NWL POP),42,278b91aa-7ad1-4b89-86aa-10e9e013f0cf,6,1032850f-7631-4d9e-a760-b0532bffd21a,7,7,0,0,HUB > DISCOVER NOW,0,5
7,8,8,3,10,9,National Asthma and COPD Audit Programme (NACAP): secondary care workstream – children and young people asthma (clinical),42,278c3fb2-6b1e-46db-a529-9fc7ddaf4461,29,33b36393-3760-40d8-bb98-61806fea5398,7,7,0,4,ALLIANCE > HQIP,3,5
6,0,0,3,10,9,Cystic Fibrosis Patient Annual Review Encounters,42,27910ce4-f74f-4fab-8649-19d5ec292ad8,6,11360490-8da3-4a25-bb87-4fcc249b9af5,7,7,0,0,ALLIANCE > CYSTIC FIBROSIS TRUST,0,5
7,2,1,3,10,9,IoN Trial,42,2a5d2a42-803c-4c96-bcd6-a4289d2b664a,11,e10a660d-b84c-475f-abd4-024dd1af7a5d,7,7,0,2,ALLIANCE > TISSUE DIRECTORY,0,5
6,4,1,3,10,9,Mental Health & Learning Disabilities Dataset v 1 (Sensitive) Records,42,2a725f9d-c4a9-4c89-aa37-b3c25cc83389,19,7c2b435c-5442-4a05-9b8d-08024ec57c30,7,7,0,5,ALLIANCE > NHS DIGITAL,3,5
7,2,1,3,10,9,ESPAC-TPlus,42,2aa58bb8-83d8-455a-87e6-d567ae4a379c,11,47f979bc-da9d-4e9e-9f2b-15e09366db04,7,7,0,2,ALLIANCE > TISSUE DIRECTORY,0,5
6,3,2,3,10,9,Admissions & Discharges,42,2aabcea9-d0dd-4780-b162-3c7ed3ee9888,15,1d5b9205-dae4-4b0e-a3d3-04707875edf8,7,7,0,2,ALLIANCE > HEALTH AND SOCIAL CARE NORTHERN IRELAND,2,5
7,9,8,3,10,9,Renal Register – ISD National dataset,42,2ab363bf-3013-475b-8254-bd7740f70edb,31,32edd77d-533c-423f-b045-937507f8505d,7,7,0,5,HEALTH INFORMATICS CENTRE - UNIVERSITY OF DUNDEE,3,5
6,0,0,3,10,9,Millennium Cohort Study,42,2b09ea87-5b22-4049-b7dd-de0889699115,7,a380bd6b-009f-4b78-b638-ba9ee62be2eb,7,7,0,0,ALLIANCE > SAIL,1,5
7,2,1,3,10,9,NIHR Nottingham Digestive Diseases Collection,42,2b198886-ccab-4276-b6b9-22c344df8304,11,f20bf814-ee80-4e67-ab00-afff884ddbb4,7,7,0,2,ALLIANCE > TISSUE DIRECTORY,0,5
7,2,0,3,10,9,BRAIN UK,42,2bf53952-e77c-4746-b36f-5ccb1574f6a7,10,1c455ad3-af51-4b93-aff4-c5d3dacfa9f4,7,7,0,2,ALLIANCE > TISSUE DIRECTORY,0,5
7,8,8,3,10,9,National Joint Registry - Revision Ankle Replacement dataset,42,2c0e04bc-2f16-4903-90dc-c9d57ab40efb,29,b4f076d2-c9a3-49ba-84f4-94148dc8511a,7,7,0,4,ALLIANCE > HQIP,3,5
7,8,8,3,10,9,National Diabetes Inpatient Audit Hospital Characteristics Survey dataset,42,2c53d1f7-4540-4c57-8e93-8115b8abc6a9,29,a9098b51-f8ec-432e-a52f-f4c1f2c1e4f6,7,7,0,4,ALLIANCE > HQIP,3,5
6,8,3,3,10,9,Rural-Urban classification for CPRD Aurum,42,2d23ad3c-0541-453c-8bf7-9dc42e1aba65,25,b7d24b82-f8a4-4838-844c-ecd86ddf5db2,7,7,0,5,ALLIANCE > CPRD,3,5
6,8,3,3,10,9,Quality of Life of Cancer Survivors in England: Pilot Patient Reported Outcomes Measures Survey (2011) for CPRD Aurum,42,2d3302d1-b6fc-4883-8168-010da0d48638,25,3a387099-e69e-479d-a937-2cc3795d7170,7,7,0,5,ALLIANCE > CPRD,3,5
6,0,0,3,10,9,GENOMICS ENGLAND 100K NHSD LINKED DATA,42,2d4b933d-1c8b-4fde-860e-c324454d28f9,6,14c31b39-f189-4417-bd38-635268495593,7,7,0,0,GENOMICS ENGLAND,0,5
7,8,8,3,10,9,Falls and Fragility Fracture Audit Programme National Hip Database Facilities Survey 2019,42,2dbd2e38-a4bb-4f8c-b401-ebec10f0d89e,29,025c9e8a-938b-4886-9e03-fcad90fe7157,7,7,0,4,ALLIANCE > HQIP,3,5
7,2,3,3,10,9,"4 Country ChrOnic: estimating respiratory disease burden in adults, South India",42,2dc79612-0e0d-4336-aaa1-6abd90d28589,15,2f1244b8-7cbf-4fa3-8534-433efd769d48,7,7,0,2,HUB > BREATHE,2,5
7,2,0,3,10,9,NHS Greater Glasgow & Clyde Bio-Repository,42,2e20b776-a0bc-44ed-9882-ad63855a0ec4,10,762976cc-83d0-4b31-a879-37f87f947406,7,7,0,2,ALLIANCE > TISSUE DIRECTORY,0,5
6,8,3,3,10,9,Mental Health Dataset (MHDS) for CPRD Aurum,42,2e8cc70b-bd57-4b64-bd12-fbc07e0f240f,25,48627b2d-f247-4921-9ee1-6c37adfff10d,7,7,0,5,ALLIANCE > CPRD,3,5
6,1,0,3,10,9,North West London Patient Index (NWL PI),42,2f19548c-99d7-4f48-a418-d7afb77aebec,7,1fe1e7bb-ef6e-4d89-9824-bb560afc81f0,7,7,0,0,HUB > DISCOVER NOW,0,5
7,2,1,3,10,9,BioDock,42,2f57c592-c65c-4d1c-b92d-d19d2a11c02e,11,ecb82441-286f-408d-880c-9239a25fb5cd,7,7,0,2,ALLIANCE > TISSUE DIRECTORY,0,5
7,3,4,3,10,9,Generation Scotland: Scottish Family Health Study,42,301233da-53f8-4cea-8f74-4d4aa8d8c42c,19,f4f0ef1a-46cf-4734-8516-3adb0b62ae6d,7,7,0,4,ALLIANCE > GENERATION SCOTLAND,2,5
7,8,8,3,10,9,National Audit of Dementia Round 4 - casenote audit,42,304430ff-0aff-4d36-91e5-94be251a409a,29,587a94e6-48a4-4e5e-8230-4018897bc7c7,7,7,0,4,ALLIANCE > HQIP,3,5
6,3,1,3,10,9,Systemic Anti-Cancer Therapy Dataset [SACT],42,3141f405-9653-4189-9a1f-443a463d4b1b,13,6c4ed998-0f05-415c-a3e4-42430bb62d24,7,7,1,1,ALLIANCE > SAIL,1,5
7,2,0,3,10,9,PHOTO Translational bladder cancer biorepository,42,319a2a77-3f4d-497e-bc3e-33002f316cae,10,07d1b768-78f6-41e8-995a-66afd2549b34,7,7,0,2,ALLIANCE > TISSUE DIRECTORY,0,5
7,2,1,3,10,9,LBIH Biobank,42,32b5d90f-6bad-40f8-96d7-69b11df6d5ff,11,c0318a31-a32c-4d3a-9591-dfe9352bf2b9,7,7,0,2,ALLIANCE > TISSUE DIRECTORY,0,5
7,9,8,3,10,9,"Deaths – CHI, Community Health Index",42,33e96a6f-8791-48c7-a440-889dba594c36,31,faf2fc49-d09f-4ea2-a2cb-b1d30fffa406,7,7,0,5,HEALTH INFORMATICS CENTRE - UNIVERSITY OF DUNDEE,3,5
7,2,0,3,10,9,Scottish Human Papillomavirus Archive,42,342bef6e-8fa2-49f0-bdbb-c95d866aa145,8,4883530f-1c8d-49aa-886e-ea3b958772ea,7,7,0,0,ALLIANCE > TISSUE DIRECTORY,0,5
7,2,1,3,10,9,Human Developmental Biology Resource (HDBR),42,355de4ca-1ce9-4ba4-8e07-2d51bb82bfbf,11,399a6d67-7577-4476-a3b6-4bbceb5a8ff7,7,7,0,2,ALLIANCE > TISSUE DIRECTORY,0,5
6,4,1,3,10,9,Mental Health Minimum Dataset v3_3.5 (Sensitive),42,36047c5f-7d57-4d25-a114-2bcc6c11708f,19,c123f74c-0731-428e-b31b-eee2723df54d,7,7,0,5,ALLIANCE > NHS DIGITAL,3,5
7,9,8,3,10,9,NHS Tayside and Fife Accident & Emergency Dataset (ISD/National),42,3728b674-68a2-4710-9f8e-b0fc3f2add10,31,750063ea-6bfd-4492-9748-2a18080cf6ea,7,7,0,5,HEALTH INFORMATICS CENTRE - UNIVERSITY OF DUNDEE,3,5
7,2,1,3,10,9,NIMRAD-TRANS,42,3784d68e-d213-43a7-bf30-8f4d34de022c,11,039b55f7-d416-49ab-9bdb-4ff7dbc733df,7,7,0,2,ALLIANCE > TISSUE DIRECTORY,0,5
7,3,5,3,10,9,Exploring psychological issues of primary care teams in Malaysia amidst COVID-19,42,37eb2884-d7df-489f-a3ad-f02f1e510475,18,64f78a5f-268f-4951-9c91-f7e7130baffa,7,7,0,2,HUB > BREATHE,2,5
7,2,1,3,10,9,"Leeds Dental Institute/School of Dentistry Leeds, Skeletal Tissues Bank",42,37fe2488-f4c3-4471-a1e0-7d4a4204f063,11,f94168a1-cab8-4211-90e0-38a241609697,7,7,0,2,ALLIANCE > TISSUE DIRECTORY,0,5
6,3,1,3,10,9,Civil Registration - Deaths,42,384176d1-8c17-46e5-8771-7e27fe3b184e,13,050163dc-1728-4ac5-a7d9-4dd3ca0ca12a,7,7,0,1,ALLIANCE > NHS DIGITAL,2,5
6,0,0,3,10,9,Congenital Anomaly Register and Information Service,42,38468759-3351-4722-9eeb-4c6dc9fa44ce,6,6fe7e004-eb51-4c7b-9905-1ec9a4827dca,7,7,0,0,ALLIANCE > SAIL,0,5
6,4,1,3,10,9,Bridge file: Hospital Episode Statistics to Diagnostic Imaging Dataset,42,3935e2fd-0c30-4f56-8388-45a02e0499b4,19,2f73575d-23c8-4bb8-87db-115cde076127,7,7,0,5,ALLIANCE > NHS DIGITAL,3,5
6,8,4,3,10,9,National Radiotherapy Dataset (RTDS) for CPRD GOLD,42,3943e6de-6c32-43dd-8090-16ec9ca0902f,26,56a66de8-3470-4a36-ac71-4d5471e72654,7,7,0,5,ALLIANCE > CPRD,3,5
7,8,8,3,10,9,National Cardiac Audit Programme - Cardiac Rhythm Management (CRM),42,395262e7-9846-4d9d-a288-8b0ebea782b9,29,3cc81e6c-0c17-4ccd-8202-a9aceb82c989,7,7,0,4,ALLIANCE > HQIP,3,5
