7,3,2,3,10,9,Business Impact of COVID-19 Survey (BICS),42,39537838-164a-4aee-8859-957f0a347390,15,8e739a01-bcfa-4b75-b7f8-e694ee185f8d,7,7,0,1,NCS > OFFICE FOR NATIONAL STATISTICS,3,5
6,1,0,3,10,9,Children’s Kidney Cancers - Great Ormond Street Hospital,42,395d4311-da00-49a4-b78e-5387c961d803,7,3f71bef5-c5a2-400c-a482-2ad30b29a240,7,7,0,0,HUB > DATA-CAN,0,5
7,2,0,3,10,9,The Cleft Collective,42,3983f3ec-ce63-4142-b73e-93130654710b,10,12288034-00a4-47a8-a779-1cf7a55270e4,7,7,0,2,ALLIANCE > TISSUE DIRECTORY,0,5
7,2,0,3,10,9,PHOENIX DDR-Anti-PD-L1 Trial,42,3a0599ed-5452-4299-956c-af5a30bbef23,10,df94730b-374b-4d91-8116-1c10a7c77c4e,7,7,0,2,ALLIANCE > TISSUE DIRECTORY,0,5
7,2,1,3,10,9,SWIFT-RTB,42,3a23e7dc-d814-4772-a6f8-a814c8e0128b,11,d387ed7c-14fa-49e2-8ced-df0f9372eb88,7,7,0,2,ALLIANCE > TISSUE DIRECTORY,0,5
7,8,8,3,10,9,Epilepsy 12 - clinical audit,42,3a51b861-026d-45ed-abe6-30d9cc07b516,29,1fcaf429-8762-454c-b999-c5fdd757b880,7,7,0,4,ALLIANCE > HQIP,3,5
7,5,5,3,10,9,Death register,42,3a56c317-bf1b-448d-89ab-3421eae3aa18,22,722056a5-5fc6-4ad2-8efe-62a80dd6389b,7,7,2,2,UK Biobank,2,5
7,8,8,3,10,9,National Paediatric Diabetes Audit - Spotlight survey of workforce in Paediatric Diabetes Units,42,3a9ab245-5fcc-49a0-ae58-12ebab9b0053,29,fe8f8e2c-2f77-464d-9d45-a601cb2f8bf9,7,7,0,4,ALLIANCE > HQIP,3,5
7,2,3,3,10,9,COVID-19 Detection from Chest X-Rays using Deep Learning,42,3aa01779-831e-478f-b4e3-7c111d642b18,13,57526718-0a9a-42ad-8b7a-582d9ef96d13,7,7,0,2,HUB > BREATHE,0,5
6,0,0,3,10,9,Annual District Birth Extract,42,3ab70331-aa54-4f0d-aa95-ea2b95bed9d5,6,12a77014-4a77-4eb1-8b26-f49689352d1b,7,7,0,0,ALLIANCE > SAIL,0,5
6,3,2,3,10,9,SICSAG Episodes (Scottish Intensive Care Audit Group),42,3c9e8226-f12c-4824-9996-29a667b9609c,15,6f8182d2-2993-400d-829d-b52cdb324bf3,7,7,1,1,ALLIANCE > PUBLIC HEALTH SCOTLAND,2,5
7,10,9,3,10,9,"Problems, Diagnosis and Procedures",42,3cd53c68-7e56-4c3e-b7c2-bd7e18040ec5,33,51b41359-1558-48df-9950-88f75ca6ac4c,7,7,0,5,ALLIANCE > BARTS HEALTH NHS TRUST,3,5
6,3,1,3,10,9,Hospital Episode Statistics Accident and Emergency,42,3ce8ddf2-c69b-4143-9e39-86c0ac2d8482,13,3ddfccc3-ba32-4653-a999-966b8d6c412f,7,7,0,1,ALLIANCE > NHS DIGITAL,2,5
6,4,2,3,10,9,Cancer Network Information System - CNIS / CANISC,42,3d13bc38-3f7f-4807-8847-2a10d6402dd3,15,da91f0eb-1761-485b-8b7f-9121b6a1d004,7,7,1,1,ALLIANCE > SAIL,1,5
6,9,8,3,10,9,Prescribing,42,3e13c6f0-2760-4ece-b047-77d750d9cdbd,31,6d044471-62d2-4190-b315-503f77d33ef2,7,7,0,5,HEALTH INFORMATICS CENTRE - UNIVERSITY OF DUNDEE,3,5
7,8,8,3,10,9,National Clinical Audit of Anxiety and Depression - spotlight audit on psychological therapies (patient experience survey),42,3e89692b-7aa2-49d6-b802-82921bd7e006,29,d94eb31c-04c4-41b6-ad38-45f6aef30132,7,7,0,4,ALLIANCE > HQIP,3,5
6,0,0,3,10,9,"Extended Cohort for E-health, Environment and DNA (EXCEED)",42,3ee52adc-b97e-4f7b-a251-a1c9841a380c,6,e22ddf52-7f9e-4072-ae61-cb722461b37d,7,7,0,0,HUB > BREATHE,0,5
7,8,8,3,10,9,National Emergency Laparotomy Audit - Patient Audit Dataset,42,3f299029-3126-4ce0-893c-4a759cbe90b1,29,25b93812-191f-49bb-bbd0-782fb85b2bd2,7,7,0,4,ALLIANCE > HQIP,3,5
6,0,0,3,10,9,Cafcass Wales,42,3fceb952-0b21-40f4-bd69-fa5cd7ad7df9,6,29a714e1-5289-4362-be24-2848c954344e,7,7,0,0,ALLIANCE > SAIL,0,5
6,2,2,3,10,9,Covid-19 UK Non-hospital Antigen Testing Results,42,401bfb5b-b66b-49e7-931a-280fd6694bbf,14,f06ec631-77d0-4b12-a21f-f11e7af49ba5,7,7,1,1,ALLIANCE > NHS DIGITAL,2,5
7,10,9,3,10,9,Endobase,42,40573895-497b-4d47-90e1-6aafe70b93f6,33,e830b2a5-14d6-4643-a206-619bf5372dc8,7,7,0,5,ALLIANCE > OXFORD UNIVERSITY HOSPITALS NHS TRUST,3,5
7,2,0,3,10,9,Bloodwise Childhood Leukaemia Cell Bank,42,406e7ae7-554b-4807-b3a5-a4d81316cf9c,10,93baeb13-cc4b-47fd-9dae-5ae5277cba54,7,7,0,2,ALLIANCE > TISSUE DIRECTORY,0,5
6,3,2,3,10,9,Secondary Uses Services Payment By Results,42,41369771-7b1d-478f-a96c-96c25b637cb2,15,2004c512-f7c9-4995-b820-55f36aa3fad2,7,7,1,1,ALLIANCE > NHS DIGITAL,2,5
6,5,2,3,10,9,Domiciliary Social Care Worker [DSCW],42,41a667eb-1c84-4665-b0d4-d26405d277c5,16,0e38bbf4-c788-4a1a-9af8-a24821250154,7,7,1,1,ALLIANCE > SAIL,1,5
6,5,1,3,10,9,Mental Health and Learning Disabilities Data Set,42,4262e057-6978-4e4c-a05d-c4f328422090,20,e9b43936-e700-40c9-8b32-57ed44583f3d,7,7,0,5,ALLIANCE > NHS DIGITAL,3,5
7,0,1,3,10,9,Scottish Stillbirth and Infant Death Survey,42,426c2cfb-3af8-444c-bfae-1b1f78c050ba,10,e54d35a6-2e7c-422d-a4a5-a7da930b08f2,7,7,0,1,ALLIANCE > PUBLIC HEALTH SCOTLAND,2,5
7,8,8,3,10,9,National Neonatal Audit Programme - 2 year outcomes audit,42,4271bc64-b139-40b0-98de-5f2e94e2d026,29,3bb02d77-9678-4e6e-832d-c2ed3ede412c,7,7,0,4,ALLIANCE > HQIP,3,5
6,5,3,3,10,9,HES Patient Reported Outcomes Measures (PROMs) data for CPRD Aurum,42,42780b16-32e3-442e-92cd-1810bf30dab8,20,7958450d-bd25-42c4-b79e-0e3d0806ac21,7,7,0,3,ALLIANCE > CPRD,3,5
7,8,8,3,10,9,Falls and Fragility Fracture Audit Programme National Audit of Inpatient Falls clinical dataset,42,430331ef-fa66-485b-b090-e4e83def9136,29,3c19e2c9-96d5-45f3-9c55-fc3cec762cd7,7,7,0,4,ALLIANCE > HQIP,3,5
6,1,1,3,10,9,Scottish Cancer Registry (SMR06),42,4481aab8-9b4f-43dd-9cd4-1e427561a2a5,11,ad36dc03-1856-44de-99b0-1af6f312d86b,7,7,0,1,ALLIANCE > PUBLIC HEALTH SCOTLAND,2,5
6,4,1,3,10,9,Mental Health Minimum Dataset v4 (Sensitive) Events,42,46493a09-b3bb-4c0e-b944-82665ee21508,19,9c31a2bd-ff3a-4379-a4b8-0b90527a4c38,7,7,0,5,ALLIANCE > NHS DIGITAL,3,5
7,1,2,3,10,9,Child Health Systems Programme - School,42,4660884b-e40a-4251-ad19-40872641fa8c,13,2c31cb1c-2b3d-40c5-b8d4-bf0b81f089b4,7,7,0,2,ALLIANCE > PUBLIC HEALTH SCOTLAND,2,5
7,8,8,3,10,9,National Vascular Registry - Organisational Audit dataset,42,4678a81d-dfb6-478a-a373-d5510866b3d0,29,3c661240-e4d2-456c-a809-133c23f9c469,7,7,0,4,ALLIANCE > HQIP,3,5
7,8,8,3,10,9,National Cardiac Audit Programme - National Congenital Heart Disease Audit (NCHDA),42,46e4c3ba-dae2-453d-832a-88ea603110f1,29,2b640175-725a-465f-9aec-6794e6d27791,7,7,0,4,ALLIANCE > HQIP,3,5
7,8,8,3,10,9,National Vascular Registry Audit - Lower Limb Bypass clinical dataset,42,47bec08b-57b7-450e-9be7-af19bab99b58,29,d357be1e-27fe-4b2f-9174-3a2a03ecc12b,7,7,0,4,ALLIANCE > HQIP,3,5
7,1,3,3,10,9,Theory of Planned Behaviour Intervention: respiratory disease in South India,42,47e9fa0a-d74f-43bc-ae63-0eb33f354f01,14,7d23e729-72b0-4dd1-820d-07697b49acd0,7,7,0,2,HUB > BREATHE,2,5
7,6,4,3,10,9,Genotype,42,480ccd8a-309e-417a-ac23-5b2d9cd281b1,24,93a7352f-fce4-42c9-9a8c-efc7fe23eda0,7,7,2,4,UK Biobank,2,5
6,1,0,3,10,9,North West London Adult Social Care Data (NWL ASC),42,4b1202a7-aaf8-486d-86b0-d75a421a5e60,7,de9cf0f5-b26a-4363-9df8-3628a4aa6b6e,7,7,0,0,HUB > DISCOVER NOW,0,5
6,0,0,3,10,9,Daily Situation Report Data,42,4b6d3344-e73a-4f46-8e9d-fabb85827772,7,c74a9b9e-1fea-4aac-99fd-54e30668e085,7,7,0,0,ALLIANCE > SAIL,1,5
7,8,8,3,10,9,National Paediatric Diabetes Audit - Spotlight survey of diabetes-related technologies,42,4b71fca4-8b2c-4e37-8996-b64a9c1450f0,29,eecbdd8d-92a0-4dfd-a216-1cf7f1f8c98f,7,7,0,4,ALLIANCE > HQIP,3,5
7,2,1,3,10,9,VinCaP,42,4cfabd2a-e590-4f63-82f5-6d543b0075cf,11,e57dd7a2-3c5c-4285-8001-8e2589c395e9,7,7,0,2,ALLIANCE > TISSUE DIRECTORY,0,5
7,2,1,3,10,9,Myeloma XII clinical trial samples,42,4d95d730-a53a-4856-a278-b2fba96657c4,11,576fbcf8-ff25-4230-ae69-e72ca02b95f1,7,7,0,2,ALLIANCE > TISSUE DIRECTORY,0,5
6,1,3,3,10,9,Child Health Systems Programme - 27-30Months Review,42,4f721a52-b3cd-4594-9099-5185f80832c7,14,d2d57b7f-95d8-425f-b2fd-cc9aff05e659,7,7,0,2,ALLIANCE > PUBLIC HEALTH SCOTLAND,2,5
7,5,2,3,10,9,COPDMAP Consortium,42,505318b6-609c-4baf-9dea-2e3532f936f8,14,bcbc41cb-99f7-482e-ba3d-561164abbd4e,7,7,0,1,HUB > BREATHE,0,5
7,8,8,3,10,9,National Audit of Psychosis - Audit on Early Intervention in Psychosis services -  patient experience survey,42,50631db6-126e-4b3a-8035-444b66ba4afa,29,c3e63860-bd61-4154-ab5f-ca927fb029c4,7,7,0,4,ALLIANCE > HQIP,3,5
6,3,3,3,10,9,RAPID (Hospital Stay Level Data),42,50e341b3-11cb-4ea3-afd0-be193c0df91f,15,1fc57971-5af5-499e-a500-4ffbb087f0c4,7,7,0,1,ALLIANCE > PUBLIC HEALTH SCOTLAND,2,5
7,0,0,3,10,9,Prospective Observation of Fibrosis in the Lung Clinical Endpoints,42,50feb9f3-3be8-4690-913b-bd462d27d3db,6,bb8de9d2-cc38-4c40-b104-ffd167f64f76,7,7,0,0,HUB > BREATHE,0,5
7,10,9,3,10,9,Outpatient Appointment Dataset,42,510e1782-1650-4342-9c20-185ca47f7b11,33,1c27bfbf-c659-42ff-8afe-d58250b49c07,7,7,0,5,ALLIANCE > OXFORD UNIVERSITY HOSPITALS NHS TRUST,3,5
6,2,2,3,10,9,COVID-19 SARI-Watch (formerly CHESS),42,511f73b6-5181-408d-ae40-69b0ef70e732,14,f61f116d-f732-450e-9d34-c6ae00e3fd1e,7,7,1,1,ALLIANCE > NHS DIGITAL,2,5
7,5,0,3,10,9,Leicester Respiratory Research Database,42,5138fa73-6695-413d-9d03-a40ecad98fb5,14,01c3d08c-6948-4059-a027-3437e4f5d53b,7,7,0,2,HUB > BREATHE,1,5
7,7,8,3,10,9,International Severe Asthma Registry,42,52a4c514-0414-43c7-a400-1498a70ed85a,28,9711e6cc-426c-4cef-afb3-64382f8d7ed4,7,7,0,5,HUB > BREATHE,2,5
7,8,8,3,10,9,National Audit of Care at the End of Life - organisational level audit,42,535fbfd4-34f0-436d-8de2-e708fd0fa103,29,a290592c-a6f5-4874-b283-1d33e923c487,7,7,0,4,ALLIANCE > HQIP,3,5
6,2,3,3,10,9,Ventilatory strategies and outcomes for patients with COVID: a dataset in OMOP,42,53b7c446-667b-409e-920e-67cb516de3ae,15,,7,7,2,1,HUB > PIONEER,1,5
7,8,8,3,10,9,National Vascular Registry - Lower Limb Angioplasty clinical dataset,42,5536b00a-fb31-4e91-9bd8-e7f774974846,29,c8b6c319-239b-4792-9898-644a63d07ab5,7,7,0,4,ALLIANCE > HQIP,3,5
6,0,0,3,10,9,National Community Child Health Database (NCCHD),42,553a0fcb-6bed-493c-a185-fa97dc5f370d,6,20fe153c-a5e5-4991-900e-8fa9988e771a,7,7,0,0,ALLIANCE > SAIL,0,5
7,1,3,3,10,9,Care-seeking practices for childhood pneumonia in non/tribal areas of Pune India,42,561b8a79-6bac-4ffc-91f4-0bbec4e90968,14,4346676d-6108-47de-b579-6cef74c6acef,7,7,0,2,HUB > BREATHE,2,5
7,2,1,3,10,9,Cardiff School of Dentistry Tooth Bank,42,5758964b-1161-48ee-97b5-1e414f406978,11,0d4f0103-82d8-43f4-8058-4aec80ea562f,7,7,0,2,ALLIANCE > TISSUE DIRECTORY,0,5
7,2,1,3,10,9,Cardamon Clinical Trial Samples,42,57f5eb44-bd9b-4ec5-b255-fe915ff74ab5,11,c0dcceca-c8cf-4269-a0e0-0c18b6ba2de1,7,7,0,2,ALLIANCE > TISSUE DIRECTORY,0,5
7,9,8,3,10,9,Tayside & Fife Diabetes – Summary and a range of diabetes related datasets.,42,5852d8bc-d721-4daf-a63b-21aebcc6f5a9,31,49e63323-e564-48ac-9f11-cf77bf0fe20b,7,7,0,5,HEALTH INFORMATICS CENTRE - UNIVERSITY OF DUNDEE,3,5
7,2,1,3,10,9,King's Health Partners Cancer Biobank,42,593a5263-e2b5-4433-81c1-30b35a520488,11,a218d0b4-0273-4a04-ba17-c01dae6dcf33,7,7,0,2,ALLIANCE > TISSUE DIRECTORY,0,5
7,3,3,3,10,9,Labour Force Survey (Longitudinal),42,598989e4-17b7-4730-87af-b7e6b1519301,16,4ac15572-fe9a-46d3-860d-a46b616181f7,7,7,1,1,NCS > OFFICE FOR NATIONAL STATISTICS,2,5
7,8,8,3,10,9,National Clinical Audit of Anxiety and Depression - spotlight audit on psychological therapies (therapist survey),42,59bc96f9-69b7-4763-81a8-ec4695b6b55e,29,bf2d780d-936b-4f4c-88f9-a280b849b652,7,7,0,4,ALLIANCE > HQIP,3,5
7,2,2,3,10,9,Coronavirus and the social impacts on Great Britain,42,5aa849d6-cff2-4515-8510-f5472b07955d,14,e253257c-48c2-491b-b3b9-205161a16a7e,7,7,0,1,NCS > OFFICE FOR NATIONAL STATISTICS,3,5
7,2,1,3,10,9,MesobanK,42,5ad32bfa-8d4b-45cb-aa10-3b0a4bcfd258,11,b03835b7-7408-49a0-a9aa-ea405f9855c9,7,7,0,2,ALLIANCE > TISSUE DIRECTORY,0,5
6,3,2,3,10,9,Enhanced Prescribing Database,42,5ae869f8-b6af-41c0-bca0-1fffef112375,17,2843087f-23a4-4cfe-8e72-53f2b9562cc3,7,7,2,2,ALLIANCE > HEALTH AND SOCIAL CARE NORTHERN IRELAND,2,5
6,3,6,3,10,9,MATCH,42,5b99795a-3db4-4020-a8f9-aa64bcc2c5f0,21,,7,7,3,1,ALLIANCE > HEALTH INFORMATICS CENTRE - UNIVERSITY OF DUNDEE,2,5
7,0,0,3,10,9,SpiroMeta Consortium Dataset,42,5d2758c6-b315-421f-9971-9df8ba83a2d4,7,fb6d98c5-e41d-4804-bb28-839556e0f657,7,7,0,1,HUB > BREATHE,0,5
6,3,1,3,10,9,Diagnostic Imaging Dataset,42,5d76d094-446d-4dcc-baa1-076095f30c23,13,86f46be3-bc29-4820-8363-de6530a94c6f,7,7,0,1,ALLIANCE > NHS DIGITAL,2,5
7,10,9,3,10,9,ARIA Radonc,42,5e022f8f-4d07-44bb-a87c-43e31200fe1e,33,59d72237-6969-4f59-9e87-48138978abe8,7,7,0,5,ALLIANCE > OXFORD UNIVERSITY HOSPITALS NHS TRUST,3,5
6,0,0,3,10,9,Emergency Department Dataset Daily,42,5e2a7277-dc64-499a-b16d-51850d9ad00b,6,fa257aa8-51fc-4eb7-a448-e473fa54686d,7,7,0,0,ALLIANCE > SAIL,0,5
7,8,8,3,10,9,National Paediatric Diabetes Audit - core clinical dataset (care processes and outcomes),42,5ea9c568-b850-4589-bcbb-6ee0cfd322cd,29,e355c9b9-44f0-4ba3-a872-645aa88f4f2b,7,7,0,4,ALLIANCE > HQIP,3,5
6,1,0,3,10,9,North West London Integrated Care Record (NWL ICR),42,5eaf28aa-dfd4-4bf6-b5e7-3d172a2c3cf7,7,602d8093-6a1e-42cf-a89c-8bf0d47ecc8c,7,7,0,0,HUB > DISCOVER NOW,0,5
7,2,1,3,10,9,UK CLL Trials Biobank,42,5eecebc6-d896-46de-92df-d108bb193b17,11,636e216a-072b-4c8b-b867-23b7666d2cb2,7,7,0,2,ALLIANCE > TISSUE DIRECTORY,0,5
7,8,8,3,10,9,National Maternity and Perinatal Audit Organisational Survey 2019,42,600be397-211b-4f65-9f82-e85f4393fb8a,29,01ad25ed-8cde-43d7-bc77-d8cc3d165df4,7,7,0,4,ALLIANCE > HQIP,3,5
6,1,2,3,10,9,Child Health Systems Programme - 13-15 Month Review,42,60a303b6-1ebf-466e-ab5c-db92ca7a13c4,13,e77af7a3-32fa-4a08-8455-4fb489e5b64a,7,7,0,2,ALLIANCE > PUBLIC HEALTH SCOTLAND,2,5
7,8,8,3,10,9,National Clinical Audit of Anxiety and Depression - Core audit of practice,42,61cf3b8d-5a1b-4241-aaac-89599bf17ab6,29,4a96b9bf-beb0-41b1-9211-e6ce39a21c1a,7,7,0,4,ALLIANCE > HQIP,3,5
6,2,2,3,10,9,Census 2011 E&W - Household structure for COVID-19 models,42,62087504-c04e-4382-9c71-e1c9b83d2d5e,14,2f66bcf9-e626-4e8d-bc6e-2d3958e709d8,7,7,0,1,NCS > OFFICE FOR NATIONAL STATISTICS,3,5
6,3,2,3,10,9,Emergency Care Data Set (ECDS),42,621008c7-67ac-4e3d-9c54-af87cc2f9579,15,7749d90e-dd7a-4697-8a9c-666491c64a0c,7,7,1,1,ALLIANCE > NHS DIGITAL,2,5
6,1,2,3,10,9,Scottish Birth Record (SBR),42,621576c2-a995-424b-a506-2276f9b03f37,12,81c53293-ef64-4507-8fcf-2a254dc19936,7,7,0,1,ALLIANCE > PUBLIC HEALTH SCOTLAND,2,5
7,1,3,3,10,9,ICT-based intervention for adult asthma with limited health literacy,42,62824365-480a-4d20-9ab2-7e7739e7e2ec,10,1d6b02f1-47b8-42ad-919d-f738b545cff7,7,7,0,0,HUBS > BREATHE,0,5
7,2,0,3,10,9,UK real-world lymphoid tissue bank,42,62b17ee5-97e3-468e-ba48-e8685ea28461,10,c9f82f86-79e1-4067-932f-5e6dc939006d,7,7,0,2,ALLIANCE > TISSUE DIRECTORY,0,5
6,0,0,3,10,9,GENOMICS ENGLAND 100K PHE LINKED DATA,42,62c01293-83a5-4d4d-9d36-9d7aa2bf120f,6,ea748742-568a-46e2-b603-2fada49024e1,7,7,0,0,GENOMICS ENGLAND,0,5
7,2,0,3,10,9,UKCTOCS Longitudinal Women's Cohort (UKLWC),42,62d11868-51d7-4b3a-99eb-da9f5d3797dc,10,e0b951ba-0f7d-4743-9374-b965042accdd,7,7,0,2,ALLIANCE > TISSUE DIRECTORY,0,5
6,2,1,3,10,9,Contact detail,42,62fc43ed-1198-4769-ad39-a0bc2c05fd47,10,c12c53cc-d1f5-4b01-b86d-5e04c67ee70a,7,7,0,1,ALLIANCE > NIHR BIORESOURCE,0,5
6,0,0,3,10,9,COVID-19 Symptom Tracker Dataset,42,6325125b-6157-4c20-8bc0-54e2c45cf19b,6,594cfe55-96e3-45ff-874c-2c0006eeb881,7,7,0,0,ALLIANCE > SAIL,0,5
6,3,2,3,10,9,SICSAG Daily (Scottish Intensive Care Audit Group),42,63f9444f-d23b-425c-9ee5-aa09968afa08,15,811a54fb-8b79-442f-8e28-a725a0561a15,7,7,1,1,ALLIANCE > PUBLIC HEALTH SCOTLAND,2,5
6,0,0,3,10,9,Wales Asthma Observatory,42,6439bf82-d0b4-4d7f-b7d9-f1e716b12df5,7,8604bcdc-235a-4c70-b29b-1617396815e6,7,7,0,0,HUB > BREATHE,1,5
7,8,8,3,10,9,National Audit of Dementia Round 4 - organisational checklist,42,64a0ba4d-776c-4979-a4b0-1f1fb6b61c85,29,0a305b29-cf23-4261-9299-5251e41ee9f0,7,7,0,4,ALLIANCE > HQIP,3,5
6,1,0,3,10,9,Higher Education Statistics Agency (HESA) Student Data,42,64c6a583-f71b-478e-a26b-5e581226ec6d,8,68b04d3b-17b4-4a04-a8a3-e2a93ed231df,7,7,0,0,ALLIANCE > SAIL,1,5
6,0,0,3,10,9,Diagnostic and Therapy Services Waiting Times,42,65c8a30c-de2c-47bf-87e4-18c86e75e54a,7,97896866-ab5e-408a-ac5a-072802db9faf,7,7,0,0,ALLIANCE > SAIL,1,5
7,10,9,3,10,9,Critical Care Minimum Dataset,42,673626f3-bdac-4d32-9bb8-c890b727c0d1,33,c71fbdc3-0311-4b3f-a9ff-7d2f2c0ba993,7,7,0,5,ALLIANCE > BARTS HEALTH NHS TRUST,3,5
6,0,0,3,10,9,Critical Care Dataset,42,67ae329c-f51e-4a28-9a1c-e35d2819a6c3,6,1789286a-deaf-49df-88cd-660e92934af6,7,7,0,0,ALLIANCE > SAIL,0,5
6,0,0,3,10,9,COVID-19 Shielded People list,42,67ef8ade-51e6-4737-acee-be871751a698,6,dc22db56-8791-4e96-9ce6-6b6a58b1241f,7,7,0,0,ALLIANCE > SAIL,0,5
7,3,5,3,10,9,Exploring the provision of supportive care for patients with COPD in Malaysia,42,68eca6a2-7c32-4bea-bcd1-c07dc50ee018,18,af8cdc87-789e-4bea-9d8b-927aa689d211,7,7,0,2,HUB > BREATHE,2,5
7,2,1,3,10,9,Leeds Breast Research Tissue Bank,42,6951e949-6aa3-4670-ad05-db8e954b3524,11,2dc1218d-df5f-4025-826c-cf5ca7d67882,7,7,0,2,ALLIANCE > TISSUE DIRECTORY,0,5
6,1,0,3,10,9,Moorfields Eye Image Dataset Release 001,42,6959639d-5bd2-4b53-918e-8f56784b2870,7,6bfe44ef-9532-4986-b8a2-9c2cda4a89cc,7,7,0,0,HUB > INSIGHT,0,5
7,2,0,3,10,9,Northern Ireland Biobank (NIB),42,6983134e-c920-47db-957b-47e873644eb0,10,c6e1ea88-f5bf-4a57-953f-688f313fcb04,7,7,0,2,ALLIANCE > TISSUE DIRECTORY,0,5
6,8,4,3,10,9,Systemic Anti-Cancer Treatment (SACT) data for CPRD GOLD,42,6a8066c7-a8f4-44a6-9efd-871b19a3689f,26,014e7973-b43e-4a4a-91b4-de3f353b71b9,7,7,0,5,ALLIANCE > CPRD,3,5
6,1,0,3,10,9,The Royal College of General Practitioners (RCGP) Research and Surveillance Centre (RSC) primary care sentinel network and database,42,6b41863d-690e-492e-8034-303d56f12f22,7,d5049af5-e351-4b22-8f75-6f3dfc96419b,7,7,0,0,ALLIANCE > RCGP,0,5
7,8,8,3,10,9,National Diabetes Audit - National Diabetes Foot Care Audit clinical dataset,42,6b53f274-c927-4b8f-bcc3-1d85fabf16ee,29,dabf34b3-7368-4097-94c5-5b4f4be68fc6,7,7,0,4,ALLIANCE > HQIP,3,5
6,1,0,3,10,9,Welsh Dispensing Dataset,42,6b7893b5-74bc-49e2-ab4d-50e7695f54a5,7,50ef6443-ed4b-40f9-97fb-1cfd53be6579,7,7,0,0,ALLIANCE > SAIL,0,5
6,2,2,3,10,9,Covid-19 Second Generation Surveillance System,42,6c878d69-2662-42db-85da-15e087606442,14,fede31c6-a9c5-4cfb-9866-9b58b2199cff,7,7,1,1,ALLIANCE > NHS DIGITAL,2,5
7,8,8,3,10,9,National Joint Registry - Revision Elbow Replacement dataset,42,6d1b9b23-1197-4857-9b17-9e26cb0633e8,29,12babf2b-42e8-4b1e-9143-3475a07bb343,7,7,0,4,ALLIANCE > HQIP,3,5
7,9,8,3,10,9,NHS Tayside and Fife Virology,42,6dd0f10d-82fa-438f-ba74-9c880f60bf4c,31,855a84b2-9d58-4b2b-a450-b6c6d534e403,7,7,0,5,HEALTH INFORMATICS CENTRE - UNIVERSITY OF DUNDEE,3,5
6,3,3,3,10,9,HES Outpatient data for CPRD Aurum,42,6e1d8f50-f718-4964-9c88-2c80cbaa92b5,16,8d3f3e58-be79-4450-b2e3-f5ab8a25fb0e,7,7,0,2,ALLIANCE > CPRD,2,5
7,2,1,3,10,9,Ethical Tissue - University of Bradford,42,6e535e7c-0ceb-4666-9361-e75e9c4a97ca,11,fdf9ac68-fc89-4adf-9a73-3a94a9974aef,7,7,0,2,ALLIANCE > TISSUE DIRECTORY,0,5
7,4,5,3,10,9,Biological samples,42,6e5916d4-017c-4542-bc71-edf6d4c5a055,23,41ac38b0-31cd-4865-a357-80ce557b2312,7,7,2,4,UK Biobank,2,5
7,3,7,3,10,9,"Trusted Research Environments for CVD-COVID-UK in England, Scotland and Wales",42,6ec3a47b-447a-4b22-9b7a-43acae5d408f,22,7e5f0247-f033-4f98-aed3-3d7422b9dc6d,7,7,1,3,OTHER > BHF Data Science Centre,2,5
6,1,1,3,10,9,Demographic,42,6ecc2cb0-3b9b-47fc-9c80-78da44f070ef,9,df28dcef-1d04-4f7d-b380-c76e07229a14,7,7,0,1,ALLIANCE > NIHR BIORESOURCE,0,5
7,8,8,3,10,9,Epilepsy 12 - Patient Reported Experience Measure,42,6efbc62f-6ebb-4f18-959b-1ec6fd0cc6fb,29,cefa4d82-5a22-4c19-82ab-4663a364e49e,7,7,0,4,ALLIANCE > HQIP,3,5
6,0,0,3,10,9,COVID-19 Test results,42,6f24a4b8-66ab-4ea7-aa8c-3be3d0b4abf1,6,f5f6d882-163d-4ef1-a53e-000fba409480,7,7,0,0,ALLIANCE > SAIL,0,5
6,2,1,3,10,9,Intensive Care National Audit and Research Centre,42,6f348bdc-21e4-459b-b658-dc839a1e2133,11,fa8bf269-4769-491b-b398-fa63137d14ab,7,7,1,1,ALLIANCE > SAIL,0,5
7,2,1,3,10,9,National Joint Registry - Primary Hip Replacement dataset,42,7038a67d-34ca-4754-a50f-41aa2849db69,10,03280e87-6975-4a2a-967d-b332cb788e44,7,7,0,0,ALLIANCE > HQIP,1,5
7,10,9,3,10,9,Infoflex Cancer Registry,42,72fe91de-b0c0-423a-ad68-bd7067b20ad8,33,5505e91d-9e0a-4969-87d5-00f256d91306,7,7,0,5,ALLIANCE > OXFORD UNIVERSITY HOSPITALS NHS TRUST,3,5
7,1,3,3,10,9,"Prevention, detection, treatment: adult lung disease/cancer in rural Tamil Nadu",42,736a9d09-83c7-4cfa-ae82-a10b2a69efc8,14,2581994d-5be2-4465-bb62-60c4c97e8e2b,7,7,0,2,HUB > BREATHE,2,5
6,0,0,3,10,9,Annual District Death Daily,42,73867034-fe12-4d23-8d11-66da716dcb3d,6,584bf8c8-d58f-44c6-9b65-e1611144fd54,7,7,0,0,ALLIANCE > SAIL,0,5
6,3,2,3,10,9,COVID antigen testing - Pillar 1,42,7389dc03-1fc7-4af7-b12c-bbab448290f9,17,3abc20ce-3dc6-4715-9de0-56aa97a6f5ec,7,7,1,3,ALLIANCE > HEALTH AND SOCIAL CARE NORTHERN IRELAND,2,5
7,7,8,3,10,9,Labour Force Survey (Person),42,73ba9de7-67fe-4728-b397-bc5fb1d67df1,27,8c60a308-1e47-4a0c-8b69-9259f05338cb,7,7,2,1,NCS > OFFICE FOR NATIONAL STATISTICS,3,5
6,0,0,3,10,9,HIC Hepatitis v2,42,73f54071-62bf-48f5-8be1-569208b18ab8,6,66be725a-b950-4bf8-9a35-7e33ce765a25,7,7,0,0,NIHR Health Informatics Collaborative Viral Hepatitis Theme,0,5
7,2,3,3,10,9,Effects of second-hand smoke on pregnant women: a phenomenological study,42,7480abe4-e073-40ef-882d-217542b5e08e,12,4a5c610f-019d-450a-90c5-0fe315027f56,7,7,0,1,HUB > BREATHE,0,5
7,5,5,3,10,9,Cancer register,42,75614b69-bc18-416b-9d27-fd8ca9fc4521,22,a4751434-54ea-4d22-a66a-a5d32bd80c40,7,7,2,2,UK Biobank,2,5
6,3,0,3,10,9,CPRD GOLD,42,756daeaa-6e47-4269-9df5-477c01cdd271,11,a29feafa-7bdd-44e9-b977-c9d26425e67f,7,7,0,1,ALLIANCE > CPRD,1,5
6,2,1,3,10,9,Intensive Care National Audit and Research Centre - Covid19,42,7639cdc3-f368-4a43-80bd-58a67e70d407,11,add6226b-0f21-439a-84a6-51dc26cdc425,7,7,1,1,ALLIANCE > SAIL,0,5
7,8,8,3,10,9,National Asthma and COPD Audit Programme (NACAP): secondary care workstream – children and young people asthma (organisational),42,76ec0282-02e0-4fff-b016-76bc6ffcb784,29,3efd9b30-1f84-48c0-a3e0-402ecb5c7724,7,7,0,4,ALLIANCE > HQIP,3,5
6,0,0,3,10,9,The National COVID-19 Chest Imaging Database,42,77824298-ef3b-40f7-a0a4-b6dedb2e7a02,6,31f0148b-f965-4136-ab39-6c5bbbf8c2d9,7,7,0,0,NHSX,0,5
6,4,3,3,10,9,HES Admitted Patient Care data for CPRD GOLD,42,77b5cf84-d4f2-4418-bafa-73306cf2d2b2,17,4bcf64a6-f404-4ef4-ae6e-172512ab5f43,7,7,0,2,ALLIANCE > CPRD,2,5
6,9,8,3,10,9,NHS Tayside and Fife Haematology Biochemistry (Lab Data Restructured),42,7858978f-30e8-42e7-abe4-d9af5447c278,31,10ffac16-d0c2-4d53-ab6a-69a38e283223,7,7,0,5,HEALTH INFORMATICS CENTRE - UNIVERSITY OF DUNDEE,3,5
7,8,8,3,10,9,National Audit of Psychosis - Early Intervention Psychosis Audit patient experience survey,42,78d25670-9d20-4eb7-a79a-f29e53cc981f,29,a464c126-8591-4af6-a10f-99c020f59527,7,7,0,4,ALLIANCE > HQIP,3,5
6,4,1,3,10,9,Mental Health Minimum Dataset v4.1 (Sensitive) Episodes,42,78fe2e13-7f40-406f-a584-04909d0ce060,19,efecbe58-4822-4f17-bf5c-92113d143db9,7,7,0,5,ALLIANCE > NHS DIGITAL,3,5
7,3,8,3,10,9,EMEP4UK Pollution,42,79116473-bda2-413c-82ad-ba2b86e5076f,23,eb76598f-e228-413c-82f3-231809062611,7,7,0,4,HUB > BREATHE,2,5
6,1,1,3,10,9,National Cancer Registration and Analysis Service,42,79a7ad18-6941-4543-924a-787f2381f5e0,9,0a852454-ee67-443b-a091-d13499a71b41,7,7,0,0,PUBLIC HEALTH ENGLAND,1,5
7,2,0,3,10,9,Daisy Tumour Bank,42,7a0d678a-a341-4643-af33-bfc22f2f4e9c,10,b3ec5c18-e339-4bd8-8a59-5a3445a81f16,7,7,0,2,ALLIANCE > TISSUE DIRECTORY,0,5
6,4,1,3,10,9,Mental Health & Learning Disabilities Dataset v 1 (Non-Sensitive) Records,42,7aa02796-787a-42c2-b97e-d008fa77e4b8,19,1a8fc23c-b67b-4171-b5e1-1b650fce1ef4,7,7,0,5,ALLIANCE > NHS DIGITAL,3,5
6,4,2,3,10,9,Covid Vaccination Dataset (CVVD),42,7abfb023-50f3-4851-8bae-4abe41d25c1d,14,471f101c-a45e-4620-8710-be3036a46fba,7,7,1,1,ALLIANCE > SAIL,0,5
7,2,1,3,10,9,PTCL Biobank,42,7c1fa7b2-2b76-4952-884e-8ef6f845c488,11,19fa25a7-c15d-441c-b635-ad49043e7a96,7,7,0,2,ALLIANCE > TISSUE DIRECTORY,0,5
7,2,0,3,10,9,Bristol Dental School Saliva Bank,42,7ca98657-037c-43a8-872a-65a0520695e5,10,8d77f0ad-f376-4d61-a97d-5e996c2bbe72,7,7,0,2,ALLIANCE > TISSUE DIRECTORY,0,5
7,10,9,3,10,9,Somerset Cancer Registry,42,7d501f79-5d1f-4104-a5b7-d46a97fcde5f,33,3ec5f1c4-95c0-4b1d-899b-399cec32ad49,7,7,0,5,ALLIANCE > BARTS HEALTH NHS TRUST,3,5
7,1,1,3,10,9,National Records of Scotland (NRS) - Births Data,42,7db1c8bd-8d99-4189-8510-e6bdb0e19219,11,3b87eef0-bfb6-4bf4-84b9-29880197fec9,7,7,0,2,ALLIANCE > PUBLIC HEALTH SCOTLAND,1,5
7,8,8,3,10,9,National Asthma and COPD Audit Programme (NACAP): Adult Asthma secondary care clinical dataset,42,7dc319da-a16f-4e63-a115-0cba3905a322,29,becd2624-9a01-4f01-bcf8-56e94545a49a,7,7,0,4,ALLIANCE > HQIP,3,5
6,1,0,3,10,9,North West London Primary Care Events Data (NWL PCE),42,7e6c0a1f-c06f-4e5f-ae2f-93500569c4a5,7,0f930154-0a0e-4bef-9464-59e657b904d6,7,7,0,0,HUB > DISCOVER NOW,0,5
7,8,8,3,10,9,Epilepsy 12 - National organisational audit (service descriptor questionnaire) and Trust profile,42,7f125091-12ba-464d-af7d-9a88179b0b95,29,2c737d63-69f4-4a02-8df9-54c1e65e845f,7,7,0,4,ALLIANCE > HQIP,3,5
7,2,0,3,10,9,UK MND Collections,42,7f55c499-abd9-4f61-ac7e-93a4d15c79a2,10,89e2d798-c488-4eaf-a50f-a93616093304,7,7,0,2,ALLIANCE > TISSUE DIRECTORY,0,5
7,8,8,3,10,9,"National Audit of Dementia - spotlight audit on the prescription of psychotropic medication, 2019",42,7fab080b-6e2a-4c82-a5e5-daf99c70662a,29,949d9d7a-a3f1-480a-8563-3fb024300561,7,7,0,4,ALLIANCE > HQIP,3,5
6,0,0,3,10,9,GENOMICS ENGLAND 100K CANCER & COMMON,42,7fdb684d-bb7a-4d0b-8666-9f10510f071f,6,702f0198-bdfe-401e-97f2-35f5d26357ad,7,7,0,0,GENOMICS ENGLAND,0,5
7,3,5,3,10,9,Developing Patient and Public Involvement in Research in Malaysia,42,7fe20f78-758d-4449-beb4-ccf98e2d8247,17,153c0ba6-f2ec-4fb4-b5a7-33e11cbdf7fc,7,7,0,1,HUB > BREATHE,2,5
6,3,2,3,10,9,NHS Scotland General Practice (GP) Contact Data - Subset,42,80b54fc9-8dc0-4134-880d-ffa8d4473204,16,8f486c3d-9504-4a0e-8e24-ab96f057fc9e,7,7,2,1,ALLIANCE > PUBLIC HEALTH SCOTLAND,2,5
6,0,0,3,10,9,Cervical Screening Wales,42,80e9c439-4909-4534-8bfe-6f01fdec7de7,6,b32325d7-7f00-4d20-9935-dd02e1bc6932,7,7,0,0,ALLIANCE > SAIL,0,5
